Location,ent_type,context,p_no
Italy,GPE,"IT was melancholy to admit that Italy also had ceased to interest him, thought Hamlin,",0
Apennine,GPE,the fast‐rising sun; misty blue‐green valley bounded by unsubstantial Apennine peaks and Carrara crags; yellow shimmer of vines and,0
Carrara,GPE,"; misty blue‐green valley bounded by unsubstantial Apennine peaks and Carrara crags; yellow shimmer of vines and of maize,",0
Italy,GPE,", nay, when the mere sense of being in Italy had done so; but now the very words “",0
lyrist,GPE,"never been your splash‐of‐scarlet and dash‐of‐orange‐and‐skyblue, lust‐and‐terror kind of lyrist; but he had begun his poetical career with a",1
Hamlin,GPE,"in those philistine days, and which had welcomed young Hamlin, with his girlish beauty and pre‐Raphaelite verses, as",1
Hamlin,GPE,"Poor old Perry! Absurd days those were, thought Hamlin, as he walked slowly towards the house, through",1
London,GPE,"Hamlin; it was that feeling which had been making London odious to him of late, and sent him abroad",1
Hamlin,GPE,Perry’s depressed voice had remained in Hamlin’s ears. This was the end of a bright,5
Florence,GPE,"might decently, on some pretext, slip off to Florence. And then—why, from Florence he might",5
Florence,GPE,"off to Florence. And then—why, from Florence he might go to America. He thought all those",5
America,GPE,"then—why, from Florence he might go to America. He thought all those big hotels, with the",5
Hamlin,GPE,"had a sort of half‐romantic, half‐idyllic charm, which Hamlin could not help recognising: it certainly was better than",6
the Lake of,LOC,largest characters: “I am gone to sketch at the Lake of Massaciuccoli; shan’t be back till lunch; please,7
Hamlin,GPE,shan’t be back till lunch; please look after Hamlin.”,7
Hamlin,GPE,"her iron on the brasier, and stared full at Hamlin with large wide‐opened eyes of strange dark‐greyish blue, beneath",9
Hamlin,GPE,The young woman eyed Hamlin for a second in no very gracious manner; then,13
Lucca,GPE,disturbed till nine; and the cook is gone to Lucca for provisions.”,14
HAMLIN,GPE,HAMLIN felt rather contrite and humiliated as he sat down at,28
Hamlin,GPE,"personality upon her notice. But her very indifference afforded Hamlin an opportunity, and, as it were, a",42
Hamlin,GPE,"English nationality had explained many otherwise unaccountable mixed types to Hamlin; but this took him by surprise, and left",46
Sicily,GPE,"was an Italian. I think her family came from Sicily or Sardinia, or somewhere,where there are Spaniards",48
Sardinia,GPE,"Italian. I think her family came from Sicily or Sardinia, or somewhere,where there are Spaniards and Moors",48
Aberdeen,GPE,“but my father was Scotch. He came from Aberdeen.”,48
Scotland,GPE,"“Have you ever been in Scotland?” he asked, just by way of saying",49
Italy,GPE,"close all further conversation, “I was born in Italy; my father was employed at Spezia in the docks",50
Spezia,GPE,was born in Italy; my father was employed at Spezia in the docks.”,50
Spezia,GPE,was one of those who make the big men‐of‐war at Spezia.”,52
Florence,GPE,"mamma says, we are the most beautiful children in Florence. They always give us chocolate and marrons glacés to",56
Perrys,GPE,"the kitchen. Mildred, the eldest of the little Perrys, sidled up to Hamlin, as he stood on",57
Hamlin,GPE,"the eldest of the little Perrys, sidled up to Hamlin, as he stood on the doorstep leading into the",57
Acrasia,GPE,blue eyes. “I call it the garden of Acrasia; because mamma told us once about Sir Guyon—,62
æsthetic,GPE,"a splendid, queenly creature slanged by a sentimental, æsthetic fishwife, as he defined his hostess to himself.",77
studio—“of,GPE,"said Perry, as they sat smoking in the sheltered studio—“of course I’m very happy, and that sort of",82
Hamlin,GPE,"“I think her extraordinarily good‐looking,” put in Hamlin, enjoying the authority of his own verdict.",98
Hamlin,GPE,"exactly a question of the body,” went on Hamlin. “That girl is one of the most singular",102
Venus Mystica,LOC,"want to do her picture, Mr Hamlin, as Venus Mystica,” and Mrs Melton Perry set her meagre features",104
Brynhilt,GPE,have some sort of tragic past—a kind of Brynhilt or Amazon.”,110
Italy,GPE,"some old friends of ours, and followed her to Italy. He got a very good position in the docks",113
Spezia,GPE,"He got a very good position in the docks at Spezia, but then the other chaps caballed against him,",113
Hamlin,GPE,"The whole of the two following days, Hamlin neither saw nor particularly remembered the strange girl whose champion",126
Perrys,GPE,"girl whose champion he had constituted himself against the little Perrys. An old chaise, with an older pony,",126
Lucca,GPE,"guest along the dusty roads to the old town of Lucca, to various villas, and other sights of the",126
Hamlin,GPE,"cypresses. At the end of the third day, Hamlin, while smoking after dinner with his host, insinuated",126
Florence,GPE,that he really thought he must be pushing on to Florence. A look of blank terror overspread poor Perry’s,126
America,GPE,"said Hamlin, hypocritically, “I intend going to America; and I really think I ought to do a",128
Italy,GPE,think I ought to do a little work before leaving Italy.”,128
Florence,GPE,can work much better here than in that swelter at Florence—”,135
Florence,GPE,the Villa Arnolfini until the Perrys should themselves return to Florence in October.,140
Hamlin,GPE,"first week of his stay at the Villa Arnolfini, Hamlin did not lose sight of the Perrys’ strange nursemaid",141
æsthetic,GPE,approach and become familiar with creatures who had caught his æsthetic and poetic fancy. He often saw her hurrying (,141
Hamlin,GPE,"what she called a menial. And even more frequently Hamlin would meet her taking the children for a walk,",141
Perrys,GPE,"young woman a degree of courtesy which astonished the little Perrys, who had seen young men flirt with various of",141
Lucca,GPE,"of old brocade and satin which he had bought at Lucca, the various bits of weather‐stained cotton which he had",143
Hamlin,GPE,"; but when she understood that the job was for Hamlin, she seemed suddenly to develop a certain interest in",143
Hamlin,GPE,Hamlin looked at her as he might have looked at a,146
Perrys,GPE,"that same evening, as he was seated with the Perrys in front of the villa, watching the stars gradually",146
Hamlin,GPE,"in this house,” he said, turning to Hamlin. “Mrs Perry can’t be got to see",163
Lake,LOC,"wanted for the Lady Guenevere or the Lady of the Lake, or some lady or other—all a lie",165
Hamlin,GPE,"a little more in this direction or that, made Hamlin nervous. He had, of course, sketched and",175
Hamlin,GPE,"set up a conversation. One morning accident came to Hamlin’s assistance. Strolling about after breakfast, he found",175
Perrys,GPE,"the trampled grass revealed the recent presence of the little Perrys, a couple of books carefully buried under a heap",175
Hamlin,GPE,". She had been sitting a little while, when Hamlin, bending over his work, suddenly broke the silence",175
Valkyr,GPE,want!” thought Hamlin; “the Amazon or Valkyr—as I thought.”,197
Hamlin,GPE,"She showed no desire to say more, and Hamlin was now engrossed in his work. They exchanged but",200
Hamlin,GPE,“They are horrible rubbish;” and Hamlin rudely tore them to shreds. “If you want,207
London,GPE,weary æsthetic discussions which he had left behind him in London.,229
Hamlin,GPE,"“I say, Hamlin, old fellow,” said Perry, as they",246
Lucca,GPE,", “do you care to see the festival at Lucca to‐morrow? I’m going to take the children in",246
Lucca,GPE,"He had declined being one of the boisterous expedition to Lucca, for he detested children in general, and the",259
Perrys,GPE,"for he detested children in general, and the little Perrys in particular; and a day in the empty house",259
cariole,GPE,"cloud; a whirlwind of dust was raised by every cariole, heavily laden with singing and yelling peasants, which",261
Hamlin,GPE,Hamlin gradually made his way to the side of the altar‐steps,262
Paris,GPE,"their Sunday clothes, brilliant caricatures of last year’s Paris fashions—close packed together on reserved seats, enjoying",262
Hamlin,GPE,"a muffled, shuffling noise, and hid her from Hamlin. The organ and bells were pealing, the voices",262
San Michele,GPE,"Cavalcanti, about the Madonna picture, enshrined at Or San Michele behind the blazing tapers, and in which he recognised",262
Hamlin,GPE,"and in which he recognised his lady, came into Hamlin’s mind, with the sound of the music and",262
Avignon,GPE,", hopelessly jumbled, of Laura in the church at Avignon that Good Friday, and Beatrice among the blazing lights",262
Hamlin,GPE,". All of a sudden her eyes caught those of Hamlin standing close by, and yet separated from him by",262
china,GPE,"tables, covered with bottles shaped like pyramids, and china men, and Garibaldi busts, full of red and",267
Hamlin,GPE,"“Don’t be ridiculous, Melton,” cried Hamlin.",279
Hamlin,GPE,"kept on ahead with the two elder children, and Hamlin hung back with Miss Brown and the two younger.",282
Hamlin,GPE,"They relapsed into silence. As they walked along, Hamlin stole glances at his companion, walking stately and serious",295
cut‐paper,GPE,"one hand, while the other moved slowly with the cut‐paper flopper; and in this position the young nursemaid struck",308
Hamlin,GPE,"the right sort of thing, isn’t it, Hamlin?”",314
waggonette,GPE,with Anne Brown. Hamlin accompanied them down‐stairs to the waggonette.,315
Hamlin,GPE,"But, for some unaccountable reason, Hamlin did leave them alone the whole afternoon. After he",318
Italy,GPE,an opera such as only the misery and genius of Italy could produce. There was a triumphal procession of six,322
Nineveh,GPE,"there was the “magnificent apartment in the palace of Nineveh, disclosing a delicious view of the famous hanging gardens",322
Lucca,GPE,"find it particularly interesting at the Teatro del Giglio of Lucca. He sat looking on listlessly, not so much",322
Hamlin,GPE,"other’s arms and began the great duet, even Hamlin felt in a kind of way that this was passionate",322
Hamlin,GPE,", and her parted lips quivered. It seemed to Hamlin as if this were the real Semiramis, the real",322
Hamlin,GPE,"“Please let me carry that child,” cried Hamlin.",325
plane‐trees,LOC,red and green lamps were already dying out among the plane‐trees. In a minute they were rattling through the narrow,327
waggonette,GPE,"shawl. Anne Brown bent over the side of the waggonette, a dark outline, the damp night breeze catching",327
Hamlin,GPE,carriage asleep; and the voice of Perry whispered to Hamlin—,327
Florence,GPE,"man, I fear I really must go on to Florence to‐morrow afternoon.”",330
Hamlin,GPE,"his wife nearly went into hysterics at the notion of Hamlin—their poet‐painter, as she called him—suddenly",331
Hamlin,GPE,"with more emphasis than was his wont, that Hamlin had bored himself to death, and must be bored",331
Rome,GPE,"Florence for three days. I may go on to Rome, Naples, Egypt, America, Japan, or",333
Naples,GPE,"three days. I may go on to Rome, Naples, Egypt, America, Japan, or return to",333
Egypt,GPE,". I may go on to Rome, Naples, Egypt, America, Japan, or return to Hammersmith.",333
America,GPE,"may go on to Rome, Naples, Egypt, America, Japan, or return to Hammersmith. I have",333
Japan,GPE,"on to Rome, Naples, Egypt, America, Japan, or return to Hammersmith. I have no notion",333
America,GPE,“Oh no; I think I shall go to America this winter.”,340
America,GPE,"WALTER HAMLIN did not go to America. On leaving the Villa Arnolfini, he met at",351
Florence,GPE,". On leaving the Villa Arnolfini, he met at Florence some artist friends, who, in his condition of",351
Perugia,GPE,", easily drew him on with them to Siena and Perugia, thence into the smaller Umbrian cities, and finally",351
Abruzzo,GPE,", and finally into a wholly unexplored region between the Abruzzo and the Adriatic. By the time that their sketching",351
Adriatic,LOC,into a wholly unexplored region between the Abruzzo and the Adriatic. By the time that their sketching and article‐writing expedition,351
Hamlin,GPE,"round, and more than three months had elapsed since Hamlin had parted with the Perrys. Would Hamlin return with",351
England,GPE,the Perrys. Would Hamlin return with his friends to England? He had often said that he had had enough,351
Italy,GPE,He had often said that he had had enough of Italy—that he would go home and shut himself up,351
Hammersmith,GPE,"go home and shut himself up in his studio at Hammersmith, among smoke and river‐fogs, seeing not a living",351
East,LOC,"next spring, when he would set off for the East, never more to return to Europe, except for",351
Europe,LOC,"off for the East, never more to return to Europe, except for the Grosvenor private view. But when",351
Hamlin,GPE,". But when the moment for return north approached, Hamlin began to hesitate; and the very day before his",351
Italy,GPE,there was still some work for him to do in Italy.,351
England,GPE,"“I shall be in England at the end of two months at latest,”",352
Lucca,GPE,", which Hamlin described merely as “a girl near Lucca,” the nickname of “The Queen of Night",356
Florence,GPE,Hamlin got into the train to carry him northward to Florence.,358
Hamlin,GPE,"explained when or how, strange notions had come into Hamlin’s head, and a still stranger plan had finally",359
England,GPE,"nursery‐governess, or into the avowedly most beautiful woman in England—that is to say, in the particular pre‐Raphaelite",359
England,GPE,"to say, in the particular pre‐Raphaelite society which constituted England to him.",359
Florence,GPE,Melton Perry (for they were all Melton Perrys at Florence) filled Hamlin with a vague disgust and irritation.,360
Hamlin,GPE,for they were all Melton Perrys at Florence) filled Hamlin with a vague disgust and irritation. Much better that,360
Hamlin,GPE,logic of this notion; but certain it is that Hamlin never doubted for a second that either Anne Brown must,360
England,GPE,"day before his friends were to carry him back to England, a new notion came into his head. His",361
Florence,GPE,oblivion: he telegraphed Perry to hire him rooms in Florence. As the meeting of certain chemical substances will sometimes,361
Hamlin,GPE,"unprecedented properties, so ideas had come in collision in Hamlin’s mind, and out of a mere perplexity had",361
London,GPE,"when she should choose him, in what part of London he would buy a house for her, which of",361
Hamlin,GPE,is the suitable house. The only further concern of Hamlin was to make sure that Anne Brown was really all,361
Hamlin,GPE,all that she seemed to him to be; and Hamlin looked forward as to a kind of preliminary romance to,361
Hamlin,GPE,"mere soulless body,” repeated Mrs Perry—“as indifferent to Hamlin as a handsome cow would be.”",364
Hamlin,GPE,"“Do you expect her to throw herself into Hamlin’s arms?” cried Perry, angrily.",365
Hamlin,GPE,"with wonder; and in this instance in particular, Hamlin seemed really to consider Anne Brown much in the light",369
Hamlin,GPE,"she had gone to her writing‐table, Melton Perry kicked Hamlin’s foot under the table, and said in an",372
Paris,GPE,"Instead of the naked goddess triumphing over the apple of Paris, whom such a name would lead you to expect",374
Hamlin,GPE,—had never loved; and this knowledge was to Hamlin a source of infinite satisfaction.,375
London,GPE,"tapestry (rubbish which Hamlin would have blushed at in London), its shelves of books and chipped majolica and",376
Hamlin,GPE,"her opinion, was evidently its affable archangel. This Hamlin perceived to his pleasure; but, nevertheless, he",376
Malibran,GPE,"had heard, the anecdotes of Landor and Rossini and Malibran which the old lady had narrated; a few allusions",377
Hamlin,GPE,"Hamlin was looking at her, as she still turned her",383
Hamlin,GPE,"“I say, Hamlin,” he began, lighting his pipe, while",407
Viareggio,GPE,"Annie will be required to take the children down to Viareggio. I am extremely sorry for you, old fellow",409
Venus,LOC,"myself. That unfinished picture, that strange, terrible Venus, would haunt me in my dreams, and I",411
Hamlin,GPE,gets low fever again: much you’ll think of Hamlin’s masterpiece then.”,412
Hamlin,GPE,"existence, she began a mellifluous and irrelevant conversation with Hamlin across him.",415
Viareggio,GPE,matter? The children no more require to go to Viareggio than I require to be made Khan of Tartary.,419
Hamlin,GPE,"“Hamlin, old boy,” resumed Perry, “do",423
Florence,GPE,"goes to the bad. And then, here in Florence especially, a girl’s none the better looked at",427
china,GPE,"shelf, the scarlet and purple anemones in the cracked china bow], the brass synagogue lamp hanging in the",433
Hamlin,GPE,at once in the arm‐chair of faded green velvet opposite Hamlin’s easel.,438
Viareggio,GPE,"“You are going to Viareggio, Miss Brown,” he remarked.",442
Hamlin,GPE,"Hamlin was seated before his easel, looking now at his",446
Hamlin,GPE,Perry. If only she might have a photograph of Hamlin! . . . For less than a second she,446
Uffizi,GPE,"“Take that letter to the post‐office at the Uffizi,” he said, pointing to his writing‐table,",448
Hamlin,GPE,It was the first time that Hamlin had sent the old woman on an errand during one,449
Hamlin,GPE,"“Well,” went on Hamlin, “I have been thinking about that; and",455
Hamlin,GPE,"acquaintance must come to an end,” went on Hamlin, rapidly; “but I cannot let this",463
Hamlin,GPE,sobbing; and every convulsive heaving of her body made Hamlin feel a sort of sickening terror. He slid down,467
Hamlin,GPE,"of water?” she asked; then, stopping Hamlin, “never mind,” she said—“never mind—",470
Hamlin,GPE,", fevered and vaguely indignant. It was as if Hamlin had struck her; she felt insulted, outraged,",479
Hamlin,GPE,"been an ungrateful beast to feel as she had towards Hamlin; and a great wave of gratitude and awe,",479
Hamlin,GPE,"nothing and receiving everything, from his kindness: and Hamlin, with whom she had spoken not twenty‐four hours earlier",479
Hamlin,GPE,"more silent than usual. On returning home she saw Hamlin in the street, close to the door. The",479
Hamlin,GPE,"“Well, then,” went on Hamlin, “with regard to the plan which I submitted",482
Florence,GPE,"have me, long ago, before I returned to Florence. And, as a favour, I beg you",497
Florence,GPE,"my mind to this step while I was away from Florence. Besides, I am not going to marry Miss",499
Hamlin,GPE,"“Hamlin wants to bring up and marry Anne Brown,”",507
Hamlin,GPE,"came forward solemnly, and stretched out her hand to Hamlin.",510
Hamlin,GPE,"a union of mystic perfection;” whereupon, to Hamlin’s horror, the tall and bony lady deposited a",513
Hamlin—“I,GPE,—but—thank you so much!” exclaimed Hamlin—“I have not asked Miss Brown to marry me; I,514
cannon‐foundry,GPE,"Brothers, New Cross. He is foreman at a cannon‐foundry, or a place where they make torpedoes. I",518
Hamlin,GPE,"NO arrangements could be come to until Hamlin should hear from Anne Brown’s guardian, and this",525
Florence,GPE,"But when Hamlin returned to his lodging in Florence, on the fourth day after his proposal to Anne",526
Hamlin,GPE,"“Ask him to come in,” cried Hamlin.",529
free‐and‐easy,GPE,"?” answered Hamlin, stiffening at the other’s free‐and‐easy manner. The very look of this man rubbed him",533
Jamaica,GPE,"incarnation of what, to the descendants of Cavaliers and Jamaica planters, seemed the aggressive lower classes.",538
Hamlin,GPE,While Hamlin was speaking a sneer came over his listener’s face,542
Hamlin,GPE,The blood rushed to Hamlin’s head. That such an interpretation should be put,547
Hamlin,GPE,"In this man there was a hatred of Hamlin, not merely as a fine gentleman, an idler",554
Hamlin,GPE,"He remained silent for a moment, unable to realise Hamlin’s state of mind, while no longer able to",556
England,GPE,Mr Perry. So I shall take her back to England with me.”,557
Hamlin,GPE,. For a moment he hesitated; his aversion to Hamlin and Hamlin’s plan fighting painfully with his sense of,571
Spezia,GPE,"a man, when she was a tiny mite at Spezia; who took care of her when her mother was",594
England,GPE,"had to work hard for my life, out in England; but now I am quite safely off—indeed",606
England,GPE,"you there. You shall come back with me to England, and I will send you to the very best",606
Hamlin,GPE,". The thought of Hamlin passed across her mind—Hamlin, who was everything which Richard Brown was not.",607
the Boboli Gardens,LOC,the little Perrys were being taken for their walk in the Boboli Gardens by a Swiss bonne in a quilted cap; and,622
England,GPE,"When Richard Brown had returned to England with the signed documents in his pocket, Hamlin had",623
Hamlin,GPE,"to England with the signed documents in his pocket, Hamlin had immediately written two letters,—one to his lawyers, instructing",623
Coblenz,GPE,"lady in whom he was interested into her school at Coblenz. It was the Easter holidays, and Mrs Simson",623
Florence,GPE,Simson had taken advantage of the fact to come to Florence in order to take back her pupil herself.,623
Venice,GPE,". The greater part of that fortnight was spent at Venice, where Anne Brown had never been, and Hamlin",624
England,GPE,", and Hamlin parted company from them to return to England, only at Munich.",624
Munich,GPE,"company from them to return to England, only at Munich.",624
Rhine,GPE,"his boyish days, and lately, passing along the Rhine, had stayed with her for a day or two",625
Rhine,LOC,two in her old‐fashioned house by the confluence of the Rhine and the Mosel. The impression that this school was,625
Athenæum,GPE,"after the first sonnet which he sent to the ‘Athenæum,’ had always been her especial object of adoration",625
Hamlin,GPE,"condition? During those hours in the train, when Hamlin was for ever jumping out and overwhelming them with coffee",626
Venice,GPE,"and newspapers at every station; during those days at Venice, when they stayed at the same hotel (the",626
Hamlin,GPE,"contrary, she gradually became conscious of a fear lest Hamlin should have cheated himself in choosing her. Unable to",627
Munich,GPE,", she let it overshadow her. One evening at Munich, two or three days before they parted company with",627
Hamlin,GPE,", two or three days before they parted company with Hamlin, Mrs Simson, coming into Anne’s room,",627
Frankfurt,GPE,"It was a real relief when, one morning at Frankfurt, Hamlin was standing on the platform of the station",646
Hamlin,GPE,"a real relief when, one morning at Frankfurt, Hamlin was standing on the platform of the station, speaking",646
Hamlin,GPE,"it went quicker and quicker, and Anne Brown saw Hamlin for a minute on the platform; he was pale",649
Coblenz,GPE,"of the train, rattled over the round stones of Coblenz, and were finally following the obstreperously welcoming cook and",652
Rhine,GPE,of sunset was on the marblelike brownish‐green swirls of the Rhine; and filaments of reddish gold streaked the sky above,652
Hamlin,GPE,"Then she took from her trunk a framed photograph of Hamlin, and stuck it on her dressing‐table; he was",653
Lucca,GPE,"; the “Petrarch” he had given her at Lucca, and the volume of his own poems. She",653
Coblenz,GPE,"girls two were orphans, and had been sent to Coblenz as a convenient riddance by their guardians; one had",656
Europe,LOC,"riddance by their guardians; one had been deposited in Europe by her parents, to be called for when educated",656
New Zealand,GPE,"be called for when educated, and shipped off to New Zealand; one, a huge damsel approaching thirty, was",656
disport,GPE,and spending her leisure making up frocks in which to disport herself at the garrison balls.,656
Perrys,GPE,"mending the clothes and making the beds of the little Perrys, interesting herself as little in, and awakening as",657
Italy,GPE,her companions as she had done among her fellow‐servants in Italy. Mrs Simson had received full instructions from Hamlin as,657
Hamlin,GPE,in Italy. Mrs Simson had received full instructions from Hamlin as to all the things which she was and was,657
Bonn,GPE,"carried on a simultaneous flirtation with a lieutenant, a Bonn student, a painter, and a piano‐master; and",658
Hamlin,GPE,"the school: most of the girls had heard of Hamlin in England, and all of them had heard of",658
England,GPE,": most of the girls had heard of Hamlin in England, and all of them had heard of him from",658
æsthetic,GPE,; and the scientific girl of twenty‐eight thought æstheticism and æsthetic poets idiotic and immoral; and each of the others,658
Rhine,LOC,"garrison balls, and on excursions up and down the Rhine and into the neighbouring hills; but all this was",659
Rhineland,GPE,"these teachers, but with Hamlin; not in this Rhineland town, but in the distant places where he travelled",660
London,GPE,"travelled. He wrote to her very often, from London, from Italy, from Greece and Egypt, and",660
Italy,GPE,"wrote to her very often, from London, from Italy, from Greece and Egypt, and wherever he roamed",660
Greece,GPE,"very often, from London, from Italy, from Greece and Egypt, and wherever he roamed about. At",660
Egypt,GPE,", from London, from Italy, from Greece and Egypt, and wherever he roamed about. At first she",660
Hamlin,GPE,", on re‐reading what she had written in answer to Hamlin, she was often filled with shame and fear.",660
Hamlin,GPE,"not of much use. She was dreadfully afraid lest Hamlin should think her a drag upon him, lest he",660
