Location,ent_type,context,p_no
St. Paul’s,GPE,"friends; and, catching sight of the dome of St. Paul’s above the irregular spires of Ludgate Hill, she pulled",2783
Westminster Abbey,GPE,"that it will, that he’ll take us past Westminster Abbey, which would be even better.”",2784
china,GPE,"burnt as usual, the little tables were laid with china and silver. There was nobody there.",2790
London,GPE,I missed my train. I have been wandering about London all day. I can bear it no longer.,2806
London,GPE,"!” she thought, and all the darkness of London seemed set with fires, roaring upwards; but her",2872
