Location,ent_type,context,p_no
Wales,GPE,HAVE you ever been to Wales? I do not ask this question of any one,0
Virginia,GPE,"and Heloise, moving as those of good Paul and Virginia. Probably those wise ones will be very few;",0
Providence,GPE,"estimate of my own powers of narration, however amply Providence may have gifted me with self-appreciation, I",0
Wales,GPE,"Have you ever been to Wales? If you have ever visited the pretty, dirty",1
Ireland,GPE,"potatoes and absenteeism and head-centres flourish, alias Ireland, you have no doubt passed through a part of",1
the Rhyl Sands,LOC,"great frowning Orme's Head, or by excavations in the Rhyl Sands. Perhaps you have gone wedding-touring to Llanberis",1
Wales,GPE,"I have lived in Wales, so I speak with authority; and for my",2
Murray,GPE,"why am I drivelling on, like a sort of Murray and water, on the manners and character of this",3
Megæra,GPE,"as this world goes; some of them, capricious Megæra and Tisyphone lashed with scorpions for their derelictions. This",3
Providence,GPE,Record would charitably have us believe is the way of Providence—equally with those who enjoy the flavour of violent,3
Atlantic,LOC,"of a mountain, or submerged it beneath the big Atlantic waves; a valley lovelier than that one in """,4
Paris,GPE,"that one in "" Ida,"" where ""beautiful Paris, evil-hearted Paris,"" pastured his sheep",4
Paris,GPE,","" where ""beautiful Paris, evil-hearted Paris,"" pastured his sheep and his jet-black",4
Parises,GPE,"valley where there are no dangerous, good-looking Parises, only one or two red-headed Welsh squires",4
England,GPE,"prerogative and King Charles, or fought and lived for England and liberty: when most houses were black and white",5
Noes,GPE,"a species of Yes after half-a-dozen Noes; I cannot imagine why, for I certainly",6
Carmel,GPE,"(the Seer's) eyes on the top of Carmel, when, by his faith, he brought up",7
London,GPE,up the tarrying rain from the sea's chambers. London is pouring out her noble army of haberdashers and greengrocers,7
Scarborough,GPE,"of haberdashers and greengrocers into Ramsgate and Margate, and Scarborough and Llandudno. The John Gilpins of to-day",7
Llandudno,GPE,"and greengrocers into Ramsgate and Margate, and Scarborough and Llandudno. The John Gilpins of to-day are not",7
Edmonton,GPE,"with a modest outing to the ""Bell"" at Edmonton, ""all in a chaise and pair.""",7
Helvellyn,GPE,"are stretching their cramped legs up the steep sides of Helvellyn and Mont Blanc, and surveying the ""frozen hurricane",8
Salisbury Plain,GPE,haycocks: to-night it is as flat as Salisbury Plain. All day long the waggons have gone grinding and,8
Grand Pré,LOC,"-brown ale to the reapers of the village of Grand Pré. And the haymakers drink insatiably, and wipe the",9
Wales,GPE,"Perceiving their condition, though too old an inhabitant of Wales to be in any degree surprised at what is,",9
niais,GPE,"addressed to me; they always sound to me so niais.""",23
Europe,LOC,the carmine out of the cheeks and lips that sent Europe mad three centuries ago. An old sheep-dog,83
the Agra Bank,GPE,"as himself, the sinking of his little all in the Agra Bank, with resignation and fortitude truly Christian; but what",90
Queens,GPE,"scarlet pyramids of strawberries, great bag-shaped British Queens, and little racy, queer-tasted hautbois.",98
Rouen ducks,GPE,", and with cinnamon stockings down to their heels; Rouen ducks, and scraggy-necked turkeys. She is doing",158
Cochin,GPE,in a shower on to the broad backs of the Cochin householders. Fiercely the war of chickens—the pushing,168
Æneas,GPE,"metaphorically upon his back, almost as much as pious Æneas did the old Anchises literally. Esther suspends her employment",211
England,GPE,"my life, and I have the best woman in England for my mother.""",274
St. Petersburg,GPE,"locust's, he could be heard from here to St. Petersburg.""",282
Bermuda,GPE,"have to disappear before he rejoins his gallant corps in Bermuda), and looking very sentimental; yet not that",299
downspikes,GPE,"but is now a sphere of delicatest, fragilest, downspikes, and blows it like a child to see what",309
Naullan,GPE,"he had got them at Hugh Hughes's, at Naullan, and advised me to go and do likewise.",342
Miranda,GPE,but I am sure that if Esther had been in Miranda's place she would have so ended; would have,349
Plas Berwyn,GPE,through the wood from Glan-yr-Afon to Plas Berwyn—from Esther's home to Robert's. It,355
Plas Berwyn,GPE,"The apples' round faces are reddening in the little Plas Berwyn orchard; the shorn fields slope barely, slantwise along",355
Plas Berwyn,GPE,Plas Berwyn is a house of about the same size as Glan,357
Plas Berwyn,GPE,", as on the Sabbath morn every living soul at Plas Berwyn, every reluctant scullion and recalcitrant housemaid, is trundled",359
Ash,GPE,Sunday. Sunday is to them a sort of aggravated Ash Wednesday and Good Friday rolled into one. On Saturday,360
Geneva,GPE,"she has a miniature of the departed Brandon, in Geneva gown and bands, about as big as a teacup",361
bustless,GPE,"on the napes of their necks—their little, bustless, waistless, hipless figures, long plaintive noses,",362
waistless,GPE,"napes of their necks—their little, bustless, waistless, hipless figures, long plaintive noses, and meek",362
Carisbrook,GPE,", went knicketty-knock, Like a pebble in Carisbrook well.""",369
shire,GPE,"the Cravens' father, and they live in —shire; that is all I know about them.""",381
Plas Berwyn,GPE,"heard of nothing but Glan-yr-Afon and Plas Berwyn, Plas Berwyn and Glan-yr- Afon, and",400
Plas Berwyn,GPE,"but Glan-yr-Afon and Plas Berwyn, Plas Berwyn and Glan-yr- Afon, and now I'm",400
Feejee,GPE,", pettishly—""no sensibler than rubbing noses together, as the Feejee islanders did; for her part, she hated it",406
Kaffirs,LOC,in my life without there being a collection for the Kaffirs or the Jews or the Additional Curates or something the,465
knolly park,LOC,", to open the gates; then a grassy, knolly park; then a great red house, likewise picked out",486
St. John,GPE,"""Oh no! that was St. John.""",500
St. John,LOC,"("" St. John! What a pretty name! How much prettier than",501
St. John,GPE,"not you going to wait for Miss Craven? And St. John is not down, either,"" suggests Lady Gerard",505
St. Cecilia,GPE,"ever ask her to sit for St. Catherine, or St. Cecilia, or St. Anybody else; hers is essentially beauté",513
St. John,GPE,"Although Miss Blessington looks shocked, St. John only laughs. He looks pleasant when he laughs;",516
St. John's,GPE,". Only one little flash of indignant contempt shoots from St. John's grey eyes. ""How I hate my father!",518
St. John,GPE,"Nobody ever speaks much at dinner at Felton. St. John because he knows, if he trusted himself to speak",519
London,GPE,"I travelled once with a woman who ate gingerbread from London to Holyhead without stopping.""",529
Holyhead,GPE,"once with a woman who ate gingerbread from London to Holyhead without stopping.""",529
St. John,GPE,"brains or down his throat, whichever you choose. St. John, with his elbow resting on the shining oak table",540
St. John,GPE,"dogs, for callers, for old almswomen, for St. John—so that none can take it personally, can",543
St. John,GPE,"(""H'm I That means with St. John— ""'Walking in a shady grove With my",547
St. John,GPE,"Miss Blessington should have Bob, and I would have St. John!"")",547
St. John,GPE,"a hand on the sill, and jumps down. St. John apparently has an aversion from going out and coming in",556
St. John,GPE,"""Won't you join us, St. John ?"" asks Miss Blessington, stooping to reinstate a",557
St. John,GPE,"St. John hesitates, and looks towards Esther to see whether she",558
St. John,GPE,Fate does not smile upon the union of St. John and Esther. Disgrace and disaster attend their arms;,575
St. John,GPE,"; in ignorance, unskilfulness, and general incapacity, St. John is no whit inferior to his partner.",575
St. John,GPE,"""Please attend to the game, St. John! It is you to play!"" exclaims Constance",581
Plas Berwyn,GPE,", like a chrysalis from its sheath, in the Plas Berwyn dining-room, and not a whit more fully",589
St. John,GPE,"""What! eavesdropping?"" asks St. John, coming down the handsome, shallow stairs in knickerbockers",591
St. John,GPE,"St. John listens too, and a sneer comes and settles on",593
icily,GPE,"whether he liked the tinting. ""Faultily faultless, icily regular, splendidly null,"" as the pithy line",605
St. John,GPE,"As her eyes lift themselves shyly, to see whether St. John is observing her, they meet his, looking at",606
St. John,GPE,", who have been at it all their lives. St. John disappears too, and Constance and Esther are left tête",609
Constance,GPE,"all their lives. St. John disappears too, and Constance and Esther are left tête-à-tête.",609
St. John,GPE,"""Where's St. John?"" grunts miladi, who makes her appearance towards",612
St. John,GPE,"Miladi likes St. John; he is very good to her, and often",613
nettled,GPE,"was such a timid fawn,"" answers Essie, nettled.",616
St. John,GPE,"LUNCHEON comes, but no St. John. After luncheon Sir Thomas, Miss Blessington, and",624
Christendom,GPE,"how she looks; she is the arrantest coward in Christendom, and her heart sinks down to the bottom of",624
St. John,GPE,"whiskers nearly as white as any miller's, is St. John. He looks rather annoyed at the rencontre.",635
St. John,GPE,"""You had better turn back with us, St. John,"" suggests Constance, graciously.",637
England,GPE,"), ""there is no class of men in England so much to be pitied as heirs to properties.",670
Burleigh,LOC,"You should go about incognito, like the Lord of Burleigh.""",673
Norway,GPE,"can say, I have shot a few bears in Norway, and a good many turkeys and grebe in Albania",674
Albania,GPE,"Norway, and a good many turkeys and grebe in Albania; I have killed several salmon in Connemara: I",674
Connemara,LOC,"grebe in Albania; I have killed several salmon in Connemara: I have made a fool of myself once,",674
St. John,GPE,"""Quite!"" acquiesces St. John, laughing heartily in his intense relief. ""And",688
St. John's,GPE,"in thinking what a pleasant, manly, straightforward face St. John's is—what a thoroughly terrified face it looked when",705
St. Anthony's,GPE,"Mr. Gerard returns, with a fire hardly inferior to St. Anthony's in his face; with his hair cleaving damply to",706
unfastens,GPE,"He rises, and unfastens the cob from the tree-branch to which he",712
St. John's,GPE,they can hold a beautiful woman without feeling it. St. John's blood is giving little quick throbs of pleasure. His,718
St. John,GPE,"familiarity. It does not arise from any distaste for St. John certainly, nor yet from any quixotic loyalty to Bob",721
plainlier,GPE,"says, in a kind, anxious voice, and plainlier still with kind, anxious eyes, ""I'm",725
St. John's,GPE,"St. John's rages, when he does get into them, which",731
St. John,GPE,! I see; a short cut home! Poor St. John has such a horror of taking a ride for riding,735
St. John,GPE,", and no such infernal machine as a gun. St. John and his papa go out shooting together. Sir Thomas",736
St. John,GPE,"""St. John sent them to you"" (rather shortly).",746
St. John,GPE,"Outside Miss Craven's door St. John pauses, as one that is devout hesitates on the",753
St. John,GPE,"""Has Miss Craven changed her mind, St. John?"" asks Miss Blessington from the doorway.",759
St. John,GPE,"St. John starts. ""Not that I know of.""",760
St. John's,GPE,"is Sir Thomas's; the Field, that is St. John's; the Cornhill, that is everybody's. Sir",762
miladi,GPE,"n't take the dice up in such a hurry, miladi,"" he says, snappishly; ""how the",763
Chambéry,GPE,"Miss Blessington, dressed by Elise in Chambéry gauze, and by Nature in her usual panoply of",766
St. John,GPE,", from the recess where she has been deposited by St. John, whose eyes she encounters, considering her attentively over",767
St. John,GPE,St. John has been rather unlucky in his experiences of women hitherto,768
Bastille,LOC,"eat and breathe with—like the fellow in the Bastille, don't you know, that got so fond",778
St. John,GPE,St. John jumps up and walks over to the players; there,783
St. John,GPE,"Pull, Baker!—Baker being represented by Constance, Devil by St. John and Esther. But two pull stronger than one,",787
St. John,GPE,"Is Miss Craven ready to come down?"" asks St. John, one morning, addressing the question to Miss Blessington",788
St. John,GPE,"""I don't know, I'm sure. St. John?""",789
St. John,GPE,"""You are very dull of comprehension this morning, St. John.""",811
St. John,GPE,"looks forward towards the ante-dinner hour, when St. John will come in from the day's amusement or occupation",823
St. John,GPE,"and his patched, creaking, Naullan boots. Imagine St. John introduced to those boots! A cold shiver runs down",824
St. John,GPE,"shiver runs down her spine at the bare idea. St. John is no dandy, it is true, but coats",824
St. John,GPE,"which the above-reported short dialogue took place, St. John and his father, converging from different points of the",825
St. John,GPE,Colossi have just deposited tea on a small table. St. John has neither neckerchief nor collar; his brown throat is,825
St. John,GPE,"""They are not for you, St. John; they are for the bazaar.""",838
bazaar,GPE,"Ere the arrival of the looked-for bazaar, Miss Craven's cure is complete. On the",868
St. John's,GPE,"garden, free from any remaining lameness, leaning on St. John's arm. She does not need the slight stay,",868
St. John,GPE,"leaf that makes the basin of the fountain—watching St. John, rapt and absorbed in her pretty foolish chatter.",868
St. John,GPE,"St. John speaks presently. ""One forms mistaken estimates of people",873
St. John,GPE,"""St. John is very useful as a walking-stick, is",880
St. John,GPE,"; ""and from some careless, slighting remarks that St. John let fall the other day, I thought I should",888
St. John's,GPE,"Esther on her first arrival at Brainton station, and St. John's smart T.-cart, with his big, black horse,",896
Honiton,GPE,", coming out under the portico and unfurling her white Honiton parasol. ""How many of us are there?",897
St. John,GPE,"myself, four, and you two gentlemen six. St. John, will you drive Miss De Grey?""",897
St. John,GPE,"And meanwhile St. John holds dreary converse with himself, while a river of",902
Melford,GPE,"Precisely seventeen minutes past two of the clock, the Melford town-hall clock, and visitors are beginning to",903
Melford,GPE,", are trotting and walking and crawling up the steep Melford street. Climbing the side of a house is child",903
Melford,GPE,clerks and doctors' assistants of weak intellect as inhabit Melford town.,906
Melford,GPE,"into his arms? So in this desert island of Melford, St. John and Dick, the only two respectable",908
St. John,GPE,"arms? So in this desert island of Melford, St. John and Dick, the only two respectable fellows, as",908
squireens,GPE,", as they think, among a savage horde of squireens, march about, hooked on together for mutual defence",908
shire,GPE,and all Melford and the southern half of ——shire are compressed into it—the result being much animal,917
Hebe,GPE,"""Rhadamantha, Hebe, and Niobe!"" says St. John, laughing",932
Niobe,GPE,"""Rhadamantha, Hebe, and Niobe!"" says St. John, laughing.",932
Providence,GPE,"""Providence made a great mistake when it made that girl a",939
St. John,GPE,"old fellow,"" remarks Mr. De Grey, touching St. John on the shoulder as he leans against the wall,",941
St. John,GPE,"T.-cart stand at some little distance down the street. St. John offers Esther his arm, and she, having no",944
England,GPE,"""A tour of all the cathedral towns throughout England, as the Heir of Redclyffe proposed spending his honeymoon",952
London,GPE,", but you may have met some of them in London: Sir Charles and Lady Bolton; Mr. and Mrs.",984
bazaar,GPE,"-the-by, you saw them at the bazaar yesterday); and two or three stray men.",984
St. John,GPE,"odd? "" asks her brother, who, with St. John, lounges in from the billiard-room, where",999
Constance,GPE,"an armchair forwards for her). ""This is Constance's chair: and don't look as if you",1049
St. John,GPE,"""St. John! St. John!"" shouts Sir Thomas, banging",1062
London,GPE,"as, for example, that she has been to London this season ; that she has seen Faed's last",1067
St. John,GPE,St. John is not in the very least degree elevated; but,1072
Asia,LOC,""" What part of the world is it in?—Europe, Asia, Africa, America, or the Polynesian Islands?",1095
Africa,LOC,"part of the world is it in?—Europe, Asia, Africa, America, or the Polynesian Islands?""",1095
America,GPE,"the world is it in?—Europe, Asia, Africa, America, or the Polynesian Islands?""",1095
the Polynesian Islands,LOC,"it in?—Europe, Asia, Africa, America, or the Polynesian Islands?""",1095
Naullan,GPE,"""It is three miles from Naullan, if you are any the wiser.""",1096
Naullan,GPE,"""Of course it does: why I was at Naullan once.""",1097
Naullan,GPE,"""If you are three miles from Naullan, and they are only four, I don't",1103
St. John,GPE,""" St. John, you are wanted to make up a rubber,",1107
St. John,GPE,""" St. John is impracticable,"" says Constance, returning from her",1118
St. John,GPE,"take their advice, if it were to give up St. John! Give him up! How can I give up",1124
St. John,GPE,you! Poor Bob! and his yellow roses that St. John made such fun of! How I wish that the,1124
St. Johns,GPE,leave you? How I wish that all Bobs and St. Johns and other worries were at the bottom of the Red,1124
the Red Sea,LOC,"St. Johns and other worries were at the bottom of the Red Sea, and you and I king and queen of some",1124
St. John,GPE,that it would be rather a dull amusement; with St. John it is different.,1127
St. John,GPE,"ripe, fresh beauty, with only the night and St. John to look at her.",1130
St. John,GPE,"St. John smiles—a smile half fierce, half amused.",1152
ce n'est que,GPE,"to tell a lie a hundred times than once; ce n'est que le premier pas que coûte. Tell me,""",1156
déshabille,GPE,drawing down upon themselves the apparition of Sir Thomas in déshabille and a blunderbuss. Their faces are close together;,1157
St. John,GPE,"! Sing, oh goddess, the destructive wrath of St. John, the son of Thomas! What time, place",1163
St. John,GPE,"""It is a pity, St. John,"" says Miss Blessington, drawing herself up,",1167
St. John,GPE,"come prying and eavesdropping upon their betters,"" retorts St. John, flushing angry-red to the roots of his",1168
St. John,GPE,"Don't be a fool, Conny!"" cries St. John, hastily, in bitter fear of having compromised Esther",1170
St. John,GPE,"she means? She's a fool!"" answers St. John, wrathfully. ""Go to bed, and do",1175
Welsh,GPE,"serious face to the east. The service is in Welsh, of which he does not understand a word.",1177
St. John,GPE,", golden chignon, and little green aerophane bonnet. St. John generally pulls the brass rings of his bit of curtain",1179
St. John,GPE,. Miladi confesses that she has gone to sleep. St. John makes no pretence of kneeling at all: he leans,1179
St. John,GPE,green to soften and relieve them. Across the grass St. John comes lounging; his Sunday frock coat sitting creaseless to,1181
St. John,GPE,frustrate the téte-à- téte she sees impending between St. John and Esther.,1183
St. John,GPE,", and four miles back! Are you mad, St. John? What do you suppose one is made of?",1185
St. John,GPE,"""Don't be so absurd, St. John !"" cries Miss Blessington, pettishly. ""Miss",1189
St. John,GPE,"you (with a fat smile). And, St. John, be sure that you are back in time for",1192
St. John's,GPE,"and flowers, and blows in little fickle puffs against St. John's bronzed cheeks and Esther's carnation ones. The girl",1200
St. John,GPE,"""Who is Robert Brandon "" repeats St. John, rather crossly.",1207
St. John,GPE,"and his pothooks and hangers, and yet vexed with St. John for sneering at them.",1213
Russia,GPE,"to insult mine"" (holding out a very minute Russia leather one). ""But may I ask,",1216
St. John,GPE,"Rung in by the grave music of their invitation, St. John and Esther enter. Verger or pew-opener is",1226
St. John,GPE,"only one hymn-book in the pew, and St. John is glad of it. There is something pleasant in",1229
St. John,GPE,"the parson at Esther, the parson's sister at St. John—Jack at Jill, and Jill at Jack as",1231
St. John,GPE,"plainly, unequivocally—Yes or No; Robert or St. John. The man whose conversation bores her, whose proximity",1254
St. John's,GPE,"a cannon-ball that will knock her away from St. John's side out into the drear, great world for ever",1267
St. John,GPE,"""Or mine,"" suggests St. John, ironically; ""put it as strongly as you",1274
St. John,GPE,"road and leads across a line of grass fields. St. John crosses the first stile, and waits politely on the",1276
Paradise,LOC,"divided and watered the rose gardens and asphodel fields of Paradise, a little beck, with many turns and bends",1279
St. John,GPE,", it is still but a narrow thread, and St. John clears it at a jump.",1279
Nile,LOC,"As headstrong as an allegory on the banks of the Nile !"" remarks Gerard, resignedly, quoting Mrs. Malaprop",1292
St. John,GPE,"St. John thinks it rude to disagree with her, so holds",1296
St. John,GPE,St. John knocks at the half-open door and puts his,1304
St. John,GPE,"St. John remains in the outer room, looks at the clock",1315
china,GPE,"the clock, behind whose dial-plate a round china-moon-face peeps out; takes up the",1315
Melford,GPE,"For a Good Boy,"" ""A Keepsake from Melford,"" ""A Present from Manchester,"" hiding",1315
bedgown,GPE,"a short, dark, linsey petticoat and lilac cotton bedgown, which, by its looseness, can adapt itself",1316
St. John,GPE,St. John surveys her for some moments: looks upward from petticoat,1317
bedgown,GPE,"her for some moments: looks upward from petticoat to bedgown, and downward from bedgown to petticoat, but observes",1317
St. John,GPE,"St. John bursts out laughing. ""A goddess in a bed",1321
St. John,GPE,It is latish and duskish by the time that St. John and his companion set out on their homeward way.,1324
St. John's,GPE,in this world; at the end of that time St. John's doubts return. He puts her a little way from,1332
Constance,GPE,"better than Sir Thomas, than my mother, than Constance, perhaps; but such liking as that I would",1336
St. John,GPE,"so strongly resent being worried about him?"" retorts St. John suspiciously.",1345
"key—""I",GPE,"his voice changing to an emphatic, eager, impassioned key—""I have been so little used to having things go as",1347
Providence,GPE,"squinting children, who, but for the finger of Providence interposing, might have been mine.""",1350
Providence,GPE,and on the hair crown of yellow gold with which Providence has seen fit to circle her dull fair brows.,1378
St. John,GPE,"""St. John is so terribly energetic!"" says Miss Blessington,",1381
Constance,GPE,"his discovering that he is an object of attention to Constance, it returns rather suddenly to the perpendicular.",1385
Israel,GPE,"destroying angel passed by the blood-painted lintels of Israel. Thoughts sweeter than virgin honey, thoughts bitterer than",1386
St. John's,GPE,"and out to the sunshiny sward, where two of St. John's dogs, forbidden by Sir Thomas on pain of death",1387
St. John,GPE,"The door opens, and St. John enters.",1399
Constance,GPE,", sitting down on the arm of the sofa beside Constance and looking over her shoulder.",1403
St. John,GPE,"into acrostics. Is there a Bible anywhere about, St. John?""",1411
St. John,GPE,St. John walks slowly round the well-laden tables; looks,1412
shyest,GPE,"pause—a little brief pause—in which that shyest, fleetest-winged of earth's visitants—Happiness",1444
earth,LOC,"—in which that shyest, fleetest-winged of earth's visitants—Happiness—folds her pinions and settles",1444
St. John,GPE,seat—to her deserted cows and impossible profiles. St. John looks out of the window. No transformation scene at,1455
St. John,GPE,"""They intend me to go with them,"" St. John had said to her overnight, à propos of this",1460
St. John,GPE,"half an hour of arguments, persuasions, caresses, St. John is constrained vexedly to own to himself that in that",1461
St. John's,GPE,"St. John's face gathers blackness. ""I am to understand,",1504
icily,GPE,"have no claim upon you,"" he answers, icily.",1516
St. John,GPE,"Through all his bitter, surging wrath, St. John can hardly forbear a smile. ""And you became",1547
"indignantly—""I",GPE,"I to be with you?"" he asks, indignantly—""I, who cannot see you without coveting you?",1571
St. John,GPE,"with a smile more tearful than her tears. ""St. John,"" she says, earnestly, ""don't",1582
St. John,GPE,"than you can say 'I forgive you.' St. John, take me back, try me once again!",1586
buhl,GPE,"from her grasp is the great house—are the buhl and marqueterie cabinets—are the ""Venus surprised by",1598
St. John,GPE,"on the smoking-room table."" It is St. John, speaking in much his usual voice. He is",1599
St. John's,GPE,"old lass!"" This is the affecting form that St. John's last words take. She cranes her neck out of",1600
St. John,GPE,"up in a vague, confused horror. Is it St. John come back? Is it some one come to murder",1602
St. John,GPE,"for permission, the person who knocked enters; not St. John, nor a murderer—only a dishevelled housemaid,",1602
Berwyn,GPE,"""When is the next train to Berwyn?"" cries Esther, almost before they had pulled",1628
Utrecht,GPE,"the waiting-room, sinks down upon a green Utrecht velvet chair.",1637
Utrecht,GPE,"the empty fire-place stands a stiff, green Utrecht velvet sofa, and round the bare table more green",1638
Utrecht,GPE,"velvet sofa, and round the bare table more green Utrecht velvet chairs. Opposite to Esther, against the wall",1638
