Location,ent_type,context,p_no
Lovedy,GPE,"Lady Temple begged to see the children, and especially Lovedy, whom she said she should like to take home",2342
Lovedy,GPE,"unsettles a child so to be going home, and Lovedy has a bad cold, my lady, and I",2343
Lovedy,GPE,"However, Lady Temple kept to her desire of seeing Lovedy, and of letting her companion see the rest of",2344
Lovedy,GPE,"it struck the ladies that all looked ill, and Lovedy was wrapped in a shawl, and sat cowering in",2344
Ailie,GPE,"perplexed, she looked daggers at the children, or Ailie fancied so, but she was forced to follow the",2345
Lovedy,GPE,". “My poor child,” she said to Lovedy, “you seem very poorly. Have you any",2345
Lovedy,GPE,"“Please, please!” began Lovedy, with a hoarse sob.",2346
Lovedy,GPE,"eagerly, though with a fugitive action of terror, Lovedy cried, unpinning the thin coarse shawl on her neck",2349
Lovedy,GPE,"Lady Temple took Lovedy in one hand, and Mary in the other;",2357
F. U.,GPE,"shouted out, “Oh, Aunt Rachel, your F. U. thing is as bad as the Sepoys. But we",2367
Lovedy,GPE,"emerged. She lifted out the little muffled figure of Lovedy, set her on her feet, and then looking",2368
St. Norbert’s,GPE,"about the terms on which they had been placed at St. Norbert’s, and Rachel, who was obliged to reply,",2389
Lovedy,GPE,"words, which were more reluctant and more hoarse from Lovedy, but even more effective. Rachel doubted no more",2393
Lovedy,GPE,"by them; with very trembling fingers by poor little Lovedy, and Mr. Grey said he would send a policeman",2394
Lovedy,GPE,"growing on her of the miserable condition of poor little Lovedy, whose burning hand she held, and whose gasping",2397
Sebastopol,GPE,a fellow that tells me he lost his arm at Sebastopol when he has got it sewn up in a bag,2413
Lovedy,GPE,"the fire, sending Susan away with the assurance that Lovedy should stay at the Homestead, and be nursed and",2417
Homestead,GPE,"away with the assurance that Lovedy should stay at the Homestead, and be nursed and fed till she was well",2417
Avonmouth,GPE,"sent for; but between Rachel and the faculty of Avonmouth there was a deadly feud, and the proposal was",2417
Athens,GPE,Timon of Athens.,2432
Lovedy,GPE,"hunt up a housemaid to make up a bed for Lovedy in a little room within her own, and the",2433
Lovedy,GPE,"entered it; but she ran upstairs at once to Lovedy, and remained with her till disinterred by the desperate",2465
Woolwich,GPE,had it through all the children of the regiment at Woolwich.”,2475
Lovedy,GPE,"was explaining to the worn-out mother that little Lovedy was more unwell, and that Captain Keith had kindly",2482
Avonford,LOC,", and his partner is with a bad accident at Avonford. The best plan will be for me to ride",2483
Lovedy,GPE,"of relief rushed into Rachel’s eyes, tears that Lovedy must have perceived, for she spoke the first articulate",2505
Lovedy,GPE,"“You will be better now, Lovedy, here is the doctor,” said Rachel,",2506
Lovedy,GPE,", but she turned from him and came back to Lovedy, who had been roused by what had been passing",2511
Ailie,GPE,"these days. Don’t stay away, pray, Ailie,” as Alison was following the child. “",2544
Ailie,GPE,"you have got the last word, for here comes Ailie.”",2551
Superior,LOC,", I went there, and begged to see the Superior, and a most kind and sensible lady I found",2564
Ailie,GPE,"master and you, and the sight of you, Ailie, had evidently stirred up much old affection, and",2566
Ekaterinburg,GPE,’s. How long would it take to hear from Ekaterinburg? I suppose Edward could travel as fast as a,2578
Myrtlewood,GPE,"day as this, while Alison was in charge at Myrtlewood in Lady Temple’s absence, and Rachel Curtis was",2595
London,GPE,"on by an early train to obtain legal advice in London, and then to see Harry Beauchamp. Meantime,",2596
St. Norbert’s,GPE,"to the little boy till his mother’s return from St. Norbert’s, when she had been obliged to give the first",2597
keepit,GPE,"mither, I’ll no say he’d been easy keepit out o’ the thick o’ the distress,",2614
yon,GPE,"was sick an’ lonesome, puir lad, in yon far awa’ land o’ wild beasts an’",2614
Ailie,GPE,"I think of myseif, while all, even my Ailie, are in distress and danger?”",2620
Deanery,LOC,"on the mother and daughters coming to sleep at the Deanery, on the Tuesday night, and remaining till the",2658
Deanery,LOC,"a visit. Lady Temple was likewise asked to the Deanery, but Conrade was still too ill for her to",2658
Ailie,GPE,"“Five or six years ago, Ailie, when I was a much poorer creature,”",2662
Belfast,GPE,his wife! I was glad to get away to Belfast.”,2677
Paris,GPE,“From Paris?”,2687
Edinburgh,GPE,Poor Mary’s most brilliant season was a winter at Edinburgh; and it must be his doing more than hers,2688
Edinburgh,GPE,is in the land of the living or gone to Edinburgh—as I hear is to be the lot of,2688
Ailie,GPE,"“I will walk back with you, Ailie. I must see the good little heroine of the",2691
Venice,GPE,“Is it so nominated in the bond?”—Merchant of Venice.,2703
St. Herbert’s,GPE,"arrangement that the prisoner should provide for the asylum at St. Herbert’s, and on her monthly payment to him of the",2710
"Jury,—The",GPE,"“Gentlemen of the Jury,—The case for the prosecution does not sustain the indictment or",2724
Avonmouth,GPE,"was from the crowd outside, many of them from Avonmouth, and all frantic with indignation at the cruelty that",2728
Belfast,GPE,lay his hands on no one but Dr. Long at Belfast.,2750
Ekaterinburg,GPE,"my father is Mr Williams, he is away at Ekaterinburg.”",2764
Ekaterinburg,GPE,“Do you remember any time before he was at Ekaterinburg?”,2765
Kensington,GPE,"“Oh yes; when we lived at Kensington, and he had the patent glass works.”",2766
Avonmouth,GPE,"it had been after Colonel Keith’s first stay at Avonmouth, but that was all, and being asked if",2782
Ailie,GPE,"Rose waited for them. “Ha, my little Ailie, I must make better friends with you.”",2810
Ailie,GPE,"“My name is Rose, not Ailie,” replied the little girl.",2811
waggonette,GPE,"She insisted that all should go home together in the waggonette, and Rose found herself upon Mr. Beauchamp’s knee",2819
Avonmouth,GPE,“At Avonmouth.”,2824
The Beleaguered City,GPE,"The Beleaguered City, LONGFELLOW.",2836
LONGFELLOW,GPE,"The Beleaguered City, LONGFELLOW.",2836
Deanery,LOC,"A dinner party at the Deanery in the sessions week was an institution, but Rachel",2837
Deanery,LOC,that Captain Keith would be there. No; the Deanery did not greatly patronize the barracks; there was not,2865
Deanery,LOC,"here was the curfew ringing, and that at the Deanery, which always felt injured if it were seven o’clock",2866
Deanery,LOC,". Certain it is that Mrs. Curtis went into the Deanery with her head considerably higher, kissed Rachel vehemently,",2920
Russia,GPE,". “I believe I shall have to go to Russia,” he said with some dejection.",2955
Homestead,GPE,"last day of those that he had spent at the Homestead, and he was leaving Rachel certainly better. She",3026
Deanery,LOC,"and then he was invited to a party at the Deanery, “which the mother would never have forgiven me",3026
Scotland,GPE,"Rachel, quickly, “the regiment is going to Scotland, and he and the mother have taken it into",3043
London,GPE,"staring at her recur all night, and when the London solicitor came down about the settlements, she shrank in",3070
London,GPE,a tin-box in Mr. Martin’s chambers in London.”,3077
London,GPE,"from old Cox, with a head and heart in London charities and churches, and it had struck him as",3084
Avonmouth,GPE,to apply the sum otherwise for the benefit of the Avonmouth girls.”,3086
emerald meadows,LOC,"retraced on the waters of the little lake set in emerald meadows, which lay before the eyes of Rachel Keith,",3096
Scotland,GPE,"travelling, and as they were eventually to go to Scotland, had proposed beginning with Dutch reformatories and Swiss cretins",3098
Wales,GPE,"that the first few weeks were to be spent in Wales, where the enjoyment of fine scenery might, it",3098
Llan,LOC,"shall we cut the waterfall, and get on to Llan—something?”",3110
Littleworthy,GPE,"that Lord and Lady Keith had taken a house at Littleworthy, while Gowanbrae was under repair, and she dreaded",3123
London,GPE,"on the next she much regretted having an engagement in London, but on the Sunday they would not fail to",3124
St. Augustine,GPE,"Mr. Clare came back to ask for a reference to St. Augustine. On her offer of her services, she was",3177
St. Augustine,GPE,"the Library of the Fathers, but spying a real St. Augustine, she could not be satisfied without a flight at",3177
Earlsworthy Park,GPE,"came, and Alick took Rachel for a ride in Earlsworthy Park, a private gate of which, just opposite to",3178
Amens,GPE,"but the shady garden, and the echoes of the Amens, and sweet, clear tones of singing, seemed",3181
Snowdon,GPE,"No one knows you are not on the top of Snowdon, or you would have had all the world to",3185
Avonmouth,GPE,", but he hates doctors. What is the last Avonmouth news? Is Ermine in good heart, and the",3190
London,GPE,under repair. It was within such easy reach of London that Bessie had been able from thence to go through,3200
London,GPE,"in her own old neighbourhood than she could be in London, and wisely abstained from a full flight till she",3200
London,GPE,"quite necessary and according to his wishes, and the London ones were usually for the sake of trying to detach",3200
the Earlsworthy Woods,LOC,“Then we are off to the Earlsworthy Woods.”,3261
Mahometan,GPE,“Which of us is the Mahometan?”,3263
Edinburgh,GPE,He will see no one but his old surgeon in Edinburgh.”,3280
Devon,LOC,and she wanted to show her a view of the Devon coast done by a notable artist in water-colours,3287
Scotland,GPE,"; and, as Bessie says, the move to Scotland would not be easy just now. As I said",3295
West,LOC,", “it is too intricate and graceful for the West.”",3302
India,GPE,"me. It was one that Lady Temple brought from India, and never had made up. Poor Grace could",3303
Earlsworthy Park,GPE,"drive the well-used phaeton about three miles through Earlsworthy Park, to a pleasant-looking demesne in the village",3308
Shetlands,LOC,", up came Lady Keith with her two brisk little Shetlands. She was one mass of pretty, fresh,",3308
Avonmouth,GPE,"trouble, and he could not get him on to Avonmouth till he had been to some chemical institution about an",3311
Edinburgh,GPE,"to-morrow, and see if the journey to Edinburgh is practicable. I almost thought of sending an apology",3313
Scotland,GPE,see she is really going to see about going to Scotland.”,3320
Scotland,GPE,as if—I shall make Lord Keith go to Scotland any way now. I was so thankful to see,3335
Scotland,GPE,"the others. When I said I was going to Scotland, what business had he to—Oh! the",3335
London,GPE,"Harvey was not at home, and we telegraphed to London, but no one has come yet, and now",3339
London,GPE,"at seeing and hearing nothing from Mr. Harvey. The London doctor arrived, he met him and took him up",3344
London,GPE,waited and watched till other sounds were heard. The London doctor was going away. Alick sprang to the door,3349
the dark valley,LOC,this was a fearfully perceptible stage on her way to the dark valley.,3374
Lovedy,GPE,"all counteracted and drove aside the painful phantom left by Lovedy’s agony, and yet the words of that poor",3383
St. John,GPE,". Or stay, it is the last chapter of St. John. I could hardly fail in that. Sit near",3386
London,GPE,"consented to a consultation the next day with an eminent London surgeon, since it was clear that the blow,",3398
Rio,GPE,"implied hope, sent him forth to his uncle at Rio, on the promise that if he did his utmost",3405
England,GPE,uncle was only too glad to ship him off for England. And when Lady Keith made her temporary home in,3405
London,GPE,", “I’m Isabel. I came down from London to-day because it was so very shocking and",3410
Scotland,GPE,"her own nursery establishment, which had been left in Scotland with a head nurse, whose name came in with",3411
Russia,GPE,"had something to do with Uncle Colin’s journey to Russia; so ridiculous of him at his age, when",3414
Avonmouth,GPE,reasons that he wished to take our dear Bessie to Avonmouth. He said there was a girl there of a,3439
Liverpool,GPE,"read the paper to him—all that dinner at Liverpool, and he made remarks, and expected me to",3460
waggonette,GPE,"o’clock train, and Lady Temple sent me in the waggonette to meet them. Aunt Ailie would not go,",3482
Providence,GPE,of hope. I cannot believe but that the Providence that has done so much to discover Edward’s innocence,3484
Ailie,GPE,filled a famished heart. Could you but have seen Ailie’s face all last evening as she sat by his,3486
Ailie,GPE,"almost stern mask had been taken away, and our Ailie’s face was beaming out as of old when she",3486
Rose,GPE,"a little that he is not more wrapped up in Rose. To say the truth, so do I;",3486
waggonette,GPE,"“They all went this morning in the waggonette, and the two boys with Miss Curtis in the",3487
Russia,GPE,undutiful to say anything about the sheep’s wool in Russia smelling of tobacco. Conrade says it is all smoking,3493
Prague,GPE,state that on the 6th he had come back to Prague from a village with a horrible Bohemian name—all,3498
Avonmouth,GPE,"Avonmouth,",3507
Homestead,GPE,I wrote it out and sent it up to the Homestead. There was a note this morning requesting Edward to,3514
Ailie,GPE,by Harry than by the Doctor; but he wants Ailie and me to go and stay at Belfast. Now,3514
Belfast,GPE,"he wants Ailie and me to go and stay at Belfast. Now I must hear Rose read, in order",3514
Bohemia,GPE,"remorse and exultation. At last came the journey to Bohemia, and his frauds became the more easy, until",3516
England,GPE,"German gambling places that destitution brought them back again to England, where he could better play the lecturer, and",3516
London,GPE,"neighbourhood, he had imagined us to be still in London, and though he heard Alison’s name, he",3516
Ailie,GPE,"that poor child’s name was given for love of Ailie, and the perception of having been used to bring",3516
Edinburgh,GPE,", who in all the bustle of the remove to Edinburgh had found time to come to Bishopsworthy to do honour",3520
Scotland,GPE,", except a few heirloom jewels that must return to Scotland. Alick demurred greatly, but the old man would",3529
India,GPE,father’s handwriting. They look like his letters from India.”,3561
London,GPE,decided announcement from Rachel that she must go up to London to procure equipments for the baby to be presented in,3566
London,GPE,How many times did you say you had been in London?”,3575
London,GPE,"He is quite right not to let you run about London by yourself, but he will be quite satisfied if",3595
Menteiths,GPE,", looking up sharply, “will nothing make the Menteiths understand that I would rather put out the child to",3607
Edinburgh,GPE,"in perambulators in the sun. You will be in Edinburgh?” he added, turning to Rachel.",3609
Scotland,GPE,", I know I shall be better at home in Scotland, and if I winter in Edinburgh, may be",3611
Edinburgh,GPE,"at home in Scotland, and if I winter in Edinburgh, may be we could make some arrangement for his",3611
Edinburgh,GPE,"to bear the journey, he wishes to return to Edinburgh, where he would be kindly attended to by Alick",3622
India,GPE,“On the staff in India there were good opportunities of saving; then out of,3664
Rose,GPE,economy in wheeled chairs has seemed like perilous discontent in Rose and me.”,3665
Ailie,GPE,"dreadful whisper about her going with her father, and Ailie too! You see now his character is cleared,",3667
Ekaterinburg,GPE,"she said abruptly, “that we could go to Ekaterinburg.”",3679
Ailie,GPE,"And what is your feeling about it? Remember, Ailie, that I am your brother too.” And",3680
Russia,GPE,consult you who have seen him at that place in Russia.”,3683
Ailie,GPE,"“And indeed, Ailie, he is so wedded to smoke and calculations,",3684
Ekaterinburg,GPE,"of his element, and was bent on returning to Ekaterinburg immediately after the marriage.",3693
Ural,LOC,". And a vague hint of being transported to the Ural mountains, away from Aunt Ermine, had haunted her",3695
partin,GPE,"between you and your luve oft enough already, without partin’ ye at the very church door. Ye would",3706
Brussels,GPE,", but over hers Ermine wore the small though exquisite Brussels lace veil that had first appeared at her mother’s",3709
Scotland,GPE,"the funeral and subsequent arrangements necessitated Colin’s presence in Scotland. It was on a crisp, beautiful October evening",3732
Scotland,GPE,"him down here on the Monday when we started for Scotland, and then coming all the way alone with her",3736
Edinburgh,GPE,“Getting better under M’Vicar and Edinburgh winds. It was hard on him to have borne,3748
Naples,GPE,for two sweet photographs of Garibaldi and the Queen of Naples.”,3754
Scotland,GPE,"Grace were persuaded to spend the spring and summer in Scotland, and Alick’s leave of absence was felt to",3767
Avonmouth,GPE,"was head girl, most of the others were from Avonmouth, but two pale Londoners came from Mr. Touchett’s",3768
Homestead,GPE,"Sunday-schools were turned out to play on the Homestead slopes, with all the world to look on at",3769
gulf,LOC,one thorough fit of what he calls leaping into the gulf. It was about the soldiers’ wives married without,3774
