Location,ent_type,context,p_no
Hamlin,GPE,". In accordance with his whole plan of proceedings, Hamlin never once wrote to Anne as if there were any",661
Hamlin,GPE,"a burning indignation with herself, a burning adoration of Hamlin. She felt as if she had done him some",661
East,LOC,"offer it to Anne, as the kings of the East offered gold and frankincense and embroidered raiment to the little",661
Hamlin,GPE,"A strange correspondence; and of which Hamlin’s half, although beautiful with all manner of artistic",662
Paris,GPE,"Once, while Mrs Simson and Anne were staying in Paris—for he had begged that her holidays might be",665
Switzerland,GPE,"had begged that her holidays might be spent either in Switzerland, or in some place where she might see pictures",665
England,GPE,suddenly turned up for a day on his way from England to Greece; and once at Coblenz. Mrs Simson,665
Greece,GPE,up for a day on his way from England to Greece; and once at Coblenz. Mrs Simson was giving,665
Coblenz,GPE,his way from England to Greece; and once at Coblenz. Mrs Simson was giving a party: suddenly into,665
Paris,GPE,"left that same evening; and as the day in Paris had been spent in seeing and talking about pictures,",665
Coblenz,GPE,"him for an instant. Only, when he left Coblenz, he seized her hand as he stood at the",665
Hamlin,GPE,", and no more. But on that second visit Hamlin had been dazzled. He had recognised from the first",665
Paris,GPE,"of the Perrys’ servant; he had seen in Paris that his judgment had been correct; but when,",665
Perrys,GPE,"which had struck him in the nursemaid of the little Perrys, was not diminished, but softened, by a",665
Coblenz,GPE,"Hamlin went away, intending that Anne should remain at Coblenz another year. But he found that his patience,",665
Coblenz,GPE,", some two years or so after her arrival at Coblenz, Anne Brown received a letter in which Hamlin reminded",666
England,GPE,"thought that it might be wiser if she came to England, where she would have better opportunities of continuing any",666
London,GPE,"widow without any children, was coming to settle in London, and that he thought it might be a good",666
London,GPE,"a word as to whether he also would settle in London, or whether he intended continuing his wandering life.",666
Hamlin,GPE,"disappointed at all? She believed that she cared for Hamlin only as for a benefactor, a divinity, a",666
Hammersmith,GPE,"in the purchase of the lease of a house at Hammersmith, which he was having prepared and furnished against her",667
Hamlin,GPE,"felt quite bewildered; and then the full consciousness of Hamlin’s goodness rushed out and overwhelmed her, and she",668
St John’s,GPE,"studio? My own lodgings are a long way from St John’s House (that is its name, for it was",669
New Zealand,GPE,"about. In the sitting‐room she found the girl from New Zealand, a little nervous creature, whom she had nursed",670
London,GPE,"felt she must say it—“going away from school—to London, next month.”",671
Hamlin,GPE,But she was already thinking of Hamlin.,683
Hamlin,GPE,but of days. And then came another letter from Hamlin. He remembered the desire she had once expressed to,684
Rhine,GPE,"the desire she had once expressed to go down the Rhine, to be on the sea: he proposed that",684
Belgium,GPE,the sea: he proposed that she should come through Belgium and cross from Antwerp to London. “I am,684
Antwerp,GPE,proposed that she should come through Belgium and cross from Antwerp to London. “I am sure you will enjoy,684
London,GPE,she should come through Belgium and cross from Antwerp to London. “I am sure you will enjoy it much,684
England,GPE,"that he was unwilling she should get any impressions of England before meeting him, however slight they might be;",684
Thames,GPE,"to meet her, in the evening, on the Thames wharf, to receiving his Amazon Queen, his mysterious",684
Hamlin,GPE,"It was from Hamlin, and ran briefly—",692
Cologne,GPE,travel. She will telegraph me how you are from Cologne and Antwerp . I shall await you Thursday evening on,693
Antwerp,GPE,She will telegraph me how you are from Cologne and Antwerp . I shall await you Thursday evening on the wharf,693
farewell.—Your,GPE,"you Thursday evening on the wharf. Till then, farewell.—Your sincere and impatient friend,",693
Cologne,GPE,"Mrs Simson’s establishment, Anne Brown set off for Cologne. This first short scrap of journey moved her very",713
Cologne,GPE,"her maid bade her good night at the hotel at Cologne, offering to brush her hair and help her to",713
Antwerp,GPE,the ship began slowly to move from the wharf at Antwerp; when she walked up and down the deserted and,713
shore‐lights,GPE,"widening mysteriously out of sight, bounded only by the shore‐lights, with here or there the white or blue or",713
Thames,GPE,"But later, as they got higher up in the Thames, and the unwonted English sunshine became dimmer, a",713
London,GPE,", and the starlight mingled with the dull smoke‐grey of London; all about were the sad grey outlines of the",714
Hamlin,GPE,"dream seemed dispelled. She was in reality, and Hamlin was really by her side.",714
Hamlin,GPE,"voice which she now recognised as that of the real Hamlin, but which was so undefinably different from the voice",715
Coblenz,GPE,"He asked her how she had left those at Coblenz, and about her journey; she had to tell",718
Cologne,GPE,"him about every picture and church she had seen at Cologne, Brussels, Bruges, and Antwerp. It is",718
Brussels,GPE,"every picture and church she had seen at Cologne, Brussels, Bruges, and Antwerp. It is strange how",718
Bruges,GPE,"and church she had seen at Cologne, Brussels, Bruges, and Antwerp. It is strange how people whose",718
Antwerp,GPE,"had seen at Cologne, Brussels, Bruges, and Antwerp. It is strange how people whose hearts have seemed",718
Hamlin,GPE,"old lady’s eyes upon her, and felt that Hamlin was looking at his aunt, as much as to",724
Hamlin,GPE,Hamlin rang. In a moment tea‐things were brought. Hamlin,728
Antwerp,GPE,“Miss Brown came by the Antwerp boat—St Catherine’s Wharf—in the City,730
London,GPE,"“You are glad to be back in London, aren’t you?” she asked.",733
England,GPE,"“This is the first time I am in England,” answered Anne, shyly; all this dim",734
Italy,GPE,"“Miss Brown was born in Italy,” explained Hamlin, probably for the hundredth time",735
Hamlin,GPE,"“All right,” interrupted Hamlin.",737
Hamlin,GPE,"which she could not possibly know anything about, and Hamlin trying to set matters right and induce Anne to talk",741
England,GPE,"you will have good dreams to welcome you home to England. I shall come in for lunch to‐morrow, Aunt",745
New Zealand,GPE,"one who loved her, except that little girl from New Zealand. She felt terribly alone in the world.",746
silver candlestick,GPE,"” said Mrs Macgregor; and taking a heavy old‐fashioned silver candlestick, she led Anne to her room. The poor",748
Florence,GPE,"a raft; and somehow it all took place at Florence, in the large pond in the Boboli Gardens.",757
the Boboli Gardens,LOC,"took place at Florence, in the large pond in the Boboli Gardens.",757
Hamlin,GPE,"was. Then it came upon her that this was Hamlin’s house, that she would actually see him again",758
china,GPE,"were blue‐and‐white jars and pots all about, and old‐fashioned china things on the dressing‐table: except for the fac‐similes of",758
Thames,GPE,"and the wooden parapet of the river‐walk; then the Thames, still wide, but so different from what she",758
London,GPE,"of moisture on the leaves and grass. Was this London, which she had always fancied so noisy, and",758
London,GPE,"should put on: they had been made expressly for London, and greatly admired by the girls at Coblenz,",759
Coblenz,GPE,"for London, and greatly admired by the girls at Coblenz, but now one looked more absurd and frumpish than",759
china,GPE,"in cabinets, were all manner of wonderful glass and china, and strange ivory and inlaid Japanese toys. There",759
Hamlin,GPE,"the accompaniment of a song of Carissimi’s, which Hamlin was fond of, but inaudibly, without letting her",760
china,GPE,"in her dressing‐gown, before a table spread with eighteenth‐century china, or what to Anne seemed such.",762
Charlotte,GPE,"“What an hour you do get up at, Charlotte!” said Mrs Macgregor, kissing Anne on both",763
"thing,—no",GPE,"quite the—what do you call it?—medieval sort of thing,—no stays, and no petticoats, and slashings, and",767
Coblenz,GPE,"felt so much like a fish out of water that Coblenz seemed more than her birthplace, and the people there",768
Hamlin,GPE,"the house‐door, and running to the window she saw Hamlin standing on the doorstep. She withdrew her head quickly",768
Florence,GPE,he used to do long ago at the studio in Florence. “Art can’t live where life is trivial,775
Coblenz,GPE,"the letters which he used to write to her at Coblenz, Hamlin had said before what he was saying now",776
Hamlin,GPE,"which he used to write to her at Coblenz, Hamlin had said before what he was saying now.",776
London,GPE,. “She must be curious to see something of London.”,786
Hamlin,GPE,"Hamlin looked at Anne, as much as to say,",787
Hammersmith,GPE,It’s a sin to keep her mewed up at Hammersmith all day; and you know Mrs Argiropoulo was so,793
Hamlin,GPE,"he would look in about four,” went on Hamlin. “He is a strange creature, and sometimes",802
Hamlin,GPE,", and the bundles of unpublished manuscripts, entrusted to Hamlin by living poets, they sat down in the studio",810
Hamlin,GPE,"never felt so happy in all her life, and Hamlin not often happier in his, as they sat in",811
London,GPE,"sensations after it; and asked her whether she liked London, with a sort of expansive chivalry of manner,",815
Hamlin,GPE,"and chirpy voice; moreover, he seemed to adore Hamlin, and this was enough to put him in her",815
London,GPE,Mr Chough rapidly informed her what the principal poets in London and Paris (for he spoke of French things with,815
Paris,GPE,rapidly informed her what the principal poets in London and Paris (for he spoke of French things with an affectation,815
Hamlin,GPE,she had greatly admired some short pieces of his which Hamlin had sent her.,815
Hamlin,GPE,"have composed rather more of the poem,” interrupted Hamlin.",822
Imperia,GPE,"“Tell me all about Imperia of Rome,” she asked. “Who was",824
Rome,GPE,"said that all the cardinals and poets and artists of Rome, nay, the Pope himself, accompanied her coffin",825
Hamlin,GPE,"Brown doesn’t understand Latin, Cosmo,” interrupted Hamlin, roughly, “and I am sure she would",828
Imperia of Rome,GPE,Anne did not attend. She was wondering about Imperia of Rome. Why had Hamlin cut short Chough? What had,830
Hamlin,GPE,"Anne looked at Hamlin; such an offer, on so slight an acquaintance",836
Spain,GPE,"’s house, which a friend had brought him from Spain; by its side dangled a large locket, enclosing",838
St Theresa—“a,GPE,"it with as much unction as he had manifested for St Theresa—“a bit of the one which Byron possessed,—the most precious thing",839
Borgia,GPE,"“Insignificant!” he cried—“ a Borgia insignificant! Why, her blood ran with evil as",842
Florence,GPE,"; and he felt, as he had felt in Florence, the persuasion that this proud and sombre woman must",847
London,GPE,; “at least all that deserves to be called London. And Mrs Argiropoulo said last night at Wendell the,853
Hamlin,GPE,"one was curious to see this nursery‐maid whom the great Hamlin had cast his eyes on, and whom he had",854
Hamlin,GPE,"“Every one’s good‐natured!” continued Hamlin, throwing himself back in his chair; “and",865
London,GPE,"sets my nerves off. That’s the misfortune of London, that a lot of vulgar creatures, merely because",865
London,GPE,"world. Positively, I shall have to give up London. But you will find,” he added,",865
Hamlin,GPE,Hamlin merely smiled. “One must make a world for,867
Park Lane,GPE,"“To the corner of Park Lane,” ordered Mrs Argiropoulo of her footman, who",875
London,GPE,"his mistress and every other creature in what they called London, that Mr Cosmo Chough lived in a secluded terrace",875
Canonbury,GPE,that Mr Cosmo Chough lived in a secluded terrace in Canonbury.,875
Hamlin,GPE,"ANNE BROWN found that Hamlin, or, as he studiously put it, Mrs",876
Coblenz,GPE,"could thoroughly realise that the school, the journey from Coblenz, were things of the past, she found herself",876
London,GPE,"passively, half unconsciously, through the mazes of æsthetic London. It was all very hazy: Anne was informed",876
Hampstead,GPE,", smut‐engrained houses in Bloomsbury, or rose‐grown cottages at Hampstead, with just the same sort of weird furniture,",876
Hamlin,GPE,courtesy which constituted a large part of her love for Hamlin.,878
Spezia,GPE,"utterly she, the daughter of the dockyard workman of Spezia, the former servant of the little Perrys, was",879
Perrys,GPE,"workman of Spezia, the former servant of the little Perrys, was foreign to all this, it made her",879
London,GPE,but you’ll see all the most interesting people in London at her house. Edith Spencer or Miss Pringle can,881
æsthetic,GPE,"by this time tolerably accustomed to the eccentric garb of æsthetic circles, and she firmly believed that it was the",899
Hamlin,GPE,"might wear; but when she saw the dress which Hamlin had designed for her, she could not help shrinking",899
Hamlin,GPE,For the first time she felt a dull anger against Hamlin.,910
Florence,GPE,"that scene, long ago, in the studio at Florence.",914
Florence,GPE,"answered Anne, unaccustomed to have her looks admired at Florence and at Coblenz; “it is a very wonderful",922
Worth,GPE,"Old ladies in velvet and diamonds, young ones in Worth toilets, or weirdly attired in lank robes and draperies",937
America,GPE,"over fresh, between petroleum tins and sewing‐machines, from America, may stray in in top‐boots and a red flannel",944
Westminster Abbey,GPE,"tea—or the ghost of Byron mistakes this for Westminster Abbey. Oh, no lions, never. Besides,",944
Hamlin,GPE,"wondering whether she should see Hamlin. But instead of Hamlin, her eyes met a face as familiar as his",948
Westminster,GPE,dimly loomed the tops of trees and the towers of Westminster. Could it be her cousin Dick? Anne rarely,948
Florence,GPE,"though she had not seen him since that morning in Florence. But what should Richard be doing here, in",948
England,GPE,"had not yet let him know of her arrival in England, and she felt ungrateful and rather ashamed, for",948
London,GPE,", I ought to ask, how do you like London?”",952
Athenæum,GPE,"“We always read the ‘Athenæum,’” answered Mrs Spencer, seriously.",957
Athenæum,GPE,", you won’t find Education Brown in the ‘Athenæum,’ Mrs Spencer—a mere barbarian, Goth",959
Philistia,GPE,"barbarian, Goth, Philistine, but well known in Philistia. He’s a tremendous Radical, goes in for",959
Smeers,GPE,"By the way, two R.A.’s, Paints and Smeers, have already said that they would like to paint",975
Hamlin,GPE,” Anne’s voice was so wretched and supplicating that Hamlin felt quite terrified.,980
Hamlin,GPE,had accepted as a fact the still stranger news that Hamlin had singled her out to change her life and love,991
Hamlin,GPE,". But much as she tried, the reality of Hamlin seemed to escape and baffle her: he was a",991
Hamlin,GPE,"a homogeneous woman; and as she could not see Hamlin well in detail, she loved him in the very",991
æsthetic,GPE,"Now that she had settled down in æsthetic society, and found her place, and got to",992
Hamlin,GPE,", was to make herself as worthy as possible of Hamlin, or rather to let him find in her the",992
Hamlin,GPE,"for these were the things which would be requisite in Hamlin’s spiritual household. The people around her, the",992
Hamlin,GPE,as long as she was doing her best to deserve Hamlin?,993
Hamlin,GPE,read quantities of medieval and Elizabethan literature; went with Hamlin to see pictures and hear music; studied Dante and,994
Hammersmith,GPE,"an evening, friends dropped in at the house at Hammersmith, when Mrs Macgregor would leave her nephew and niece",994
London,GPE,"man had in his miserable home in the north of London a wife older than himself, often bedridden and always",994
Venus,LOC,"most jealous and perverse temper; but the victim of Venus, as he styled himself, nursed her with absolute",994
Hammersmith,GPE,"permission to have one of Chough’s little girls at Hammersmith every Saturday till Monday, and tried to instil into",997
Hamlin,GPE,"in the carriage with you, surely?” asked Hamlin, the first Sunday that Maggy Chough spent at Hammersmith",998
Hammersmith,GPE,"Hamlin, the first Sunday that Maggy Chough spent at Hammersmith.",998
Elgin,GPE,it’s much more fascinating than the Grosvenor or the Elgin rooms.”,999
Italy,GPE,"of happiness was to travel about, to live in Italy, and this she had cheerfully sacrificed to please her",1009
Hamlin,GPE,"or ordinary love: and as Mary Leigh likewise adored Hamlin, and Hamlin in return thought Mary Leigh a nice",1009
Hamlin,GPE,": and as Mary Leigh likewise adored Hamlin, and Hamlin in return thought Mary Leigh a nice sort of girl",1009
cut‐and‐dry,GPE,"humanitarian and practical younger sister, who, with the cut‐and‐dry decision of a philosopher of twenty‐two, looked upon æsthetics",1009
æsthetic,GPE,"girl, who had been pointed out to Anne in æsthetic circles as a rising poetess, was seated opposite them",1013
Marjory,GPE,", “that I might perhaps—teach something at Marjory’s college?”",1017
Elgin,GPE,"then all the Titians in the gallery, and the Elgin marbles, and all Keats, and all Shelley,",1023
Hamlin,GPE,"rest before dinner on their arrival at Wotton Hall, Hamlin took Miss Brown round the huge, deserted‐looking house,",1054
Jamaica,GPE,"house, which his grandfather had built on returning from Jamaica. It was like an Italian villa, with vaulted",1054
bobwigs,GPE,"ladies and gentlemen in armour, and ruffs, and bobwigs, and powder, hanging all round—his ancestors",1055
England,GPE,round—his ancestors ever since his family had left England in the civil wars.,1055
Hamlin,GPE,. My mother was the first woman married by a Hamlin for eighty years who was not at least a second,1057
Hamlin,GPE,"” said Anne, laughing, as she looked at Hamlin, at that noble and delicate face, which seemed",1058
Hamlin,GPE,certain disgust at the thought that perhaps—perhaps— Hamlin was just a little like him.,1058
Jamaica,GPE,wondering where you got your expression from among all your Jamaica ancestors.”,1060
Hamlin,GPE,"“It’s very curious,” pursued Hamlin, with a sort of psychological interest in his own",1066
Hamlin,GPE,"“I hate this place,” went on Hamlin, leaning on the window‐sill by Anne’s side,",1079
Hamlin,GPE,"“I don’t know,” went on Hamlin, again looking out at the vaporous yellow sunset horizon",1080
Hamlin,GPE,"of speaking, any more than she could believe that Hamlin could be correct in thus speaking of himself. The",1088
Hamlin,GPE,"noticed, treasured up, reproduced in himself,—which existed in Hamlin, would be perfectly unintelligible to Anne.",1088
Hamlin,GPE,", that things could never go any further, that Hamlin was prophesying the inevitable future: and yet, in",1093
Hamlin,GPE,"Then, when she saw Hamlin, and thought of the noble way in which he",1103
Hamlin,GPE,"vices (taking them quite as ordinary matters) of Hamlin’s grandfather and father and uncles, of the neglect",1103
Hamlin,GPE,"somehow, here all alone in this ancestral home of Hamlin’s, as if the fate which Hamlin had refused",1104
Hamlin,GPE,"home of Hamlin’s, as if the fate which Hamlin had refused to forestall was working itself happily out;",1104
æsthetic,GPE,"BY the middle of the summer a perfect colony from æsthetic London had settled itself, to the amazed terror of",1105
London,GPE,"the middle of the summer a perfect colony from æsthetic London had settled itself, to the amazed terror of the",1105
Hamlin,GPE,"indirectly. The æsthetic school of poetry, of which Hamlin and Chough were the most brilliant exponents of the younger",1106
æsthetic,GPE,"he should substitute, for the conventional background copied by æsthetic poetry from the borders of missals, the pictures of",1106
Hamlin,GPE,"for a new style, who were to recognise in Hamlin the leader of a new school, the prophet of",1106
London,GPE,"prophet of a new art. When the colony of London æsthetes arrived at Wotton, the new poem was solemnly",1106
Hamlin,GPE,"slight laugh at Mrs Spencer’s vehemence, in which Hamlin alone did not join.",1113
Hamlin,GPE,"being married. Don’t you think, now, Hamlin, that you might just alter a little, and",1121
Wordsworth,GPE,"tone of the poem which is pestilent. It’s Wordsworth pure and simple, that’s what it is.",1124
Hamlin,GPE,"felt, and her spirit sank within her, that Hamlin had been disgusted with his poem. He was rather",1144
Hamlin,LOC,"—towards his critics for their criticism, and towards Hamlin for minding it.",1144
Hamlin,GPE,"petulance, perhaps not quite new to her, in Hamlin’s manner.",1145
Hamlin,GPE,dreamed that it could be); but at last Hamlin might reap some advantage from his generosity. He had,1149
Hamlin,GPE,"all its contents at one time or other, yet Hamlin, in his grave, ceremoniously adoring way, handed",1150
Hamlin,GPE,already; others were expansions in verse of things which Hamlin had said or written to her; many were about,1159
Hamlin,GPE,water. She did not for one instant believe that Hamlin had ever felt the things about which he was writing,1159
Hamlin,GPE,"as well as from her own deep love, that Hamlin was as pure a man as could be found;",1159
Hamlin,GPE,neither. She did not for one second believe that Hamlin was in any way a bad man. She repeated,1159
Hamlin,GPE,"longer about them, so foreign did they seem to Hamlin, so impossible was it to bring them into connection",1159
Hamlin,GPE,Hamlin bit his moustache.,1168
England,GPE,"curiously impressed her the first morning after her arrival in England, rose before her eyes; since then she had",1207
England,GPE,"strange had happened to him—that he had left England for good,” remarked Anne.",1208
England,GPE,"her, Mrs Spencer, when she first came to England.”",1211
England,GPE,"husband is dead, and that she is coming to England. I rather loathe the idea of her, and",1231
Hamlin,GPE,"“At all events,” went on Hamlin, “I insist upon her being properly treated as",1247
London,GPE,“Not here; but to London. Her husband is dead; and she writes to,1249
England,GPE,an English school; and as the only person in England upon whom she has a claim—”,1249
London,GPE,"has done us no harm. She will be in London, most likely, when we return at the beginning",1253
Jamaica,GPE,", and lazy, and hysterical, like a regular Jamaica woman. She was enough in the house; but",1255
the East End,LOC,the little heathens whom they pick out of gutters in the East End and send to reformatories.”,1255
Christendom,GPE,couldn’t believe that such a child could exist in Christendom. She could no more spell the simplest word than,1257
America,GPE,in such a way that poor Arnold ran away to America. Then we had no news of him for about,1257
Rhine,GPE,", who sent her to some German deaconesses on the Rhine—a nice child to bring up! Walter returned",1257
America,GPE,for the university; then Arnold was got back from America; but he had only got into worse and worse,1257
Hamlin,GPE,"weak as my poor sister, ruin or save a Hamlin, ever since Walter’s great‐uncle Mordaunt went to the",1262
Hamlin,GPE,"Chough, or Dennistoun, or almost any other of Hamlin’s æsthetic friends. He did not make himself up",1265
Hamlin,GPE,"had got to associate with a poetic endowment. Over Hamlin, at all events, Edmund Lewis had an undeniable",1265
Hamlin,GPE,"way, himself, and took much more interest in Hamlin’s art than in his poetry; so that Hamlin",1265
Hamlin,GPE,"Hamlin’s art than in his poetry; so that Hamlin, who was sick of versifying for the moment,",1265
Messalina,LOC,"possibility be broken of his tendency to talk overmuch about Messalina, Lucretia Borgia, and La Belle Heaulmière; but",1265
Hamlin,GPE,"in the morning to teach them the piano, while Hamlin and Lewis were still asleep.",1265
æsthetic,GPE,"Anne in the light of an irresponsible but decidedly objectionable æsthetic villain on her departure from London, looked on in",1266
London,GPE,"irresponsible but decidedly objectionable æsthetic villain on her departure from London, looked on in puzzled amazement. She could not",1266
Hamlin,GPE,"friendless, by an indistinct yet real personality—by Hamlin, who had done for her more than any other",1266
Hamlin,GPE,"such an ideal passion; and what was worse, Hamlin was not the man who could substitute for an impossible",1266
Hamlin,GPE,not be. She tried to settle her love of Hamlin on a real and more solid basis. She fully,1267
Hamlin,GPE,"more solid basis. She fully admitted to herself that Hamlin had weaknesses,—the weaknesses which she remarked in so many of",1267
Hamlin,GPE,"and selfish interest in sin,—Anne used often to think that Hamlin was in the position of a sort of Rinaldo,",1267
Hamlin,GPE,"“Hamlin does not resist,” replied Lewis, with a",1276
Hamlin,GPE,. “I can do just whatever I choose with Hamlin.”,1276
Hamlin,GPE,suddenly stopped short. She had only just remembered that Hamlin was a poet and a painter of the school which,1282
Hamlin,GPE,"never seen any pictures scarcely, and having heard of Hamlin and Lewis as famous painters from London, were delighted",1286
London,GPE,"having heard of Hamlin and Lewis as famous painters from London, were delighted. The whole party went up to",1286
