Location,ent_type,context,p_no
Rome,GPE,"for the same woman, whether it were called of Rome or of Corinth, of Byzantium or of Athens,",3915
Corinth,GPE,"woman, whether it were called of Rome or of Corinth, of Byzantium or of Athens, of Babylon or",3915
Byzantium,GPE,"it were called of Rome or of Corinth, of Byzantium or of Athens, of Babylon or of Paris,",3915
Athens,GPE,"of Rome or of Corinth, of Byzantium or of Athens, of Babylon or of Paris, and whether she",3915
Babylon,GPE,"of Corinth, of Byzantium or of Athens, of Babylon or of Paris, and whether she herself were hailed",3915
Paris,GPE,"of Byzantium or of Athens, of Babylon or of Paris, and whether she herself were hailed hetaira or imperatrix",3915
Paris,GPE,"“Ah! Go?—to beg your way to Paris, and to creep through the cellars and the hospitals",3961
"suspected,—most",GPE,"“You will be suspected,—most likely imprisoned. You are an outcast.”",3977
Brocken,GPE,once had heard another prayer than the blasphemies of the Brocken.,3992
earth,LOC,The morning was warm and radiant; the earth and the trees were dripping with the rains of the,4014
Paris,GPE,a wayside cabin is she were near or far to Paris?,4014
Paris,GPE,"porch, and for answer cried to her: “Paris! pouf‐f‐f! get out, you drowned rat.",4015
Paris,GPE,“To Paris.”,4047
Paris,GPE,",” they urged. “We too go to Paris. We are poor. We follow art. We",4065
Paris,GPE,"on her their companionship. They too were going to Paris; they spoke of perils she would run, of",4067
Paris,GPE,followed art; they told her she could never enter Paris nameless and alone: so she went. The chief,4068
Paris,GPE,", and of the working classes and street mobs of Paris.",4068
"lips,—since",GPE,". Food seemed to choke her as it passed her lips,—since how could she tell but what his lips were parched",4109
Thessaly,GPE,had not Helios himself been bound as a slave in Thessaly?,4114
earth,LOC,in their footsteps; the skies were blue; the earth was fragrant.,4115
Paris,GPE,"and her feet weary, and she asked always,—“Where is Paris?”",4118
Paris,GPE,"“You look at Paris,” he said after a time. “There",4122
Paris,GPE,The next day she entered Paris with them as one of their own people.,4131
Rome,GPE,"of the lion, went fettered past the palaces of Rome in the triumphal train of Africanus or Pompeius.",4134
Africanus,LOC,past the palaces of Rome in the triumphal train of Africanus or Pompeius.,4134
silver moon,GPE,"them. The stars were out, and a great silver moon bathed half the skies in its white glory. In",4198
wind‐sown,GPE,"pleasure lay; all creatures near her slept; the wind‐sown plants blew to and fro, rooted in the spaces",4223
Paris,GPE,the round white moon rise over the shining roofs of Paris.,4231
Paradise,LOC,"such fruit and flowers as Dorothea might have sent from Paradise, and curled amidst them some thin leaf that would",4237
him?—had,GPE,steel was set hard against her breast. But for him?—had the gods forgotten? had he forgot?,4293
Paradise,LOC,"women rising from flames and clouds, the flowers of Paradise blossoming amidst the corruption and tortures of Antenora. All",4343
plague‐stricken places,GPE,"him. He had breathed in the foul air of plague‐stricken places, unconscious of its peril; he had starved his",4345
Jerusalem,GPE,"place, the burning colour of the great canvas of Jerusalem glowed in s wondrous pomp and power against all the",4382
"her,—if",GPE,"him to pardon her if it had been weakness in her,—if it had been feebleness and self‐pity thus to shrink from",4388
"one,—a",GPE,"The one,—a genius which had suddenly arisen in its midst, and",4510
Rome,GPE,", in the public ways, as a tribune of Rome placed in his chariot of triumph the vanquished splendour of",4512
Asia,LOC,of triumph the vanquished splendour of some imperial thing of Asia made his slave.,4512
Pherœ,GPE,; about the feet of the bound sun king in Pherœ and over the calm serene mockery of Hermes’ smile,4521
the grey skies,LOC,"A late light strayed in from the grey skies, pale as the primrose flowers that grew amongst the",4526
