Location,ent_type,context,p_no
Hamlin,GPE,"with slightly raised eyebrows and curious green eyes, towards Hamlin, as if to call his attention. Lewis turned",1288
Perrys,GPE,"on the dry warm mint and fennel with the little Perrys, where, under the big mulberry‐tree, they had",1294
Lewis,GPE,"severe face flushed, her slate‐grey eyes flashing, at Lewis.",1298
Hamlin,GPE,"Oh how, how could Hamlin, with his chivalrous nature, endure the daily contact",1302
Hammersmith,GPE,Hamlin time to make some alterations in the house at Hammersmith. Such at least was the pretext; but Anne,1307
London,GPE,"; but Anne knew that Madame Elaguine had arrived in London, and she guessed that Hamlin would wish to transact",1307
Hamlin,GPE,That may be.” There was some disappointment in Hamlin’s tone.,1317
London,GPE,her charge; and the Leighs were to return to London with her and Aunt Claudia. The big house seemed,1322
Hamlin,GPE,Aunt Claudia. The big house seemed very empty without Hamlin and his friends; but the quiet was pleasant.,1322
the East End of,LOC,in the neighbourhood in order to become a curate in the East End of London.,1323
London,GPE,order to become a curate in the East End of London.,1323
Hamlin,GPE,"some time, belonged to the æsthetic set of which Hamlin and Melton Perry had been the heads: but he",1324
St John,GPE,"was handsome, tall, and emaciated, like a St John the Baptist by Donatello; he was in his own",1324
the East End,LOC,"Collett. Harry was already back at his post in the East End; but Marjory, being unable to discuss philanthropy with",1326
London,GPE,they were within three or four days of return to London—Marjory Leigh returned more than usually excited from a,1327
Hamlin,GPE,"asked Anne, as the three girls sat alone in Hamlin’s empty studio.",1328
the moon,LOC,"in clotted flame‐coloured masses in its thick grey waters; the moon rising, a spectral crescent on the blue evening sky",1339
Hamlin,GPE,"the two Leighs and Harry Collett; and she and Hamlin lingering behind, watching the reddened stream—and the",1339
Hamlin,GPE,", dark outlines on the flat green banks opposite; Hamlin scrambling down the bank to get a tuft of willow",1339
Hamlin,GPE,", of the poems of Swinburne and Morris, and Hamlin and Chough. But that abominations like these should be",1339
London,GPE,"IT was raining when they arrived in London—a warmish, brown, clammy autumn day.",1367
Hamlin,GPE,"in which lay her redemption, and the redemption of Hamlin.",1367
Hamlin,GPE,like the first breaking of the spell which hung over Hamlin. She felt no jealousy of Cousin Sacha; for,1373
Hamlin,GPE,hand tremble as she poured out a second cup for Hamlin.,1378
Hamlin,GPE,"; rings and knocks; but no Madame Elaguine. Hamlin, at every false alarm, got up and looked",1380
England,GPE,“You have come to settle in England?” asked Anne.,1396
Hamlin,GPE,"to come an hour earlier, had returned, and Hamlin dreaded a scene. But Madame Elaguine understood also.",1406
Hamlin,GPE,"here,” and the little emaciated creature rapidly stopped Hamlin as he was raising the curtain into the next room—“I",1410
Hamlin,GPE,There was something theatrical in this which took Hamlin by surprise; but it was the theatricalness of a,1415
Hamlin,GPE,Hamlin was standing by the piano. How he wished his,1423
Villa Arnolfini—“I,GPE,"and ducks, and people in boats, at the Villa Arnolfini—“I always thought that you had something strange in you,",1446
Hamlin,GPE,"had desisted on noticing the absolute want of seriousness in Hamlin’s manner, the æsthetic vagueness and fickleness of his",1453
Hamlin,GPE,"of property only when it is pointed out, of Hamlin’s want of seriousness, of his utter want of",1453
Yankee,GPE,"world, in whose apprehension, as Thaddy O’Reilly’s Yankee friend had quietly remarked, “right or wrong do",1454
Hamlin,GPE,"“Come in,” cried Hamlin.",1456
London,GPE,this time become so familiar to the artistic world of London. It never seemed to her that this could have,1462
Hamlin,GPE,"Hamlin was standing a little aside, looking from her to",1463
Hamlin,GPE,terrible hoarseness; and her wide‐opened eyes fixed themselves upon Hamlin.,1477
Hamlin,GPE,"say to herself that she had expected this; that Hamlin, being unaccustomed to any serious thought of the evil",1485
Hamlin,GPE,The word factory seemed to sear into Hamlin’s nerves.,1487
England,GPE,"such a thing: there is no greater pollution in England than factories; thank Heaven, there are as yet",1491
London,GPE,", and then there is the expense of housekeeping in London. Do think of it. I am sure you",1500
Hamlin,GPE,"the beautiful things about her,—her beautiful fantastic dress, which Hamlin always designed for her, her knowledge and good‐breeding,—all that",1502
Hamlin,GPE,Hamlin was a man who could not easily keep at high,1512
Hamlin,GPE,"Fremley, they concluded that she had not spoken to Hamlin about it. Hamlin noticed no change in her,",1517
Worth,GPE,"will abandon Mantegnesque costumes, will open a bill with Worth, and insist upon hiring a house in Belgravia for",1517
Belgravia,GPE,"with Worth, and insist upon hiring a house in Belgravia for at least one season.” So said Thaddy",1517
Hamlin,GPE,"poems and to literary discussions, she still sat to Hamlin and to half‐a‐dozen other painters; but when people at",1517
Hamlin,GPE,"painting, music, romance—which had originally surrounded Hamlin with a sort of luminous emanation in Anne’s eyes,—had",1517
London,GPE,"that sordid ugliness which had, on her arrival in London, given her such a shock, and to which",1517
Hamlin,GPE,", given her such a shock, and to which Hamlin and his friends were always shutting their eyes. The",1517
Hamlin,GPE,"much less than the beautiful pictures of Italian scenery which Hamlin hung up at Hammersmith,—than the lovely, mysterious creatures in",1517
"Hammersmith,—than the",LOC,"beautiful pictures of Italian scenery which Hamlin hung up at Hammersmith,—than the lovely, mysterious creatures in jewel‐coloured robes, wandering in",1517
Hamlin,GPE,"wandering in distant countries of bliss and romance, which Hamlin painted. The poetry of pure beauty sickened her;",1517
Spezia,GPE,"faint recollections of her father’s grimy, workshop at Spezia, of the poor little room where her mother had",1517
Florence,GPE,"cheap dressmaking, returned to her. The life at Florence, the sordid life with the Perrys, the tattered",1517
Perrys,GPE,"The life at Florence, the sordid life with the Perrys, the tattered furniture and ill‐swept rooms, the dirty",1517
Coblenz,GPE,"had almost been effaced during her happy new life at Coblenz and in London, returned to her, vivid as",1517
London,GPE,"effaced during her happy new life at Coblenz and in London, returned to her, vivid as reality, and",1517
"slums,—home",GPE,"her attendance on lectures, her ghastly rounds in the slums,—home to the lovely house, with the Persian carpets,",1518
Hamlin,GPE,"music,—returning home to the discussions on art and literature in Hamlin’s studio and at her own dinner‐table,—Anne felt mere despair",1518
Perrys,GPE,"the servants and the Italians who surrounded her at the Perrys, she had learned only a contempt for the conscienceless",1518
Hamlin,GPE,"the heartless conventionalism of mere social Protestantism; and from Hamlin himself, and Hamlin’s friends (for at Coblenz",1518
Coblenz,GPE,"Hamlin himself, and Hamlin’s friends (for at Coblenz he had stipulated that Miss Brown was not to be",1518
Hamlin,GPE,least to understand and feel about all these subjects which Hamlin and his friends tabooed. And with this haunting desire,1520
Hammersmith,GPE,"They were sitting alone in the drawing‐room at Hammersmith. Richard Brown had called only once before, ceremoniously",1522
æsthetic,GPE,"things when one is brought up in luxury in an æsthetic house, than when one has to buy books at",1533
æsthetic,GPE,"arduous task of freeing her spirit from the slough of æsthetic selfishness; his suspiciousness of her motives, his sarcasms",1546
Hamlin,GPE,"him. And sometimes even, though the sense of Hamlin’s baseness, of his selfish æstheticism and his untruthful",1546
Hamlin,GPE,"those letters, carefully collecting together all the stances of Hamlin’s generosity and delicacy and gentleness which she could remember",1546
Hamlin,GPE,"him—made up out of them a simulacrum of Hamlin, and persuaded herself that she loved it, and",1546
Hamlin,GPE,"a reality nevertheless. Nay, sometimes the sense of Hamlin’s weakness would come home to her, and with",1546
Hamlin,GPE,", poetic gratitude, was always to end, in Hamlin’s expectation, with a sudden burst of passion,",1547
Heathcliff,GPE,"always admired more than any other in literature, of Heathcliff for Catharine in ‘Wuthering Heights,’—a passion such as some",1547
Hamlin,GPE,"the world around her and in her own soul, Hamlin would watch her, and feel, with a pang",1547
"Hamlin,—she",GPE,"“She is not a woman, Hamlin,—she has an intellect and a will, but she has",1549
Alps,LOC,"the manifold sea; the third is like the high Alps, the highest strata of air, the purest light",1555
Hamlin,GPE,"there was one subject upon which Anne sympathised warmly with Hamlin, and that was his cousin Sacha. For all",1557
Hamlin,GPE,"certainly also. She flirted with every one, with Hamlin, with as many of his friends—Chough,",1557
London,GPE,"very impulsive and rather injudicious, all alone here in London; and I think she ought not to be shut",1573
æsthetic,GPE,"accidentally drafted into æsthetical society, before she had got æsthetic literature, æsthetic gossip, and æsthetic modes of feeling",1576
æsthetic,GPE,"æsthetical society, before she had got æsthetic literature, æsthetic gossip, and æsthetic modes of feeling at her finger‐ends",1576
Hamlin,GPE,"her finger‐ends. She immediately understood the relative positions of Hamlin, of Chough, of Dennistoun, of Lewis,",1576
æsthetic,GPE,"cousin.” She let herself be talked to about æsthetic dresses, gravely listening (with only a little side‐look",1576
Hamlin,GPE,listening (with only a little side‐look of amusement at Hamlin or Anne) to Mrs Spencer’s strictures on modern,1576
Hamlin,GPE,the grandfathers and granduncles of Sacha as well as of Hamlin.,1598
Hamlin,GPE,"AUTUMN turned to winter, and at last Hamlin’s long‐expected, much‐talked‐of book of new poems made its",1600
Hamlin,GPE,"poems made its appearance. In her gradual estrangement from Hamlin, in the gradual replacing of the ideal creature whom",1600
Hamlin,GPE,"Mozart, by Keats—men as solely artistic as Hamlin? and Hamlin was a great poet, and would",1600
Hammersmith,GPE,At length the volume was published. Hamlin arrived at Hammersmith one morning and placed a copy of it by the,1600
Hamlin,GPE,"from the love‐songs of the Tuscan peasants, in which Hamlin dedicated the volume to her; it was beautiful and",1602
Hamlin,GPE,"had called down the wrath of the whole school, Hamlin had set in his beautiful descriptions a ghastly tale which",1604
icily,GPE,"“Yes,” said Anne, icily. There was the description of the sunset on the",1606
Hamlin,GPE,"surrounded by an icy atmosphere, through which she saw Hamlin as through a mist. He had broken his word",1608
Hamlin,GPE,"“Hamlin has brought out a new book,” said Collett",1618
London,GPE,on. Things that happened seemed spectral. Here in London she saw less of Hamlin than in the country;,1620
Hamlin,GPE,seemed spectral. Here in London she saw less of Hamlin than in the country; he was going about with,1620
Hamlin,GPE,"The review was one of the few bad ones which Hamlin’s book had had, among a chorus of good",1634
Limerick,GPE,"mysteriously that his father (who was an apothecary at Limerick) was a duke, but that he would rather",1643
London,GPE,repent of his book. He declared himself sick of London and of æsthetic society.,1645
Hamlin,GPE,"She had got so accustomed to these sudden returns of Hamlin’s, to these false starts, these longings after",1647
Paris,GPE,"“Go to Paris and study for a year or so under Bastien‐Lepage,",1650
"self,—a",GPE,"was something vague and quite unselfish and outside one’s self,—a sort of act of adoration and purification and renunciation,—a meeting",1654
Hamlin,LOC,", hopeless throwing of herself back on to the unreal Hamlin. She felt that Richard Brown, with all his",1655
Hamlin,GPE,"to her with a chill; and she felt that Hamlin wanted, expected from her that sort of passion which",1655
Kensington,GPE,"extremely assiduous visits at the Russian lady’s house at Kensington, during which he poured out to the enthusiastic little",1656
Hamlin,GPE,"It was about Christmas, and Anne had prevailed upon Hamlin to accompany her and Madame Elaguine to a pantomime,",1679
Hamlin,GPE,"and while Chough shoved on his two children, and Hamlin tried to make way through the crowd for his frail",1679
Kensington,GPE,The carriage stopped at her door in Kensington.,1686
Hammersmith,GPE,"“I will go to Hammersmith now, and leave you with her,” whispered",1694
England,GPE,". It was the first time since Madame was in England, but it was quite common. Madame,”",1704
Hamlin,GPE,"a slow, vague tone, fixing her eyes upon Hamlin. “Don’t think me very foolish or mad",1719
Hamlin,GPE,future.” And she fixed her eyes wildly on Hamlin. “As other women have lived on knowing that,1725
Russia,GPE,", and tell me all about the miserable condition of Russia, and how all the good was being stamped out",1727
Cannes,GPE,"made to carry off the child; once, at Cannes, she had gone to the window just in time",1728
London,GPE,"“Ever since I have come to London,” said Madame Elaguine, “I have been",1731
Hammersmith,GPE,"this room, which was so unlike her own at Hammersmith. It was full of pretty things, but in",1750
Hamlin,GPE,"love and kindle love in him, were, like Hamlin, the former object of passionate worship. But with",1751
æsthetic,GPE,"the most precious (because the most refined), æsthetic lust of a selfish æsthetic voluptuary, Anne experienced a",1752
æsthetic,GPE,"the most refined), æsthetic lust of a selfish æsthetic voluptuary, Anne experienced a sense of horror and self‐debasement",1752
Hamlin,GPE,sense of horror and self‐debasement. So this was what Hamlin was waiting for—this which made him play that,1752
Hamlin,GPE,", as she had so often said before, that Hamlin might be redeemed, that he might yet become once",1753
Hamlin,GPE,"sickened; she no longer thought of trying to influence Hamlin, of trying to help others; all her energies",1754
Hamlin,GPE,"of these people whom she despised; and as to Hamlin, an instinct told her that he would never guess",1761
Hamlin,GPE,"her understand that she was not ungrateful, and that Hamlin was not ungenerous. Yet she felt the terrible need",1761
Hamlin,GPE,"a glimpse into the world of imagination, and giving Hamlin a glimpse into the world of reality,—she was now thinking",1762
Hamlin,GPE,"to studying, no longer to be more worthy of Hamlin, or more useful in the world, but to",1762
Hamlin,GPE,it. And Anne had to admit to herself that Hamlin was not the man to feel or act like this,1762
Hamlin,GPE,she had let herself go to the vain belief that Hamlin would one day awaken to the sense that this woman,1762
Hamlin,GPE,"nature, neither more nor less than the nature of Hamlin and his friend was swallowed up by their æsthetical feelings",1763
Sahara,LOC,"the evil in the world, storms from the great Sahara of misery which would lower over her own oasis of",1764
Hamlin,GPE,"Anne was accustomed to such hits at Hamlin; they were too true to be refuted, and",1776
Hamlin,GPE,"her a more serene determination to accomplish her duty towards Hamlin; and, what was more important, it had",1794
Hamlin,GPE,"not an ideal being to adore as she had adored Hamlin, but a good, wholesome, strong reality whom",1794
Hampstead,GPE,"parlours of Bloomsbury, the chilly, ascetic studios of Hampstead, for Madame Elaguine’s curious, disorderly, charming",1800
Kensington,GPE,"Madame Elaguine’s curious, disorderly, charming house in Kensington—the house patched up with old lodging‐house furniture and",1800
Hamlin,GPE,"Hamlin was standing by, smoking his cigarette sullenly. He",1808
Hamlin,GPE,Miss Brown went but rarely to the house of Hamlin’s cousin. She was extremely sorry for the poor,1821
Hamlin,GPE,"I have at these moments,” said Sacha to Hamlin, as her little soft hand touched his. “",1828
Hamlin,GPE,Hamlin somehow admired Anne’s answer; he was glad it,1830
Hamlin,GPE,"Brown, scornful and angry, fixed upon that of Hamlin, who was flushed, hesitating, surprised.",1839
Hamlin,GPE,but of that radiant look which she had seen in Hamlin when the lights had first been lit. And she,1850
East End,LOC,"way—a fit beginning for the wife of an East End curate, for a man like Harry Collett!”",1855
East End,LOC,"man, and was not the fit wife for an East End curate, as you expressed it?”",1912
Hamlin,GPE,"of sullen savage satisfaction. It was a humiliation for Hamlin, but he had deserved it; it was a",1929
Hamlin,GPE,"him as well as the good. To admit that Hamlin had, from mere womanish ill‐temper, calumniated a friend",1929
Hamlin,GPE,"of the matter; and her whole nature recoiled from Hamlin’s. Nay, it did not recoil; there",1929
æsthetic,GPE,"the side of a man whose whole nature was merely æsthetic, who was wholly without moral nerves or moral muscles",1929
bitter‐sweet,GPE,"out of life all that perfume, that narcotic and bitter‐sweet fiavour, which some other men taste, to be",1937
Hamlin,GPE,"Madame Elaguine laughed; but Chough thought it was at Hamlin, and frowned.",1940
Hamlin,GPE,the better. I know no man to compare with Hamlin as a mere person; to compare with him not,1941
Hamlin,GPE,"“But, perhaps—Hamlin may be a sort of child of genius, and",1946
Constantinople,GPE,think that was his name—who was ambassador at Constantinople. M. de Ferréol sent her to his sister‐in‐law in,1953
Paris,GPE,. M. de Ferréol sent her to his sister‐in‐law in Paris to educate. Aïssé grew up the most refined and,1953
Constantinople,GPE,"and love also, when M. de Ferréol returned from Constantinople, and said to this exquisite, proud, and",1953
Florence,GPE,"over all those scenes at the Villa Arnolfini, at Florence, nay, here in England not so long ago",1965
England,GPE,"Villa Arnolfini, at Florence, nay, here in England not so long ago; she thought of Hamlin’s",1965
Marjory,GPE,Unconsciously Anne’s mind reverted to the business of Marjory and Harry Collett; and her mind’s eye rested,1966
Hamlin,GPE,"and this, in her future as the wife of Hamlin, as the queen of this æsthetic world, which",1966
Richmond,GPE,"the advent of justice. Anne had never spoken to Richmond; but she felt that, of all human souls",1968
Richmond,GPE,"“I detest that man Richmond,” Madame Elaguine had once said; “he",1970
London,GPE,"most repugnant to her; and a walk through the London streets, in murky spring weather, was to Anne",1975
Hamlin,GPE,Always that indirect attack upon Hamlin and his friends: it was just and reasonable;,1984
Rome,GPE,"“Nero rebuilt Rome, didn’t he,” sneered Brown, “",1986
Hamlin,GPE,"two or three years ago? Almost as rich as Hamlin, do you know, young woman?” and",1990
Richmond,GPE,", as so many men have done—as poor Richmond is doing.”",2002
Hamlin,GPE,"people say,—that Mr Lewis had rather a bad influence upon Hamlin some years ago—in short, made him take",2007
Hamlin,GPE,"Anne resented being thus cross‐questioned about Hamlin, but she was quite unable to prevaricate in her",2013
Florence,GPE,"very words to you, long, long ago in Florence, when Mr Hamlin first proposed to educate you,",2037
icily,GPE,"You can make me stand here,” she answered icily, “but you cannot make me listen.",2040
Hamlin,GPE,. And she walked away and entered the house—Hamlin’s house.,2069
Hamlin,GPE,", base or doing their best to become it; Hamlin, her girlish ideal of poetical love, had gone",2070
Hamlin,GPE,"for the hour of the sacrifice to strike; for Hamlin to claim her. To fulfil that debt, to",2070
Hamlin,GPE,"matters been different, had she been free, had Hamlin not claimed her, had Richard not loved her (",2071
Hamlin,GPE,"Anne did not pay much heed to Hamlin and his doings: it seemed to her, whose",2072
Hamlin,GPE,"years, that it was always the same monotony; Hamlin was waiting for her to fall in love with him",2072
Hamlin,GPE,"more than usual vacuity, would get the better of Hamlin’s patience, and when he would say to Anne",2072
Hamlin,GPE,"summer, that certain slight changes were taking place in Hamlin. He had, without any intentional rupture, taken",2072
Richmond,GPE,"might be a fortnight after the memorable walk home from Richmond’s lecture—Anne found among her letters one,",2075
Italy,GPE,"which a child is incapable. Had she been in Italy, Anne would have expected to find within that envelope",2075
Hamlin,GPE,"the whole matter. Should she show that paper to Hamlin? Once in her life, Anne gave way to",2078
Hamlin,GPE,"of cowardice. That letter, shown by her to Hamlin, would, she knew, bring the catastrophe.",2078
Hamlin,GPE,"themselves. A change had taken place of late in Hamlin; he had become solitary and morose, and more",2079
Hamlin,GPE,a woman who was everything that she was not—Hamlin should ever come to feel for Sacha more than mere,2079
Hamlin,GPE,", the tendency always to be in extremes, of Hamlin’s cousin. Anyhow, Sacha had determined that Helen",2081
Hamlin,GPE,over the anonymous letter either to Madame Elaguine or to Hamlin. She felt that she had now no longer a,2126
London,GPE,“But where in all this wretched London have you been that you should feel happy?”,2130
Hamlin,GPE,"his. There has been a grand scene, and Hamlin has come round to reason. I met her returning",2136
Hampstead,GPE,"seated among an admiring crowd in his dusty studio at Hampstead, among his ghastly Saviours on gilded grounds, and",2137
Hamlin,GPE,the same time to the horrible false position into which Hamlin’s self‐engagement to a woman so different from himself created,2148
Hamlin,GPE,it strike Anne that perhaps she had no right towards Hamlin to pay off her debt of gratitude at the expense,2148
Hamlin,GPE,"the very qualities which would make her appreciate what in Hamlin was original and charming, and blind her, for",2148
Hamlin,GPE,"in her belief. On one pretext or other, Hamlin was perpetually at Madame Elaguine’s. The latest excuse",2149
Hammersmith,GPE,"days, Sacha came every morning to the house at Hammersmith, and spent a couple of hours at least closeted",2149
Hamlin,GPE,"and spent a couple of hours at least closeted with Hamlin in the studio. Anne usually received her, and",2149
Hamlin,GPE,could not help feeling indignant at the coolness with which Hamlin amused himself playing with two women: he was perpetually,2149
icily,GPE,"“How very sad!” said Anne, icily; “what a pity you can’t make up",2151
Hamlin,GPE,"Hamlin was silent. He had—she felt sure,",2152
Coblenz,GPE,"had begun long ago in his letters to her at Coblenz, which she had watched with admiration, and love",2155
Hamlin,GPE,"thus begun, and Miss Brown shrank from believing that Hamlin would have been so deliberately base, it was clear",2155
Properzia,GPE,"” instead of with this or the other Sappho or Properzia dei Rossi of her circle, she added—“I always knew",2159
Hamlin,GPE,"“Besides, Hamlin is too honourable,” said Mary, forgetting about",2163
Hamlin,GPE,"to bring back the high priest in person, namely Hamlin, to the worship from which the powers of evil",2172
Paris,GPE,"he has a magnificent hôtel entre cour et jardin in Paris, has been affianced ever since his childhood to the",2185
Hamlin,GPE,of embroidery which she was doing from a design by Hamlin.,2185
mélusine,GPE,"—une méchante fée—une fernme serpent —une mélusine, enfin tout ce qu’il vous plaira” (Chough",2191
Hamlin,GPE,"Brown, I know, I understand fully, that Hamlin has acted unworthily towards you. I know, I",2214
Hamlin,GPE,"would it not be worthy of you to reflect that Hamlin is a poet, and acting merely as a poet",2214
Hamlin,GPE,"frown!—well, but such the poet is, such is Hamlin. His soul loves and adores you; what if",2214
Hamlin,GPE,"“Nay, have patience—for the sake of Hamlin, for the sake of your own noble goodness !",2216
Messalina,LOC,"stronger for the blessing of the preposterous little poet of Messalina and Lucrezia Borgia, who declared himself to be an",2236
Hamlin,GPE,Wotton. Among these friends was Madame Elaguine. That Hamlin should care to take his cousin to the house where,2237
Hamlin,GPE,"say, Anne, Mrs Spencer, Lewis, and Hamlin—to a perfect concert of all manner of wild",2241
Hamlin,GPE,"fits of laughing, threw Chough into enthusiasm, annoyed Hamlin a little, puzzled poor Mrs Spencer, and made",2241
Hamlin,GPE,"Cousin Sacha seemed to take a pleasure in vexing Hamlin, in shocking Anne, in making Mrs Spencer think",2243
Imperia of Rome,GPE,", quietly. “Have you seen the ghost of Imperia of Rome, Mr Chough?”",2262
Hamlin,GPE,"it!” shrieked Madame Elaguine, throwing herself into Hamlin’s arms. “They want to kill me!",2271
Russia,GPE,"“We’re not in Russia, Mr Lewis,” rejoined Mrs Spencer, bridling",2279
Hammersmith,GPE,"the whole pre‐Raphaelite set which centred round the house at Hammersmith, with the result of turning Madame Elaguine, in",2289
Hamlin,GPE,". But now, every lover‐like look or word from Hamlin inspired Anne with positive terror; it seemed as if",2291
Hamlin,GPE,"a mere hysterical liar, she could not sincerely love Hamlin, Hamlin could not love her; and if this",2292
Hamlin,GPE,"hysterical liar, she could not sincerely love Hamlin, Hamlin could not love her; and if this man and",2292
