Location,ent_type,context,p_no
Hamlin,GPE,"Mr Lewis, who had spent all his mornings in Hamlin’s studio, and all his evenings in Madame Elaguine",2293
Hamlin,GPE,"friend, of a woman whom he loved, made Hamlin suddenly conscious of his love for Sacha, and of",2294
ill‐health,GPE,", the result was unmistakable. On the score of ill‐health, Madame Elaguine had more or less dismissed all those",2295
Hamlin,GPE,"friends who had given Hamlin so much umbrage, and Hamlin had become almost her sole and constant visitor. He",2295
Hamlin,GPE,"the truth; nay, Miss Brown thought she knew Hamlin sufficiently well to be persuaded that there entered into his",2296
Hamlin,GPE,", to let her see how completely she had taken Hamlin away from her, to humiliate and insult her:",2298
Hamlin,GPE,she but know that every proof of her supremacy over Hamlin was to Miss Brown as each successively sawed‐through window‐bar is,2298
Hamlin,GPE,"become her livelihood if she should ever be released from Hamlin. Miss Brown had often and often, even when",2299
Hamlin,GPE,"to him some day, part of the money which Hamlin had settled upon her, in entering Girton or Newnham",2299
Hamlin,GPE,"the same time a great triumph, rose up in Hamlin’s heart.",2304
Hammersmith,GPE,"one day as Madame Elaguine came into the studio at Hammersmith, after visiting the sick woman, “it is",2305
Euclid,GPE,"like that works only with her brain. Too much Euclid, Kant, Hegel, Fichte, etc. You",2306
Perrys,GPE,"past and the future, about Miss Curzon, the Perrys, the Villa Arnolfini, Cousin Dick, Girton College",2310
Hamlin,GPE,"—by some singular obliviousness of the present—about Hamlin and Sacha,—the first persons that Anne Brown recognised about her",2310
Hammersmith,GPE,"to settle for the time being in the house at Hammersmith, she herself being far too unpractical to be of",2310
Thames,GPE,"window, of the whistle of the steamboat on the Thames; the song of the canary in the housekeeper’s",2310
London,GPE,"Mrs Spencer, who came from the other end of London every afternoon; of Chough and Cousin Dick, who",2311
Hamlin,GPE,"Dick, who came to make inquiries; even of Hamlin, whose magnificent bundles and baskets of flowers and fruit",2311
Alps,LOC,"and difficulties remaining far distant behind her, like the Alps which the traveller has arduously crossed, and looks back",2312
Hamlin,GPE,". She noticed that the Leighs scarcely ever spoke of Hamlin; that they brought in his flowers, books,",2312
Hamlin,GPE,"every time that one of the Leighs spoke coldly of Hamlin, or looked savage when he was mentioned. And",2319
Hamlin,GPE,"burst for her silence. Miss Leigh had brought in Hamlin’s usual gift of flowers, a bunch of beautiful",2319
Hamlin,GPE,"time. Anne’s first impression was merely strengthened; Hamlin was extraordinarily depressed, worried‐looking, taciturn. Anne felt",2332
Hamlin,GPE,"Was it possible that Hamlin, weak as he was, and feeling himself cornered",2339
Hamlin,GPE,"WHILE she was in this perplexity about Hamlin, Miss Brown received a visit from her cousin Dick",2341
Richmond,GPE,you told me that afternoon when we walked home from Richmond’s lecture—a rainy day at the end of,2346
Hamlin,GPE,". He had always resented his cousin’s fidelity to Hamlin, had always, with his tendency to seek for",2354
Ireland,GPE,", which will be shortly, is to go to Ireland for a few months with Mary Leigh, to finish",2362
Hamlin,GPE,"of being mean, of appearing to take advantage of Hamlin’s generosity.",2363
Hamlin,GPE,"Richard Brown frowned. She could never pluck Hamlin, Hamlin in some shape, real or false,",2390
Hamlin,GPE,"Richard Brown frowned. She could never pluck Hamlin, Hamlin in some shape, real or false, out of",2390
Hamlin,GPE,hoping that you might have lost your looks—that Hamlin might be quite unable ever to care for you again,2391
Florence,GPE,distant past—a vision of the untidy house at Florence; of Mrs Perry’s lean and Sapphic profile;,2397
Hamlin,GPE,"herbs in the vineyard of the Villa Arnolfini; of Hamlin as she had first known him—a mysterious,",2397
Hamlin,GPE,"has begun it. The comedy of her love for Hamlin, and of Hamlin’s love for her, was",2398
Petersburg,GPE,"? He taught at the school where I was in Petersburg: a thin lank creature, with long red wrists",2402
"time,—a",GPE,"confused resemblance of the men’s dress of Moliére’s time,—a crimson plush coat and a big man’s cravat of",2404
Flanders,GPE,"crimson plush coat and a big man’s cravat of Flanders lace, but all bursting out, by every conceivable",2404
Worth,GPE,with always making my own frocks. It’s from Worth. I swore I would bring round Watty from belief,2405
Worth,GPE,and purfled sleeves and eighteen‐penny medievalism to a belief in Worth; you know he used always to rant at Paris,2405
Paris,GPE,"Worth; you know he used always to rant at Paris clothes. Well, I’ve been as good as",2405
Worth,GPE,"been as good as my word; this is from Worth, and what’s more, Walter has paid my",2405
Worth,GPE,", I’m a pauper, and can’t buy Worth frocks on a thousand a‐year, including subscription for a",2405
morocco,GPE,"’ with all the improprieties annotated, Dutch paper, morocco, rough edges, price three guineas, can I",2405
Hamlin,GPE,"paid for Sacha’s dress! And yet, had Hamlin not paid for not merely one, but all Anne",2406
Hamlin,GPE,"crimson plush and watered white silk and lace, which Hamlin had paid for, she could not get out of",2406
Hamlin,GPE,"missed her opportunity; it was impossible to speak before Hamlin, although she had once or twice contemplated clearing up",2411
Hamlin,GPE,"did not stay long. Madame Elaguine rose, and Hamlin mechanically followed her example: was it that he could",2412
London,GPE,". “Oh no; I can’t do without London and my friends—hideous London and disagreeable friends,",2415
London,GPE,"can’t do without London and my friends—hideous London and disagreeable friends, at least so far as Walter",2415
Paris,GPE,"of Sittlicher Ernst, again. I am going to Paris this evening. I have a notion of taking Boris",2415
Hamlin,GPE,"notion of that fortnight of Sacha’s absence. Would Hamlin, fickle, easily wounded in his vanity, sated",2418
Glaciers,LOC,"self‐reproach, with what his cousin called Madonna of the Glaciers? And as Hamlin was leaving, he had said",2418
Hamlin,GPE,"was brought up a twisted note. It was from Hamlin, written late the previous night.",2420
Paris,GPE,"so I shall join her for a few days in Paris. Pray forgive my apparent rudeness.—Yours sincerely, W. H.",2421
Paris,GPE,much like sitting yet. Mr Hamlin’s gone to Paris to look after a school for Boris Elaguine.”,2424
Hamlin,GPE,"to understand whatever good there was or had been in Hamlin. This big and self‐reliant man, who had already",2429
Hamlin,GPE,"when there suddenly came a telegram, sent on from Hamlin’s lodgings, and opened by his servant, which",2430
Hamlin,GPE,Could he be the explanation of Anne’s indifference to Hamlin? thought the poet of the Eternal Feminine.,2432
Limerick,GPE,"duke, and of his real father the apothecary at Limerick, was absolutely unable to comprehend.",2434
Paris,GPE,"“I hear that Walter Hamlin is in Paris with his cousin,” he had remarked, after",2439
Paris,GPE,"object of Madame Elaguine’s and Hamlin’s journey to Paris, but the journey itself.",2441
Paris,GPE,Elaguine’s Russian relations—her aunt who lives in Paris and Boris’s grandfather—will be particularly pleased at,2442
Paris,GPE,"“True; but the people who meet them in Paris won’t know that, or won’t believe it",2445
Hamlin,GPE,"“being engaged, to you makes a difference to Hamlin. A man who is engaged to be married may",2445
Central Asia,LOC,"very sorry I shall be far away, somewhere in Central Asia or South America—I don’t know where—",2445
South America,LOC,"shall be far away, somewhere in Central Asia or South America—I don’t know where—when your marriage",2445
Paris,GPE,"get over Hamlin’s thoughtlessness in accompanying Madame Elaguine to Paris,” he said. “It would have been",2452
Hamlin,GPE,that Sacha should relieve her of the intolerable debt to Hamlin. The creature described by this odious man was the,2468
Hamlin,GPE,"All this kind of talk, of which Hamlin was so fond, perfectly sickened Anne; and the",2478
Hamlin,GPE,"closed her door to him, she had complained to Hamlin; and now, as soon as their backs were",2486
Dover,GPE,"hers. “I suppose you expected me by the Dover train. But I came by Dieppe, six hours",2490
Dieppe,GPE,"me by the Dover train. But I came by Dieppe, six hours’ agony, but a saving of",2490
Paris,GPE,Mr Hamlin has been quite well. He is in Paris at present; he didn’t expect you quite so,2500
Italy,GPE,"; I want to hear about you now, about Italy—about your work, the children, Mrs Perry",2503
England,GPE,"him, in good case to make money, to England. Miss Brown insisted upon showing him up to his",2505
Italy,GPE,"n’t know what. You are far handsomer than in Italy, and you never did look much like a girl",2510
Italy,GPE,"—nay, even about all her former fellow‐servants in Italy, and the grocer round the corner, and the",2514
æsthetic,GPE,turn her into a wonderful æsthetic being in a wonderful æsthetic house: it was very sensible of Mrs Perry to,2514
London,GPE,"in the dusk, on one of the most stifling London afternoons. Perry mechanically took out a cigarette; but",2515
Hamlin,GPE,"and get him to understand, to explain things to Hamlin. But how get this good‐natured, kindly, childish",2518
Hamlin,GPE,"could conceive. Perry was sure to burst out against Hamlin, to refuse to listen to her explanations, to",2518
Lucca,GPE,"and anything. Do you remember when we went into Lucca that day for the feast of the Holy Face,",2521
Hamlin,GPE,with Winnie and Mildred to go to the opera with Hamlin? D’you remember the plaster bust of Castruccio at the,2521
æsthetic,GPE,"Annie? You are certainly the queerest people, you æsthetic folk. By Jove! you actually have a photograph",2523
Hamlin,GPE,"“Hamlin’s cousin!” whistled Melton Perry,—“well, upon my",2525
Hamlin,GPE,"“Hamlin’s cousin or not Hamlin’s cousin, how in",2527
England,GPE,"is Mr Hamlin’s cousin; she has settled in England recently; he—we, I mean—see",2533
Florence,GPE,"all that sort of thing. I knew them in Florence, where Miss Bulzo, who was four or five",2537
Venice,GPE,"Well, six months later I met the two at Venice. They were staying at the same hotel as your",2537
quondam,GPE,", and wishing to dismiss and settle accounts with her quondam lover, had, in some fiendish way, induced",2537
Perugia,GPE,off with him. Next summer I met them at Perugia; they were travelling about in remote places as Mr,2539
Venice,GPE,of hers. Two years later the Bulzos were at Venice again; and I came just in time for the,2539
Paris,GPE,"not answer. Hamlin had returned the previous evening from Paris, and she also had noticed that he was changed",2551
Paris,GPE,"made rapid progress during his fortnight or three weeks in Paris, or at least that this absence enabled her to",2551
Hamlin,GPE,“It’s awfully good of old Hamlin to wish me to know all these grand swell painters,2552
Hamlin,GPE,"One afternoon, they were seated—Hamlin, Perry, and she—with Mrs Macgregor at",2554
Hamlin,GPE,; she thought she could see his eyes going from Hamlin’s face to her own inquiringly. The conversation was,2554
Hamlin,GPE,"Melton Perry hoped for an explanation from Richard Brown; Hamlin looked on passively, with that half‐stupefied look which she",2554
Hamlin,GPE,"Hamlin was more than merely depressed, he was very sad",2555
Hamlin,LOC,"; whether the poet, the dreamer, the chivalrous Hamlin of former days, still existed and suffered within this",2555
Italy,GPE,awkward drawl; “we have none like them in Italy. Why don’t Italians cultivate flowers? What do,2565
La France,GPE,? What do you call this? Is it a La France? I never knew a turnip from a jasmine.,2565
La France,GPE,"“I think it is a La France; I don’t know,” answered Anne,",2566
Hamlin,GPE,; but now I am quite sure of it—Hamlin drinks.”,2567
Perrys,GPE,"as she used to fold the clothes of the little Perrys, put out her light and lay down.",2577
Hamlin,GPE,". She knew, and only too well, that Hamlin was selfish, whimsical, fantastic, vain, a",2583
Hamlin,GPE,", to the belief that in one thing at least Hamlin had been perfectly noble, that no subsequently discovered weakness",2583
Hamlin,GPE,"And now this Hamlin, this man to whom she owed all, and",2584
Hamlin,GPE,"attempts she had made to awaken the better qualities of Hamlin; or rather, she could no longer conceive that",2584
Hamlin,GPE,"which she could not prevent, instead of thinking of Hamlin, whom she might have saved; and finally,",2584
Hamlin,GPE,never asked herself whether it was not her duty towards Hamlin to come to some conclusion about his cousin; she,2585
Hamlin,GPE,"she remembered the joy with which she had heard of Hamlin’s departure for Paris—that is to say,",2585
Paris,GPE,"with which she had heard of Hamlin’s departure for Paris—that is to say, of the crowning act",2585
Hamlin,GPE,", lying motionless in the dark, the face of Hamlin, as she had recently seen it, that weak",2585
Hamlin,GPE,"degradation, of the portraits at Wotton Hall—of Hamlin’s half‐crazy, disgraced brother; of his odious,",2585
Florence,GPE,"Brown had required of him in that distant past in Florence, to marry Anne Brown at whatever time she rnight",2586
Hamlin,GPE,"prostitution. To become, therefore, the wife of Hamlin, was an intolerable self‐degradation—nay, a pollution",2589
Hamlin,GPE,"Under her very eyes, before all the world, Hamlin had deceived her—had been another woman’s lover",2590
Hamlin,GPE,of embroidery on the wall—all the things which Hamlin had put there to please her. Was there anything,2594
Hamlin,GPE,her: she had asked him for a photograph during Hamlin’s absence with Sacha. She took the photograph and,2594
Hamlin,GPE,"When she had finished writing, she went down to Hamlin’s studio. He would come soon, and she",2599
Hamlin,GPE,"notes, but stopped. She loathed that music which Hamlin and Sacha so admired—that music, with its",2600
Hamlin,GPE,stickiness on her fingers. So Perry was right; Hamlin had returned to his old practice of taking opium.,2600
Hamlin,GPE,"leaves of a palm‐branch. It was the picture which Hamlin had begun long, long ago in Florence; and",2600
Florence,GPE,"picture which Hamlin had begun long, long ago in Florence; and her mind went back to that other rainy",2600
Hamlin,GPE,"in the tower studio, about to take leave of Hamlin, as she thought, for the last time.",2600
Hamlin,GPE,". Anne shuddered. Steps came along the corridor—Hamlin’s steps. She sat down near the window,",2600
Coblenz,GPE,“it is going on three years since I left Coblenz and came into this house. I am over twenty‐four,2606
Hamlin,GPE,"Hamlin, who had been sitting with his head resting on",2612
London,GPE,you promise that? And will you promise to leave London in a day or two—to go to Italy,2629
Italy,GPE,"London in a day or two—to go to Italy, anywhere where she is not—and wait till",2629
Italy,GPE,"“Walter is leaving for Italy to‐morrow,” she said, as she met Melton",2638
Hamlin,GPE,immediately recognised as part of the set once belonging to Hamlin’s mother which he had shown her long ago at,2647
Florence,GPE,"whom she had overtaken one day, years ago in Florence, browbeating and insulting the laundress’s girl, accusing",2656
Glaciers,LOC,"to make such things clear to a Madonna of the Glaciers, but perhaps Mr Perry will help you to understand",2659
Hamlin,GPE,"his friends.” He gave a contemptuous nod to Hamlin, waited for Anne to have said good‐bye to her",2673
Hamlin,GPE,"dress. Then, as she was going away on Hamlin’s entrance, he turned round suddenly to her and",2679
Hamlin,GPE,"street lamp as they passed quickly, had shown her Hamlin’s face close to her own, and radiant with",2690
