Location,ent_type,context,p_no
St. Piran's,LOC,"sign and testimony of primitive Cornish faith, even as St. Piran's white cross on a black ground, the first banner",1310
Cornwall,GPE,"cross on a black ground, the first banner of Cornwall, bore aloft the same symbol in days when the",1310
Cornwall,GPE,summer world the truth as she now understood it. Cornwall suddenly became a new Holy Land to the girl.,1312
Newlyn,GPE,imagined Him standing upon one of the stranded luggers in Newlyn harbor with the gulls floating round His head and the,1312
Saint Madron,GPE,"at the altar-stone in the ruined baptistery of Saint Madron. Thither on a day in early August, Joan",1314
sorrer,GPE,I'd have en hear me tell I'm in sorrer for the ill I brot 'pon his name.,1322
Newlyn,GPE,"gray horse and the squeaking wheel, rattled off to Newlyn some two hours later, and the ordeal, longed",1324
the golden dawn,LOC,the foliage of the elms was at its darkest before the golden dawn of autumn. Well-remembered sights rose on Joan,1324
Tedn,GPE,"take on so at them buzzin' fools! 'Tedn' the trouble, 'tis the money make 'em",1325
He'm,GPE,"""He'm to sea, but the whole world do knaw you",1329
Penzance,GPE,"what her've comed to say. I be gwaine to Penzance now, 'pon a matter o' business,",1330
sorrer,GPE,else theer'll come a whirlwind o' God-sent sorrer to strike wheer your heart's desire be rooted.,1367
Lanyon,LOC,"stone"" which stands away in a moor croft beyond Lanyon. She knew that it was no right cross,",1394
Cornwall,GPE,"gray-headed stone, perhaps the loneliest in all Cornwall, was pleasant to her thoughts, and she trudged",1395
Lanyon,LOC,"a rivulet and mounted again past the famous cromlech of Lanyon. But Joan passed the quoit unheeding, and kept",1398
Lanyon,LOC,"the quoit unheeding, and kept upon flint roads through Lanyon farm, where its irregular buildings stretch across the hill",1398
Western Cornwall,LOC,". The weather was much too warm even for ""Western Cornwall. A few leaves still hung on the crown of",1407
rousin,GPE,"his nieces, ""an' till us get a rousin' storm o' crooked forks an' heavy thunder",1408
boilin,GPE,'tis 'good-by' to the whole boilin'. Not but 'twill be a miracle for,1408
Melbury Gardens,GPE,"""No. 6 Melbury Gardens, London.",1418
London,GPE,"""No. 6 Melbury Gardens, London.",1418
London,GPE,letter. You have but to enter the train for London and stop in it until it gets to the end,1420
Penzance,GPE,"not later than eight o'clock, that by going into Penzance she might learn at what time the morning train departed",1421
London,GPE,might learn at what time the morning train departed to London.,1421
the adjacent hill,LOC,"and monstrous pile which rose in their midst. From the adjacent hill, superstitious watchers might have supposed that they beheld some",1423
streamlet,LOC,"the darkness, skirting the lake and splashing through the streamlet which fed it. Mary Chirgwin it was who now",1423
Earth,LOC,"vast bodies, from the reverberations of remote music; Earth or Heaven might have bred them, or the upper",1426
Providence,GPE,"done. The hay's in the hand o' Providence, but I wouldn't be perched on top o",1431
Earth,LOC,"water answering the thunder above it was to their ears Earth groaning against the rod, and right well they knew",1434
upland hay,LOC,"sheep and cattle in its depths; that tons of upland hay swam upon it; that, like enough, dead",1434
Providence,GPE,in the breast of one alone. Uncle Chirgwin trusted Providence and his hempen ropes and clothesline; but it was,1435
nort,GPE,"be tuned to the trump o' God, for nort—no, not the screech o' horns blawed",1439
Western Cornwall,LOC,"blue, hastily shown and greedily hidden, broke over Western Cornwall and uncovered the handiwork of a flood more savage in",1441
Talcarne valley,LOC,"been the ravage wrought by it. The orchards of Talcarne valley were ruined as though artillery had swept them, and",1441
Newlyn,GPE,like a wolf on the low-lying portion of Newlyn. Here it burst through the alleys and narrow passages,1441
Penzance,GPE,"theater of a desolation which covered wide regions. At Penzance, the Laregan River flooded all the lowlands as it",1442
the Laregan River,LOC,"a desolation which covered wide regions. At Penzance, the Laregan River flooded all the lowlands as it swept with prodigious cataracts",1442
Penzance,GPE,"prodigious cataracts to the sea; mighty lakes stretched between Penzance and Gulval; the brooklets of Ponsandine and Coombe,",1442
Plymouth,GPE,fleet who were lost that night upon the way toward Plymouth waters to join the herring fishery; and Newlyn heard,1444
Mounts Bay,LOC,", began to dot the wind-torn waters of Mounts Bay. The tide was out, but within the shelter",1446
the Scilly Islands,GPE,the storm had fallen suddenly upon them when westward of the Scilly Islands. One or two were believed to have made neighboring,1447
Penzance,GPE,", you see. Her might have marched off to Penzance to larn 'bout the manner o' gwaine to Lunnon",1452
Penzance,GPE,"-comin'; or her might have slept in Penzance to catch a early train away.""",1452
Penzance,GPE,the day's much aulder. I be gwaine to Penzance now an' I'll let 'e knaw if,1454
Scilly,GPE,"it was certainly known that some had taken refuge at Scilly, those vitally interested in the few remaining vessels withdrew",1477
Thomasin,GPE,"flung himself down and was soon sleeping heavily; while Thomasin, marveling at his stolidity and resenting it not a",1477
Thomasin,GPE,"in the morning. Her husband still slept, and Thomasin, her grief being of a nature which required spectators",1477
graaves,GPE,be twenty fathom nearer hell than them as lies in graaves ashore. But let en wait for the last trump,1485
Penzance,GPE,Chirgwin did not return to Newlyn after making inquiries at Penzance. There indeed she learned one fact which might prove,1493
Penzance,GPE,"from it were various. Joan had been at the Penzance railway station, and chance made Mary question the identical",1493
Penzance,GPE,"very anxious, for supposing that Joan had returned from Penzance on the previous evening, or attempted to do so",1499
Penzance,GPE,"On the night of the storm Joan had gone to Penzance, ascertained the first train which she could catch next",1500
Penzance,GPE,. An' theer's things to be done in Penzance—the doctor an' the crowner an'—an' the,1522
London,GPE,clung to a theory that Joan was long since in London. Dread and fear came over him. The thought,1524
Drownded,GPE,her in the brook as the waters went down. Drownded theer—the awnly sunshine as ever smiled at Drift,1526
forbeareth,GPE,"that heareth let en hear, an' he that forbeareth let en forbear, for they are a rebellious house",1534
Zion,GPE,"a pigeon. 'Because o' the mountain of Zion, which is desolate, the foxes walk upon it",1534
Thomasin,LOC,"Mr. Chirgwin took his leave of Thomasin, prayed that she might be supported in her tribulation",1536
Penzance,GPE,"'s eyes; then, together, they walked to Penzance, there to chronicle the sudden death of Joan Tregenza",1536
restin,GPE,"us, an' us can see wheer she be restin' 'pon Sundays. Sancreed's best an'",1541
He'm,GPE,"' the neighbors to bide along wi' Michael. He'm daft for all time, but 'tis said as",1547
Thomasin,GPE,"there walked behind her, Uncle Chirgwin, Mary and Thomasin, Mr. Bartlett, his wife, Gaffer Polglaze,",1550
Providence,GPE,"those present, save Thomas Chirgwin, but felt that Providence, harsh till now, had dealt kindly by Joan",1550
earth,LOC,". But soon he returned to his labor; the earth rose foot by foot, and the strong young man",1551
Providence,GPE,related to the parties both now unhappily swept away by Providence—I mean Thomas Tregenza and Joan—it is,1555
Newlyn,GPE,"felt that her own position must henceforth be exalted in Newlyn, for the effects of the combination of catastrophes led",1556
Thomasin,LOC,"pertaining thereto. The cottage was already Tregenza property. Thomasin therefore looked through the overwhelming misery of the time,",1556
Newlyn,GPE,"funeral of Joan Tregenza there blew a southwest wind over Newlyn, from out a gray sky, dotted with watery",1557
London,GPE,through the village. He had come that day from London upon the paying off of his vessel; and while,1558
London,GPE,"with the sailor; and he did not write from London to tell any of his return, that their pleasure",1558
Newlyn,GPE,"full of the fair girl he meant to marry at Newlyn. To her, at least, he had kept",1559
Tregenzas,GPE,"he sighted the lamp-lighted cottage window of the Tregenzas. Thereupon he stopped a moment, brought his bag",1560
Levant,GPE,"welcome. Theer be thots in me so deep as Levant mine, but I doan't speak 'em for anybody's",1575
wans,GPE,"of 'em. The devil's nets was the full wans, 'cause—""",1577
He'm,GPE,worst on it. What terrible evil be here? He'm—he'm daft seemin'ly; he's spawk the awfulest,1579
Let'n,GPE,in en for my better light. Er said 'Let'n come home an' call the devil as did it,1599
Newlyn,GPE,"an hour before had hastened hot-footed through the Newlyn streets, whose habitual stern expression had softened before the",1607
the gray village,LOC,"softened before the well-known sights and smells of the gray village, whose earnest soul was full of happiness under the",1607
Noy,GPE,his sorrow. There was no space now vacant in Noy's brain to hold the full extent of his loss,1607
Penzance,GPE,"Newlyn; and he wandered back, therefore, toward Penzance. A glare of gas lamps splashed the wet surface",1609
Newlyn,GPE,disannulled by chance. He turned a moment where the Newlyn harbor light flashed across the darkness to him. From,1610
London,GPE,"station, with a vague purpose to go straight to London at the earliest opportunity, when a wiser thought arrested",1612
Newlyn,GPE,"""I be come from Newlyn, from the Tregenzas. Thomasin have tawld me of",1614
Tregenzas,GPE,"""I be come from Newlyn, from the Tregenzas. Thomasin have tawld me of all that's falled",1614
Thomasin,GPE,"I be come from Newlyn, from the Tregenzas. Thomasin have tawld me of all that's falled out;",1614
Providence,GPE,", absolutely convinced that to this end it had pleased Providence to give him life, went forth into the world",1647
Penzance,GPE,"seducer of Joan. After leaving Drift he returned to Penzance, lay there that night, and upon the following",1647
Tarrant,GPE,"a similar way. His suspicious nature took fright and Tarrant's dark, bright eyes seemed to read his secret",1649
Tedn,GPE,"""Awnly sideways. 'Tedn' nothin' to me. I knaws the parties an",1651
London,GPE,"'s impossible, I fear, unless you go to London. I cannot help you further than to say",1652
Tarrant,GPE,", being anxious to escape further questioning, now thanked Tarrant and speedily departed. Not until half way back again",1653
Penzance,GPE,speedily departed. Not until half way back again to Penzance did he realize how slight was the nature of this,1653
London,GPE,to his object; the man he wanted lived in London and had a painting of Joan Tregenza in a picture,1653
London,GPE,". Allowing the ample margin of ten picture galleries to London, and assuming that the portrait of Joan once found",1654
Paddington,GPE,". He hired a bedroom in a mean street near Paddington, and, on the day after his arrival in",1655
London,GPE,", and, on the day after his arrival in London, purchased a large map and index of the city",1655
London,GPE,London swept and surged about Joe Noy unheeded. He cared,1656
Tregenzas,GPE,"the quay, Joe saw the white cottage of the Tregenzas, and there his survey stopped, for at this",1659
London,GPE,"Noy from the moment when first he set foot in London and began his search, now for a moment overwhelmed",1674
Melbury Gardens,GPE,"JOHN BARRON, No. 6 Melbury Gardens, S. W.",1676
S. W.,GPE,"JOHN BARRON, No. 6 Melbury Gardens, S. W.",1676
Melbury Gardens,GPE,", and set to work to find the position of Melbury Gardens upon his map. This done the man marked his",1677
Melbury Gardens,LOC,"his map and committed to memory, Noy soon reached Melbury Gardens and presently stood opposite No, 6 and scanned it",1680
Tobago,GPE,"; upon one wall hung the ""Negresses Bathing at Tobago."" For the rest the room appeared empty.",1697
Cornwall,GPE,"Station, and was soon on his way back to Cornwall.",1705
London,GPE,"The first letter came from London, the second, directed in a similar hand,",1710
Penzance,GPE,"He, it may be said, had reached Penzance by the same train which conveyed his various missives,",1711
London,GPE,"another letter for you from me, sent off from London. It is all wrong, so burn it,",1713
Cornwall,GPE,least of any desperate action. That he was in Cornwall again and a free man appeared to her proof sufficient,1714
nort,GPE,"mountains; he do knaw that sorrer ban't sent for nort.""",1723
West,LOC,"stood silently at the top, their faces to the West.",1754
earth,LOC,Already the voices of the frost began to break the earth's silence. In the darkness of woods it was,1755
