Location	ent_type	context	p_no	LongLabel	Addr_type	Type	StAddr	StName	AddNum	City	Subregion	Region	CntryName	Country	x	y	score	error
Hypersomnia	GPE	Either the patient suffers from Insomnia, or else from Hypersomnia, which we subdivide into sopor, carus, and	2473															nothing found
sopor	GPE	, or else from Hypersomnia, which we subdivide into sopor, carus, and lethargus; or thirdly from Kakosomnia	2473	Sopor, Bāramūla, Jammu and Kashmīr	Locality	City				Sopur	Bāramūla	Jammu and Kashmīr			74.47228000000007	34.28671000000003	100	
London	GPE	, you know, is jackal to an asylum in London; Dr. Wycherley, I have heard, keeps two	2557	London, Greater London, England, GBR	Locality	City				London	Greater London	England	United Kingdom	GBR	-0.12769887399997515	51.507408346000034	100	
brazened	GPE	I saw he didn't know all, and I brazened up a bit: told him I hadn't a	2586	Brazenet, 1710 7th St N, Clanton, AL, 35045, USA	POI	Telecom	1710 7th St N	7th	1710	Clanton	Chilton County	Alabama	United States	USA	-86.63700599999999	32.854903000000036	87.5	
London	GPE	and the stone jug, so I'm off to London, and there I'll un-Skinner myself into	2590	London, Greater London, England, GBR	Locality	City				London	Greater London	England	United Kingdom	GBR	-0.12769887399997515	51.507408346000034	100	
India	GPE	“The fourteen thousand pounds Captain Dodd brought home from India: the fourteen thousand pounds I heard him claim of	2602	India	Locality	Country							India	IND	79.44332654800007	23.379379735000043	100	
Armageddon	GPE	saints in prison,” and “the battle of Armageddon.”	2626	Armageddon, Vladimir, Vladimirskaya oblast', 600023, RUS	POI	Indoor Sports				Vladimir	Vladimir	Vladimirskaya oblast'	Rossiya	RUS	40.48992000000004	56.14227000000005	100	
India	GPE	Agra; I was spoiled by a long residence in India, and gave your husband sore trouble by resisting discipline	2633	India	Locality	Country							India	IND	79.44332654800007	23.379379735000043	100	
him.—I am	GPE	more freely to you, you know, than to him.—I am, dear Madam, Yours very faithfully,	2635	Americana, São Paulo, BRA	Locality	City				Americana		São Paulo	Brasil	BRA	-47.331879999999956	-22.739019999999982	72.27	
lucet	GPE	he says—he said Cicero says 'AEquitas ipsa lucet per se; something significat something else:' and	2660	Lucet, Maine-et-Loire, Loire, FRA	Locality	City				Lucet	Maine-et-Loire	Loire	France	FRA	-0.46302999999994654	47.16112000000004	100	
London	GPE	he said he was going to take unfurnished rooms in London, send up what furniture is absolutely necessary, and	2666	London, Greater London, England, GBR	Locality	City				London	Greater London	England	United Kingdom	GBR	-0.12769887399997515	51.507408346000034	100	
London	GPE	“Dec. 24th.—Edward started for London at five in the morning to take a place for	2668	London, Greater London, England, GBR	Locality	City				London	Greater London	England	United Kingdom	GBR	-0.12769887399997515	51.507408346000034	100	
Miss.	GPE	all in a hurry with, I was wanted, Miss. But I would finish my chapter, and O how	2701	Mississippi, USA	Locality	State or Province						Mississippi	United States	USA	-89.65717580799998	32.72397779900007	100	
London	GPE	. Edward says we could make a modest living in London; and nobody be the wiser: but here we	2723	London, Greater London, England, GBR	Locality	City				London	Greater London	England	United Kingdom	GBR	-0.12769887399997515	51.507408346000034	100	
Jerusalem	GPE	two fellow-pilgrims of mine on the way to Jerusalem, viz: to E. H., Rom. viii	2740	Jerusalem, ISR	Locality	City					Jerusalem	Jerusalem	Israel	ISR	35.21873000000005	31.780030000000068	100	
London	GPE	, and packed up his bag and rushed up to London. I caught a side view of his face;	2788	London, Greater London, England, GBR	Locality	City				London	Greater London	England	United Kingdom	GBR	-0.12769887399997515	51.507408346000034	100	
Brussels	GPE	: this, carefully undone upon the bed revealed a Brussels lace flounce and a veil: “It was my	2824	Brussels, BEL	Locality	City				Brussels	Brussels	Brussels	Belgium	BEL	4.406264339000074	50.89806471000003	100	
China	GPE	here is something.” And she produced a white China crape shawl. “Oh, how sweet,”	2827	China	Locality	Country							China	CHN	103.93002703300004	36.567348398000036	100	
London	GPE	very thing. Your dear papa bought me this in London, and I remonstrated with him well for buying me	2829	London, Greater London, England, GBR	Locality	City				London	Greater London	England	United Kingdom	GBR	-0.12769887399997515	51.507408346000034	100	
Honiton	GPE	say another word, I will trim her poplin with Honiton two feet deep.”	2846	Honiton, East Devon, Devon, England, GBR	Locality	City				East Devon	Devon	England	United Kingdom	GBR	-3.189076729999954	50.79963985400008	100	
Miss.	GPE	declare! Come in; there's only me and Miss. Master is in Yorkshire, and that there crocodile,	2890	Mississippi, USA	Locality	State or Province						Mississippi	United States	USA	-89.65717580799998	32.72397779900007	100	
Yorkshire	GPE	; there's only me and Miss. Master is in Yorkshire, and that there crocodile, Peggy, she is	2890	Yorkshire, VA, USA	Locality	Village				Yorkshire	Prince William County	Virginia	United States	USA	-77.44777999999997	38.793310000000076	100	
Barkington	GPE	the “White Lion,” the principal inn in Barkington. He went into the stable-yard, and	2916	Barrington, NS, CAN	Locality	Village				Barrington	Shelburne County	Nova Scotia	Canada	CAN	-65.56156099999998	43.56263900000005	91.2	
England	GPE	a funeral it was; for the sweetest girl in England buried her hopes, her laugh, her May of	2974	England, GBR	Locality	State or Province						England	United Kingdom	GBR	-1.4586284489999457	52.59274188900008	100	
London	GPE	this scanty information. Alfred could hardly have gone to London; for there was a train up from Barkington itself	3017	London, Greater London, England, GBR	Locality	City				London	Greater London	England	United Kingdom	GBR	-0.12769887399997515	51.507408346000034	100	
Barkington	GPE	to London; for there was a train up from Barkington itself at 8.30. But he might have gone to	3017	Barrington, NS, CAN	Locality	Village				Barrington	Shelburne County	Nova Scotia	Canada	CAN	-65.56156099999998	43.56263900000005	91.2	
midicine	GPE	the chronothairmal Therey riconciles all th' undisputed facks in midicine. So now sairch for a solution to riconcile the	3018	Medicine, 16 Station Road, Codsall, Wolverhampton, West Midlands, England, WV8 1, GBR	POI	Coffee Shop	16 Station Road	Station	16	Wolverhampton	West Midlands	England	United Kingdom	GBR	-2.201309999999978	52.629950000000065	87.5	
Bedlam	GPE	the nixt thing we hard, my lorrd was in Bedlam.”	3022	Bedlam, Harrogate, North Yorkshire, England, GBR	Locality	District				Harrogate	North Yorkshire	England	United Kingdom	GBR	-1.754445933999932	54.08669644200006	100	
Australia	GPE	county and buries the booty; or sails t' Australia with it. N'list'me; I'm an old friend	3035	Australia	Locality	Country							Australia	AUS	134.48403119800003	-25.70993156999998	100	
Yorkshire	GPE	on the box, returning to Musgrove Cottage as from Yorkshire: in passing Albion Villa he cast it a look	3045	Yorkshire, VA, USA	Locality	Village				Yorkshire	Prince William County	Virginia	United States	USA	-77.44777999999997	38.793310000000076	100	
London	GPE	a nicety: and the description will go up to London this morning, and all over Barkington, and the	3065	London, Greater London, England, GBR	Locality	City				London	Greater London	England	United Kingdom	GBR	-0.12769887399997515	51.507408346000034	100	
London	GPE	“And that he will turn up in London before very long; not in this neighbourhood. He	3068	London, Greater London, England, GBR	Locality	City				London	Greater London	England	United Kingdom	GBR	-0.12769887399997515	51.507408346000034	100	
London	GPE	reason my mistress and me we are going up to London that day early, and she talk of taking me	3075	London, Greater London, England, GBR	Locality	City				London	Greater London	England	United Kingdom	GBR	-0.12769887399997515	51.507408346000034	100	
London	GPE	calm. I have come down all the way from London to see you, and I am sure you wo	3088	London, Greater London, England, GBR	Locality	City				London	Greater London	England	United Kingdom	GBR	-0.12769887399997515	51.507408346000034	100	
London	GPE	pray who asked you to come all the way from London, sir?”	3089	London, Greater London, England, GBR	Locality	City				London	Greater London	England	United Kingdom	GBR	-0.12769887399997515	51.507408346000034	100	
Silverton Grove	GPE	back direct to Albion Villa: so he went to Silverton Grove full dressed, all ready for the wedding.	3103	Silverton, 830 McClaine St, Silverton, OR, 97381, USA	POI	Fitness Center	830 McClaine St	McClaine	830	Silverton	Marion County	Oregon	United States	USA	-122.79700299999996	45.00623200000007	78.57	
England	GPE	which is natural to a sane man, and in England is fed by occasional disclosures, and the general suspicion	3149	England, GBR	Locality	State or Province						England	United Kingdom	GBR	-1.4586284489999457	52.59274188900008	100	
India	GPE	, and played the game the jackal desperate plays in India, the fox in England, the elephant in Ceylon	3162	India	Locality	Country							India	IND	79.44332654800007	23.379379735000043	100	
England	GPE	the jackal desperate plays in India, the fox in England, the elephant in Ceylon: he feigned death;	3162	England, GBR	Locality	State or Province						England	United Kingdom	GBR	-1.4586284489999457	52.59274188900008	100	
Ceylon	GPE	India, the fox in England, the elephant in Ceylon: he feigned death; filled his mouth with water	3162	Ceylon, SK, CAN	Locality	Village				Ceylon	Division No. 2	Saskatchewan	Canada	CAN	-104.60120199999994	49.45911300000006	100	
Christendom	GPE	here than a bark from any dog-kennel in Christendom. “This is my father's doing,”	3169	Christendom, Waterford, Kilkenny, IRL	Locality	Village				Waterford		Kilkenny	Ireland	IRL	-7.093738178999956	52.25854011900003	100	
London	GPE	How can they?” said she. “The London asylums are visited four times a year by the commissioners	3238	London, Greater London, England, GBR	Locality	City				London	Greater London	England	United Kingdom	GBR	-0.12769887399997515	51.507408346000034	100	
Silverton	GPE	He was a full-blown pawnbroker of Silverton town, whom the legislature, with that keen knowledge	3253	Silverton, OR, USA	Locality	City				Silverton	Marion County	Oregon	United States	USA	-122.78199999999998	45.00380000000007	100	
Silverton Grove	GPE	keep calm, and this was his last day at Silverton Grove. The first thing he did was to make a	3304	Silverton, 830 McClaine St, Silverton, OR, 97381, USA	POI	Fitness Center	830 McClaine St	McClaine	830	Silverton	Marion County	Oregon	United States	USA	-122.79700299999996	45.00623200000007	78.57	
Silverton Grove	GPE	Silverton Grove in particular was supplied with the grotesque in dress from	3308	Silverton, 830 McClaine St, Silverton, OR, 97381, USA	POI	Fitness Center	830 McClaine St	McClaine	830	Silverton	Marion County	Oregon	United States	USA	-122.79700299999996	45.00623200000007	78.57	
Ireland	GPE	Oxford man, sir, a prize man, an Ireland scholar. But, unfortunately for me, my mother	3312	Ireland, IRL	Locality	Country							Ireland	IRL	-8.14600614699998	53.17587984600004	100	
Silverton Grove	GPE	their shoes, and vowed they were very comfortable in Silverton Grove.	3329	Silverton, 830 McClaine St, Silverton, OR, 97381, USA	POI	Fitness Center	830 McClaine St	McClaine	830	Silverton	Marion County	Oregon	United States	USA	-122.79700299999996	45.00623200000007	78.57	
England	GPE	dangerous; I am as sane as any man in England. Pray examine me, and judge for yourself.	3344	England, GBR	Locality	State or Province						England	United Kingdom	GBR	-1.4586284489999457	52.59274188900008	100	
Calton Retreat	GPE	she. “I know all about that death in Calton Retreat: you kept it dark before the coroner; but	3410	Retreat, New South Wales, AUS	Locality	City				Retreat		New South Wales	Australia	AUS	151.1273500000001	-30.608019999999954	81.54	
London	GPE	and sent them up to a famous analysing chemist in London, and told him she had; and said,	3429	London, Greater London, England, GBR	Locality	City				London	Greater London	England	United Kingdom	GBR	-0.12769887399997515	51.507408346000034	100	
Barkington	GPE	you are out, come to Albion Villa, in Barkington, and I'll have it all ready for you	3474	Barrington, NS, CAN	Locality	Village				Barrington	Shelburne County	Nova Scotia	Canada	CAN	-65.56156099999998	43.56263900000005	91.2	
Greece	GPE	hotter than ever was—out of the isles of Greece. Oh do help me out, and I'll	3482	Greece	Locality	Country							Greece	GRC	22.000000000000057	39.00000000000006	100	
London	GPE	and told him he must move Alfred directly to a London asylum. Baker raised objections; Mr. Hardie crushed them	3515	London, Greater London, England, GBR	Locality	City				London	Greater London	England	United Kingdom	GBR	-0.12769887399997515	51.507408346000034	100	
Silverton	GPE	two keepers came down from Dr. Wycherley's asylum to Silverton station: Baker met them and drove them to Silverton	3516	Silverton, OR, USA	Locality	City				Silverton	Marion County	Oregon	United States	USA	-122.78199999999998	45.00380000000007	100	
Barkington	GPE	him. The police knew, though nobody else in Barkington did, that this ostler had been in what rogues	3585	Barrington, NS, CAN	Locality	Village				Barrington	Shelburne County	Nova Scotia	Canada	CAN	-65.56156099999998	43.56263900000005	91.2	
London	GPE	did know something; so they had telegraphed to the London office to mark him down.	3589	London, Greater London, England, GBR	Locality	City				London	Greater London	England	United Kingdom	GBR	-0.12769887399997515	51.507408346000034	100	
Agra	GPE	unlikely the money was not to be lost in the Agra. Why, the 'Tiser says she went to	3656	Agra, Uttar Pradesh, IND	Locality	City				Agra	Agra	Uttar Pradesh	India	IND	78.00005000000004	27.19219000000004	100	
Barkington	GPE	Richard Hardie, Esq., of Musgrove Cottage, Barkington, was assaulted at his own door by three ruffians	3657	Barrington, NS, CAN	Locality	Village				Barrington	Shelburne County	Nova Scotia	Canada	CAN	-65.56156099999998	43.56263900000005	91.2	
Yorkshire	GPE	be paid by Mr. Thomas Hardie of Clare Court, Yorkshire.”	3658	Yorkshire, VA, USA	Locality	Village				Yorkshire	Prince William County	Virginia	United States	USA	-77.44777999999997	38.793310000000076	100	
china	GPE	, the greater part of the furniture, plate, china, glass, Oriental inlaid boxes and screens, with	3660	China	Locality	Country							China	CHN	103.93002703300004	36.567348398000036	100	
India	GPE	, Oriental inlaid boxes and screens, with several superb India shawls, scarfs, and dresses; also a twenty	3660	India	Locality	Country							India	IND	79.44332654800007	23.379379735000043	100	
London	GPE	Edward took unfurnished apartments in London, near Russell Square: a locality in which,	3661	London, Greater London, England, GBR	Locality	City				London	Greater London	England	United Kingdom	GBR	-0.12769887399997515	51.507408346000034	100	
London	GPE	He manoeuvred thus: first, he went back to London for a day or two to do other jobs,	3663	London, Greater London, England, GBR	Locality	City				London	Greater London	England	United Kingdom	GBR	-0.12769887399997515	51.507408346000034	100	
Barkington	GPE	then he returned, and wrote from a town near Barkington to Peggy Black, telling her he had been sent	3663	Barrington, NS, CAN	Locality	Village				Barrington	Shelburne County	Nova Scotia	Canada	CAN	-65.56156099999998	43.56263900000005	91.2	
London	GPE	all traces of his personal identity, and up to London by the train in the character of a young swell	3678	London, Greater London, England, GBR	Locality	City				London	Greater London	England	United Kingdom	GBR	-0.12769887399997515	51.507408346000034	100	
London	GPE	Sarah, that Mrs. and Miss Dodd would leave for London the day before the sale, and Edward the day	3682	London, Greater London, England, GBR	Locality	City				London	Greater London	England	United Kingdom	GBR	-0.12769887399997515	51.507408346000034	100	
Paris	GPE	“The letter is dated Paris. See!” And he showed her the date	3688	Paris, Île-de-France, FRA	Locality	City				Paris	Paris	Île-de-France	France	FRA	2.3616573370000538	48.86369757600005	100	
London	GPE	“But he says here he is coming back to London directly; and he orders me in the most peremptory	3688	London, Greater London, England, GBR	Locality	City				London	Greater London	England	United Kingdom	GBR	-0.12769887399997515	51.507408346000034	100	
Barkington	GPE	Dr. Phillips, in a cart, coming back to Barkington to end his days there, at the almshouse.	3694	Barrington, NS, CAN	Locality	Village				Barrington	Shelburne County	Nova Scotia	Canada	CAN	-65.56156099999998	43.56263900000005	91.2	
Paris	GPE	out a great deal of it. He was in Paris, but just starting for London: and he demanded	3721	Paris, Île-de-France, FRA	Locality	City				Paris	Paris	Île-de-France	France	FRA	2.3616573370000538	48.86369757600005	100	
London	GPE	. He was in Paris, but just starting for London: and he demanded his money and his accounts.	3721	London, Greater London, England, GBR	Locality	City				London	Greater London	England	United Kingdom	GBR	-0.12769887399997515	51.507408346000034	100	
Redeemer	GPE	it; I have my mother still—and my Redeemer.”	3737	Redeemer, Saginaw, MI, USA	Locality	Neighborhood				Saginaw	Saginaw County	Michigan	United States	USA	-83.91141999999996	43.40426000000008	100	
grampus	GPE	jaw: and there was Edward Dodd blowing like a grampus with rage, and Maxley on his back in the	3752	Grampus, South Australia, AUS	Locality	City				Grampus		South Australia	Australia	AUS	139.39726000000007	-32.72504999999995	100	
London	GPE	train moved, and his messenger was flying fast to London, with a note to Dr. Wycherley:	3837	London, Greater London, England, GBR	Locality	City				London	Greater London	England	United Kingdom	GBR	-0.12769887399997515	51.507408346000034	100	
DR	GPE	DR. SHORT arrived, approved Dr. Phillips's treatment,	3839	DR, NLD	Locality	State or Province						Drenthe	Nederland	NLD	6.618473407000067	52.86248761600007	100	
Yorkshire	GPE	, then, Mr. Hardie would telegraph Thomas Hardie in Yorkshire to telegraph him (Wycherley), Alfred should be	3847	Yorkshire, VA, USA	Locality	Village				Yorkshire	Prince William County	Virginia	United States	USA	-77.44777999999997	38.793310000000076	100	
Yorkshire	GPE	for Alfred at all. So, instead of telegraphing Yorkshire, he remained passive, and said sullenly to Mrs.	3848	Yorkshire, VA, USA	Locality	Village				Yorkshire	Prince William County	Virginia	United States	USA	-77.44777999999997	38.793310000000076	100	
Jordan	GPE	with smiles and triumph. For her the grave was Jordan, and death was but the iron gate of life	3854	Jordan	Locality	Country							Hashemite Kingdom of Jordan	JOR	36.78810430300007	31.248189480000065	100	
Redeemer	GPE	drop of wine; she could not even praise her Redeemer; that is to say, she could not speak	3855	Redeemer, Saginaw, MI, USA	Locality	Neighborhood				Saginaw	Saginaw County	Michigan	United States	USA	-83.91141999999996	43.40426000000008	100	
London	GPE	would not take the trouble. He went up to London, and dashed into speculation as some in their despair	3865	London, Greater London, England, GBR	Locality	City				London	Greater London	England	United Kingdom	GBR	-0.12769887399997515	51.507408346000034	100	
London	GPE	with the balance the sad young pair came up to London, and were clasped in their mother's arms.	3870	London, Greater London, England, GBR	Locality	City				London	Greater London	England	United Kingdom	GBR	-0.12769887399997515	51.507408346000034	100	
verjuice	GPE	charming people, when they got their own way; verjuice, when they didn't: and, to conclude	3877															nothing found
England	GPE	. It was the element his ancestors had invaded fair England by; and on its tranquil bosom a lover is	3877	England, GBR	Locality	State or Province						England	United Kingdom	GBR	-1.4586284489999457	52.59274188900008	100	
City	GPE	12, 13, and 14, Primrose Lane, City. “Say, I recommend you. To tell	3907	City, Leeds, West Yorkshire, England, GBR	Locality	District				Leeds	West Yorkshire	England	United Kingdom	GBR	-1.6003126909999423	53.74608611800005	100	
Southwark	GPE	him; a packing foreman's in a warehouse at Southwark; he went there, and was referred to Mr.	3924	Southwark, Greater London, England, GBR	Locality	District				Southwark	Greater London	England	United Kingdom	GBR	-0.09679500899994764	51.50275630600004	100	
Southwark	GPE	Tiser a spirited and magniloquent description of a fire in Southwark, and of the heroism displayed by a young gentleman	3934	Southwark, Greater London, England, GBR	Locality	District				Southwark	Greater London	England	United Kingdom	GBR	-0.09679500899994764	51.50275630600004	100	
flunkeyism	GPE	Edward: “but, soyons de notre siecle; flunkeyism is on the decline. I'll give you something	3946															nothing found
brieflessness	GPE	-barrister, who had consented to resign feelessness and brieflessness for a snug 1500l. a year at Whitehall.	3980															nothing found
India	GPE	, which sum is known to have been brought from India by one Captain Dodd, and has disappeared.”	4008	India	Locality	Country							India	IND	79.44332654800007	23.379379735000043	100	
India	GPE	the Dodds. They will show you his letter from India, announcing his return with the money.”	4010	India	Locality	Country							India	IND	79.44332654800007	23.379379735000043	100	
London	GPE	the Dodds had left the town, and were in London, but their address not known.	4033	London, Greater London, England, GBR	Locality	City				London	Greater London	England	United Kingdom	GBR	-0.12769887399997515	51.507408346000034	100	
London	GPE	with a notoriously unscrupulous madhouse keeper in the suburbs of London, and effected a masterstroke; whereof anon.	4065	London, Greater London, England, GBR	Locality	City				London	Greater London	England	United Kingdom	GBR	-0.12769887399997515	51.507408346000034	100	
Denmark	GPE	he found that Dr. Wycherley, had he lived in Denmark at the time, would have conferred cannily with Hamlet	4070	Denmark	Locality	Country							Denmark	DNK	10.053934054000024	55.959300779000046	100	
Silverton Grove	GPE	him deeper than his wrist, and reminded him of Silverton Grove; he could not suppress a shudder. The carriage	4096	Silverton, 830 McClaine St, Silverton, OR, 97381, USA	POI	Fitness Center	830 McClaine St	McClaine	830	Silverton	Marion County	Oregon	United States	USA	-122.79700299999996	45.00623200000007	78.57	
London	GPE	not suppress a shudder. The carriage rolled all through London with him. He saw the Parks with autumn's	4096	London, Greater London, England, GBR	Locality	City				London	Greater London	England	United Kingdom	GBR	-0.12769887399997515	51.507408346000034	100	
dale	GPE	whether sheep were washed or no in Ettrick's distant dale. She was retiring with a tender look at Alfred	4148	Dale, IN, USA	Locality	City				Dale	Spencer County	Indiana	United States	USA	-86.98998999999998	38.16880000000003	100	
England	GPE	go from the sham protection of the Lord Chancellor of England to the real protection of their Creator and their Judge	4159	England, GBR	Locality	State or Province						England	United Kingdom	GBR	-1.4586284489999457	52.59274188900008	100	
London	GPE	away: and transfer him to a small asylum nearer London, and kept by a Mrs. Ellis. “Women	4194	London, Greater London, England, GBR	Locality	City				London	Greater London	England	United Kingdom	GBR	-0.12769887399997515	51.507408346000034	100	
Whitechapel	GPE	Whitehall? Why, my mare would take you to Whitechapel and back in an hour, let alone Whitehall.	4385	Whitechapel, Tower Hamlets, Greater London, England, GBR	Locality	District				Tower Hamlets	Greater London	England	United Kingdom	GBR	-0.06907257799997524	51.51636757400007	100	
London	GPE	airth can ye go on in such a place as London without a Chick?”	4388	London, Greater London, England, GBR	Locality	City				London	Greater London	England	United Kingdom	GBR	-0.12769887399997515	51.507408346000034	100	
London	GPE	occasion Dr. Sampson, whose affectionate respect for the leading London physicians has already displayed itself, was inveighing specially against	4391	London, Greater London, England, GBR	Locality	City				London	Greater London	England	United Kingdom	GBR	-0.12769887399997515	51.507408346000034	100	
Wales	GPE	time Garrett had got a hammer, and he and Wales rushed wildly up the stairs to batter in the strong	4500	Wales, GBR	Locality	State or Province						Wales	United Kingdom	GBR	-3.7652226249999785	52.337163856000075	100	
Wales	GPE	Garrett sank down gasping at the stair-foot. Wales ran into the yard uttering pitiful cries, and pointing	4500	Wales, GBR	Locality	State or Province						Wales	United Kingdom	GBR	-3.7652226249999785	52.337163856000075	100	
Dover	GPE	Then Mrs. Dodd had a female inspiration. “The Dover road! Ah! my husband will make for the	4570	Dover, Kent, England, GBR	Locality	City				Dover	Kent	England	United Kingdom	GBR	1.3084585650000236	51.12814449600006	100	
Dover	GPE	sight of your door: and I'll take the Dover road directly with my drag. My teeth weren't	4578	Dover, Kent, England, GBR	Locality	City				Dover	Kent	England	United Kingdom	GBR	1.3084585650000236	51.12814449600006	100	
Dover	GPE	surprise, made few inquiries for some miles on the Dover road; but he explained to her that the parties	4586	Dover, Kent, England, GBR	Locality	City				Dover	Kent	England	United Kingdom	GBR	1.3084585650000236	51.12814449600006	100	
Rochester	GPE	, on the strength of which he rattled on to Rochester. There he pulled up, deposited Mrs. Dodd at	4587	Rochester, NY, USA	Locality	City				Rochester	Monroe County	New York	United States	USA	-77.61631999999997	43.155800000000056	100	
