Location	ent_type	context	p_no	LongLabel	Addr_type	Type	StAddr	StName	AddNum	City	Subregion	Region	CntryName	Country	x	y	score	error
Euphrosyne	GPE	“Where are some of my family? Is not Euphrosyne here—or Eboracus?”	1508	Sophrosyne, 429 Schulte Rd NW, Albuquerque, NM, 87107, USA	POI	Sports Center	429 Schulte Rd NW	Schulte	429	Albuquerque	Bernalillo County	New Mexico	United States	USA	-106.63951999999995	35.156030000000044	70	
Rome	GPE	am I here and not in Lamia’s house in Rome?”	1517	Rome, ITA	Locality	City				Rome	Rome	Latium	Italie	ITA	12.495650000000069	41.90322000000003	100	
Rome	GPE	I will also guarantee. I thank the Gods, Rome is not on the confines of the world, that	1522	Rome, ITA	Locality	City				Rome	Rome	Latium	Italie	ITA	12.495650000000069	41.90322000000003	100	
Edessa	GPE	perpetrated with impunity. We are not at Nizibis or Edessa to be fallen upon by Parthians, or held to	1522	Edessa, Şanlıurfa, TUR	Locality	City				Urfa		Şanlıurfa	Turquia	TUR	38.79392000000007	37.167080000000055	100	
Rome	GPE	and Domitia remained undisturbed. No tidings reached her from Rome, but to her great relief the Cæsar Domitian did	1532	Rome, ITA	Locality	City				Rome	Rome	Latium	Italie	ITA	12.495650000000069	41.90322000000003	100	
Augusta	GPE	love me! I expect yet to hear you proclaimed Augusta, and to have to offer incense and to pour	1544	Augusta, Bayern, DEU	Locality	City				Augsburg	Augsburg (Stadt)	Bayern	Germania	DEU	10.897880000000043	48.370340000000056	100	
Rome	GPE	I thank the Immortals, divorce is easily obtained in Rome—with money, influence in Rome—to the	1548	Rome, ITA	Locality	City				Rome	Rome	Latium	Italie	ITA	12.495650000000069	41.90322000000003	100	
Rome	GPE	easily obtained in Rome—with money, influence in Rome—to the end of time, my dear.	1548	Rome, ITA	Locality	City				Rome	Rome	Latium	Italie	ITA	12.495650000000069	41.90322000000003	100	
Rome	GPE	not. Why, there is not a court in Rome, not the Senate even can afford you protection and	1560	Rome, ITA	Locality	City				Rome	Rome	Latium	Italie	ITA	12.495650000000069	41.90322000000003	100	
Egypt	GPE	“He is in Egypt.”	1562	Egypt	Locality	Country							Arab Republic of Egypt	EGY	29.870494860000065	26.512273493000066	100	
Hercules	GPE	from Lamius, and was not he the child of Hercules and Omphale? It was very naughty and shocking,	1570	Hercules, CA, USA	Locality	City				Hercules	Contra Costa County	California	United States	USA	-122.26538	38.01040000000006	100	
Omphale	GPE	, and was not he the child of Hercules and Omphale? It was very naughty and shocking, and all	1570	Omphile, Kodi St, Protea North, Johannesburg, Gauteng, 1818, ZAF	POI	Sports Center	Kodi St	Kodi		Johannesburg	Johannesburg	Gauteng	South Africa	ZAF	27.834490000000073	-26.278169999999932	85.71	
Syria	GPE	marry him, you must positively obtain the proconsulship of Syria or Egypt for him. And as to Lamia,	1572	Syria	Locality	Country							Syria	SYR	38.50527333900004	35.01280854600003	100	
Egypt	GPE	, you must positively obtain the proconsulship of Syria or Egypt for him. And as to Lamia, he can	1572	Egypt	Locality	Country							Arab Republic of Egypt	EGY	29.870494860000065	26.512273493000066	100	
Rome	GPE	for you is what there is not another woman in Rome who would not give her jewels to obtain.”	1586	Rome, ITA	Locality	City				Rome	Rome	Latium	Italie	ITA	12.495650000000069	41.90322000000003	100	
Italy	GPE	, drive us, if you will, out of Italy—but do not separate us.”	1595	Italy	Locality	Country							Italian Republic	ITA	12.833330000000046	42.833330000000046	100	
Duilia	GPE	in the entrance, holding back the curtain, and Duilia drew her daughter from her seat.	1597	Douilia, Mostaganem, DZA	POI	Forest						Mostaganem	Algérie	DZA	0.4651200000000699	35.86199000000005	85.71	
Munich	GPE	At Munich and Bayreuth, at the performance of Wagner’s operas	1627	Munich, Bavaria, DEU	Locality	City				Munich	Munich	Bavaria	Federal Republic of Germany	DEU	11.577540000000056	48.13641000000007	100	
Bayreuth	GPE	At Munich and Bayreuth, at the performance of Wagner’s operas, the	1627	Bayreuth, Bayern, DEU	Locality	City				Bayreuth	Bayreuth (Stadt)	Bayern	Deutschland	DEU	11.571270000000027	49.945440000000076	100	
Jerusalem	GPE	brother, a man who, by the capture of Jerusalem, had gained a name, and had attached the	1632	Jerusalem, ISR	Locality	City					Jerusalem	Jerusalem	Israel	ISR	35.21873000000005	31.780030000000068	100	
Germany	GPE	only by his abortive attempt to pluck the laurels in Germany from the brow of his kinsman Cerealis, for the	1632	Germany	Locality	Country							Federal Republic of Germany	DEU	10.39227793200007	51.11063104900006	100	
Empire	GPE	granted none of the titles that indicated association in the Empire. He was not suffered to take part in public	1633	Empire, CA, USA	Locality	City				Empire	Stanislaus County	California	United States	USA	-120.89932999999996	37.637920000000065	100	
Empire	GPE	raised. His father had already associated him in the Empire and had gradually transferred the conduct of affairs to his	1640	Empire, CA, USA	Locality	City				Empire	Stanislaus County	California	United States	USA	-120.89932999999996	37.637920000000065	100	
Domitian	GPE	each other, at all events in appearance, and Domitian had been sufficiently prudent to veil his jealousy of Titus	1641	GuangdongMaomingDoumitian	Locality	City					Maoming	Guangdong	中國	CHN	111.14418000000006	22.505450000000053	90	
Rome	GPE	, retained his younger son about his person, in Rome, and it was but rarely that the prince was	1644	Rome, ITA	Locality	City				Rome	Rome	Latium	Italie	ITA	12.495650000000069	41.90322000000003	100	
Rome	GPE	She occasionally visited her mother in Rome, but the chasm between them widened. Duilia could	1652	Rome, ITA	Locality	City				Rome	Rome	Latium	Italie	ITA	12.495650000000069	41.90322000000003	100	
Duilia	GPE	in Rome, but the chasm between them widened. Duilia could not understand her daughter’s refusal to accept the	1652	Douilia, Mostaganem, DZA	POI	Forest						Mostaganem	Algérie	DZA	0.4651200000000699	35.86199000000005	85.71	
Duilia	GPE	it, “eat her rat.” The older Duilia grew, the less inclined she was to acknowledge her	1652	Douilia, Mostaganem, DZA	POI	Forest						Mostaganem	Algérie	DZA	0.4651200000000699	35.86199000000005	85.71	
Duilia	GPE	to obtain an interview with the aged Emperor, and Duilia took pains to assure him that the marriage had been	1653	Douilia, Mostaganem, DZA	POI	Forest						Mostaganem	Algérie	DZA	0.4651200000000699	35.86199000000005	85.71	
Gabii	GPE	, “let me go to my old home at Gabii. I have lived in seclusion enough at Albanum to	1673	Gabii, Monte Compatri, Roma, ITA	POI	Ruin				Monte Compatri	Roma	Lazi	Italia	ITA	12.716670000000022	41.88333000000006	100	
Rome	GPE	have become. Caligula threw mud, the mud of Rome, into the lap of my grandfather, because he	1678	Rome, ITA	Locality	City				Rome	Rome	Latium	Italie	ITA	12.495650000000069	41.90322000000003	100	
Rome	GPE	the streets. It was ominous—the soil of Rome has been taken away from the divine race of Julius	1678	Rome, ITA	Locality	City				Rome	Rome	Latium	Italie	ITA	12.495650000000069	41.90322000000003	100	
Rome	GPE	them. It is not I only, but all Rome, that knows that your life together is not that	1688	Rome, ITA	Locality	City				Rome	Rome	Latium	Italie	ITA	12.495650000000069	41.90322000000003	100	
Rome	GPE	well pleased with our house. We have given to Rome peace and prosperity at home, and victory abroad.	1695	Rome, ITA	Locality	City				Rome	Rome	Latium	Italie	ITA	12.495650000000069	41.90322000000003	100	
Rome	GPE	disorders, thy violence, before our father came to Rome, have not been forgotten or forgiven, and Senate	1695	Rome, ITA	Locality	City				Rome	Rome	Latium	Italie	ITA	12.495650000000069	41.90322000000003	100	
Rome	GPE	Domitia, seated beside the balustrade, looked over mighty Rome, the teeming forum, roofs with gilded tiles of	1711	Rome, ITA	Locality	City				Rome	Rome	Latium	Italie	ITA	12.495650000000069	41.90322000000003	100	
Euphrosyne	GPE	“Euphrosyne,” said Domitia, “come hither! observe	1718	Sophrosyne, 429 Schulte Rd NW, Albuquerque, NM, 87107, USA	POI	Sports Center	429 Schulte Rd NW	Schulte	429	Albuquerque	Bernalillo County	New Mexico	United States	USA	-106.63951999999995	35.156030000000044	70	
Rome	GPE	were parted. Your quarrels are now the talk of Rome, and many a cutting jest is put into your	1744	Rome, ITA	Locality	City				Rome	Rome	Latium	Italie	ITA	12.495650000000069	41.90322000000003	100	
Rome	GPE	some days, and it is my intent to leave Rome and be free from business and take my cure at	1748	Rome, ITA	Locality	City				Rome	Rome	Latium	Italie	ITA	12.495650000000069	41.90322000000003	100	
Rome	GPE	what my brother is. By Jupiter Capitolinus! if Rome should ever have him as its prince, it will	1750	Rome, ITA	Locality	City				Rome	Rome	Latium	Italie	ITA	12.495650000000069	41.90322000000003	100	
Antioch	GPE	to advance him to some foreign post—he knows Antioch, I will give him the proconsulship of Syria and	1753	Antioch, CA, USA	Locality	City				Antioch	Contra Costa County	California	United States	USA	-121.81973999999997	38.01583000000005	100	
Syria	GPE	knows Antioch, I will give him the proconsulship of Syria and Cilicia, and so move him away from Rome	1753	Syria	Locality	Country							Syria	SYR	38.50527333900004	35.01280854600003	100	
Cilicia	GPE	, I will give him the proconsulship of Syria and Cilicia, and so move him away from Rome. And	1753	Cilicia, TUR	Locality	Zone							Türkiye	TUR	36.00000000000006	37.00000000000006	100	
Rome	GPE	Syria and Cilicia, and so move him away from Rome. And then—” he took a turn,	1753	Rome, ITA	Locality	City				Rome	Rome	Latium	Italie	ITA	12.495650000000069	41.90322000000003	100	
Antioch	GPE	see that you need mope at Gabii. You know Antioch; you were there for some years. It is	1753	Antioch, CA, USA	Locality	City				Antioch	Contra Costa County	California	United States	USA	-121.81973999999997	38.01583000000005	100	
Rome	GPE	not, unless the Emperor could not trust him in Rome—or may be, in his goodness he has	1761	Rome, ITA	Locality	City				Rome	Rome	Latium	Italie	ITA	12.495650000000069	41.90322000000003	100	
Rome	GPE	that was a topic of gossip in the saloons of Rome.	1766	Rome, ITA	Locality	City				Rome	Rome	Latium	Italie	ITA	12.495650000000069	41.90322000000003	100	
Carinæ	GPE	tell the fellows not to go at once to the Carinæ. I have a fancy to see the wife of	1768	Carinae, Videla Aranda, Maipú, M5529, Mendoza, ARG	POI	Winery	Videla Aranda	Videla Aranda			Maipú	Mendoza	Argentina	ARG	-68.71088999999995	-33.04734999999994	100	
Paris	GPE	. I have a fancy to see the wife of Paris the actor, in the Insula of Castor and Pollux	1768	Paris, Île-de-France, FRA	Locality	City				Paris	Paris	Île-de-France	France	FRA	2.3616573370000538	48.86369757600005	100	
Rome	GPE	who had in fact forbidden them—was absent from Rome.	1769	Rome, ITA	Locality	City				Rome	Rome	Latium	Italie	ITA	12.495650000000069	41.90322000000003	100	
Euphrosyne	GPE	Taking Euphrosyne along with her, Domitia made her way towards the	1775	Sophrosyne, 429 Schulte Rd NW, Albuquerque, NM, 87107, USA	POI	Sports Center	429 Schulte Rd NW	Schulte	429	Albuquerque	Bernalillo County	New Mexico	United States	USA	-106.63951999999995	35.156030000000044	70	
Augusta	GPE	it was whispered would some day be herself Empress, Augusta, and an object of religious worship.	1777	Augusta, Bayern, DEU	Locality	City				Augsburg	Augsburg (Stadt)	Bayern	Germania	DEU	10.897880000000043	48.370340000000056	100	
Paris	GPE	, times have been better, and why has not Paris moved into superior quarters? Surely he is in better	1786	Paris, Île-de-France, FRA	Locality	City				Paris	Paris	Île-de-France	France	FRA	2.3616573370000538	48.86369757600005	100	
Paris	GPE	degree,” answered the actor’s wife. “Paris performs in the grand old dramas in Greek only;	1787	Paris, Île-de-France, FRA	Locality	City				Paris	Paris	Île-de-France	France	FRA	2.3616573370000538	48.86369757600005	100	
Rome	GPE	a sad bungler in comedy. Now the taste of Rome is not for the masterpieces of the ancients. The	1787	Rome, ITA	Locality	City				Rome	Rome	Latium	Italie	ITA	12.495650000000069	41.90322000000003	100	
Paris	GPE	we live; I hang as a log about my Paris’s neck, but thank God, he loves his	1787	Paris, Île-de-France, FRA	Locality	City				Paris	Paris	Île-de-France	France	FRA	2.3616573370000538	48.86369757600005	100	
the Kingdom of Heaven	GPE	low firm voice, “thou art not far from the Kingdom of Heaven.”	1793	Kingdom of Heaven, Moniya Rd, Akinyele, Oyo, NGA	POI	Church	Moniya Rd	Moniya		Akinyele		Oyo	Nigeria	NGA	3.8546000000000618	7.623530000000073	99.95	
Paris	GPE	But before he could offer any explanation, Paris appeared, his face expressive of alarm; he had	1807	Paris, Île-de-France, FRA	Locality	City				Paris	Paris	Île-de-France	France	FRA	2.3616573370000538	48.86369757600005	100	
Carinæ	GPE	she, “I will visit my mother in the Carinæ. She will know everything.”	1821	Carinae, Videla Aranda, Maipú, M5529, Mendoza, ARG	POI	Winery	Videla Aranda	Videla Aranda			Maipú	Mendoza	Argentina	ARG	-68.71088999999995	-33.04734999999994	100	
Tablinum	GPE	passed the vestibule, traversed the Atrium and entered the Tablinum. But Longa Duilia was not there. A slave	1827															nothing found
Duilia	GPE	ushered into her mother’s presence, and at once Duilia bowed to her with profound respect.	1829	Douilia, Mostaganem, DZA	POI	Forest						Mostaganem	Algérie	DZA	0.4651200000000699	35.86199000000005	85.71	
Rome	GPE	—what is this that has cast a shadow over Rome and frightened the people as with an eclipse?”	1832	Rome, ITA	Locality	City				Rome	Rome	Latium	Italie	ITA	12.495650000000069	41.90322000000003	100	
Rome	GPE	be only rumor and yet,—he was suffering when he left Rome.”	1833	Rome, ITA	Locality	City				Rome	Rome	Latium	Italie	ITA	12.495650000000069	41.90322000000003	100	
Rome	GPE	The silence that had fallen on Rome had passed away, the town was now resonant with	1841	Rome, ITA	Locality	City				Rome	Rome	Latium	Italie	ITA	12.495650000000069	41.90322000000003	100	
Rome	GPE	had—ah me!—Things would have been very different in Rome. But he suffered for his obstinacy. You must	1860	Rome, ITA	Locality	City				Rome	Rome	Latium	Italie	ITA	12.495650000000069	41.90322000000003	100	
Domitian	GPE	“Go whither? the world belongs to Domitian. There is not a corner where you can hide	1862	GuangdongMaomingDoumitian	Locality	City					Maoming	Guangdong	中國	CHN	111.14418000000006	22.505450000000053	90	
Alba	GPE	When the Romans were a pastoral people at Alba, then it was the duty of the young girls	1883	Alba, Cuneo, ITA	Locality	City				Alba	Cuneo	Piemonte	Italia	ITA	8.034100000000024	44.69605000000007	100	
Rome	GPE	Virgins, an institution which lasted from the founding of Rome in B. C. 753, to the disestablishment of	1886	Rome, ITA	Locality	City				Rome	Rome	Latium	Italie	ITA	12.495650000000069	41.90322000000003	100	
B. C. 753	GPE	an institution which lasted from the founding of Rome in B. C. 753, to the disestablishment of Paganism, and the expulsion	1886	B.C., BC, CAN	Locality	State or Province						British Columbia	Canada	CAN	-125.10409485599996	54.56186070000007	75.24	
Rome	GPE	maintaining the perpetual fire. They preserved the palladia of Rome, those mysterious articles on which the prosperity, nay	1889	Rome, ITA	Locality	City				Rome	Rome	Latium	Italie	ITA	12.495650000000069	41.90322000000003	100	
Rome	GPE	I know not—only let me get away from Rome, then trust my craft to enable me to evade	1902	Rome, ITA	Locality	City				Rome	Rome	Latium	Italie	ITA	12.495650000000069	41.90322000000003	100	
Italy	GPE	“Get me out of Italy, and I shall be safe. I will not	1904	Italy	Locality	Country							Italian Republic	ITA	12.833330000000046	42.833330000000046	100	
Rome	GPE	wonderfully peaceful, in the midst of busy, seething Rome, and in the centre of its greatest movement.	1923	Rome, ITA	Locality	City				Rome	Rome	Latium	Italie	ITA	12.495650000000069	41.90322000000003	100	
Italy	GPE	it is impossible for you to lie hid anywhere in Italy—and impossible to escape from it, unknown to	1927	Italy	Locality	Country							Italian Republic	ITA	12.833330000000046	42.833330000000046	100	
Augusta	GPE	the weight of duties that will now fall on the Augusta, and that thy health is feeble and thou needest	1927	Augusta, Bayern, DEU	Locality	City				Augsburg	Augsburg (Stadt)	Bayern	Germania	DEU	10.897880000000043	48.370340000000056	100	
Gabii	GPE	Domitia was at Gabii. Cornelia, the Vestal Great Mother had sent her	1933	Gabii, Monte Compatri, Roma, ITA	POI	Ruin				Monte Compatri	Roma	Lazi	Italia	ITA	12.716670000000022	41.88333000000006	100	
Rome	GPE	been in the Gabian villa, Celer came out from Rome. He was a plain middle-aged man with	1938	Rome, ITA	Locality	City				Rome	Rome	Latium	Italie	ITA	12.495650000000069	41.90322000000003	100	
Euphrosyne	GPE	,” said Domitia. “Come, now, Euphrosyne, bring me spindle and distaff, I will be	1952	Sophrosyne, 429 Schulte Rd NW, Albuquerque, NM, 87107, USA	POI	Sports Center	429 Schulte Rd NW	Schulte	429	Albuquerque	Bernalillo County	New Mexico	United States	USA	-106.63951999999995	35.156030000000044	70	
Rome	GPE	So days passed, occasionally tidings came from Rome, but these were uncertain rumors. Domitia was enjoying	1953	Rome, ITA	Locality	City				Rome	Rome	Latium	Italie	ITA	12.495650000000069	41.90322000000003	100	
Euphrosyne	GPE	from annoyance in the country. And she had in Euphrosyne one with whom she talked with pleasure, for the	1953	Sophrosyne, 429 Schulte Rd NW, Albuquerque, NM, 87107, USA	POI	Sports Center	429 Schulte Rd NW	Schulte	429	Albuquerque	Bernalillo County	New Mexico	United States	USA	-106.63951999999995	35.156030000000044	70	
Longa Duilia	GPE	A bustle, and in a moment, in sailed Longa Duilia, very much painted, very yellow in hair,	1970	Duillia, Koundara, Boke, GIN	Locality	City					Koundara	Boke	Guinée	GIN	-13.016669999999976	12.150000000000034	70.13	
Carinæ	GPE	“Whither? To your house in the Carinæ?”	1976	Carinae, Videla Aranda, Maipú, M5529, Mendoza, ARG	POI	Winery	Videla Aranda	Videla Aranda			Maipú	Mendoza	Argentina	ARG	-68.71088999999995	-33.04734999999994	100	
Augusta	GPE	proper place. My dear, you will be proclaimed Augusta, and receive worship as a divinity. The Senate	1977	Augusta, Bayern, DEU	Locality	City				Augsburg	Augsburg (Stadt)	Bayern	Germania	DEU	10.897880000000043	48.370340000000056	100	
Duilia	GPE	“Then,” said Duilia, looking carefully about, “that jade, big	1979	Douilia, Mostaganem, DZA	POI	Forest						Mostaganem	Algérie	DZA	0.4651200000000699	35.86199000000005	85.71	
Rome	GPE	. There has been a good deal of disturbance in Rome. As the Gods love me! I do not	1993	Rome, ITA	Locality	City				Rome	Rome	Latium	Italie	ITA	12.495650000000069	41.90322000000003	100	
Rome	GPE	men’s minds. You know what a disturbance in Rome is, we have gone through several. By Jupiter	1993	Rome, ITA	Locality	City				Rome	Rome	Latium	Italie	ITA	12.495650000000069	41.90322000000003	100	
Rome	GPE	“Rome does. The Roman rabble will not have it so	1995	Rome, ITA	Locality	City				Rome	Rome	Latium	Italie	ITA	12.495650000000069	41.90322000000003	100	
Messalinus	GPE	blade of which is innocuous. I will call in Messalinus. He will tell you more.”	1997	Messaline, 26 Avenue Baraduc, 63140, Châtel-Guyon, Puy-de-Dôme, Auvergne-Rhône-Alpes, FRA	POI	Clothing Store	26 Avenue Baraduc	Baraduc	26	Châtel-Guyon	Puy-de-Dôme	Auvergne-Rhône-Alpes	France	FRA	3.0657200000000557	45.91957000000008	82	
Duilia	GPE	“Catullus Messalinus,” said Duilia, “have the goodness to inform my daughter of	2000	Douilia, Mostaganem, DZA	POI	Forest						Mostaganem	Algérie	DZA	0.4651200000000699	35.86199000000005	85.71	
Rome	GPE	On her return to Rome and the palace, Domitia did not see the Emperor	2006	Rome, ITA	Locality	City				Rome	Rome	Latium	Italie	ITA	12.495650000000069	41.90322000000003	100	
Rome	GPE	hear the mutter of voices in the circus; all Rome would be there. As she had descended from the	2015	Rome, ITA	Locality	City				Rome	Rome	Latium	Italie	ITA	12.495650000000069	41.90322000000003	100	
Domitian	GPE	Vestal Virgins. But Nero had broken this rule and Domitian, the more to emphasize his reconciliation with Domitia,	2016	GuangdongMaomingDoumitian	Locality	City					Maoming	Guangdong	中國	CHN	111.14418000000006	22.505450000000053	90	
Rome	GPE	pleasure of his well-beloved, the citizens of Rome, senators, knights, and people generally, and	2021	Rome, ITA	Locality	City				Rome	Rome	Latium	Italie	ITA	12.495650000000069	41.90322000000003	100	
Rome	GPE	of such strangers as might at the time be in Rome, the centre of the world.	2021	Rome, ITA	Locality	City				Rome	Rome	Latium	Italie	ITA	12.495650000000069	41.90322000000003	100	
Augusta	GPE	! the blue! It is the color of the Augusta! The blue! Sabaste! I swear by her	2044	Augusta, Bayern, DEU	Locality	City				Augsburg	Augsburg (Stadt)	Bayern	Germania	DEU	10.897880000000043	48.370340000000056	100	
Augusta	GPE	blue! It shall win! The color of the Augusta! of the divine Augusta, the friend of the	2046	Augusta, Bayern, DEU	Locality	City				Augsburg	Augsburg (Stadt)	Bayern	Germania	DEU	10.897880000000043	48.370340000000056	100	
Augusta	GPE	! The color of the Augusta! of the divine Augusta, the friend of the Roman people! The blue	2046	Augusta, Bayern, DEU	Locality	City				Augsburg	Augsburg (Stadt)	Bayern	Germania	DEU	10.897880000000043	48.370340000000056	100	
Paris	GPE	“It is the actor Paris. Yet do nothing now. It would be inauspicious	2051	Paris, Île-de-France, FRA	Locality	City				Paris	Paris	Île-de-France	France	FRA	2.3616573370000538	48.86369757600005	100	
Augusta	GPE	blue! the dear blue! the blue of the Augusta has it! Ye Gods be praised! I vow	2055	Augusta, Bayern, DEU	Locality	City				Augsburg	Augsburg (Stadt)	Bayern	Germania	DEU	10.897880000000043	48.370340000000056	100	
Augusta	GPE	! The blue has it. All hail to the Augusta! to heaven’s blue!”	2055	Augusta, Bayern, DEU	Locality	City				Augsburg	Augsburg (Stadt)	Bayern	Germania	DEU	10.897880000000043	48.370340000000056	100	
Paris	GPE	“Paris, madam, the inimitable, the admired Paris,	2064	Paris, Île-de-France, FRA	Locality	City				Paris	Paris	Île-de-France	France	FRA	2.3616573370000538	48.86369757600005	100	
Paris	GPE	“Paris, madam, the inimitable, the admired Paris, that he may recite from Greek plays to our	2064	Paris, Île-de-France, FRA	Locality	City				Paris	Paris	Île-de-France	France	FRA	2.3616573370000538	48.86369757600005	100	
Paris	GPE	brow of Domitia at the sneers and covert insinuations. Paris! what was Paris to her? what but the	2065	Paris, Île-de-France, FRA	Locality	City				Paris	Paris	Île-de-France	France	FRA	2.3616573370000538	48.86369757600005	100	
Paris	GPE	the sneers and covert insinuations. Paris! what was Paris to her? what but the struggling husband of Glyceria	2065	Paris, Île-de-France, FRA	Locality	City				Paris	Paris	Île-de-France	France	FRA	2.3616573370000538	48.86369757600005	100	
Augusta	GPE	a word or two. “He is beside the Augusta—what did he say—and in a low	2090	Augusta, Bayern, DEU	Locality	City				Augsburg	Augsburg (Stadt)	Bayern	Germania	DEU	10.897880000000043	48.370340000000056	100	
Paris	GPE	which she had fallen, by hearing the voice of Paris, the tragic actor.	2101	Paris, Île-de-France, FRA	Locality	City				Paris	Paris	Île-de-France	France	FRA	2.3616573370000538	48.86369757600005	100	
Paris	GPE	Paris bowed, and drawing himself up, closing his eyes	2105	Paris, Île-de-France, FRA	Locality	City				Paris	Paris	Île-de-France	France	FRA	2.3616573370000538	48.86369757600005	100	
Paris	GPE	Paris resumed:—	2110	Paris, Île-de-France, FRA	Locality	City				Paris	Paris	Île-de-France	France	FRA	2.3616573370000538	48.86369757600005	100	
Paris	GPE	As she rose, she looked at Paris. Their eyes met, and at once a horror	2114	Paris, Île-de-France, FRA	Locality	City				Paris	Paris	Île-de-France	France	FRA	2.3616573370000538	48.86369757600005	100	
Paris	GPE	“Be speedy. Follow Paris, and protect him. There is evil planned against	2119	Paris, Île-de-France, FRA	Locality	City				Paris	Paris	Île-de-France	France	FRA	2.3616573370000538	48.86369757600005	100	
Paris	GPE	could think of nothing else but the danger that menaced Paris. She went out on the terrace, and the	2123	Paris, Île-de-France, FRA	Locality	City				Paris	Paris	Île-de-France	France	FRA	2.3616573370000538	48.86369757600005	100	
Euphrosyne	GPE	“Euphrosyne,” said she, “I bid you go	2139	Sophrosyne, 429 Schulte Rd NW, Albuquerque, NM, 87107, USA	POI	Sports Center	429 Schulte Rd NW	Schulte	429	Albuquerque	Bernalillo County	New Mexico	United States	USA	-106.63951999999995	35.156030000000044	70	
Euphrosyne	GPE	as her emotion threatened to get the upper hand—“and, Euphrosyne, tell Glyceria that I shall go to see her	2139	Sophrosyne, 429 Schulte Rd NW, Albuquerque, NM, 87107, USA	POI	Sports Center	429 Schulte Rd NW	Schulte	429	Albuquerque	Bernalillo County	New Mexico	United States	USA	-106.63951999999995	35.156030000000044	70	
Euphrosyne	GPE	not be a cause of fresh evil. O, Euphrosyne, does she curse me?”	2139	Sophrosyne, 429 Schulte Rd NW, Albuquerque, NM, 87107, USA	POI	Sports Center	429 Schulte Rd NW	Schulte	429	Albuquerque	Bernalillo County	New Mexico	United States	USA	-106.63951999999995	35.156030000000044	70	
Paris	GPE	with the flowers the spot stained with the blood of Paris.	2144	Paris, Île-de-France, FRA	Locality	City				Paris	Paris	Île-de-France	France	FRA	2.3616573370000538	48.86369757600005	100	
Paris	GPE	was through no ill-will on her part that Paris and his pupil, and some of their own party	2150	Paris, Île-de-France, FRA	Locality	City				Paris	Paris	Île-de-France	France	FRA	2.3616573370000538	48.86369757600005	100	
