Location	ent_type	context	p_no	LongLabel	Addr_type	Type	StAddr	StName	AddNum	City	Subregion	Region	CntryName	Country	x	y	score	error
Quebec	GPE	dirt or dust in it, from the faces of Quebec and Malta to the bright tin pots and pannikins upon	3110	Québec, QC, CAN	Locality	State or Province						Québec	Canada	CAN	-71.74874224599995	53.382603420000066	100	
Malta	GPE	dust in it, from the faces of Quebec and Malta to the bright tin pots and pannikins upon the dresser	3110	Malta	Locality	Country							Malta	MLT	14.400072590000036	35.92254885600005	100	
Quebec	GPE	street, keeping step and time, until summoned by Quebec and Malta to do justice to the pork and greens	3123	Québec, QC, CAN	Locality	State or Province						Québec	Canada	CAN	-71.74874224599995	53.382603420000066	100	
Malta	GPE	keeping step and time, until summoned by Quebec and Malta to do justice to the pork and greens; over	3123	Malta	Locality	Country							Malta	MLT	14.400072590000036	35.92254885600005	100	
Quebec	GPE	his domestic character of Bluffy, to take leave of Quebec and Malta, and insinuate a sponsorial shilling into the	3132	Québec, QC, CAN	Locality	State or Province						Québec	Canada	CAN	-71.74874224599995	53.382603420000066	100	
Malta	GPE	character of Bluffy, to take leave of Quebec and Malta, and insinuate a sponsorial shilling into the pocket of	3132	Malta	Locality	Country							Malta	MLT	14.400072590000036	35.92254885600005	100	
Lincolnshire	GPE	upon his legs. He is at his place in Lincolnshire; but the waters are out again on the low	3147	Lincolnshire, England, GBR	Locality	Zone						England	United Kingdom	GBR	-0.27856999999994514	53.184390000000064	100	
England	GPE	attachment, and fidelity in such a station, which England may well be proud of; but of which no	3197	England, GBR	Locality	State or Province						England	United Kingdom	GBR	-1.4586284489999457	52.59274188900008	100	
Lincolnshire	GPE	, while on a short out in the county of Lincolnshire with a friend, such a resemblance between Miss Esther	3277	Lincolnshire, England, GBR	Locality	Zone						England	United Kingdom	GBR	-0.27856999999994514	53.184390000000064	100	
Wales	GPE	It was Mrs. Woodcourt, who, having come from Wales to stay with Mrs. Bayham Badger, and having written	3319	Wales, GBR	Locality	State or Province						Wales	United Kingdom	GBR	-3.7652226249999785	52.337163856000075	100	
Welsh	GPE	Though I never knew what they were (being in Welsh), further than that they were highly eulogistic of	3321	Welsh, LA, USA	Locality	City				Welsh	Jefferson Davis Parish	Louisiana	United States	USA	-92.82211999999998	30.232180000000028	100	
India	GPE	caring so very much for Morgan ap Kerrig, in India and China; but of course I never expressed them	3323	India	Locality	Country							India	IND	79.44332654800007	23.379379735000043	100	
China	GPE	very much for Morgan ap Kerrig, in India and China; but of course I never expressed them. I	3323	China	Locality	Country							China	CHN	103.93002703300004	36.567348398000036	100	
Saint Paul's	GPE	Mrs. Jellyby's household had been the only lodgers in Saint Paul's or Saint Peter's, the sole advantage they would	3388	St Paul's, Gloucester, Gloucestershire, England, GBR	Locality	District				Gloucester	Gloucestershire	England	United Kingdom	GBR	-2.2491943659999265	51.85625408700008	100	
London	GPE	a sea stricken immoveable as it was heaving. Towards London, a lurid glare overhung the whole dark waste;	3460	London, Greater London, England, GBR	Locality	City				London	Greater London	England	United Kingdom	GBR	-0.12769887399997515	51.507408346000034	100	
London	GPE	of the town. I had known him up in London yonder. Hadn't I, Jo?”	3480	London, Greater London, England, GBR	Locality	City				London	Greater London	England	United Kingdom	GBR	-0.12769887399997515	51.507408346000034	100	
London	GPE	“When did he come from London?” I asked,	3483	London, Greater London, England, GBR	Locality	City				London	Greater London	England	United Kingdom	GBR	-0.12769887399997515	51.507408346000034	100	
London	GPE	“I come from London yes'day,” said the boy himself, now flushed	3484	London, Greater London, England, GBR	Locality	City				London	Greater London	England	United Kingdom	GBR	-0.12769887399997515	51.507408346000034	100	
London	GPE	his being reserved like Whittington to become Lord Mayor of London. In that event, no doubt, he would	3529	London, Greater London, England, GBR	Locality	City				London	Greater London	England	United Kingdom	GBR	-0.12769887399997515	51.507408346000034	100	
St. Albans	GPE	-houses, and a little annual Corporation Pilgrimage to St. Albans. He had no doubt, he said, that	3529	St Albans, Hertfordshire, England, GBR	Locality	City				St Albans	Hertfordshire	England	United Kingdom	GBR	-0.3390664859999788	51.752313608000065	100	
Jericho	GPE	“I thought you had gone to Jericho at least, instead of coming here,” says	3610	Jericho, West Bank	Locality	City				Jericho		West Bank			35.461730000000045	31.856210000000033	100	
London	GPE	And the day may discern, even with its dim London eye, that the court has been up all night	3718	London, Greater London, England, GBR	Locality	City				London	Greater London	England	United Kingdom	GBR	-0.12769887399997515	51.507408346000034	100	
Windsor	GPE	occasion they are so particularly lively in connexion with a Windsor arm-chair, fellow to that in which Mr.	3784	Windsor, ON, CAN	Locality	City				Windsor	Essex County	Ontario	Canada	CAN	-83.03522499999997	42.31743800000004	100	
Verona	GPE	set forth in detail by one Bianchini, prebendary of Verona, who wrote a scholarly work or so, and	3801	Verona, ITA	Locality	City				Verona	Verona	Veneto	Italia	ITA	10.991710000000069	45.43831000000006	100	
Hyde Park	GPE	a wreck on the Cornish coast to a review in Hyde Park, or a meeting at Manchester,—and in Mrs. Perkins's	3801	Hyde Park, UT, USA	Locality	City				Hyde Park	Cache County	Utah	United States	USA	-111.82055999999994	41.79910000000007	100	
Tulkinghorn	GPE	happens to be an old man of the name of Tulkinghorn. And that old man, coming with his quiet	3826															nothing found
Kenge	GPE	need to look again—not he. “From Kenge and Carboy's, surely?”	3831	Kenge, Songololo, Cataractes, Kongo Central, COD	Locality	Village				Songololo	Cataractes	Kongo Central	République Dém. du Congo	COD	13.668760000000077	-5.76085999999998	100	
Lookye	GPE	“Lookye, Phil,” says the trooper, sitting on	3848	Luokė, Telšių rajono savivaldybė, Telšių Apskritis, LTU	Locality	City				Luokė	Telšių rajono savivaldybė	Telšių Apskritis	Lietuva	LTU	22.525300000000072	55.891410000000064	83.33	
wice	GPE	in his dispositions, he's a screw and a wice in his actions, a snake in his twistings,	3855	Wice, Комсомольская улица, 23, Магнитогорск, Челябинская область, 455000, RUS	POI	Food and Beverage Shop	Комсомольская улица, 23	Комсомольская	23	Магнитогорск	Магнитогорск	Челябинская область	Russian Federation	RUS	58.986150000000066	53.42587000000003	100	
Lignum Vitæ	GPE	, on account, as it is supposed, of Lignum Vitæ having been his old regimental nickname when they first became	3868	Lignum Vitae Bay, Saint Mary, ATG	POI	Bay						Saint Mary	Antigua and Barbuda	ATG	-61.89035999999999	17.063550000000077	82	
Woolwich	GPE	morning, but we turned out early, and left Woolwich, the best of boys, to mind his sisters	3870	Woolwich, ON, CAN	Locality	City				Woolwich	Waterloo Regional Municipality	Ontario	Canada	CAN	-80.54606824999996	43.59472432000007	100	
Quebec	GPE	steady-going chap he is. You know what Quebec and Malta and Woolwich are—and I never did	3876	Québec, QC, CAN	Locality	State or Province						Québec	Canada	CAN	-71.74874224599995	53.382603420000066	100	
Malta	GPE	going chap he is. You know what Quebec and Malta and Woolwich are—and I never did think you	3876	Malta	Locality	Country							Malta	MLT	14.400072590000036	35.92254885600005	100	
Woolwich	GPE	he is. You know what Quebec and Malta and Woolwich are—and I never did think you would,	3876	Woolwich, ON, CAN	Locality	City				Woolwich	Waterloo Regional Municipality	Ontario	Canada	CAN	-80.54606824999996	43.59472432000007	100	
England	GPE	Whether there are two people in England less likely to come satisfactorily out of any negotiation with	3894	England, GBR	Locality	State or Province						England	United Kingdom	GBR	-1.4586284489999457	52.59274188900008	100	
Gibraltar	GPE	high of the old girl—as the rock of Gibraltar—and still you'll be thinking low—of	3903	Gibraltar	Locality	Country							Gibraltar	GIB	-5.348661838999931	36.13600766900004	100	
Quebec	GPE	At first Mrs. Bagnet trusts to the combined endearments of Quebec and Malta to restore him; but finding those young	3970	Québec, QC, CAN	Locality	State or Province						Québec	Canada	CAN	-71.74874224599995	53.382603420000066	100	
Malta	GPE	Mrs. Bagnet trusts to the combined endearments of Quebec and Malta to restore him; but finding those young ladies sensible	3970	Malta	Locality	Country							Malta	MLT	14.400072590000036	35.92254885600005	100	
Malta	GPE	at all like Bluffy, mother!” cries little Malta.	3975	Malta	Locality	Country							Malta	MLT	14.400072590000036	35.92254885600005	100	
Quebec	GPE	n't well, I think, mother!” adds Quebec.	3976	Québec, QC, CAN	Locality	State or Province						Québec	Canada	CAN	-71.74874224599995	53.382603420000066	100	
Woolwich	GPE	as she plies her needle, he looks to young Woolwich, sitting on his stool in the corner, and	3982	Woolwich, ON, CAN	Locality	City				Woolwich	Waterloo Regional Municipality	Ontario	Canada	CAN	-80.54606824999996	43.59472432000007	100	
Woolwich	GPE	man, you had better have that by you, Woolwich!”	3985	Woolwich, ON, CAN	Locality	City				Woolwich	Waterloo Regional Municipality	Ontario	Canada	CAN	-80.54606824999996	43.59472432000007	100	
Madeira	GPE	fowl, a sweetbread, vegetables, pudding, and Madeira; and it was so pleasant to see how she	4061	Madeira, São Roque, Funchal, Madeira, PRT	POI	Island				Funchal	Funchal	Madeira	Portugal	PRT	-16.921829999999943	32.65871000000004	100	
Gridley	GPE	signs, my dear. I saw them begin in Gridley. And I saw them end. Fitz Jarndyce,	4082	Gridley, CA, USA	Locality	City				Gridley	Butte County	California	United States	USA	-121.69641999999999	39.36590000000007	100	
England	GPE	I said it was not the custom in England to confer titles on men distinguished by peaceful services,	4101	England, GBR	Locality	State or Province						England	United Kingdom	GBR	-1.4586284489999457	52.59274188900008	100	
England	GPE	, my dear, that all the greatest ornaments of England, in knowledge, imagination, active humanity, and	4102	England, GBR	Locality	State or Province						England	United Kingdom	GBR	-1.4586284489999457	52.59274188900008	100	
Lincolnshire	GPE	I did not set off alone upon our expedition into Lincolnshire. My guardian had made up his mind not to	4106	Lincolnshire, England, GBR	Locality	Zone						England	United Kingdom	GBR	-0.27856999999994514	53.184390000000064	100	
London	GPE	. Accordingly I wrote a little note to him in London, telling him how all his favorite plants and trees	4108	London, Greater London, England, GBR	Locality	City				London	Greater London	England	United Kingdom	GBR	-0.12769887399997515	51.507408346000034	100	
Plymouth	GPE	but when an answer came back all the way from Plymouth, in which he mentioned that he was going to	4118	Plymouth, Devon, England, GBR	Locality	City				Plymouth	Devon	England	United Kingdom	GBR	-4.142097422999939	50.37000040500004	100	
America	GPE	was going to take the picture all the way to America, and from America would write again, I got	4118	America	Locality	Country							United States	USA	-99.41461918999994	39.39870315600007	100	
America	GPE	the picture all the way to America, and from America would write again, I got all the credit that	4118	America	Locality	Country							United States	USA	-99.41461918999994	39.39870315600007	100	
London	GPE	at the House two nights, on her way from London to visit at some other great house in the next	4188	London, Greater London, England, GBR	Locality	City				London	Greater London	England	United Kingdom	GBR	-0.12769887399997515	51.507408346000034	100	
Vholes	GPE	all united—if you want an exemplary man—Vholes is the man.”	4314	Violès, Vaucluse, Provence-Alpes-Côte d'Azur, FRA	Locality	City				Violès	Vaucluse	Provence-Alpes-Côte d'Azur	France	FRA	4.952585063000072	44.16193131000006	83.33	
Vholes	GPE	Kenge, and took up, I believe, with Vholes. Indeed, I know he did, because I	4316	Violès, Vaucluse, Provence-Alpes-Côte d'Azur, FRA	Locality	City				Violès	Vaucluse	Provence-Alpes-Côte d'Azur	France	FRA	4.952585063000072	44.16193131000006	83.33	
Vholes	GPE	I know he did, because I introduced him to Vholes.”	4316	Violès, Vaucluse, Provence-Alpes-Côte d'Azur, FRA	Locality	City				Violès	Vaucluse	Provence-Alpes-Côte d'Azur	France	FRA	4.952585063000072	44.16193131000006	83.33	
the Vale of Taunton	GPE	I have the privilege of supporting an aged father in the Vale of Taunton—his native place—and I admire that country	4330	Vale View, Bagborough, Taunton, Somerset, England, TA4 3, GBR	StreetName		Vale View	Vale		Taunton	Somerset	England	United Kingdom	GBR	-3.1993326147262073	51.09235225457205	86.21	
London	GPE	, I paid a visit of a few hours to London, which something in the letter I had destroyed at	4343	London, Greater London, England, GBR	Locality	City				London	Greater London	England	United Kingdom	GBR	-0.12769887399997515	51.507408346000034	100	
London	GPE	home very early in the morning, I got to London by stage-coach in such good time, that	4344	London, Greater London, England, GBR	Locality	City				London	Greater London	England	United Kingdom	GBR	-0.12769887399997515	51.507408346000034	100	
Pa.	GPE	. You can't think how kind he is to Pa. He talks to Pa, of an evening, about	4371	PA	Locality	Country							Panama	PAN	-79.97292613699994	8.939604460000055	100	
London	GPE	-office on the very day when I came to London, and first saw you, my dear. Now	4376	London, Greater London, England, GBR	Locality	City				London	Greater London	England	United Kingdom	GBR	-0.12769887399997515	51.507408346000034	100	
Pentonville	GPE	“William Guppy of Penton Place, Pentonville, in the county of Middlesex,” he murmured	4421	Pentonville, Islington, Greater London, England, GBR	Locality	District				Islington	Greater London	England	United Kingdom	GBR	-0.11139452199995503	51.532632411000066	100	
Middlesex	GPE	of Penton Place, Pentonville, in the county of Middlesex,” he murmured.	4421	Middlesex, JAM	Locality	State or Province						Middlesex	Jamaica	JAM	-77.20259987899993	18.12891323200006	100	
Pentonville	GPE	this gentleman, Mr. William Guppy of Penton Place, Pentonville, in the county of Middlesex, and myself.	4422	Pentonville, Islington, Greater London, England, GBR	Locality	District				Islington	Greater London	England	United Kingdom	GBR	-0.11139452199995503	51.532632411000066	100	
Middlesex	GPE	of Penton Place, Pentonville, in the county of Middlesex, and myself.”	4422	Middlesex, JAM	Locality	State or Province						Middlesex	Jamaica	JAM	-77.20259987899993	18.12891323200006	100	
London	GPE	, then of Thavies Inn, within the city of London, but extra-parochial; now of Newman-	4425	London, Greater London, England, GBR	Locality	City				London	Greater London	England	United Kingdom	GBR	-0.12769887399997515	51.507408346000034	100	
Oxford	GPE	extra-parochial; now of Newman-street, Oxford-street. Much obliged.”	4425	Oxford, Oxfordshire, England, GBR	Locality	City				Oxford	Oxfordshire	England	United Kingdom	GBR	-1.257628795999949	51.751982637000026	100	
the Vale of	GPE	daughters. And his father is dependent on him in the Vale of Taunton.	4433	Vale, OR, USA	Locality	City				City of Vale	Malheur County	Oregon	United States	USA	-117.24174999999997	43.98395000000005	99.9	
Taunton	GPE	his father is dependent on him in the Vale of Taunton.	4433	Taunton, Somerset West and Taunton, Somerset, England, GBR	Locality	City				Somerset West and Taunton	Somerset	England	United Kingdom	GBR	-3.1081894159999592	51.01340623800007	100	
the Vale of Taunton	GPE	a man of undoubted respectability, with a father in the Vale of Taunton, and three daughters at home. Take a few	4436	Vale View, Bagborough, Taunton, Somerset, England, TA4 3, GBR	StreetName		Vale View	Vale		Taunton	Somerset	England	United Kingdom	GBR	-3.1993326147262073	51.09235225457205	86.21	
Vholes	GPE	, say they, and what is to become of Vholes's father? Is he to perish? And of	4436	Violès, Vaucluse, Provence-Alpes-Côte d'Azur, FRA	Locality	City				Violès	Vaucluse	Provence-Alpes-Côte d'Azur	France	FRA	4.952585063000072	44.16193131000006	83.33	
Vholes	GPE	's father? Is he to perish? And of Vholes's daughters? Are they to be shirt-makers	4436	Violès, Vaucluse, Provence-Alpes-Côte d'Azur, FRA	Locality	City				Violès	Vaucluse	Provence-Alpes-Côte d'Azur	France	FRA	4.952585063000072	44.16193131000006	83.33	
the Vale of Taunton	GPE	Vholes, with his three daughters and his father in the Vale of Taunton, is continually doing duty, like a piece of	4437	Vale View, Bagborough, Taunton, Somerset, England, TA4 3, GBR	StreetName		Vale View	Vale		Taunton	Somerset	England	United Kingdom	GBR	-3.1993326147262073	51.09235225457205	86.21	
Vholes	GPE	of injury or advantage to that eminently respectable legion, Vholes.	4437	Violès, Vaucluse, Provence-Alpes-Côte d'Azur, FRA	Locality	City				Violès	Vaucluse	Provence-Alpes-Côte d'Azur	France	FRA	4.952585063000072	44.16193131000006	83.33	
Vholes	GPE	say nothing done, sir,” returns the placid Vholes. “That is scarcely fair, sir, scarcely	4440	Violès, Vaucluse, Provence-Alpes-Côte d'Azur, FRA	Locality	City				Violès	Vaucluse	Provence-Alpes-Côte d'Azur	France	FRA	4.952585063000072	44.16193131000006	83.33	
Vholes	GPE	sir, without knowing it,” returns the equable Vholes. “Very naturally. It is my duty to	4451	Violès, Vaucluse, Provence-Alpes-Côte d'Azur, FRA	Locality	City				Violès	Vaucluse	Provence-Alpes-Côte d'Azur	France	FRA	4.952585063000072	44.16193131000006	83.33	
Kenge	GPE	such terms as I was bound to speak, of Kenge and Carboy's office, which stands high. You	4471	Kenge, Songololo, Cataractes, Kongo Central, COD	Locality	Village				Songololo	Cataractes	Kongo Central	République Dém. du Congo	COD	13.668760000000077	-5.76085999999998	100	
Vholes	GPE	consultations and attendances of late, sir,” observes Vholes, turning over the leaves of his Diary, “	4473	Violès, Vaucluse, Provence-Alpes-Côte d'Azur, FRA	Locality	City				Violès	Vaucluse	Provence-Alpes-Côte d'Azur	France	FRA	4.952585063000072	44.16193131000006	83.33	
Vholes	GPE	in the agent's hands. All the while, Vholes, buttoned up in body and mind, looks at	4474	Violès, Vaucluse, Provence-Alpes-Côte d'Azur, FRA	Locality	City				Violès	Vaucluse	Provence-Alpes-Côte d'Azur	France	FRA	4.952585063000072	44.16193131000006	83.33	
Vholes	GPE	to the wheel.” Thus they part; and Vholes, left alone, employs himself in carrying sundry little	4475	Violès, Vaucluse, Provence-Alpes-Côte d'Azur, FRA	Locality	City				Violès	Vaucluse	Provence-Alpes-Côte d'Azur	France	FRA	4.952585063000072	44.16193131000006	83.33	
Vholes	GPE	buttoned-up maidens, who dwell with the parent Vholes in an earthy cottage situated in a damp garden at	4475	Violès, Vaucluse, Provence-Alpes-Côte d'Azur, FRA	Locality	City				Violès	Vaucluse	Provence-Alpes-Côte d'Azur	France	FRA	4.952585063000072	44.16193131000006	83.33	
Kennington	GPE	in an earthy cottage situated in a damp garden at Kennington.	4475	Kennington, Ashford, Kent, England, GBR	Locality	District				Ashford	Kent	England	United Kingdom	GBR	0.8928084170000261	51.16852461800005	100	
Suffolk	GPE	his sister, and also of Mr. Elwes, of Suffolk, and transfers all the facts from those authentic narratives	4491	Suffolk, VA, USA	Locality	City				Suffolk	City of Suffolk	Virginia	United States	USA	-76.58836999999994	36.73114000000004	100	
London	GPE	! Why, Mr. Guppy, there are people in London who would give their ears to be you.”	4514	London, Greater London, England, GBR	Locality	City				London	Greater London	England	United Kingdom	GBR	-0.12769887399997515	51.507408346000034	100	
Kenge	GPE	to my profession, and do what is right by Kenge and Carboy, my friends and acquaintances are of no	4515	Kenge, Songololo, Cataractes, Kongo Central, COD	Locality	Village				Songololo	Cataractes	Kongo Central	République Dém. du Congo	COD	13.668760000000077	-5.76085999999998	100	
Great Britain	GPE	wouldn't come in, and there being nobody in Great Britain (to speak of) except Coodle and Doodle,	4524	Great Britain	Locality	Country							United Kingdom	GBR	-1.9695595439999352	53.40838660500003	100	
England	GPE	killed each other, it is to be presumed that England must have waited to be governed until young Coodle and	4524	England, GBR	Locality	State or Province						England	United Kingdom	GBR	-1.4586284489999457	52.59274188900008	100	
Coodle	GPE	that England must have waited to be governed until young Coodle and young Doodle, now in frocks and long stockings	4524	Coondle, Western Australia, AUS	Locality	City				Coondle		Western Australia	Australia	AUS	116.44020000000012	-31.47551999999996	85.71	
Doodle	GPE	have waited to be governed until young Coodle and young Doodle, now in frocks and long stockings, were grown	4524	Doodle, 150 Oak St, San Francisco, CA, 94102, USA	POI	Fitness Center	150 Oak St	Oak	150	San Francisco	San Francisco County	California	United States	USA	-122.42158799999999	37.775367000000074	100	
England	GPE	posterity as the mirror of virtue and honor. Still England has been some weeks in the dismal strait of having	4524	England, GBR	Locality	State or Province						England	United Kingdom	GBR	-1.4586284489999457	52.59274188900008	100	
England	GPE	and the marvellous part of the matter is, that England has not appeared to care very much about it,	4524	England, GBR	Locality	State or Province						England	United Kingdom	GBR	-1.4586284489999457	52.59274188900008	100	
Doodle	GPE	the flood. But Coodle knew the danger, and Doodle knew the danger, and all their followers and hangers	4524	Doodle, 150 Oak St, San Francisco, CA, 94102, USA	POI	Fitness Center	150 Oak St	Oak	150	San Francisco	San Francisco County	California	United States	USA	-122.42158799999999	37.775367000000074	100	
Britannia	GPE	a considerable portion of the country at one time. Britannia being much occupied in pocketing Doodle in the form of	4525	Britannia, Mid Glamorgan, Wales, GBR	Locality	District				Britannia	Mid Glamorgan	Wales	United Kingdom	GBR	-3.3979200489999357	51.60903370400007	100	
London	GPE	to the advancement of her glory and morality—the London season comes to a sudden end, through all the	4525	London, Greater London, England, GBR	Locality	City				London	Greater London	England	United Kingdom	GBR	-0.12769887399997515	51.507408346000034	100	
Britannia	GPE	, through all the Doodleites and Coodleites dispersing to assist Britannia in those religious exercises.	4525	Britannia, Mid Glamorgan, Wales, GBR	Locality	District				Britannia	Mid Glamorgan	Wales	United Kingdom	GBR	-3.3979200489999357	51.60903370400007	100	
Doodle	GPE	about all those particular parts of the country on which Doodle is at present throwing himself in an auriferous and malty	4537	Doodle, 150 Oak St, San Francisco, CA, 94102, USA	POI	Fitness Center	150 Oak St	Oak	150	San Francisco	San Francisco County	California	United States	USA	-122.42158799999999	37.775367000000074	100	
England	GPE	and there, and show themselves on the side of England, it would be hard to find. Volumnia is	4538	England, GBR	Locality	State or Province						England	United Kingdom	GBR	-1.4586284489999457	52.59274188900008	100	
tapn	GPE	holds that it's—sort of thing that's sure tapn slongs votes—giv'n—Mob.	4589	Tapin, Kalimantan Selatan, IDN	Locality	City						Kalimantan Selatan	Indonesia	IDN	114.98158000000001	-2.91895999999997	80	
Tulkinghorn	GPE	the last great secret to the many secrets of the Tulkinghorn existence? Is the man born yet, is the	4656															nothing found
Lincolnshire	GPE	, and that there is hospitality at the place in Lincolnshire.	4714	Lincolnshire, England, GBR	Locality	Zone						England	United Kingdom	GBR	-0.27856999999994514	53.184390000000064	100	
London	GPE	Tulkinghorn transfers himself to the stale heat and dust of London. His manner of coming and going between the two	4715	London, Greater London, England, GBR	Locality	City				London	Greater London	England	United Kingdom	GBR	-0.12769887399997515	51.507408346000034	100	
London	GPE	Like a dingy London bird among the birds at roost in these pleasant fields	4716	London, Greater London, England, GBR	Locality	City				London	Greater London	England	United Kingdom	GBR	-0.12769887399997515	51.507408346000034	100	
London	GPE	In pursuance of this plan, we went into London on an early day, and presented ourselves at Mr.	4816	London, Greater London, England, GBR	Locality	City				London	Greater London	England	United Kingdom	GBR	-0.12769887399997515	51.507408346000034	100	
Town	GPE	lived in a place called the Polygon, in Somers Town, where there were at that time a number of	4817	Town, Kasungu, Central Region, MWI	Locality	Village				Kasungu		Central Region	Malawi	MWI	33.47947000000005	-13.015099999999961	100	
Saint Summerson	GPE	here. We shall call it the Saint Clare and Saint Summerson day. You must see my daughters. I have	4828	Summerston, City of Glasgow, Scotland, GBR	Locality	District				Summerston	City of Glasgow	Scotland	United Kingdom	GBR	-4.292083631999958	55.90370778500005	78.17	
