Location	ent_type	context	p_no	LongLabel	Addr_type	Type	StAddr	StName	AddNum	City	Subregion	Region	CntryName	Country	x	y	score	error
Rome	GPE	and request you to present yourself at the Capitol in Rome on June 15, when you will be installed with	1670	Rome, ITA	Locality	City				Rome	Rome	Latium	Italie	ITA	12.495650000000069	41.90322000000003	100	
France	GPE	"did. For they hold service under the King of France."""	1673	France	Locality	Country							France	FRA	2.5505399530000545	46.55941704400004	100	
Spain	GPE	"""And what of the King in Spain?"" asked Wogan."	1676	Spain	Locality	Country							Kingdom of Spain	ESP	-3.6460631049999392	40.227949660000036	100	
Spain	GPE	"Cardinal; ""but it is a long journey into Spain. We must wait."""	1677	Spain	Locality	Country							Kingdom of Spain	ESP	-3.6460631049999392	40.227949660000036	100	
England	GPE	"country's sake;"" and he looked northwards towards England. But ""for her own sake"" was the"	1678	England, GBR	Locality	State or Province						England	United Kingdom	GBR	-1.4586284489999457	52.59274188900008	100	
Rome	GPE	the days passed. The three promised patents came from Rome, and Cardinal Origo unlocked the drawer and joined Wogan	1679	Rome, ITA	Locality	City				Rome	Rome	Latium	Italie	ITA	12.495650000000069	41.90322000000003	100	
Spain	GPE	"""And what of the King in Spain?"" asked Wogan."	1685	Spain	Locality	Country							Kingdom of Spain	ESP	-3.6460631049999392	40.227949660000036	100	
Spain	GPE	at Montefiascone as soon as the King could depart from Spain, and after that statement, a declaration that since	1687	Spain	Locality	Country							Kingdom of Spain	ESP	-3.6460631049999392	40.227949660000036	100	
Bologna	GPE	her, a marriage by proxy should take place at Bologna. The Chevalier added that he had written to Cardinal	1687	Bologna, ITA	Locality	City				Bologna	Bologna	Emilia Romagna	Italia	ITA	11.345070000000021	44.50484000000006	100	
Bologna	GPE	those laborious months since he had ridden hopefully out of Bologna to Ohlau were to bear no fruit, he chanced	1691	Bologna, ITA	Locality	City				Bologna	Bologna	Emilia Romagna	Italia	ITA	11.345070000000021	44.50484000000006	100	
Ohlau	GPE	months since he had ridden hopefully out of Bologna to Ohlau were to bear no fruit, he chanced to remember	1691	Ohlau, Oławski, Lower Silesia, POL	Locality	City				Oława	Oławski	Lower Silesia	Polen	POL	17.29260000000005	50.946600000000046	100	
Spain	GPE	"""Why does the King linger in Spain?"""	1695	Spain	Locality	Country							Kingdom of Spain	ESP	-3.6460631049999392	40.227949660000036	100	
Cadiz	GPE	"""The expedition from Cadiz—"""	1696	Cádiz, Andalucía, ESP	Locality	City				Cádiz	Cádiz	Andalucía	España	ESP	-6.290269999999964	36.52988000000005	100	
Spain	GPE	"expedition now on the high seas detain his Majesty in Spain?"""	1697	Spain	Locality	Country							Kingdom of Spain	ESP	-3.6460631049999392	40.227949660000036	100	
Spain	GPE	moment was not so much the King's delay in Spain as a doubt whether he himself had played with her	1703	Spain	Locality	Country							Kingdom of Spain	ESP	-3.6460631049999392	40.227949660000036	100	
icily	GPE	"""Could you not?"" she asked icily."	1706	Icily, Jalan Laksamana, Taman Melaka Raya, Melaka, Melaka Tengah, 75000, Melaka, MYS	POI	Food and Beverage Shop	Jalan Laksamana	Laksamana		Melaka	Melaka Tengah	Melaka	Malaysia	MYS	102.24992000000009	2.1952000000000567	100	
Scotland	GPE	, they are to come.' We were in Scotland with him, and we know they will not fail	1714	Scotland, GBR	Locality	State or Province						Scotland	United Kingdom	GBR	-4.181296541999927	56.84002490600005	100	
Ohlau	GPE	and lit on you? Should I have ridden to Ohlau and pestered your father till he yielded? Should I	1726	Ohlau, Oławski, Lower Silesia, POL	Locality	City				Oława	Oławski	Lower Silesia	Polen	POL	17.29260000000005	50.946600000000046	100	
Strasbourg	GPE	he yielded? Should I have ridden across Europe to Strasbourg? Should I have endangered my friends in the rush	1726	Strasbourg, Bas-Rhin, Grand Est, FRA	Locality	City				Strasbourg	Bas-Rhin	Grand Est	France	FRA	7.752005015000066	48.57334029100008	100	
Spain	GPE	"""Then why is the King in Spain?"""	1730	Spain	Locality	Country							Kingdom of Spain	ESP	-3.6460631049999392	40.227949660000036	100	
Rome	GPE	though to-day that face gladdens the streets of Rome, a lover in Spain might see it through all	1743	Rome, ITA	Locality	City				Rome	Rome	Latium	Italie	ITA	12.495650000000069	41.90322000000003	100	
Spain	GPE	face gladdens the streets of Rome, a lover in Spain might see it through all the thick earth of the	1743	Spain	Locality	Country							Kingdom of Spain	ESP	-3.6460631049999392	40.227949660000036	100	
Spain	GPE	"I promised to acquaint you why the King lingered in Spain. I have fulfilled that promise;"" and making"	1743	Spain	Locality	Country							Kingdom of Spain	ESP	-3.6460631049999392	40.227949660000036	100	
Bologna	GPE	"""His Eminence the Cardinal fixes the marriage in Bologna here for to-day fortnight. You have thus"	1756	Bologna, ITA	Locality	City				Bologna	Bologna	Emilia Romagna	Italia	ITA	11.345070000000021	44.50484000000006	100	
Rome	GPE	"""You went to Rome in the spring,"" said he. ""There"	1766	Rome, ITA	Locality	City				Rome	Rome	Latium	Italie	ITA	12.495650000000069	41.90322000000003	100	
Rome	GPE	"see anyone else by any chance whilst you were in Rome?"""	1766	Rome, ITA	Locality	City				Rome	Rome	Latium	Italie	ITA	12.495650000000069	41.90322000000003	100	
Rome	GPE	". ""So you saw my friend Harry Whittington at Rome. Did you see him with the King?"""	1770	Rome, ITA	Locality	City				Rome	Rome	Latium	Italie	ITA	12.495650000000069	41.90322000000003	100	
Rome	GPE	"""Oh, outside a house in Rome,"" said Gaydon, as though he barely remembered"	1774	Rome, ITA	Locality	City				Rome	Rome	Latium	Italie	ITA	12.495650000000069	41.90322000000003	100	
Rome	GPE	"Whittington be waiting for the King outside a house in Rome?"""	1775	Rome, ITA	Locality	City				Rome	Rome	Latium	Italie	ITA	12.495650000000069	41.90322000000003	100	
Rome	GPE	King wished to pay a visit to a house in Rome, he would take an attendant with a lantern.	1777	Rome, ITA	Locality	City				Rome	Rome	Latium	Italie	ITA	12.495650000000069	41.90322000000003	100	
berlin	GPE	the table at Schlestadt, of certain conversations in the berlin when he had feigned to sleep.	1782	Berlin, DEU	Locality	City				Berlin	Berlin	Berlin	Deutschland	DEU	13.376910000000066	52.51604000000003	100	
Clementina	GPE	he had taken and the conversation he had held with Clementina that morning. Gaydon listened with an unfeigned surprise.	1787	Clementina, São Paulo, BRA	Locality	City				Clementina		São Paulo	Brasil	BRA	-50.44874999999996	-21.558869999999956	100	
Rome	GPE	"Tell me from first to last what you saw in Rome."""	1789	Rome, ITA	Locality	City				Rome	Rome	Latium	Italie	ITA	12.495650000000069	41.90322000000003	100	
Spain	GPE	"""Or a certain letter your Eminence received from Spain to-day?"" asked Wogan."	1793	Spain	Locality	Country							Kingdom of Spain	ESP	-3.6460631049999392	40.227949660000036	100	
not,—no	GPE	to publish the fellow's treachery. But he could not,—no, he had to make his account with the man	1811	Notono, Wakasa, Mikatakaminaka, Fukui, JPN	Locality	District					Mikatakaminaka	Fukui	Japan	JPN	135.9057396500001	35.50898842000004	82.33	
Bologna	GPE	"He hired it for a friend who has now left Bologna."""	1818	Bologna, ITA	Locality	City				Bologna	Bologna	Emilia Romagna	Italia	ITA	11.345070000000021	44.50484000000006	100	
Spain	GPE	with a particular account of why the King lingers in Spain after the Cadiz expedition has put out to sea.	1826	Spain	Locality	Country							Kingdom of Spain	ESP	-3.6460631049999392	40.227949660000036	100	
Cadiz	GPE	"account of why the King lingers in Spain after the Cadiz expedition has put out to sea."""	1826	Cádiz, Andalucía, ESP	Locality	City				Cádiz	Cádiz	Andalucía	España	ESP	-6.290269999999964	36.52988000000005	100	
Spain	GPE	""" said Wogan, ""for the King lingers in Spain, and the portrait of Maria Vittoria glows on the"	1833	Spain	Locality	Country							Kingdom of Spain	ESP	-3.6460631049999392	40.227949660000036	100	
Bologna	GPE	the King's hand and would shortly set out for Bologna. Sir, the King was in despair, though	1835	Bologna, ITA	Locality	City				Bologna	Bologna	Emilia Romagna	Italia	ITA	11.345070000000021	44.50484000000006	100	
Rome	GPE	, grateful face. Mlle. de Caprara went to Rome; the King stayed here awaiting his betrothed. There	1835	Rome, ITA	Locality	City				Rome	Rome	Latium	Italie	ITA	12.495650000000069	41.90322000000003	100	
Bologna	GPE	No, but because Mr. Charles Wogan was back in Bologna, because Mr. Charles Wogan had sought for a private	1837	Bologna, ITA	Locality	City				Bologna	Bologna	Emilia Romagna	Italia	ITA	11.345070000000021	44.50484000000006	100	
Spain	GPE	"""Yet he lingers in Spain."""	1842	Spain	Locality	Country							Kingdom of Spain	ESP	-3.6460631049999392	40.227949660000036	100	
Rome	GPE	"right to make reproaches, ""the King was in Rome visiting Mlle. de Caprara."""	1844	Rome, ITA	Locality	City				Rome	Rome	Latium	Italie	ITA	12.495650000000069	41.90322000000003	100	
Rome	GPE	. Your King saw Mlle. de Caprara once in Rome, once only. Major Gaydon had come at your	1846	Rome, ITA	Locality	City				Rome	Rome	Latium	Italie	ITA	12.495650000000069	41.90322000000003	100	
Rome	GPE	only. Major Gaydon had come at your request to Rome to fetch a letter in the King's hand,	1846	Rome, ITA	Locality	City				Rome	Rome	Latium	Italie	ITA	12.495650000000069	41.90322000000003	100	
Spain	GPE	"But you must also explain why the King lingers in Spain,"" Wogan objected. ""I am very certain"	1849	Spain	Locality	Country							Kingdom of Spain	ESP	-3.6460631049999392	40.227949660000036	100	
Bologna	GPE	is gone, until the eve of the marriage in Bologna. Give me till then. I have a hope	1851	Bologna, ITA	Locality	City				Bologna	Bologna	Emilia Romagna	Italia	ITA	11.345070000000021	44.50484000000006	100	
hortum	GPE	"O'Toole nodded. ""Hortus, hortus, hortum,"" said he, ""horti—hortus,"	1860	Hortum, Gilan Province, IRN	Locality	Village						Gilan Province	Iran	IRN	49.49600000000004	37.13900000000007	100	
horto	GPE	"book at his back, ""no, horti, horto, horto. Do you know, my friend,"	1860	Horto, Ubatuba, São Paulo, BRA	Locality	District				Ubatuba		São Paulo	Brasil	BRA	-45.11251999999996	-23.42298999999997	100	
Bologna	GPE	dismissed the matter from his mind and rode out from Bologna. Four days afterwards he presented himself at the door	1876	Bologna, ITA	Locality	City				Bologna	Bologna	Emilia Romagna	Italia	ITA	11.345070000000021	44.50484000000006	100	
Bologna	GPE	part, saw the glowing original of the picture at Bologna, but armed at all points with hostility.	1877	Bologna, ITA	Locality	City				Bologna	Bologna	Emilia Romagna	Italia	ITA	11.345070000000021	44.50484000000006	100	
Bologna	GPE	had a wish to escort Mlle. de Caprara to Bologna. He spoke as though he was suggesting a walk	1878	Bologna, ITA	Locality	City				Bologna	Bologna	Emilia Romagna	Italia	ITA	11.345070000000021	44.50484000000006	100	
Bologna	GPE	"""And why should I travel to Bologna?"" she asked. Wogan explained. The explanation"	1879	Bologna, ITA	Locality	City				Bologna	Bologna	Emilia Romagna	Italia	ITA	11.345070000000021	44.50484000000006	100	
Spain	GPE	"her Highness may justly ask why the King lingers in Spain."" Wogan saw a look, a smile of"	1881	Spain	Locality	Country							Kingdom of Spain	ESP	-3.6460631049999392	40.227949660000036	100	
Spain	GPE	"""You would say why the King lingers in Spain."""	1890	Spain	Locality	Country							Kingdom of Spain	ESP	-3.6460631049999392	40.227949660000036	100	
Clementina	GPE	the Chevalier and Maria Vittoria had a strong parallel in Clementina's own history. Circumstance and duty held them apart	1897	Clementina, São Paulo, BRA	Locality	City				Clementina		São Paulo	Brasil	BRA	-50.44874999999996	-21.558869999999956	100	
Bologna	GPE	"certainly softened. ""I will go with you to Bologna,"" she said; and that afternoon with the"	1905	Bologna, ITA	Locality	City				Bologna	Bologna	Emilia Romagna	Italia	ITA	11.345070000000021	44.50484000000006	100	
Rome	GPE	and that afternoon with the smallest equipment she started from Rome. Wogan had ridden alone from Bologna to Rome in	1905	Rome, ITA	Locality	City				Rome	Rome	Latium	Italie	ITA	12.495650000000069	41.90322000000003	100	
Bologna	GPE	she started from Rome. Wogan had ridden alone from Bologna to Rome in four days; he had spent three	1905	Bologna, ITA	Locality	City				Bologna	Bologna	Emilia Romagna	Italia	ITA	11.345070000000021	44.50484000000006	100	
Rome	GPE	from Rome. Wogan had ridden alone from Bologna to Rome in four days; he had spent three days in	1905	Rome, ITA	Locality	City				Rome	Rome	Latium	Italie	ITA	12.495650000000069	41.90322000000003	100	
Rome	GPE	in four days; he had spent three days in Rome; he now took six days to return in company	1905	Rome, ITA	Locality	City				Rome	Rome	Latium	Italie	ITA	12.495650000000069	41.90322000000003	100	
Bologna	GPE	Caprara and her few servants. He thus arrived in Bologna on the eve of that day when he was to	1905	Bologna, ITA	Locality	City				Bologna	Bologna	Emilia Romagna	Italia	ITA	11.345070000000021	44.50484000000006	100	
Rome	GPE	mile of that homeward journey. On his ride to Rome he had been sensible of but one obstacle,—the difficulty of	1914	Rome, ITA	Locality	City				Rome	Rome	Latium	Italie	ITA	12.495650000000069	41.90322000000003	100	
England	GPE	days, when the King sits upon his throne in England, to think that your self-sacrifice had set	1914	England, GBR	Locality	State or Province						England	United Kingdom	GBR	-1.4586284489999457	52.59274188900008	100	
Spain	GPE	Vittoria had exacted some promise which held his King in Spain he was now aware. She would say what that	1916	Spain	Locality	Country							Kingdom of Spain	ESP	-3.6460631049999392	40.227949660000036	100	
Spain	GPE	, did not, believe it. I came from Spain to prove it false. I find it true,	1937	Spain	Locality	Country							Kingdom of Spain	ESP	-3.6460631049999392	40.227949660000036	100	
Bologna	GPE	he had never found Harry Whittington in any corner of Bologna. Harry Whittington had been riding to Spain.	1939	Bologna, ITA	Locality	City				Bologna	Bologna	Emilia Romagna	Italia	ITA	11.345070000000021	44.50484000000006	100	
Spain	GPE	corner of Bologna. Harry Whittington had been riding to Spain.	1939	Spain	Locality	Country							Kingdom of Spain	ESP	-3.6460631049999392	40.227949660000036	100	
Italy	GPE	"book out of his coat. ""At Peri in Italy we were attacked by five soldiers sent over the border"	1953	Italy	Locality	Country							Italian Republic	ITA	12.833330000000046	42.833330000000046	100	
Spain	GPE	"all events, who did not need to travel to Spain for an ear to poison;"" and he leaned"	1956	Spain	Locality	Country							Kingdom of Spain	ESP	-3.6460631049999392	40.227949660000036	100	
Spain	GPE	the same sort of venomous story breathed to you in Spain has been spoken here in Bologna, only with altered	1958	Spain	Locality	Country							Kingdom of Spain	ESP	-3.6460631049999392	40.227949660000036	100	
Bologna	GPE	breathed to you in Spain has been spoken here in Bologna, only with altered names. I told your Majesty	1958	Bologna, ITA	Locality	City				Bologna	Bologna	Emilia Romagna	Italia	ITA	11.345070000000021	44.50484000000006	100	
Rome	GPE	"-morrow. I brought her all the way from Rome."""	1958	Rome, ITA	Locality	City				Rome	Rome	Latium	Italie	ITA	12.495650000000069	41.90322000000003	100	
Rome	GPE	"""From Rome?"" exclaimed the Chevalier."	1959	Rome, ITA	Locality	City				Rome	Rome	Latium	Italie	ITA	12.495650000000069	41.90322000000003	100	
Spain	GPE	proxy, Wogan. I am not yet returned from Spain. I wish no questions or talk about this evening	1971	Spain	Locality	Country							Kingdom of Spain	ESP	-3.6460631049999392	40.227949660000036	100	
Bologna	GPE	that flight from Innspruck; he was far away from Bologna thundering down the Brenner through the night, with the	1981	Bologna, ITA	Locality	City				Bologna	Bologna	Emilia Romagna	Italia	ITA	11.345070000000021	44.50484000000006	100	
berlin	GPE	, with the sparks striking from the wheels of the berlin, and all about him a glimmering, shapeless waste	1981	Berlin, DEU	Locality	City				Berlin	Berlin	Berlin	Deutschland	DEU	13.376910000000066	52.51604000000003	100	
King,—three	GPE	"door there came yourself, the lady, and the King,—three people."""	1986	Three, King Street, Huddersfield, West Yorkshire, England, HD1 2, GBR	POI	Consumer Electronics Store	King Street	King		Huddersfield	West Yorkshire	England	United Kingdom	GBR	-1.7801999999999794	53.645710000000065	80.41	
San Domenico	GPE	this garb she went at once to the church of San Domenico, where she made her confession, and from the	1989	San Domenico, Fiesole, Firenze, ITA	Locality	District				Fiesole	Firenze	Toscana	Italia	ITA	11.285660000000064	43.80135000000007	100	
Rome	GPE	Cardinal, with one Maas, an English priest from Rome, at his elbow, was already waiting for her	1989	Rome, ITA	Locality	City				Rome	Rome	Latium	Italie	ITA	12.495650000000069	41.90322000000003	100	
Rome	GPE	read the procuration, for which he had ridden to Rome in haste so many months before, and pronounced the	1989	Rome, ITA	Locality	City				Rome	Rome	Latium	Italie	ITA	12.495650000000069	41.90322000000003	100	
Rome	GPE	the garden, and that same forenoon set out for Rome.	1991	Rome, ITA	Locality	City				Rome	Rome	Latium	Italie	ITA	12.495650000000069	41.90322000000003	100	
Rome	GPE	", then. I will send him after you to Rome."""	1998	Rome, ITA	Locality	City				Rome	Rome	Latium	Italie	ITA	12.495650000000069	41.90322000000003	100	
Rome	GPE	"window to him. ""If ever you come to Rome, the Caprara Palace stands where it did at your"	1999	Rome, ITA	Locality	City				Rome	Rome	Latium	Italie	ITA	12.495650000000069	41.90322000000003	100	
Bologna	GPE	his lodging, and mounting a horse rode out of Bologna, and towards the Apennines.	2007	Bologna, ITA	Locality	City				Bologna	Bologna	Emilia Romagna	Italia	ITA	11.345070000000021	44.50484000000006	100	
Bologna	GPE	room from the windows of which he looked down on Bologna, that city of colonnades. Lady Featherstone, however	2008	Bologna, ITA	Locality	City				Bologna	Bologna	Emilia Romagna	Italia	ITA	11.345070000000021	44.50484000000006	100	
Bologna	GPE	Your Ladyship was wise, I think, to leave Bologna. The little house in the trees there had no	2010	Bologna, ITA	Locality	City				Bologna	Bologna	Emilia Romagna	Italia	ITA	11.345070000000021	44.50484000000006	100	
Italy	GPE	just to hinder this marriage that she had come to Italy, but her failure was at this moment of no	2013	Italy	Locality	Country							Italian Republic	ITA	12.833330000000046	42.833330000000046	100	
Bologna	GPE	"""Last night Mr. Whittington came with the King to Bologna—you understand, no doubt, why;"""	2014	Bologna, ITA	Locality	City				Bologna	Bologna	Emilia Romagna	Italia	ITA	11.345070000000021	44.50484000000006	100	
Rome	GPE	King and Mlle. de Caprara. I rode to Rome, and when the King came last night Mlle.	2015	Rome, ITA	Locality	City				Rome	Rome	Latium	Italie	ITA	12.495650000000069	41.90322000000003	100	
Ohlau	GPE	quiet way imaginable. 'You insulted Lady Featherstone at Ohlau, Mr. Wogan,' said he, 'one	2021	Ohlau, Oławski, Lower Silesia, POL	Locality	City				Oława	Oławski	Lower Silesia	Polen	POL	17.29260000000005	50.946600000000046	100	
Italy	GPE	"death the story should be closed, if you left Italy within the week."""	2025	Italy	Locality	Country							Italian Republic	ITA	12.833330000000046	42.833330000000046	100	
Italy	GPE	, within so short a time of that journey into Italy, James separated from the chosen woman, and the	2030	Italy	Locality	Country							Italian Republic	ITA	12.833330000000046	42.833330000000046	100	
La Mancha	GPE	convent. As his reward he was made Governor of La Mancha in Spain, and no place could have been found	2030	La Mancha, Royal Palm Beach, FL, USA	Locality	Neighborhood				Royal Palm Beach	Palm Beach County	Florida	United States	USA	-80.21767999999997	26.719340000000045	100	
Spain	GPE	his reward he was made Governor of La Mancha in Spain, and no place could have been found with associations	2030	Spain	Locality	Country							Kingdom of Spain	ESP	-3.6460631049999392	40.227949660000036	100	
England	GPE	Latin verse, and corresponding with many distinguished men in England upon matters of the intellect. Matters of the heart	2030	England, GBR	Locality	State or Province						England	United Kingdom	GBR	-1.4586284489999457	52.59274188900008	100	
Spain	GPE	himself was an exile alone in his white patio in Spain. In only one point was Maria Vittoria's prophecy	2030	Spain	Locality	Country							Kingdom of Spain	ESP	-3.6460631049999392	40.227949660000036	100	
