Location	ent_type	context	p_no	LongLabel	Addr_type	Type	StAddr	StName	AddNum	City	Subregion	Region	CntryName	Country	x	y	score	error
London	GPE	of the streets, but indoors, in the tall London house, there was only a sickly, yellow twilight	0	London, Greater London, England, GBR	Locality	City				London	Greater London	England	United Kingdom	GBR	-0.12769887399997515	51.507408346000034	100	
London	GPE	Downstairs, in the little study giving on a meagre London yard, a girl was bending over a desk.	1	London, Greater London, England, GBR	Locality	City				London	Greater London	England	United Kingdom	GBR	-0.12769887399997515	51.507408346000034	100	
Winchester	GPE	and her young brother Jimmie, who had arrived from Winchester, sat with a few old friends in the dining	7	Winchester, Hampshire, England, GBR	Locality	City				Winchester	Hampshire	England	United Kingdom	GBR	-1.3109917989999644	51.061756711000044	100	
London	GPE	men's feet, as they staggered down the narrow London staircase with their heavy burden, and then someone had	7	London, Greater London, England, GBR	Locality	City				London	Greater London	England	United Kingdom	GBR	-0.12769887399997515	51.507408346000034	100	
England	GPE	‘England—I may say the world—is mourning to	9	England, GBR	Locality	State or Province						England	United Kingdom	GBR	-1.4586284489999457	52.59274188900008	100	
the Kingdom of Heaven	GPE	cut in glittering gilt letters: ‘Of such is the Kingdom of Heaven.’ And everywhere there was the whiteness of graves	14	Kingdom of Heaven, Moniya Rd, Akinyele, Oyo, NGA	POI	Church	Moniya Rd	Moniya		Akinyele		Oyo	Nigeria	NGA	3.8546000000000618	7.623530000000073	99.95	
London	GPE	buildings lost in the murkiness of the horizon line, London was spread out. Here and there a dome,	18	London, Greater London, England, GBR	Locality	City				London	Greater London	England	United Kingdom	GBR	-0.12769887399997515	51.507408346000034	100	
London	GPE	taking the boy by the arm, ‘there's London! We're going to make it listen to us	19	London, Greater London, England, GBR	Locality	City				London	Greater London	England	United Kingdom	GBR	-0.12769887399997515	51.507408346000034	100	
St. John's	GPE	garden, for it lived then in a house in St. John's Wood; a child who was devoted to animals and	29	St John's, Saint John, ATG	Locality	City				Saint John		Saint John	Antigua and Barbuda	ATG	-61.84328999999997	17.120960000000025	100	
Italy	GPE	said that she was poorly, and had gone to Italy, and then they said that she was very ill	32	Italy	Locality	Country							Italian Republic	ITA	12.833330000000046	42.833330000000046	100	
Italy	GPE	brows, notching and slicing at her ships, that Italy and heaven were perhaps the same place. Nurse said	32	Italy	Locality	Country							Italian Republic	ITA	12.833330000000046	42.833330000000046	100	
Italy	GPE	that, some little time before her mother went to Italy, they took her upstairs one day and showed her	33	Italy	Locality	Country							Italian Republic	ITA	12.833330000000046	42.833330000000046	100	
china	GPE	with his fat, pink cheeks, his round, china-blue eyes, his dump of a nose,	33	China	Locality	Country							China	CHN	103.93002703300004	36.567348398000036	100	
London	GPE	now, for they had moved to another quarter of London, and the change made a vast difference in the	35	London, Greater London, England, GBR	Locality	City				London	Greater London	England	United Kingdom	GBR	-0.12769887399997515	51.507408346000034	100	
Wuthering Heights	GPE	favourite poem—or thrilled with the lurid emotion of Wuthering Heights. A little later Villette became her cherished book;	38	Wuthering Heights, Main Street, Haworth, Keighley, West Yorkshire, England, BD22 8, GBR	POI	Bar or Pub	Main Street	Main		Keighley	West Yorkshire	England	United Kingdom	GBR	-1.9546699999999646	53.830310000000054	100	
Jerusalem	GPE	to her at all. The poignant tragedy enacted at Jerusalem ate into her heart, and this child of fourteen	40	Jerusalem, ISR	Locality	City					Jerusalem	Jerusalem	Israel	ISR	35.21873000000005	31.780030000000068	100	
stigmatises	GPE	diatribes on virtue before she had comprehended what civilised mankind stigmatises as vice. Emile: ou, de l'Education was	41	Stigmatines Thamuang Road, Khao Niwet, Mueang Ranong, Ranong 85000, THA	POI	Church	Thamuang Road	Thamuang		Khao Niwet	Mueang Ranong	Ranong	Thailand	THA	98.62812000000008	9.95989000000003	92.18	
Italy	GPE	Em'ly is a lost woman, because she goes to Italy with that Mr. Steerforth. Was Mr. Steerforth a lost	44	Italy	Locality	Country							Italian Republic	ITA	12.833330000000046	42.833330000000046	100	
Australia	GPE	of a Peninsular and Oriental steamer on its way to Australia, and after that, on the mornings when the	50	Australia	Locality	Country							Australia	AUS	134.48403119800003	-25.70993156999998	100	
Australia	GPE	applied. During the months in which those letters from Australia grew rarer, the girl understood for the first time	50	Australia	Locality	Country							Australia	AUS	134.48403119800003	-25.70993156999998	100	
Zermatt	GPE	get a long holiday. He wanted to go to Zermatt. At the Riffel Alp he would get the air	56	Zermatt, Wallis, CHE	Locality	City				Zermatt	Visp	Wallis	Schweiz	CHE	7.748410000000035	46.02416000000005	100	
London	GPE	AS sometimes happens with busy people in London, the Erles had hundreds of acquaintances and but few	61	London, Greater London, England, GBR	Locality	City				London	Greater London	England	United Kingdom	GBR	-0.12769887399997515	51.507408346000034	100	
Paris	GPE	It was a habit which she had picked up in Paris, when she was working in a sculptor's studio	62	Paris, Île-de-France, FRA	Locality	City				Paris	Paris	Île-de-France	France	FRA	2.3616573370000538	48.86369757600005	100	
Whitechapel	GPE	with one small servant, whom she had befriended in Whitechapel.	64	Whitechapel, Tower Hamlets, Greater London, England, GBR	Locality	District				Tower Hamlets	Greater London	England	United Kingdom	GBR	-0.06907257799997524	51.51636757400007	100	
South Kensington	GPE	go in and try. I suppose it'll mean South Kensington, the Royal Academy, and then—portraits of	70	South Kensington, Kensington and Chelsea, Greater London, England, GBR	Locality	District				Kensington and Chelsea	Greater London	England	United Kingdom	GBR	-0.18137034299996913	51.492758423000055	100	
Providence	GPE	. As for my own, I leave it to Providence.’	83	Providence, RI, USA	Locality	City				Providence	Providence County	Rhode Island	United States	USA	-71.41197999999997	41.82388000000003	100	
Essex	GPE	. ‘She drifted into the East-end from Essex, about three years ago, and became a drudge	91	Essex, England, GBR	Locality	Zone						England	United Kingdom	GBR	0.5744900000000257	51.78449000000006	100	
London	GPE	and never dared to go back. Mary, these London idylls are not pretty. She is, however,	91	London, Greater London, England, GBR	Locality	City				London	Greater London	England	United Kingdom	GBR	-0.12769887399997515	51.507408346000034	100	
Providence	GPE	My dear, it was only by the intervention of Providence that I didn't have to dine the first night	93	Providence, RI, USA	Locality	City				Providence	Providence County	Rhode Island	United States	USA	-71.41197999999997	41.82388000000003	100	
Paris	GPE	charming trams. I told Worth when I was in Paris that I always went on the tops of omnibuses,	97	Paris, Île-de-France, FRA	Locality	City				Paris	Paris	Île-de-France	France	FRA	2.3616573370000538	48.86369757600005	100	
London	GPE	, of course, you prefer an artistic life in London,’ he was relieved, distinctly relieved, when	112	London, Greater London, England, GBR	Locality	City				London	Greater London	England	United Kingdom	GBR	-0.12769887399997515	51.507408346000034	100	
India	GPE	. I am thinking seriously of taking that trip to India and Australia, of which I told you.’	135	India	Locality	Country							India	IND	79.44332654800007	23.379379735000043	100	
Australia	GPE	am thinking seriously of taking that trip to India and Australia, of which I told you.’	135	Australia	Locality	Country							Australia	AUS	134.48403119800003	-25.70993156999998	100	
Canada	GPE	Woman Question. I might come home by way of Canada, and if so, the thing would take me	137	Canada	Locality	Country							Canada	CAN	-113.64257999999995	60.108670000000075	100	
St. John's	GPE	same expression as of old, in the summerhouse in St. John's Wood, when she sat alone notching and slicing at	146	St John's, Saint John, ATG	Locality	City				Saint John		Saint John	Antigua and Barbuda	ATG	-61.84328999999997	17.120960000000025	100	
London	GPE	spectator the impression that he was a grown-up London gutter-boy. But in truth he had had	147	London, Greater London, England, GBR	Locality	City				London	Greater London	England	United Kingdom	GBR	-0.12769887399997515	51.507408346000034	100	
St. John's	GPE	whom Mary remembered as the daughter of a confectioner in St. John's Wood, a girl who affected peacock-blue velveteen	152	St John's, Saint John, ATG	Locality	City				Saint John		Saint John	Antigua and Barbuda	ATG	-61.84328999999997	17.120960000000025	100	
Paris	GPE	‘How nice it must be in Paris,’ said Mary with a sigh. A place	163	Paris, Île-de-France, FRA	Locality	City				Paris	Paris	Île-de-France	France	FRA	2.3616573370000538	48.86369757600005	100	
Russias	GPE	I've just come from the Ambassador of all the Russias,’ drawled a pretty woman to Lady Jane,	166	Russas, Ceará, BRA	Locality	City				Russas		Ceará	Brasil	BRA	-37.97764999999998	-4.94190999999995	85.71	
Vous	GPE	remember Lady Blaythewaite doesn't like sugar.’ ‘Vous versez le thé avec une grâce parfaite,’ sighed	168	Vòus, Alpes-de-Haute-Provence, Provence-Alpes-Côte d'Azur, FRA	Locality	City				Volx	Alpes-de-Haute-Provence	Provence-Alpes-Côte d'Azur	França	FRA	5.841480000000047	43.87787000000003	100	
India	GPE	went on, ‘You've sent him off to India, you naughty child, and he may die of	177	India	Locality	Country							India	IND	79.44332654800007	23.379379735000043	100	
Oxford	GPE	journalism. You pluck your editor nice and hot from Oxford—someone who has none of the old hackneyed Fleet	187	Oxford, Oxfordshire, England, GBR	Locality	City				Oxford	Oxfordshire	England	United Kingdom	GBR	-1.257628795999949	51.751982637000026	100	
London	GPE	expected to sympathise with this lady's adventures in a London music-hall.	192	London, Greater London, England, GBR	Locality	City				London	Greater London	England	United Kingdom	GBR	-0.12769887399997515	51.507408346000034	100	
Fourth	GPE	you say early Victorian now, or late William the Fourth?’	207	Fourth, Jetty Rd, Glenelg, Adelaide, South Australia, 5045, AUS	POI	Bar or Pub	Jetty Rd	Jetty		Adelaide		South Australia	Australia	AUS	138.51280000000008	-34.980399999999975	100	
china	GPE	the fire, with its silver kettle, its dainty china, and the hot cakes which cook used to make	210	China	Locality	Country							China	CHN	103.93002703300004	36.567348398000036	100	
the Central London	GPE	dispiriting enough. Art and artists, as exemplified in the Central London, were but doubtfully alluring; Mary wondered if anywhere	212	Central London, Greater London, England, GBR	Locality	Zone					Greater London	England	United Kingdom	GBR	-0.10202999999995654	51.523930000000064	99.95	
Haslemere	GPE	on that long summer day which they had spent at Haslemere, and finally at Tilbury, when the great P.	215	Haslemere, Waverley, Surrey, England, GBR	Locality	City				Waverley	Surrey	England	United Kingdom	GBR	-0.7095744139999738	51.08765515200008	100	
Tilbury	GPE	which they had spent at Haslemere, and finally at Tilbury, when the great P. and 0. steamer had	215	Tilbury, Essex, England, GBR	Locality	City				Tilbury	Essex	England	United Kingdom	GBR	0.3636488810000742	51.46164367500006	100	
England	GPE	that my health has vastly improved since my departure from England; the fact alone that I anticipate with pleasure the	217	England, GBR	Locality	State or Province						England	United Kingdom	GBR	-1.4586284489999457	52.59274188900008	100	
England	GPE	in relation to a possible future together before I left England. But I am paying you no mean compliment,	219	England, GBR	Locality	State or Province						England	United Kingdom	GBR	-1.4586284489999457	52.59274188900008	100	
Indian Empire	GPE	of such widely-differing ethical standards as this great Indian Empire—’ and here the handwriting changed again to the	219	Indian Empire, 455 Oxley Dr, Runaway Bay, Gold Coast, Queensland, 4216, AUS	POI	Indian Food	455 Oxley Dr	Oxley	455	Gold Coast		Queensland	Australia	AUS	153.38803000000007	-27.91994999999997	100	
Haslemere	GPE	he had even liked the sketch she had made at Haslemere, on that last day they had spent in the	220	Haslemere, Waverley, Surrey, England, GBR	Locality	City				Waverley	Surrey	England	United Kingdom	GBR	-0.7095744139999738	51.08765515200008	100	
Billington	GPE	Smith, Mary Gwendo]en; Walsh, Joseph Frederick; Billington, George Francis; Thomson, Pamela Evelyn; Beadle	225	Billington, Bedfordshire, England, GBR	Locality	Village				Billington	Bedfordshire	England	United Kingdom	GBR	-0.6301941019999617	51.891869936000035	100	
Thomson	GPE	Walsh, Joseph Frederick; Billington, George Francis; Thomson, Pamela Evelyn; Beadle, Reginald Forsyth.’	225	Thomson, GA, USA	Locality	City				Thomson	McDuffie County	Georgia	United States	USA	-82.50276999999994	33.468020000000024	100	
Londoner	GPE	Though young, he was, after all, a Londoner, and had the Cockney's intuitive knowledge of the	227	Londoner, Rockport, MA, USA	POI	Island				Rockport	Essex County	Massachusetts	United States	USA	-70.56596999999994	42.63498000000004	100	
Somervail	GPE	it by?” And he says, “By Somervail.” Well, I never heard of him—	238	Somervell, 33 Foxham Road, London, England, N19 4, GBR	POI	Consumer Electronics Store	33 Foxham Road	Foxham	33	London	London	England	United Kingdom	GBR	-0.1321199999999294	51.55985000000004	77.78	
Somervail	GPE	later comes a stiff kind of a letter from this Somervail, saying I must call at once, that evening	240	Somervell, 33 Foxham Road, London, England, N19 4, GBR	POI	Consumer Electronics Store	33 Foxham Road	Foxham	33	London	London	England	United Kingdom	GBR	-0.1321199999999294	51.55985000000004	77.78	
London	GPE	Mr. Somervail is the art critic of two or three London papers?’	243	London, Greater London, England, GBR	Locality	City				London	Greater London	England	United Kingdom	GBR	-0.12769887399997515	51.507408346000034	100	
Billington	GPE	be devoted to celebrating the admittance of Messrs. Walsh, Billington, and Beadle to the Royal Academy Schools, for	249	Billington, Bedfordshire, England, GBR	Locality	Village				Billington	Bedfordshire	England	United Kingdom	GBR	-0.6301941019999617	51.891869936000035	100	
portmanteaux	GPE	crowded, garishly coloured omnibuses, the hansoms laden with portmanteaux on their way to Waterloo Station, the flaxen hair	252	Portmanteau, Via Biella 21, 10152, Torino, ITA	POI	Bed and Breakfast	Via Biella 21	Biella	21	Torino	Torino	Piemonte	Italia	ITA	7.674340000000029	45.08298000000008	93	
London	GPE	out of his office quicker than any other editor in London.	255	London, Greater London, England, GBR	Locality	City				London	Greater London	England	United Kingdom	GBR	-0.12769887399997515	51.507408346000034	100	
London	GPE	with soot, and adorned only with a map of London on a roller; on the floor was stretched a	262	London, Greater London, England, GBR	Locality	City				London	Greater London	England	United Kingdom	GBR	-0.12769887399997515	51.507408346000034	100	
Discobolus	GPE	better, after all, than stippling eternally at the Discobolus—for it was the Discobolus this time, with	280	Diskobolos, Frances Baard, Northern Cape, ZAF	Locality	District				Sol Plaatjie	Frances Baard	Northern Cape	South Africa	ZAF	24.79418000000004	-28.817969999999946	82	
Discobolus	GPE	stippling eternally at the Discobolus—for it was the Discobolus this time, with which she was to try her	280	Diskobolos, Frances Baard, Northern Cape, ZAF	Locality	District				Sol Plaatjie	Frances Baard	Northern Cape	South Africa	ZAF	24.79418000000004	-28.817969999999946	82	
New Zealand	GPE	like to telegraph to Vincent, who was now in New Zealand, but she felt the impulse was a silly one	301	New Zealand	Locality	Country							New Zealand	NZL	172.34343250000006	-42.28723356399996	100	
Liverpool	GPE	lodgings in Bulstrode Street. Vincent Hemming had telegraphed from Liverpool; he was to be in London that afternoon.	305	Liverpool, Merseyside, England, GBR	Locality	City				Liverpool	Merseyside	England	United Kingdom	GBR	-2.9784949999999526	53.40936677000008	100	
London	GPE	had telegraphed from Liverpool; he was to be in London that afternoon.	305	London, Greater London, England, GBR	Locality	City				London	Greater London	England	United Kingdom	GBR	-0.12769887399997515	51.507408346000034	100	
Whitechapel	GPE	a lot of human nature one sees down there in Whitechapel.’	311	Whitechapel, Tower Hamlets, Greater London, England, GBR	Locality	District				Tower Hamlets	Greater London	England	United Kingdom	GBR	-0.06907257799997524	51.51636757400007	100	
London	GPE	wait, all alone. He can't be in London till four o'clock, so I don't imagine I	318	London, Greater London, England, GBR	Locality	City				London	Greater London	England	United Kingdom	GBR	-0.12769887399997515	51.507408346000034	100	
London	GPE	‘It's doubtfully alluring—the London ball of to-day,’ assented Mary,	328	London, Greater London, England, GBR	Locality	City				London	Greater London	England	United Kingdom	GBR	-0.12769887399997515	51.507408346000034	100	
Euston	GPE	. Secretly, she would have liked to go to Euston to meet her lover, but he had said nothing	332	Euston, West Suffolk, Suffolk, England, GBR	Locality	Village				West Suffolk	Suffolk	England	United Kingdom	GBR	0.786011343000041	52.37960584700005	100	
London	GPE	, collecting his manifold baggage, hailing a cab. London was the richer for one important person; London contained	332	London, Greater London, England, GBR	Locality	City				London	Greater London	England	United Kingdom	GBR	-0.12769887399997515	51.507408346000034	100	
London	GPE	. London was the richer for one important person; London contained her lover!	332	London, Greater London, England, GBR	Locality	City				London	Greater London	England	United Kingdom	GBR	-0.12769887399997515	51.507408346000034	100	
London	GPE	chambers in the Temple; passing, actually rolling on London streets, in a London cab, not so very	334	London, Greater London, England, GBR	Locality	City				London	Greater London	England	United Kingdom	GBR	-0.12769887399997515	51.507408346000034	100	
London	GPE	passing, actually rolling on London streets, in a London cab, not so very far from where she sat	334	London, Greater London, England, GBR	Locality	City				London	Greater London	England	United Kingdom	GBR	-0.12769887399997515	51.507408346000034	100	
London	GPE	; stuffy with the damp, vitiated air of a London night verging on August. Few people passed. Bulstrode	351	London, Greater London, England, GBR	Locality	City				London	Greater London	England	United Kingdom	GBR	-0.12769887399997515	51.507408346000034	100	
Ottawa	GPE	way of the Canadian Pacific. And you went to Ottawa—and Niagara—’ added Mary vaguely, as	363	Ottawa, ON, CAN	Locality	City				Ottawa	Ottawa Division	Ontario	Canada	CAN	-75.69996299999997	45.425226000000066	100	
Niagara	GPE	Canadian Pacific. And you went to Ottawa—and Niagara—’ added Mary vaguely, as people always talk	363	Niagara, NY, USA	POI	Waterfall						New York	United States	USA	-79.06948865099997	43.08458754000003	100	
Niagara	GPE	countries they have never seen. ‘And what is Niagara like?’	363	Niagara, NY, USA	POI	Waterfall						New York	United States	USA	-79.06948865099997	43.08458754000003	100	
Niagara	GPE	‘Niagara,’ said Hemming, with a certain solemnity,	364	Niagara, NY, USA	POI	Waterfall						New York	United States	USA	-79.06948865099997	43.08458754000003	100	
Niagara	GPE	’ said Hemming, with a certain solemnity, ‘Niagara is something like London. The great falls, you	364	Niagara, NY, USA	POI	Waterfall						New York	United States	USA	-79.06948865099997	43.08458754000003	100	
London	GPE	with a certain solemnity, ‘Niagara is something like London. The great falls, you know, are not	364	London, Greater London, England, GBR	Locality	City				London	Greater London	England	United Kingdom	GBR	-0.12769887399997515	51.507408346000034	100	
London	GPE	, you know, are not beautiful; neither is London. But they are, like London, a unique	364	London, Greater London, England, GBR	Locality	City				London	Greater London	England	United Kingdom	GBR	-0.12769887399997515	51.507408346000034	100	
London	GPE	; neither is London. But they are, like London, a unique, a terrifying spectacle. The roar	364	London, Greater London, England, GBR	Locality	City				London	Greater London	England	United Kingdom	GBR	-0.12769887399997515	51.507408346000034	100	
Niagara	GPE	; all these things are identical. Some day, Niagara will have dried up, retreated, become a mere	364	Niagara, NY, USA	POI	Waterfall						New York	United States	USA	-79.06948865099997	43.08458754000003	100	
London	GPE	become a mere dribble among waterfalls. Some day, London will be a handful of ruins.’	364	London, Greater London, England, GBR	Locality	City				London	Greater London	England	United Kingdom	GBR	-0.12769887399997515	51.507408346000034	100	
London	GPE	obliged to see the Colonial Secretary on my arrival in London. I had a confidential message of the highest importance	372	London, Greater London, England, GBR	Locality	City				London	Greater London	England	United Kingdom	GBR	-0.12769887399997515	51.507408346000034	100	
London	GPE	remember,’ she added, ‘ever being in London so late in the summer. Yes, I daresay	380	London, Greater London, England, GBR	Locality	City				London	Greater London	England	United Kingdom	GBR	-0.12769887399997515	51.507408346000034	100	
Aix	GPE	‘They're going to Aix on Monday, and later on the house will be	384	Aix, Bouches-du-Rhône, Provence-Alpes-Côte d'Azur, FRA	Locality	City				Aix	Bouches-du-Rhône	Provence-Alpes-Côte d'Azur	France	FRA	5.449730000000045	43.52830000000006	100	
the Surrey Hills	GPE	, and quiet on a week-day! Or the Surrey Hills, places that are mauve with heather; and pine	384	Surrey Hills, Melbourne, Victoria, AUS	Locality	District				Melbourne		Victoria	Australia	AUS	145.09739000000002	-37.825229999999976	99.95	
Sydney	GPE	the unusual opportunities he had enjoyed in Calcutta, in Sydney, and in Ottawa of studying the different systems of	386	Sydney, New South Wales, AUS	Locality	City				Sydney		New South Wales	Australia	AUS	151.2069100000001	-33.869599999999934	100	
Ottawa	GPE	had enjoyed in Calcutta, in Sydney, and in Ottawa of studying the different systems of government which obtained in	386	Ottawa, ON, CAN	Locality	City				Ottawa	Ottawa Division	Ontario	Canada	CAN	-75.69996299999997	45.425226000000066	100	
the British Empire	GPE	different systems of government which obtained in various parts of the British Empire, Mary was a model hostess.	386	British Empire, Krebsgasse 9, 90402, Nürnberg, Bayern, DEU	POI	Clothing Store	Krebsgasse 9	Krebs	9	Nürnberg	Nürnberg	Bayern	Deutschland	DEU	11.075180000000046	49.44954000000007	99.95	
India	GPE	brought him in touch with all the important men in India and the colonies. He had ample material for a	390	India	Locality	Country							India	IND	79.44332654800007	23.379379735000043	100	
England	GPE	were out, he, too, would be among England's legislators. (It was typical of Hemming that	390	England, GBR	Locality	State or Province						England	United Kingdom	GBR	-1.4586284489999457	52.59274188900008	100	
Northborough	GPE	. As luck would have it, the member for Northborough was known to be seriously ill, a lingering illness	390	Northborough, MA, USA	Locality	City				Northborough	Worcester County	Massachusetts	United States	USA	-71.65479999999997	42.31098000000003	100	
Northborough	GPE	Mr., Mrs., and Miss Violet Higgins, of Northborough, Lancashire, engaged in a protracted quarrel with the	391	Northborough, MA, USA	Locality	City				Northborough	Worcester County	Massachusetts	United States	USA	-71.65479999999997	42.31098000000003	100	
Lancashire	GPE	Mrs., and Miss Violet Higgins, of Northborough, Lancashire, engaged in a protracted quarrel with the black porter	391	Lancashire, England, GBR	Locality	Zone						England	United Kingdom	GBR	-2.63000999999997	53.84331000000003	100	
New York	GPE	protracted quarrel with the black porter in a train bound New York-wards from Niagara. The Higgins family had wished	391	New York, NY, USA	Locality	City				New York	New York County	New York	United States	USA	-74.00711999999999	40.714530000000025	100	
Niagara	GPE	porter in a train bound New York-wards from Niagara. The Higgins family had wished to have the windows	391	Niagara, NY, USA	POI	Waterfall						New York	United States	USA	-79.06948865099997	43.08458754000003	100	
Northborough	GPE	a compromise, and the perspiring mayor and mayoress of Northborough had been, he thought, somewhat unduly thankful.	391	Northborough, MA, USA	Locality	City				Northborough	Worcester County	Massachusetts	United States	USA	-71.65479999999997	42.31098000000003	100	
New York	GPE	steamer, for they met again on the wharf at New York, in the rush and bustle of embarkation. The	391	New York, NY, USA	Locality	City				New York	New York County	New York	United States	USA	-74.00711999999999	40.714530000000025	100	
Northborough	GPE	young man. Vincent remembered how impressed the Mayor of Northborough had been when he found out that this was ‘	391	Northborough, MA, USA	Locality	City				Northborough	Worcester County	Massachusetts	United States	USA	-71.65479999999997	42.31098000000003	100	
