Location	ent_type	context	p_no	LongLabel	Addr_type	Type	StAddr	StName	AddNum	City	Subregion	Region	CntryName	Country	x	y	score	error
CHARLES	GPE	“DEAR CHARLES,	1	Charles, North Devon, Devon, England, GBR	Locality	Village				North Devon	Devon	England	United Kingdom	GBR	-3.8749422519999257	51.08022974700003	100	
Seacombe	GPE	and my uncle the nobleman offered me the living of Seacombe, which is in his gift, if I would	4	Seacombe, Wirral, Merseyside, England, GBR	Locality	District				Wirral	Merseyside	England	United Kingdom	GBR	-3.0261728609999636	53.40894877900007	100	
Tynedale	GPE	I was quite right to shake off the burden of Tynedale’s patronage, but a fool to offer my shoulders	6	Tynedale, Western Australia, AUS	POI	House					Harvey	Western Australia	Australia	AUS	115.90370000000007	-33.32851999999997	100	
Seacombe	GPE	without some expression of determined enmity against the house of Seacombe, and some reproach to me for living, as	8	Seacombe, Wirral, Merseyside, England, GBR	Locality	District				Wirral	Merseyside	England	United Kingdom	GBR	-3.0261728609999636	53.40894877900007	100	
shire	GPE	but he said I might come down to ——shire, if I liked, and he would ‘see	9	Shire, Eden, Cumbria, England, GBR	Locality	District				Eden	Cumbria	England	United Kingdom	GBR	-2.599768044999962	54.71006426900004	100	
morocco	GPE	I took the stuffed easy chair, covered with red morocco, which stood by the fireside, and while my	13	Morocco	Locality	Country							Kingdom of Morocco	MAR	-4.999999999999943	32.00000000000006	100	
morocco	GPE	head to foot; he took his seat in the morocco covered arm-chair, and motioned me to another	15	Morocco	Locality	Country							Kingdom of Morocco	MAR	-4.999999999999943	32.00000000000006	100	
Tynedale	GPE	“‘Have you quite broken with Tynedale and Seacombe?’ he asked hastily.	21	Tynedale, Western Australia, AUS	POI	House					Harvey	Western Australia	Australia	AUS	115.90370000000007	-33.32851999999997	100	
Tynedale	GPE	I, ‘as alien to what I like as Tynedale, Seacombe, the Misses Seacombe—as the affectionate	26	Tynedale, Western Australia, AUS	POI	House					Harvey	Western Australia	Australia	AUS	115.90370000000007	-33.32851999999997	100	
Seacombe	GPE	‘as alien to what I like as Tynedale, Seacombe, the Misses Seacombe—as the affectionate relative now	26	Seacombe, Wirral, Merseyside, England, GBR	Locality	District				Wirral	Merseyside	England	United Kingdom	GBR	-3.0261728609999636	53.40894877900007	100	
shire hills	GPE	. The autumn sun, rising over the ——shire hills, disclosed a pleasant country; woods brown and mellow	38	Shire Hill, High Peak, Derbyshire, England, GBR	POI	Mountain				High Peak	Derbyshire	England	United Kingdom	GBR	-1.919888167999943	53.44764139500006	100	
Bigben Close	GPE	into a great paved yard, and we were in Bigben Close, and the mill was before us, vomiting soot	43	Big Ben, Westminster, Greater London, England, GBR	POI	Historical Monument				Westminster	Greater London	England	United Kingdom	GBR	-0.12464999999997417	51.50060000000008	95.41	
shire	GPE	“You are come down to ——shire to learn to be a tradesman?”	48	Shire, Eden, Cumbria, England, GBR	Locality	District				Eden	Cumbria	England	United Kingdom	GBR	-2.599768044999962	54.71006426900004	100	
Hunsden	GPE	propelled me from my superior. I had frequently seen Hunsden in Bigben Close, where he came almost weekly to	80	Hunden, Drage, Niedersachsen, DEU	Locality	District				Drage	Harburg	Niedersachsen	Deutschland	DEU	10.29532000000006	53.371480000000076	85.71	
Bigben Close	GPE	from my superior. I had frequently seen Hunsden in Bigben Close, where he came almost weekly to transact business with	80	Big Ben, Westminster, Greater London, England, GBR	POI	Historical Monument				Westminster	Greater London	England	United Kingdom	GBR	-0.12464999999997417	51.50060000000008	95.41	
Bigben Close	GPE	the closeness, smoke, monotony and joyless tumult of Bigben Close, and its panting desire for freer and fresher scenes	111	Big Ben, Westminster, Greater London, England, GBR	POI	Historical Monument				Westminster	Greater London	England	United Kingdom	GBR	-0.12464999999997417	51.50060000000008	95.41	
Grove	GPE	my course towards the country; I had got into Grove-street, and began to feel the pleasure of	116	Groves, TX, USA	Locality	City				Groves	Jefferson County	Texas	United States	USA	-93.91966999999994	29.945650000000057	100	
Hunsden	GPE	It suited me to accept the invitation as it suited Hunsden to give it. I passed through the gate,	131	Hunden, Drage, Niedersachsen, DEU	Locality	District				Drage	Harburg	Niedersachsen	Deutschland	DEU	10.29532000000006	53.371480000000076	85.71	
shire	GPE	the bright grate was filled with a genuine ——shire fire, red, clear, and generous, no	132	Shire, Eden, Cumbria, England, GBR	Locality	District				Eden	Cumbria	England	United Kingdom	GBR	-2.599768044999962	54.71006426900004	100	
Hunsden	GPE	slovenly habits. From what I saw I concluded that Hunsden’s ideas on that point corresponded with my own.	132	Hunden, Drage, Niedersachsen, DEU	Locality	District				Drage	Harburg	Niedersachsen	Deutschland	DEU	10.29532000000006	53.371480000000076	85.71	
Crimsworth	GPE	patient because you expect to make something eventually out of Crimsworth, notwithstanding his tyranny, or perhaps by means of	148	Chisworth, High Peak, Derbyshire, England, GBR	Locality	Village				High Peak	Derbyshire	England	United Kingdom	GBR	-2.014556480999943	53.424548634000075	82	
Hunsden	GPE	The first part of Hunsden’s speech moved me not at all, or,	152	Hunden, Drage, Niedersachsen, DEU	Locality	District				Drage	Harburg	Niedersachsen	Deutschland	DEU	10.29532000000006	53.371480000000076	85.71	
Hunsden	GPE	I make myself a tradesman? Why did I enter Hunsden’s house this evening? Why, at dawn to	158	Hunden, Drage, Niedersachsen, DEU	Locality	District				Drage	Harburg	Niedersachsen	Deutschland	DEU	10.29532000000006	53.371480000000076	85.71	
Hunsden	GPE	’s, nor Eccle’s company; and as to Hunsden, you fancied there was pleasure to be derived from	160	Hunden, Drage, Niedersachsen, DEU	Locality	District				Drage	Harburg	Niedersachsen	Deutschland	DEU	10.29532000000006	53.371480000000076	85.71	
Egypt	GPE	the Israelite crawling over the sun-baked fields of Egypt in search of straw and stubble wherewith to accomplish his	161	Egypt	Locality	Country							Arab Republic of Egypt	EGY	29.870494860000065	26.512273493000066	100	
shire	GPE	last term is, I believe, purely ——shire, and alludes to the horn of black, rancid	173	Shire, Eden, Cumbria, England, GBR	Locality	District				Eden	Cumbria	England	United Kingdom	GBR	-2.599768044999962	54.71006426900004	100	
Town	GPE	and a hypocrite. At a public meeting in the Town-hall yesterday, I had the pleasure of hearing	185	Town, Kasungu, Central Region, MWI	Locality	Village				Kasungu		Central Region	Malawi	MWI	33.47947000000005	-13.015099999999961	100	
Hunsden	GPE	month ago, and I know that you were at Hunsden’s rooms last night. Deny it if you dare	185	Hunden, Drage, Niedersachsen, DEU	Locality	District				Drage	Harburg	Niedersachsen	Deutschland	DEU	10.29532000000006	53.371480000000076	85.71	
Sirrah	GPE	“Sirrah! sirrah!” reiterated Crimsworth; and to complete	187	Sirrah, Papua Pegunungan, IDN	POI	Mountain						Papua Pegunungan	Indonesia	IDN	140.88333000000011	-4.983329999999967	100	
Grovetown	GPE	did look up, lo! straight before me lay Grovetown, a village of villas about five miles out of	197	Grovetown, GA, USA	Locality	City				Grovetown	Columbia County	Georgia	United States	USA	-82.20361999999994	33.452360000000056	100	
Grovetown	GPE	the scene, and treasure it for future years. Grovetown church clock struck four; looking up, I beheld	197	Grovetown, GA, USA	Locality	City				Grovetown	Columbia County	Georgia	United States	USA	-82.20361999999994	33.452360000000056	100	
Crimsworth	GPE	impossible for me to live in the same town with Crimsworth, to come into weekly contact with him, to	217	Chisworth, High Peak, Derbyshire, England, GBR	Locality	Village				High Peak	Derbyshire	England	United Kingdom	GBR	-2.014556480999943	53.424548634000075	82	
Hunsden	GPE	speech interested me much, both because it brought out Hunsden’s character, and because it explained his motives;	218	Hunden, Drage, Niedersachsen, DEU	Locality	District				Drage	Harburg	Niedersachsen	Deutschland	DEU	10.29532000000006	53.371480000000076	85.71	
Hunsden	GPE	-manifestation of feeling appeared at the same moment on Hunsden’s lips.	233	Hunden, Drage, Niedersachsen, DEU	Locality	District				Drage	Harburg	Niedersachsen	Deutschland	DEU	10.29532000000006	53.371480000000076	85.71	
Hunsden	GPE	“Indeed! Do you think so?” interrupted Hunsden, scoffingly.	255	Hunden, Drage, Niedersachsen, DEU	Locality	District				Drage	Harburg	Niedersachsen	Deutschland	DEU	10.29532000000006	53.371480000000076	85.71	
Brussels	GPE	what the deuce hinders you? You may get to Brussels, for instance, for five or six pounds,	261	Brussels, BEL	Locality	City				Brussels	Brussels	Brussels	Belgium	BEL	4.406264339000074	50.89806471000003	100	
Brussels	GPE	way for you when you get there. I know Brussels almost as well as I know X——,	263	Brussels, BEL	Locality	City				Brussels	Brussels	Brussels	Belgium	BEL	4.406264339000074	50.89806471000003	100	
London	GPE	it would suit such a one as you better than London.”	263	London, Greater London, England, GBR	Locality	City				London	Greater London	England	United Kingdom	GBR	-0.12769887399997515	51.507408346000034	100	
Brussels	GPE	I get recommendation, or introduction, or employment at Brussels?”	264	Brussels, BEL	Locality	City				Brussels	Brussels	Brussels	Belgium	BEL	4.406264339000074	50.89806471000003	100	
Christendom	GPE	and professed that I did not envy any being in Christendom.	272	Christendom, Waterford, Kilkenny, IRL	Locality	Village				Waterford		Kilkenny	Ireland	IRL	-7.093738178999956	52.25854011900003	100	
Hunsden	GPE	“The lad is a heathen,” said Hunsden, and taking his hat from a sideboard, he	278	Hunden, Drage, Niedersachsen, DEU	Locality	District				Drage	Harburg	Niedersachsen	Deutschland	DEU	10.29532000000006	53.371480000000076	85.71	
Belgium	GPE	READER, perhaps you were never in Belgium? Haply you don’t know the physiognomy of the	280	Belgium	Locality	Country							Belgium	BEL	4.661070427000027	50.640682937000065	100	
Belgium	GPE	Third, Belgium; and I will pause before this landscape. As	282	Belgium	Locality	Country							Belgium	BEL	4.661070427000027	50.640682937000065	100	
Belgium	GPE	rate, for the present it must hang undisturbed. Belgium! name unromantic and unpoetic, yet name that whenever	282	Belgium	Locality	Country							Belgium	BEL	4.661070427000027	50.640682937000065	100	
Belgium	GPE	syllables, however sweet or classic, can produce. Belgium! I repeat the word, now as I sit	282	Belgium	Locality	Country							Belgium	BEL	4.661070427000027	50.640682937000065	100	
Belgium	GPE	This is Belgium, reader. Look! don’t call the picture	283	Belgium	Locality	Country							Belgium	BEL	4.661070427000027	50.640682937000065	100	
Brussels	GPE	February morning, and found myself on the road to Brussels, nothing could look vapid to me. My sense	283	Brussels, BEL	Locality	City				Brussels	Brussels	Brussels	Belgium	BEL	4.406264339000074	50.89806471000003	100	
Brussels	GPE	my eye caught the first gleam of the lights of Brussels. I saw little of the city but its lights	284	Brussels, BEL	Locality	City				Brussels	Brussels	Brussels	Belgium	BEL	4.406264339000074	50.89806471000003	100	
London	GPE	for a night or two at a respectable inn in London while waiting for the sailing of the packet! Yet	285	London, Greater London, England, GBR	Locality	City				London	Greater London	England	United Kingdom	GBR	-0.12769887399997515	51.507408346000034	100	
London	GPE	first heard the great bell of St. Paul’s telling London it was midnight, and well do I recall the	285	London, Greater London, England, GBR	Locality	City				London	Greater London	England	United Kingdom	GBR	-0.12769887399997515	51.507408346000034	100	
London	GPE	, I first saw the dome, looming through a London mist. I suppose the sensations, stirred by those	285	London, Greater London, England, GBR	Locality	City				London	Greater London	England	United Kingdom	GBR	-0.12769887399997515	51.507408346000034	100	
Brussels	GPE	living languages I afterwards found to be so general in Brussels.	286	Brussels, BEL	Locality	City				Brussels	Brussels	Brussels	Belgium	BEL	4.406264339000074	50.89806471000003	100	
Liege	GPE	meditation he named a place in a mercantile house at Liege, and another in a bookseller’s shop at Louvain	289	Liège, BEL	Locality	City				Liège	Liège	Wallonie	Belgique	BEL	5.590462810000076	50.63176777000007	100	
Louvain	GPE	Liege, and another in a bookseller’s shop at Louvain.	289	Louvain, BEL	Locality	City				Louvain	Brabant flamand	Flandre	Belgique	BEL	4.705906121000055	50.88217392300004	100	
Brussels	GPE	me better; besides I did not wish to leave Brussels.	290	Brussels, BEL	Locality	City				Brussels	Brussels	Brussels	Belgium	BEL	4.406264339000074	50.89806471000003	100	
Brussels	GPE	“I know of no place in Brussels,” answered Mr. Brown, “unless indeed you	291	Brussels, BEL	Locality	City				Brussels	Brussels	Brussels	Belgium	BEL	4.406264339000074	50.89806471000003	100	
Belgium	GPE	” returned Mr. Brown, “professor, here in Belgium, means a teacher, that is all.”	298	Belgium	Locality	Country							Belgium	BEL	4.661070427000027	50.640682937000065	100	
Brussels	GPE	I had traversed a good deal of Brussels before five o’clock arrived, but punctually as that hour	300	Brussels, BEL	Locality	City				Brussels	Brussels	Brussels	Belgium	BEL	4.406264339000074	50.89806471000003	100	
Brussels	GPE	which M. Pelet had engaged me were really liberal for Brussels; instruction being extremely cheap there on account of the	301	Brussels, BEL	Locality	City				Brussels	Brussels	Brussels	Belgium	BEL	4.406264339000074	50.89806471000003	100	
Wakefield	GPE	“livre de lecture” was the “Vicar of Wakefield,” much used in foreign schools because it is	310	Wakefield, West Yorkshire, England, GBR	Locality	City				Wakefield	West Yorkshire	England	United Kingdom	GBR	-1.4981716159999792	53.68372055800006	100	
Great Britain	GPE	to the language in ordinary use amongst the natives of Great Britain. My God! how he did snuffle, snort	310	Great Britain	Locality	Country							United Kingdom	GBR	-1.9695595439999352	53.40838660500003	100	
Flamands	GPE	his throat and nose, for it is thus the Flamands speak, but I heard him to the end of	310	Flamands, Saint-Barthélemy, BLM	Locality	Village				Flamands	Saint-Barthélemy	Saint-Barthélemy	Saint-Barthélemy	BLM	-62.854769999999974	17.918690000000026	100	
Wakefield	GPE	began at the very beginning of the “Vicar of Wakefield,” and read, in a slow, distinct	314	Wakefield, West Yorkshire, England, GBR	Locality	City				Wakefield	West Yorkshire	England	United Kingdom	GBR	-1.4981716159999792	53.68372055800006	100	
Belgium	GPE	it had two windows. Light not being taxed in Belgium, the people never grudge its admission into their houses	318	Belgium	Locality	Country							Belgium	BEL	4.661070427000027	50.640682937000065	100	
n’est-ce	GPE	et les convenances exigent—enfin, vous comprenez—n’est-ce pas, monsieur?”	319	Nest, Avenida Carlos Jereissati 100, Maracanaú, Ceará, 61900-010, BRA	POI	Medical Clinic	Avenida Carlos Jereissati 100	Carlos Jereissati	100	Maracanaú		Ceará	Brasil	BRA	-38.62121999999994	-3.879799999999932	99.99	
Ste	GPE	it in rock—become immutable as the towers of Ste. Gudule; for a step—but half a	323	Sainté, Loire, Auvergne-Rhône-Alpes, FRA	Locality	City				Saint-Étienne	Loire	Auvergne-Rhône-Alpes	France	FRA	4.390000000000043	45.433890000000076	100	
Belgium	GPE	details will sound very odd in English ears, but Belgium is not England, and its ways are not our	328	Belgium	Locality	Country							Belgium	BEL	4.661070427000027	50.640682937000065	100	
England	GPE	very odd in English ears, but Belgium is not England, and its ways are not our ways.	328	England, GBR	Locality	State or Province						England	United Kingdom	GBR	-1.4586284489999457	52.59274188900008	100	
Belgium	GPE	“How do you like Belgium, Monsieur?” asked she, in an accent	337	Belgium	Locality	Country							Belgium	BEL	4.661070427000027	50.640682937000065	100	
ponche	GPE	. Take one drop of the punch” (or ponche, as she pronounced it); “it is	339	Ponche, Huambo, AGO	POI	Stream						Huambo	Angola	AGO	15.150000000000034	-12.249999999999943	100	
Brussels	GPE	singularly, at least I thought so that evening. Brussels seemed a very pleasant place to me when I got	368	Brussels, BEL	Locality	City				Brussels	Brussels	Brussels	Belgium	BEL	4.406264339000074	50.89806471000003	100	
china	GPE	beaufet and the armoire vitree, filled with glass and china, which formed part of its furniture. Ere she	416	China	Locality	Country							China	CHN	103.93002703300004	36.567348398000036	100	
Brussels	GPE	was considered one of the best-conducted schools in Brussels.	416	Brussels, BEL	Locality	City				Brussels	Brussels	Brussels	Belgium	BEL	4.406264339000074	50.89806471000003	100	
Venez	GPE	of the stair, “ou allez-vous? Venez a la salle-a-manger, que je	428	Venez I, Tayir Zharokov köshesy, Almati, 050060, KAZ	POI	Furniture Store	Tayir Zharokov köshesy	Tayir Zharokov		Almati		Almati	Qazaqstan	KAZ	76.90292000000005	43.21219000000008	98.28	
china	GPE	, a sugar-basin, and two large white china cups. While M. Pelet employed himself in choosing a	430	China	Locality	Country							China	CHN	103.93002703300004	36.567348398000036	100	
voyez-vous	GPE	“Je connais un peu ma petite voisine—voyez-vous.”	445															nothing found
n’est-ce pas que cela	GPE	tendresse d’une petite maman a l’amour d’une epouse devouee; n’est-ce pas que cela t’irait superieurement?”	454	Estação, Itapipoca, Ceará, BRA	Locality	Neighborhood				Itapipoca		Ceará	Brasil	BRA	-39.58288999999996	-3.495499999999936	73.5	
n’y	GPE	observe then her eyebrows, et dites-moi s’il n’y a pas du chat dans l’un et du renard dans	468	NY, USA	Locality	State or Province						New York	United States	USA	-75.61070144699994	42.93708397900008	99.99	
parmi ces	GPE	N’y a-t-il pas de belles etudes parmi ces jeunes tetes?”	479	Parmi, Совхозная улица, Химки, Московская область, 141406, RUS	POI	International Food	Совхозная улица	Совхозная		Химки	Химки	Московская область	Russian Federation	RUS	37.47960000000006	55.90276000000006	77.5	
Brussels	GPE	I known of female character previously to my arrival at Brussels? Precious little. And what was my notion of	494	Brussels, BEL	Locality	City				Brussels	Brussels	Brussels	Belgium	BEL	4.406264339000074	50.89806471000003	100	
Brussels	GPE	eighteen years of age, and has been sent to Brussels to finish her education; she is of middle size	496	Brussels, BEL	Locality	City				Brussels	Brussels	Brussels	Belgium	BEL	4.406264339000074	50.89806471000003	100	
France	GPE	as their parents wandered from land to land—from France to Germany, from Germany to Belgium—they had	502	France	Locality	Country							France	FRA	2.5505399530000545	46.55941704400004	100	
Germany	GPE	parents wandered from land to land—from France to Germany, from Germany to Belgium—they had picked up	502	Germany	Locality	Country							Federal Republic of Germany	DEU	10.39227793200007	51.11063104900006	100	
Germany	GPE	land to land—from France to Germany, from Germany to Belgium—they had picked up some scanty instruction	502	Germany	Locality	Country							Federal Republic of Germany	DEU	10.39227793200007	51.11063104900006	100	
Belgium	GPE	land—from France to Germany, from Germany to Belgium—they had picked up some scanty instruction, many	502	Belgium	Locality	Country							Belgium	BEL	4.661070427000027	50.640682937000065	100	
Rome	GPE	and nursling of Protestantism from the foster-child of Rome, the protégée of Jesuistry: proud, too,	503	Rome, ITA	Locality	City				Rome	Rome	Latium	Italie	ITA	12.495650000000069	41.90322000000003	100	
Mdlles	GPE	were three in number, all French—their names Mdlles. Zephyrine, Pelagie, and Suzette; the two	504	Mülles, Hahnbach, Bayern, DEU	Locality	District				Hahnbach	Amberg-Sulzbach	Bayern	Deutschland	DEU	11.810230000000047	49.56898000000007	83.33	
Eulalie	GPE	, access to books being forbidden. While Mdlle. Eulalie, Hortense, Caroline, etc., were pondering	538	Eulalie, TX, USA	Locality	Village				Eulalie	Rusk County	Texas	United States	USA	-94.53945999999996	31.96148000000005	100	
Belgium	GPE	of sensitiveness in any human face since my arrival in Belgium, I had begun to regard it almost as a	548	Belgium	Locality	Country							Belgium	BEL	4.661070427000027	50.640682937000065	100	
maison d’or	GPE	to Marie “vierge celeste, reine des anges, maison d’or, tour d’ivoire!” and then an invocation to	549	Maison D'or, улица Розы Люксембург, 22, Екатеринбург, Свердловская область, 620075, RUS	POI	Furniture Store	улица Розы Люксембург, 22	Розы Люксембург	22	Екатеринбург	Екатеринбург	Свердловская область	Russian Federation	RUS	60.61218000000008	56.83256000000006	100	
Perth	GPE	“On his way to Perth, the king was met by a Highland woman,	562	Perth, Western Australia, AUS	Locality	City				Perth		Western Australia	Australia	AUS	115.85742000000005	-31.95264999999995	100	
Essex	GPE	the counterpart of what any well-educated lady in Essex or Middlesex might have enounced, yet the speaker or	563	Essex, England, GBR	Locality	Zone						England	United Kingdom	GBR	0.5744900000000257	51.78449000000006	100	
Middlesex	GPE	of what any well-educated lady in Essex or Middlesex might have enounced, yet the speaker or reader was	563	Middlesex, JAM	Locality	State or Province						Middlesex	Jamaica	JAM	-77.20259987899993	18.12891323200006	100	
England	GPE	! you read it well; you have been in England?”	567	England, GBR	Locality	State or Province						England	United Kingdom	GBR	-1.4586284489999457	52.59274188900008	100	
Brabantoises	GPE	the way of controlling our giddy, high-spirited Brabantoises. But, monsieur, I would add one word	580															nothing found
England	GPE	she had obtained access somehow to an abridged history of England, and had copied the anecdote out fair. I	584	England, GBR	Locality	State or Province						England	United Kingdom	GBR	-1.4586284489999457	52.59274188900008	100	
Wales	GPE	friends; my troops wander broken in the hills of Wales; reckless robbers spoil my country; my subjects lie	591	Wales, GBR	Locality	State or Province						Wales	United Kingdom	GBR	-3.7652226249999785	52.337163856000075	100	
wintry	GPE	, of the crownless king; she had imagined the wintry forest, she had recalled the old Saxon ghost-	592	Wintery	POI	Trench									-24.811229999999966	-60.126619999999946	85.71	
England	GPE	, yet she told me she had neither been in England, nor taken lessons in English, nor lived in	593	England, GBR	Locality	State or Province						England	United Kingdom	GBR	-1.4586284489999457	52.59274188900008	100	
Belgium	GPE	“You are not a native of Belgium?”	610	Belgium	Locality	Country							Belgium	BEL	4.661070427000027	50.640682937000065	100	
France	GPE	“Nor of France?”	612	France	Locality	Country							France	FRA	2.5505399530000545	46.55941704400004	100	
Geneva	GPE	“I was born at Geneva.”	615	Geneva, CHE	Locality	City				Geneva	Geneva	Geneva	Switzerland	CHE	6.142750000000035	46.208330000000046	100	
n’en	GPE	“C’est si difficile, monsieur, quand on n’en a plus l’habitude.”	635	Nen, Momo, Northwest, CMR	Locality	Village				Momo		Northwest	Cameroon	CMR	9.83573000000007	5.8285300000000575	99.99	
un mois j’aurai dix-neuf ans	GPE	“Pas encore, monsieur—en un mois j’aurai dix-neuf ans.”	651															nothing found
Berlin	GPE	“Yes, yes, you can work with Berlin wools, and embroider handkerchiefs and collars—that will	678	Berlin, DEU	Locality	City				Berlin	Berlin	Berlin	Deutschland	DEU	13.376910000000066	52.51604000000003	100	
Brussels	GPE	me taught lace-mending soon after we came to Brussels, because I knew it was a métier, a	685	Brussels, BEL	Locality	City				Brussels	Brussels	Brussels	Belgium	BEL	4.406264339000074	50.89806471000003	100	
Brussels	GPE	, and I quickly got work, for all the Brussels ladies have old lace—very precious—which must	685	Brussels, BEL	Locality	City				Brussels	Brussels	Brussels	Belgium	BEL	4.406264339000074	50.89806471000003	100	
England	GPE	“I will go and live in England; I will teach French there.”	687	England, GBR	Locality	State or Province						England	United Kingdom	GBR	-1.4586284489999457	52.59274188900008	100	
England	GPE	The words were pronounced emphatically. She said “England” as you might suppose an Israelite of Moses’	688	England, GBR	Locality	State or Province						England	United Kingdom	GBR	-1.4586284489999457	52.59274188900008	100	
Canaan	GPE	suppose an Israelite of Moses’ days would have said Canaan.	688	Canaan, ME, USA	Locality	City				Canaan	Somerset County	Maine	United States	USA	-69.56169999999997	44.762020000000064	100	
England	GPE	“Have you a wish to see England?”	689	England, GBR	Locality	State or Province						England	United Kingdom	GBR	-1.4586284489999457	52.59274188900008	100	
England	GPE	“What is your idea of England, mademoiselle? Why do you wish to go there	695	England, GBR	Locality	State or Province						England	United Kingdom	GBR	-1.4586284489999457	52.59274188900008	100	
England	GPE	“England is something unique, as I have heard and read	697	England, GBR	Locality	State or Province						England	United Kingdom	GBR	-1.4586284489999457	52.59274188900008	100	
