Location	ent_type	context	p_no	LongLabel	Addr_type	Type	StAddr	StName	AddNum	City	Subregion	Region	CntryName	Country	x	y	score	error
Chicago	GPE	abundant, but not ostentatious, like that of the Chicago pork-packers' wives and daughters who graced the	391	Chicago, IL, USA	Locality	City				Chicago	Cook County	Illinois	United States	USA	-87.63244999999995	41.884250000000065	100	
Northborough	GPE	president of his committee should he think of standing for Northborough; he had talked of heading a subscription to defray	391	Northborough, MA, USA	Locality	City				Northborough	Worcester County	Massachusetts	United States	USA	-71.65479999999997	42.31098000000003	100	
Northborough	GPE	A month later, Vincent was still at Northborough, and Mary, whose drawing for the Academy had	393	Northborough, MA, USA	Locality	City				Northborough	Worcester County	Massachusetts	United States	USA	-71.65479999999997	42.31098000000003	100	
York	GPE	to the fact that a buffet, spread with a York ham, a magnificent display of bath buns, and	394	York, North Yorkshire, England, GBR	Locality	City				York	North Yorkshire	England	United Kingdom	GBR	-1.0836837719999721	53.96202662400003	100	
Inverness	GPE	-looking men, with wide-awake hats and Inverness capes of dubious freshness, strolled in twos out of	394	Inverness, Scotland, GBR	Locality	City				Inverness	Inverness	Scotland	United Kingdom	GBR	-4.2262195809999525	57.47998157100005	100	
Rome	GPE	or no. Yonder was a yellow and blue ‘Rome from the Pincian Hill,’ by a man with	395	Rome, ITA	Locality	City				Rome	Rome	Latium	Italie	ITA	12.495650000000069	41.90322000000003	100	
bedizened	GPE	was seen the profile of another girl, painted, bedizened, supercilious.	395															nothing found
London	GPE	of old, the look of a grown-up London street-boy.	397	London, Greater London, England, GBR	Locality	City				London	Greater London	England	United Kingdom	GBR	-0.12769887399997515	51.507408346000034	100	
Australia	GPE	bought it, sold thousands of engravings— especially in Australia. Australia, you know, is like England—	400	Australia	Locality	Country							Australia	AUS	134.48403119800003	-25.70993156999998	100	
Australia	GPE	, sold thousands of engravings— especially in Australia. Australia, you know, is like England—only more	400	Australia	Locality	Country							Australia	AUS	134.48403119800003	-25.70993156999998	100	
England	GPE	in Australia. Australia, you know, is like England—only more so. And in America, too	400	England, GBR	Locality	State or Province						England	United Kingdom	GBR	-1.4586284489999457	52.59274188900008	100	
America	GPE	is like England—only more so. And in America, too. I'm told that in America they	400	America	Locality	Country							United States	USA	-99.41461918999994	39.39870315600007	100	
America	GPE	in America, too. I'm told that in America they give away an autogravure of that picture with every	400	America	Locality	Country							United States	USA	-99.41461918999994	39.39870315600007	100	
America	GPE	‘America is a wonderful country,’ said Mary gravely.	401	America	Locality	Country							United States	USA	-99.41461918999994	39.39870315600007	100	
Kensington	GPE	'll come and see my studio. I'm down Kensington way now—all among the Royal Academicians.’	402	Kensington, PE, CAN	Locality	City				Kensington	Prince County	Prince Edward Island	Canada	CAN	-63.635685999999964	46.43773200000004	100	
Cologne	GPE	a white beard, who had painted the interior of Cologne cathedral for forty years, was leading affectionately by the	412	Cologne, North-Rhine-Westphalia, DEU	Locality	City				Cologne	Cologne	North-Rhine-Westphalia	Federal Republic of Germany	DEU	6.955130000000054	50.941680000000076	100	
Rome	GPE	eye ran along the walls covered with smooth views of Rome, of the Thames at Wargrave, impossible fisher-	425	Rome, ITA	Locality	City				Rome	Rome	Latium	Italie	ITA	12.495650000000069	41.90322000000003	100	
Kensington	GPE	herself severely as the train rattled on its way to Kensington that she could not afford to break down now.	443	Kensington, PE, CAN	Locality	City				Kensington	Prince County	Prince Edward Island	Canada	CAN	-63.635685999999964	46.43773200000004	100	
London	GPE	he looked more than ever like a grown-up London street-boy, who had found his way,	447	London, Greater London, England, GBR	Locality	City				London	Greater London	England	United Kingdom	GBR	-0.12769887399997515	51.507408346000034	100	
Northborough	GPE	the stalls who knows. It's the mayor of Northborough, the mayoress of Northborough, and the heiress-	496	Northborough, MA, USA	Locality	City				Northborough	Worcester County	Massachusetts	United States	USA	-71.65479999999997	42.31098000000003	100	
Northborough	GPE	It's the mayor of Northborough, the mayoress of Northborough, and the heiress-apparent. They're as	496	Northborough, MA, USA	Locality	City				Northborough	Worcester County	Massachusetts	United States	USA	-71.65479999999997	42.31098000000003	100	
qu'elle est fagotée	GPE	's high at the back! And the daughter—qu'elle est fagotée, mon Dieu, and with diamonds put in all	496															nothing found
America	GPE	Vincent's friends, whom he had picked up in America, and who had got him returned to parliament.	497	America	Locality	Country							United States	USA	-99.41461918999994	39.39870315600007	100	
London	GPE	the lists for first-nights at fashionable theatres in London.	504	London, Greater London, England, GBR	Locality	City				London	Greater London	England	United Kingdom	GBR	-0.12769887399997515	51.507408346000034	100	
Northborough	GPE	Hemming, the man who's just got in for Northborough. They say he's going to marry her.	507	Northborough, MA, USA	Locality	City				Northborough	Worcester County	Massachusetts	United States	USA	-71.65479999999997	42.31098000000003	100	
America	GPE	it would be on the day of his return from America.	508	America	Locality	Country							United States	USA	-99.41461918999994	39.39870315600007	100	
Lancashire	GPE	-law. They say she's got a strong Lancashire accent,’ he concluded in his most malicious and	509	Lancashire, England, GBR	Locality	Zone						England	United Kingdom	GBR	-2.63000999999997	53.84331000000003	100	
Lancashire	GPE	brushed her elbow as he passed her unwittingly with the Lancashire heiress. The girl, Mary could see, wore	515	Lancashire, England, GBR	Locality	Zone						England	United Kingdom	GBR	-2.63000999999997	53.84331000000003	100	
London	GPE	doctor, frowning. ‘You live too much in London. There is too much strain on the nervous system	518	London, Greater London, England, GBR	Locality	City				London	Greater London	England	United Kingdom	GBR	-0.12769887399997515	51.507408346000034	100	
London	GPE	she rose to go. ‘I cannot leave London now; and I don't see any prospect of	523	London, Greater London, England, GBR	Locality	City				London	Greater London	England	United Kingdom	GBR	-0.12769887399997515	51.507408346000034	100	
St. James's	GPE	‘Spesh—shul!—Globe piper—St. James's Gizett—Pall Mall,’ shouted a newsboy in	527	St James's, City of Westminster, Greater London, England, GBR	Locality	District				City of Westminster	Greater London	England	United Kingdom	GBR	-0.13831404699993755	51.50789205900003	100	
London	GPE	in blue or red letters, spattered and stained with London mud, the posters of the evening newspapers:—‘The Great Divorce	527	London, Greater London, England, GBR	Locality	City				London	Greater London	England	United Kingdom	GBR	-0.12769887399997515	51.507408346000034	100	
England	GPE	the Blaythewaite scandal hung, like a pestilence, over England. Like some foul miasma, it poisoned everything.	527	England, GBR	Locality	State or Province						England	United Kingdom	GBR	-1.4586284489999457	52.59274188900008	100	
England	GPE	. Must be fit to go into every parsonage in England. Remember that you write chiefly for healthy English homes	538	England, GBR	Locality	State or Province						England	United Kingdom	GBR	-1.4586284489999457	52.59274188900008	100	
Londoner	GPE	‘Oh, she's not a Londoner. Came from Sussex five or six years ago.	586	Londoner, Rockport, MA, USA	POI	Island				Rockport	Essex County	Massachusetts	United States	USA	-70.56596999999994	42.63498000000004	100	
Sussex	GPE	Oh, she's not a Londoner. Came from Sussex five or six years ago.’	586	Sussex, NB, CAN	Locality	City				Sussex	Kings County	New Brunswick	Canada	CAN	-65.51087299999995	45.723648000000026	100	
Paris	GPE	replied the lady, with a complacent survey of her Paris frock and her somewhat obvious charms in the huge gilt	599	Paris, Île-de-France, FRA	Locality	City				Paris	Paris	Île-de-France	France	FRA	2.3616573370000538	48.86369757600005	100	
India	GPE	looking somewhat pale and worn; a young A.D.C. from India, with a crooked line of sunburn across his forehead	600	India	Locality	Country							India	IND	79.44332654800007	23.379379735000043	100	
London	GPE	his forehead, and a naïve enthusiasm for the two London beauties; and the Attorney-General, famous for	600	London, Greater London, England, GBR	Locality	City				London	Greater London	England	United Kingdom	GBR	-0.12769887399997515	51.507408346000034	100	
Whitechapel	GPE	, or poking about in those horrible smelling streets in Whitechapel?’	601	Whitechapel, Tower Hamlets, Greater London, England, GBR	Locality	District				Tower Hamlets	Greater London	England	United Kingdom	GBR	-0.06907257799997524	51.51636757400007	100	
Brussels	GPE	face growing white. ‘I thought he was in Brussels? It was in the papers that he had been	606	Brussels, BEL	Locality	City				Brussels	Brussels	Brussels	Belgium	BEL	4.406264339000074	50.89806471000003	100	
Brussels	GPE	in the papers that he had been sent for from Brussels.’	606	Brussels, BEL	Locality	City				Brussels	Brussels	Brussels	Belgium	BEL	4.406264339000074	50.89806471000003	100	
London	GPE	now. She could not leave the room without all London knowing that—	609	London, Greater London, England, GBR	Locality	City				London	Greater London	England	United Kingdom	GBR	-0.12769887399997515	51.507408346000034	100	
Dover	GPE	'm so sorry; the boat was late getting into Dover, and I've only just got here,’	610	Dover, Kent, England, GBR	Locality	City				Dover	Kent	England	United Kingdom	GBR	1.3084585650000236	51.12814449600006	100	
rôle	GPE	Dunlop Strange was popular with great ladies); the rôle, three-parts confessor and one-fourth adorer	614	Role, Łuków (Gmina), Powiat Łukowski, Woj. Lubelskie, POL	Locality	District				Łuków (Gmina)	Powiat Łukowski	Woj. Lubelskie	Polska	POL	22.415550000000053	51.97489000000007	100	
London	GPE	to make him one of the most envied men in London.	614	London, Greater London, England, GBR	Locality	City				London	Greater London	England	United Kingdom	GBR	-0.12769887399997515	51.507408346000034	100	
Cambridgeshire	GPE	an attentive ear to his neighbour's confidences about the Cambridgeshire, and how much ‘ready cash’ she expected	620	Cambridgeshire, England, GBR	Locality	Zone						England	United Kingdom	GBR	0.004330000000038581	52.367170000000044	100	
Sussex	GPE	shall be decently buried in the little country churchyard in Sussex, in the village where she used to live.	635	Sussex, NB, CAN	Locality	City				Sussex	Kings County	New Brunswick	Canada	CAN	-65.51087299999995	45.723648000000026	100	
London	GPE	when he was positively given up by every doctor in London. And they say the poor young man had led	694	London, Greater London, England, GBR	Locality	City				London	Greater London	England	United Kingdom	GBR	-0.12769887399997515	51.507408346000034	100	
Northborough	GPE	her heart, was from Vincent, and bore a Northborough post-mark. Going to the window, she	724	Northborough, MA, USA	Locality	City				Northborough	Worcester County	Massachusetts	United States	USA	-71.65479999999997	42.31098000000003	100	
Northborough	GPE	forward in the failing light and broke the seal. Northborough, Dec. 3rd. ‘MY DEAR MARY,—You are perhaps	724	Northborough, MA, USA	Locality	City				Northborough	Worcester County	Massachusetts	United States	USA	-71.65479999999997	42.31098000000003	100	
Northborough	GPE	Northborough, Dec. 3rd.	725	Northborough, MA, USA	Locality	City				Northborough	Worcester County	Massachusetts	United States	USA	-71.65479999999997	42.31098000000003	100	
Belgravia	GPE	five years; no one could have the megrims in Belgravia or Mayfair without consulting Sir Dunlop Strange. Reports of	760	Belgravia, City of Westminster, Greater London, England, GBR	Locality	District				City of Westminster	Greater London	England	United Kingdom	GBR	-0.151303569999925	51.49672173600004	100	
London	GPE	, Mrs. Vincent Hemming had not made herself popular in London society, and her husband had always a somewhat uneasy	763	London, Greater London, England, GBR	Locality	City				London	Greater London	England	United Kingdom	GBR	-0.12769887399997515	51.507408346000034	100	
Haslemere	GPE	in that pine-y, heathery place, at Haslemere, where we went before you sailed—’	789	Haslemere, Waverley, Surrey, England, GBR	Locality	City				Waverley	Surrey	England	United Kingdom	GBR	-0.7095744139999738	51.08765515200008	100	
Paris	GPE	I shall catch that, and go straight through to Paris. Mary, dear child,’ he said,	812	Paris, Île-de-France, FRA	Locality	City				Paris	Paris	Île-de-France	France	FRA	2.3616573370000538	48.86369757600005	100	
France	GPE	to you. We—we could live somewhere in France,’ he went on, frowning slightly, ‘	814	France	Locality	Country							France	FRA	2.5505399530000545	46.55941704400004	100	
Hampstead	GPE	gardens. She would walk on until she came to Hampstead. Up there, there was space, distance;	828	Hampstead, QC, CAN	Locality	City				Hampstead	Communauté-Urbaine-de-Montréal	Québec	Canada	CAN	-73.64813499999997	45.480765000000076	100	
Paris	GPE	gas-lamp—how they always reminded her of Paris: of Paris, where they might have been on	829	Paris, Île-de-France, FRA	Locality	City				Paris	Paris	Île-de-France	France	FRA	2.3616573370000538	48.86369757600005	100	
Paris	GPE	—how they always reminded her of Paris: of Paris, where they might have been on their way by	829	Paris, Île-de-France, FRA	Locality	City				Paris	Paris	Île-de-France	France	FRA	2.3616573370000538	48.86369757600005	100	
London	GPE	her heart against him, in a road in a London suburb. On each side was the prosperous, orderly	829	London, Greater London, England, GBR	Locality	City				London	Greater London	England	United Kingdom	GBR	-0.12769887399997515	51.507408346000034	100	
London	GPE	light. A faint chirruping of birds began, though London still lay mute, but soon the bird-chorus	847	London, Greater London, England, GBR	Locality	City				London	Greater London	England	United Kingdom	GBR	-0.12769887399997515	51.507408346000034	100	
Paris	GPE	to his wife. Yes, he would go to Paris, and then he would go back to domesticity in	851	Paris, Île-de-France, FRA	Locality	City				Paris	Paris	Île-de-France	France	FRA	2.3616573370000538	48.86369757600005	100	
London	GPE	out of the great sea of dwellings. It was London that lay stretched out at her feet; majestic,	861	London, Greater London, England, GBR	Locality	City				London	Greater London	England	United Kingdom	GBR	-0.12769887399997515	51.507408346000034	100	
London	GPE	; majestic, awe-inspiring, inexorable, triumphant London.	861	London, Greater London, England, GBR	Locality	City				London	Greater London	England	United Kingdom	GBR	-0.12769887399997515	51.507408346000034	100	
