Location	ent_type	context	p_no	LongLabel	Addr_type	Type	StAddr	StName	AddNum	City	Subregion	Region	CntryName	Country	x	y	score	error
Baden	GPE	for it. We have gained on the Prince of Baden, who is no more than two stages ahead.	1273	Baden, Niederösterreich, AUT	Locality	City				Baden	Baden	Niederösterreich	Österreich	AUT	16.232610000000022	48.006440000000055	100	
Clementina	GPE	Clementina and Mrs. Misset descended and supped in company with Gaydon	1274	Clementina, São Paulo, BRA	Locality	City				Clementina		São Paulo	Brasil	BRA	-50.44874999999996	-21.558869999999956	100	
Baden	GPE	, and if they had gained on the Prince of Baden, their pursuers had no less certainly gained on them	1274	Baden, Niederösterreich, AUT	Locality	City				Baden	Baden	Niederösterreich	Österreich	AUT	16.232610000000022	48.006440000000055	100	
Clementina	GPE	""" exclaimed Wogan; and looking up he saw that Clementina was watching him with a strange intentness. Her eyes"	1275	Clementina, São Paulo, BRA	Locality	City				Clementina		São Paulo	Brasil	BRA	-50.44874999999996	-21.558869999999956	100	
Tyrol	GPE	""" and he filled a glass half full with red Tyrol wine from the bottle at his elbow."	1290	Tyrol, AUT	Locality	Zone							Österreich	AUT	11.500000000000057	47.00000000000006	100	
Germany	GPE	"""I am the thirstiest man in all Germany,"" said he, and he took a gulp"	1293	Germany	Locality	Country							Federal Republic of Germany	DEU	10.39227793200007	51.11063104900006	100	
Baden	GPE	had ridden had first been tired by the Prince of Baden, and then had the last spark of fire flogged	1298	Baden, Niederösterreich, AUT	Locality	City				Baden	Baden	Niederösterreich	Österreich	AUT	16.232610000000022	48.006440000000055	100	
Trent	GPE	"""To Innspruck; we're from Trent,"" said Misset, boldly."	1301	Trent, Trento, ITA	Locality	City				Trent	Trento	Trentin	Italia	ITA	11.121080000000063	46.06787000000003	100	
Strasbourg	GPE	the water-bottle. It was full of burnt Strasbourg brandy, of double strength. It is as potent	1328	Strasbourg, Bas-Rhin, Grand Est, FRA	Locality	City				Strasbourg	Bas-Rhin	Grand Est	France	FRA	7.752005015000066	48.57334029100008	100	
berlin	GPE	with word that horses were already being harnessed to the berlin. Wogan explained their predicament.	1330	Berlin, DEU	Locality	City				Berlin	Berlin	Berlin	Deutschland	DEU	13.376910000000066	52.51604000000003	100	
Bologna	GPE	"Gaydon and himself. ""When the Princess drives into Bologna, Charles Wogan, who first had the high heart"	1332	Bologna, ITA	Locality	City				Bologna	Bologna	Emilia Romagna	Italia	ITA	11.345070000000021	44.50484000000006	100	
berlin	GPE	The berlin was brought round to the door; the Princess,	1335	Berlin, DEU	Locality	City				Berlin	Berlin	Berlin	Deutschland	DEU	13.376910000000066	52.51604000000003	100	
Clementina	GPE	with him a muff, and he slipped it over Clementina's feet to keep her warm during the night;	1335	Clementina, São Paulo, BRA	Locality	City				Clementina		São Paulo	Brasil	BRA	-50.44874999999996	-21.558869999999956	100	
berlin	GPE	upon the road; he had a vision of the berlin thundering through the night with a trail of sparks from	1335	Berlin, DEU	Locality	City				Berlin	Berlin	Berlin	Deutschland	DEU	13.376910000000066	52.51604000000003	100	
berlin	GPE	her sentinel was watchful and alert. Three times the berlin stopped for a change of horses; and on each	1336	Berlin, DEU	Locality	City				Berlin	Berlin	Berlin	Deutschland	DEU	13.376910000000066	52.51604000000003	100	
Italy	GPE	"""Not till we reach Italy,"" he replied; and with the confidence of"	1338	Italy	Locality	Country							Italian Republic	ITA	12.833330000000046	42.833330000000046	100	
berlin	GPE	. The grey light of the morning stole into the berlin and revealed to her the erect and tireless figure of	1338	Berlin, DEU	Locality	City				Berlin	Berlin	Berlin	Deutschland	DEU	13.376910000000066	52.51604000000003	100	
Monte Scanupia	GPE	-ridge, away to the towering limestone cliffs of Monte Scanupia; on her right, the white peaks of the	1338															nothing found
Italy	GPE	"""This is Italy,"" she cried."	1339	Italy	Locality	Country							Italian Republic	ITA	12.833330000000046	42.833330000000046	100	
Italy	GPE	"""But the Emperor's Italy,"" answered Wogan; and at half-past"	1340	Italy	Locality	Country							Italian Republic	ITA	12.833330000000046	42.833330000000046	100	
Trent	GPE	that morning the carriage stopped in the public square of Trent. As Wogan stepped onto the ground, he saw	1340	Trent, Trento, ITA	Locality	City				Trent	Trento	Trentin	Italia	ITA	11.121080000000063	46.06787000000003	100	
Baden	GPE	too, the sound of wheels. The Prince of Baden had that instant driven away, and he had taken	1340	Baden, Niederösterreich, AUT	Locality	City				Baden	Baden	Niederösterreich	Österreich	AUT	16.232610000000022	48.006440000000055	100	
Trent	GPE	"""I dare not. My face is known in Trent, though this is the first time ever I saw"	1342	Trent, Trento, ITA	Locality	City				Trent	Trento	Trentin	Italia	ITA	11.121080000000063	46.06787000000003	100	
Baden	GPE	stable, from inn to inn. The Prince of Baden had hired thirty-six horses; six more were	1343	Baden, Niederösterreich, AUT	Locality	City				Baden	Baden	Niederösterreich	Österreich	AUT	16.232610000000022	48.006440000000055	100	
Clementina	GPE	Wogan's vain search,—two hours of daylight, during which Clementina had sat in an unharnessed carriage in the market square	1343	Clementina, São Paulo, BRA	Locality	City				Clementina		São Paulo	Brasil	BRA	-50.44874999999996	-21.558869999999956	100	
Strasbourg	GPE	her face. Wogan himself had bought that cloak in Strasbourg to guard his Princess from the cold of the Brenner	1343	Strasbourg, Bas-Rhin, Grand Est, FRA	Locality	City				Strasbourg	Bas-Rhin	Grand Est	France	FRA	7.752005015000066	48.57334029100008	100	
Italy	GPE	Count of Cernes has business of the last importance in Italy, and begs permission, since the Prince of Baden	1345	Italy	Locality	Country							Italian Republic	ITA	12.833330000000046	42.833330000000046	100	
Baden	GPE	Italy, and begs permission, since the Prince of Baden has hired every post-horse in the town,	1345	Baden, Niederösterreich, AUT	Locality	City				Baden	Baden	Niederösterreich	Österreich	AUT	16.232610000000022	48.006440000000055	100	
Strasbourg	GPE	"""He has set out from Strasbourg with that aim."""	1360	Strasbourg, Bas-Rhin, Grand Est, FRA	Locality	City				Strasbourg	Bas-Rhin	Grand Est	France	FRA	7.752005015000066	48.57334029100008	100	
Baden	GPE	He would have her formally betrothed to the Prince of Baden before Charles Wogan is caught and hanged sky-high	1362	Baden, Niederösterreich, AUT	Locality	City				Baden	Baden	Niederösterreich	Österreich	AUT	16.232610000000022	48.006440000000055	100	
Italy	GPE	-high. Therefore, since I was pressing into Italy, he charged me with this message to the Prince	1362	Italy	Locality	Country							Italian Republic	ITA	12.833330000000046	42.833330000000046	100	
Baden	GPE	he charged me with this message to the Prince of Baden. Now observe this, if you please. Suppose	1362	Baden, Niederösterreich, AUT	Locality	City				Baden	Baden	Niederösterreich	Österreich	AUT	16.232610000000022	48.006440000000055	100	
berlin	GPE	about her face and take the air; for the berlin was on the road from Trent to Roveredo.	1363	Berlin, DEU	Locality	City				Berlin	Berlin	Berlin	Deutschland	DEU	13.376910000000066	52.51604000000003	100	
Trent	GPE	air; for the berlin was on the road from Trent to Roveredo.	1363	Trent, Trento, ITA	Locality	City				Trent	Trento	Trentin	Italia	ITA	11.121080000000063	46.06787000000003	100	
Italy	GPE	the glow of the sun upon a country which was Italy in all but name, raised them all to the	1364	Italy	Locality	Country							Italian Republic	ITA	12.833330000000046	42.833330000000046	100	
Clementina	GPE	Wogan looked so woe-begone under this reproof that Clementina suddenly broke out into a laugh, and so showed	1377	Clementina, São Paulo, BRA	Locality	City				Clementina		São Paulo	Brasil	BRA	-50.44874999999996	-21.558869999999956	100	
them,—an	GPE	of his campaigns; and so the evening came upon them,—an evening of stars and mysterious quiet and a clear,	1377	Le Theman, 31 Rue Centrale, 50340, Les Pieux, Manche, Normandie, FRA	POI	Creperie	31 Rue Centrale	Centrale	31	Les Pieux	Manche	Normandie	France	FRA	-1.8070899999999597	49.51403000000005	82.77	
berlin	GPE	village twinkling like so many golden candles. But the berlin, which had drawn them so stoutly over these rugged	1378	Berlin, DEU	Locality	City				Berlin	Berlin	Berlin	Deutschland	DEU	13.376910000000066	52.51604000000003	100	
Clementina	GPE	The axle-tree was broken. He saw that Clementina was about to follow him.	1379	Clementina, São Paulo, BRA	Locality	City				Clementina		São Paulo	Brasil	BRA	-50.44874999999996	-21.558869999999956	100	
berlin	GPE	left the postillion to make what he could of the berlin and walked forward in the clear night to Ala. The	1390	Berlin, DEU	Locality	City				Berlin	Berlin	Berlin	Deutschland	DEU	13.376910000000066	52.51604000000003	100	
Ala.	GPE	the berlin and walked forward in the clear night to Ala. The shock of the tumble had alarmed Mrs. Misset;	1390	Alabama, USA	Locality	State or Province						Alabama	United States	USA	-86.84028685899995	32.766542541000035	100	
berlin	GPE	Forty-eight hours had passed since the berlin left Innspruck. Twenty-four hours ago Clementina knew	1391	Berlin, DEU	Locality	City				Berlin	Berlin	Berlin	Deutschland	DEU	13.376910000000066	52.51604000000003	100	
Innspruck	GPE	Forty-eight hours had passed since the berlin left Innspruck. Twenty-four hours ago Clementina knew Wogan's	1391	Innsbruck, Innsbruck-Stadt, Tirol, AUT	Locality	City				Innsbruck	Innsbruck-Stadt	Tirol	Österreich	AUT	11.391300000000058	47.26800000000003	90	
Baden	GPE	necessary five miles into Venetian territory. The Prince of Baden was still ahead of them, however. The inn	1392	Baden, Niederösterreich, AUT	Locality	City				Baden	Baden	Niederösterreich	Österreich	AUT	16.232610000000022	48.006440000000055	100	
Italy	GPE	"""The rider comes from Italy,"" said Clementina. ""But he might have"	1400	Italy	Locality	Country							Italian Republic	ITA	12.833330000000046	42.833330000000046	100	
Clementina	GPE	"light falls on your face;"" and he drew Clementina into the shadow of the wall. But at the"	1405	Clementina, São Paulo, BRA	Locality	City				Clementina		São Paulo	Brasil	BRA	-50.44874999999996	-21.558869999999956	100	
Austria	GPE	"""He rides into Austria!"" said he. ""He rides to Trent"	1406	Austria	Locality	Country							Austria	AUT	14.137076948000072	47.58581000500004	100	
Italy	GPE	a little village ten miles from Ala, but in Italy. At Peri, Mrs. Misset and her husband were	1409	Italy	Locality	Country							Italian Republic	ITA	12.833330000000046	42.833330000000046	100	
Bologna	GPE	and from Peri they could travel by slow stages to Bologna. The tears flowed from Clementina's eyes when she	1409	Bologna, ITA	Locality	City				Bologna	Bologna	Emilia Romagna	Italia	ITA	11.345070000000021	44.50484000000006	100	
Clementina	GPE	by slow stages to Bologna. The tears flowed from Clementina's eyes when she took her farewell of her little	1409	Clementina, São Paulo, BRA	Locality	City				Clementina		São Paulo	Brasil	BRA	-50.44874999999996	-21.558869999999956	100	
Italy	GPE	. They were alone and together on the road to Italy. That embarrassment from which Wogan's confession of fear	1410	Italy	Locality	Country							Italian Republic	ITA	12.833330000000046	42.833330000000046	100	
Italy	GPE	"""The gateway of Italy,"" answered Wogan; and he drew the lash"	1414	Italy	Locality	Country							Italian Republic	ITA	12.833330000000046	42.833330000000046	100	
Clementina	GPE	the day when he had first conceived the rescue of Clementina. And the rescue had been effected, and here	1417	Clementina, São Paulo, BRA	Locality	City				Clementina		São Paulo	Brasil	BRA	-50.44874999999996	-21.558869999999956	100	
Austria	GPE	been effected, and here was Clementina safe out of Austria, and Wogan sure of a deathless renown, of	1417	Austria	Locality	Country							Austria	AUT	14.137076948000072	47.58581000500004	100	
Clementina	GPE	Clementina was the first to perceive that her behaviour fell below	1421	Clementina, São Paulo, BRA	Locality	City				Clementina		São Paulo	Brasil	BRA	-50.44874999999996	-21.558869999999956	100	
Italy	GPE	behaviour fell below the occasion. She was safe in Italy, journeying henceforward safely to her betrothed. She spurred	1421	Italy	Locality	Country							Italian Republic	ITA	12.833330000000046	42.833330000000046	100	
Clementina	GPE	calling the villagers to Mass. Wogan spoke but once to Clementina, and then only to point out a wooden hut	1423	Clementina, São Paulo, BRA	Locality	City				Clementina		São Paulo	Brasil	BRA	-50.44874999999996	-21.558869999999956	100	
Monte Lessini	GPE	wooden hut which stood picturesquely on a wooded bluff of Monte Lessini, high up upon the left. A narrow gorge	1423	Monti Lessini, ITA	POI	Mountain Range						Veneto	Italia	ITA	11.216670000000022	45.68333000000007	93	
Silesia	GPE	this girl bred in the rugged country-side of Silesia than even Wogan was aware of, and during the	1428	Silesia, POL	Locality	Zone							Poland	POL	18.000000000000057	51.00000000000006	100	
Baden	GPE	fixedly towards her. The man was the Prince of Baden. Had he recognised her? She peered between her	1429	Baden, Niederösterreich, AUT	Locality	City				Baden	Baden	Niederösterreich	Österreich	AUT	16.232610000000022	48.006440000000055	100	
Baden	GPE	Wogan understood her. The Prince of Baden must not know that she had come to Peri escorted	1435	Baden, Niederösterreich, AUT	Locality	City				Baden	Baden	Niederösterreich	Österreich	AUT	16.232610000000022	48.006440000000055	100	
Baden	GPE	", ""and a better lodging than the Prince of Baden can look back upon, though he pay never so"	1438	Baden, Niederösterreich, AUT	Locality	City				Baden	Baden	Niederösterreich	Österreich	AUT	16.232610000000022	48.006440000000055	100	
wakefully	GPE	for it. Poor man, he will have slept wakefully this night! Here, sir, you will find	1438															nothing found
Clementina	GPE	the afternoon to lay the table for dinner and saw Clementina standing wistfully at the window with her eyes upon that	1442	Clementina, São Paulo, BRA	Locality	City				Clementina		São Paulo	Brasil	BRA	-50.44874999999996	-21.558869999999956	100	
Italy	GPE	gentlemen travelling for their pleasure passed down the road into Italy. Mr. Wogan saw them not, or saw them	1442	Italy	Locality	Country							Italian Republic	ITA	12.833330000000046	42.833330000000046	100	
Clementina	GPE	soon as she had left the room Wogan asked of Clementina,—	1451	Clementina, São Paulo, BRA	Locality	City				Clementina		São Paulo	Brasil	BRA	-50.44874999999996	-21.558869999999956	100	
Italy	GPE	have it in mind to snatch your Highness out of Italy even as I did out of Austria; and of	1459	Italy	Locality	Country							Italian Republic	ITA	12.833330000000046	42.833330000000046	100	
Austria	GPE	Highness out of Italy even as I did out of Austria; and of a truth it would be the easier	1459	Austria	Locality	Country							Austria	AUT	14.137076948000072	47.58581000500004	100	
Verona	GPE	"message behind for Mrs. Misset and wait for her in Verona."""	1460	Verona, ITA	Locality	City				Verona	Verona	Veneto	Italia	ITA	10.991710000000069	45.43831000000006	100	
Clementina	GPE	said, meaning not to sleep at all, as Clementina very well understood. She leaned over the balustrade by	1471	Clementina, São Paulo, BRA	Locality	City				Clementina		São Paulo	Brasil	BRA	-50.44874999999996	-21.558869999999956	100	
Italy	GPE	to you. We are safe; we are in Italy. The stars tell me so. Let me watch	1472	Italy	Locality	Country							Italian Republic	ITA	12.833330000000046	42.833330000000046	100	
Ala.	GPE	her so tenderly in his arms on the road to Ala.	1472	Alabama, USA	Locality	State or Province						Alabama	United States	USA	-86.84028685899995	32.766542541000035	100	
Ala.	GPE	who had spurred past the doorway of the inn at Ala. He knew now why he had thought to recognise it	1483	Alabama, USA	Locality	State or Province						Alabama	United States	USA	-86.84028685899995	32.766542541000035	100	
Italy	GPE	one of anger,—because he had seen Clementina and himself in Italy? He had spurred onwards—towards Trent? There	1483	Italy	Locality	Country							Italian Republic	ITA	12.833330000000046	42.833330000000046	100	
Stuttgart	GPE	and put to death, at a wayside inn outside Stuttgart, one Anton Gans, servant to the Countess of	1497	Stuttgart, Baden-Württemberg, DEU	Locality	City				Stuttgart	Stuttgart	Baden-Württemberg	Deutschland	DEU	9.172030000000063	48.76778000000007	100	
Venice	GPE	"Wogan, ""that the Emperor's warrant runs in Venice?"""	1503	Venice, CA, USA	Locality	City				Venice	Los Angeles County	California	United States	USA	-118.47214999999994	33.987540000000024	100	
Venice	GPE	"""Because the Emperor's arm strikes in Venice,"" cried the hindermost again, and he pushed"	1504	Venice, CA, USA	Locality	City				Venice	Los Angeles County	California	United States	USA	-118.47214999999994	33.987540000000024	100	
Trent	GPE	Mr. Harry Whittington knocked at the Governor's door in Trent and told the poor gout-ridden man that the	1523	Trent, Trento, ITA	Locality	City				Trent	Trento	Trentin	Italia	ITA	11.121080000000063	46.06787000000003	100	
Ala.	GPE	"Mr. Wogan had put up at the Cervo Inn at Ala."""	1523	Alabama, USA	Locality	State or Province						Alabama	United States	USA	-86.84028685899995	32.766542541000035	100	
Venice	GPE	hidden amongst vines, through lighted cities, down to Venice and the sea. If one could travel it,	1543	Venice, CA, USA	Locality	City				Venice	Los Angeles County	California	United States	USA	-118.47214999999994	33.987540000000024	100	
Ohlau	GPE	"me some hint at Innspruck of an adventurous ride from Ohlau,"" and she drew her breath sharply at the"	1547	Ohlau, Oławski, Lower Silesia, POL	Locality	City				Oława	Oławski	Lower Silesia	Polen	POL	17.29260000000005	50.946600000000046	100	
Strasbourg	GPE	"all its associations struck her a blow, ""into Strasbourg. Tell me its history. So will this hour"	1547	Strasbourg, Bas-Rhin, Grand Est, FRA	Locality	City				Strasbourg	Bas-Rhin	Grand Est	France	FRA	7.752005015000066	48.57334029100008	100	
Stuttgart	GPE	his escape from the inn a mile or so beyond Stuttgart. He described how he hid in the garden,	1548	Stuttgart, Baden-Württemberg, DEU	Locality	City				Stuttgart	Stuttgart	Baden-Württemberg	Deutschland	DEU	9.172030000000063	48.76778000000007	100	
Clementina	GPE	"the Duke of Würtemberg,"" Wogan explained, and Clementina nodded."	1571	Clementina, São Paulo, BRA	Locality	City				Clementina		São Paulo	Brasil	BRA	-50.44874999999996	-21.558869999999956	100	
Königsmarck	GPE	"""I sat alone, feeling the ghost of Königsmarck in the room with me,"" he resumed quickly"	1578	Königsmark, Osterburg (Altmark), Sachsen-Anhalt, DEU	Locality	District				Osterburg (Altmark)	Stendal	Sachsen-Anhalt	Deutschland	DEU	11.839240000000075	52.80093000000005	92.18	
Stuttgart	GPE	the window, as it spread over the lawn beyond Stuttgart, I remembered Otto von Ahlen and his talk of	1586	Stuttgart, Baden-Württemberg, DEU	Locality	City				Stuttgart	Stuttgart	Baden-Württemberg	Deutschland	DEU	9.172030000000063	48.76778000000007	100	
Königsmarck	GPE	", I remembered Otto von Ahlen and his talk of Königsmarck. I tried to hear the menaces."""	1586	Königsmark, Osterburg (Altmark), Sachsen-Anhalt, DEU	Locality	District				Osterburg (Altmark)	Stendal	Sachsen-Anhalt	Deutschland	DEU	11.839240000000075	52.80093000000005	92.18	
Ala.	GPE	"in my arms beneath the stars upon the road to Ala."""	1588	Alabama, USA	Locality	State or Province						Alabama	United States	USA	-86.84028685899995	32.766542541000035	100	
London	GPE	a flight which would make her name a byword from London to Budapest, that he could envisage; but that	1598	London, Greater London, England, GBR	Locality	City				London	Greater London	England	United Kingdom	GBR	-0.12769887399997515	51.507408346000034	100	
Budapest	GPE	which would make her name a byword from London to Budapest, that he could envisage; but that this blood	1598	Budapest, HUN	Locality	City				Budapest	Budapest	Budapest	Magyarország	HUN	19.055080000000032	47.49972000000008	100	
Poland	GPE	"exclaimed, and with an emphasis of despair, ""Poland's King! But I was mad! Indeed,"	1601	Poland	Locality	Country							Poland	POL	19.39876898600005	52.12379015400006	100	
Bologna	GPE	"""Yes,"" she answered. ""There is Bologna. Say that Bologna is our goal. I shall"	1607	Bologna, ITA	Locality	City				Bologna	Bologna	Emilia Romagna	Italia	ITA	11.345070000000021	44.50484000000006	100	
Bologna	GPE	"she answered. ""There is Bologna. Say that Bologna is our goal. I shall go with you to"	1607	Bologna, ITA	Locality	City				Bologna	Bologna	Emilia Romagna	Italia	ITA	11.345070000000021	44.50484000000006	100	
Bologna	GPE	is our goal. I shall go with you to Bologna. There is Venice and the sea. Bid me	1607	Bologna, ITA	Locality	City				Bologna	Bologna	Emilia Romagna	Italia	ITA	11.345070000000021	44.50484000000006	100	
Venice	GPE	I shall go with you to Bologna. There is Venice and the sea. Bid me go, then;	1607	Venice, CA, USA	Locality	City				Venice	Los Angeles County	California	United States	USA	-118.47214999999994	33.987540000000024	100	
Bologna	GPE	"""We travel to Bologna,"" said he. ""I will not have"	1616	Bologna, ITA	Locality	City				Bologna	Bologna	Emilia Romagna	Italia	ITA	11.345070000000021	44.50484000000006	100	
Bologna	GPE	thus reunited they passed one evening into the streets of Bologna and stopped at the Pilgrim Inn.	1624	Bologna, ITA	Locality	City				Bologna	Bologna	Emilia Romagna	Italia	ITA	11.345070000000021	44.50484000000006	100	
Bologna	GPE	of release but in you. Now I am in Bologna, and free. I could not believe that any	1626	Bologna, ITA	Locality	City				Bologna	Bologna	Emilia Romagna	Italia	ITA	11.345070000000021	44.50484000000006	100	
Ala.	GPE	"shoulders one evening under the stars upon the road to Ala."""	1627	Alabama, USA	Locality	State or Province						Alabama	United States	USA	-86.84028685899995	32.766542541000035	100	
Clementina	GPE	Gaydon had, besides his joy at the rescue of Clementina, a private satisfaction that matters which were none of	1635	Clementina, São Paulo, BRA	Locality	City				Clementina		São Paulo	Brasil	BRA	-50.44874999999996	-21.558869999999956	100	
Bologna	GPE	end to her captivity, now we are safe at Bologna. I have friends here who can serve me so	1637	Bologna, ITA	Locality	City				Bologna	Bologna	Emilia Romagna	Italia	ITA	11.345070000000021	44.50484000000006	100	
Bologna	GPE	""" said Wogan, ""that Farini is now at Bologna."""	1639	Bologna, ITA	Locality	City				Bologna	Bologna	Emilia Romagna	Italia	ITA	11.345070000000021	44.50484000000006	100	
nick	GPE	"""You come in the nick of time,"" replied the Cardinal. ""This"	1640	Nick, Sárvári Járás, Vas, HUN	Locality	City				Nick	Sárvári Járás	Vas	Magyarország	HUN	17.01950000000005	47.40307000000007	100	
Bologna	GPE	"Princess Clementina, is now at the Pilgrim Inn at Bologna."""	1646	Bologna, ITA	Locality	City				Bologna	Bologna	Emilia Romagna	Italia	ITA	11.345070000000021	44.50484000000006	100	
Bologna	GPE	"""In Bologna!"" cried the Cardinal; and he stood frowning"	1647	Bologna, ITA	Locality	City				Bologna	Bologna	Emilia Romagna	Italia	ITA	11.345070000000021	44.50484000000006	100	
Spain	GPE	this most desirable issue. For the King's in Spain. It is that which troubles me. Her Highness	1649	Spain	Locality	Country							Kingdom of Spain	ESP	-3.6460631049999392	40.227949660000036	100	
Bologna	GPE	"is that which troubles me. Her Highness comes to Bologna, and the King's in Spain."""	1649	Bologna, ITA	Locality	City				Bologna	Bologna	Emilia Romagna	Italia	ITA	11.345070000000021	44.50484000000006	100	
Spain	GPE	"Highness comes to Bologna, and the King's in Spain."""	1649	Spain	Locality	Country							Kingdom of Spain	ESP	-3.6460631049999392	40.227949660000036	100	
Spain	GPE	"upon his Eminence. ""Why is the King in Spain?"""	1650	Spain	Locality	Country							Kingdom of Spain	ESP	-3.6460631049999392	40.227949660000036	100	
Cadiz	GPE	"""There is pressing business in Spain,—an expedition from Cadiz. The King's presence there was urged most earnestly"	1651	Cádiz, Andalucía, ESP	Locality	City				Cádiz	Cádiz	Andalucía	España	ESP	-6.290269999999964	36.52988000000005	100	
Spain	GPE	rather feared to guess. The Chevalier's departure to Spain had been a puzzle to him before; he remembered	1656	Spain	Locality	Country							Kingdom of Spain	ESP	-3.6460631049999392	40.227949660000036	100	
Bologna	GPE	"fiercely. ""I brought her out of Innspruck to Bologna. The King must marry the Princess;"" and"	1657	Bologna, ITA	Locality	City				Bologna	Bologna	Emilia Romagna	Italia	ITA	11.345070000000021	44.50484000000006	100	
Bologna	GPE	Wogan rejoiced in the good sense of the citizens of Bologna who could appreciate the great qualities of his chosen woman	1657	Bologna, ITA	Locality	City				Bologna	Bologna	Emilia Romagna	Italia	ITA	11.345070000000021	44.50484000000006	100	
Clementina	GPE	It is possible that they seemed of small account to Clementina now, for though they rang in ears and were	1659	Clementina, São Paulo, BRA	Locality	City				Clementina		São Paulo	Brasil	BRA	-50.44874999999996	-21.558869999999956	100	
Spain	GPE	"""The King is still in Spain, is he not?"""	1661	Spain	Locality	Country							Kingdom of Spain	ESP	-3.6460631049999392	40.227949660000036	100	
Bologna	GPE	. Nor did he appear again for some while in Bologna. Wogan searched for him high and low. Here	1669	Bologna, ITA	Locality	City				Bologna	Bologna	Emilia Romagna	Italia	ITA	11.345070000000021	44.50484000000006	100	
