Location	ent_type	context	p_no	LongLabel	Addr_type	Type	StAddr	StName	AddNum	City	Subregion	Region	CntryName	Country	x	y	score	error
Agra	GPE	The elephant gun popped and the rifle cracked in the Agra's mizen top, and the man at the pirate	1168	Agra, Uttar Pradesh, IND	Locality	City				Agra	Agra	Uttar Pradesh	India	IND	78.00005000000004	27.19219000000004	100	
Agra	GPE	ever: he would soon wear, and cross the Agra's defenceless bows, to rake her fore and aft	1172	Agra, Uttar Pradesh, IND	Locality	City				Agra	Agra	Uttar Pradesh	India	IND	78.00005000000004	27.19219000000004	100	
Long Island	GPE	below him, he saw a vessel running out from Long Island, and coming swiftly up on his lee quarter.	1173	Long Island, BHS	Locality	State or Province						Long Island	Bahamas	BHS	-75.08700499999998	23.112499600000035	100	
Agra	GPE	pirate's bow-chaser, and crashed into the Agra's side, and passed nearly through her.	1184	Agra, Uttar Pradesh, IND	Locality	City				Agra	Agra	Uttar Pradesh	India	IND	78.00005000000004	27.19219000000004	100	
Yankee	GPE	the pirate captain leaning wounded against the mainmast with a Yankee bullet in his shoulder, and his crew uttering yells	1185	Yankee, NM, USA	Locality	Village				Yankee	Colfax County	New Mexico	United States	USA	-104.32906999999994	36.94450000000006	100	
Agra	GPE	a board, lay far nearer the wind than the Agra could, and sailed three feet to her two besides	1185	Agra, Uttar Pradesh, IND	Locality	City				Agra	Agra	Uttar Pradesh	India	IND	78.00005000000004	27.19219000000004	100	
Agra	GPE	wore and fired his bow chasers at the now flying Agra, split one of the carronades in two, and	1201	Agra, Uttar Pradesh, IND	Locality	City				Agra	Agra	Uttar Pradesh	India	IND	78.00005000000004	27.19219000000004	100	
Lascar	GPE	one of the carronades in two, and killed a Lascar, and made a hole in the foresail. This	1201	Lascar, CO, USA	Locality	Village				Lascar	Huerfano County	Colorado	United States	USA	-104.82780999999994	37.82146000000006	100	
Agra	GPE	pirates to windward and the pirates to leeward of the Agra had found out, at one and the same moment	1206	Agra, Uttar Pradesh, IND	Locality	City				Agra	Agra	Uttar Pradesh	India	IND	78.00005000000004	27.19219000000004	100	
Agra	GPE	able villain. Astern the consort thundered; but the Agra's response was a dead silence more awful than broadsides	1207	Agra, Uttar Pradesh, IND	Locality	City				Agra	Agra	Uttar Pradesh	India	IND	78.00005000000004	27.19219000000004	100	
Agra	GPE	gathered way, and their furious consort close on the Agra's heels just then scourged her deck with grape.	1218	Agra, Uttar Pradesh, IND	Locality	City				Agra	Agra	Uttar Pradesh	India	IND	78.00005000000004	27.19219000000004	100	
Sooloos	GPE	parted the races on board her: the Papuans and Sooloos, their black faces livid and blue with horror,	1221															nothing found
Agra	GPE	horrible shrieking yell; wild forms heaped off on the Agra, and were hacked to pieces almost ere they reached	1221	Agra, Uttar Pradesh, IND	Locality	City				Agra	Agra	Uttar Pradesh	India	IND	78.00005000000004	27.19219000000004	100	
Fullalove	GPE	a loud cry of pity and dismay, Sharpe, Fullalove, Kenealy, and others rushed to catch him;	1223	Fullalove Cemetery, Fullalove Cemetery, Keithville, LA, 71047, USA	POI	Cemetery	Fullalove Cemetery	Fullalove Cemetery		Keithville	Caddo Parish	Louisiana	United States	USA	-93.99082699999997	32.23203300000006	78	
Agra	GPE	her blotted-out consort. The group on the Agra's quarter-deck watched her to see what she	1229	Agra, Uttar Pradesh, IND	Locality	City				Agra	Agra	Uttar Pradesh	India	IND	78.00005000000004	27.19219000000004	100	
Agra	GPE	The Agra had, meantime, got a start of more than	1231	Agra, Uttar Pradesh, IND	Locality	City				Agra	Agra	Uttar Pradesh	India	IND	78.00005000000004	27.19219000000004	100	
Agra	GPE	While Dodd was recovering, the Agra was beating westward with light but contrary winds, and	1312	Agra, Uttar Pradesh, IND	Locality	City				Agra	Agra	Uttar Pradesh	India	IND	78.00005000000004	27.19219000000004	100	
Ebony	GPE	favourable circumstances. For instance, secure this worker in Ebony 150 years' life, and he would sign a	1314	EBONY, Tuen Mun, HKG	Locality	Neighborhood				EBONY		Tuen Mun	Hong Kong SAR	HKG	113.99995241941531	22.365686242462345	100	
Young Africa	GPE	breed long heads.” So Vespasian was to engender Young Africa; he was to be first elevated morally and intellectually	1314	Young, Gamagara, John Taolo Gaetsewe, Northern Cape, ZAF	Locality	Village				Gamagara	John Taolo Gaetsewe	Northern Cape	South Africa	ZAF	22.787210000000073	-27.86621999999994	97.68	
Experimentalist	GPE	she would consent to without an illicit connection with the Experimentalist. He would be down on their Pickaninnies before the	1314	Experimental, Calle 6 S, Hipotecho Occidental, Kennedy, Bogotá, D.C., COL	POI	Nightlife	Calle 6 S	6		Bogotá, D.C.	Bogotá, D.C.	Bogotá, D.C.	Colombia	COL	-74.13816999999995	4.618790000000047	82.6	
Young Africa	GPE	the better; make a curious contrast in favour of Young Africa.	1314	Young, Gamagara, John Taolo Gaetsewe, Northern Cape, ZAF	Locality	Village				Gamagara	John Taolo Gaetsewe	Northern Cape	South Africa	ZAF	22.787210000000073	-27.86621999999994	97.68	
Guinea	GPE	to cross the obsequious cuss with the catawamptiousest gal in Guinea, and one that never saw a blacking bottle,	1325	Guinea	Locality	Country							Guinea	GIN	-10.942500889999963	10.435445941000069	100	
Mauritius	GPE	Being now about a hundred miles south of the Mauritius, in fine weather with a light breeze, Dodd	1326	Mauritius	Locality	Country							Mauritius	MUS	57.57181746400005	-20.283556218999934	100	
Agra	GPE	scourging wind, that rose and rose, till the Agra, under the pressure of that single sail treble reefed	1337	Agra, Uttar Pradesh, IND	Locality	City				Agra	Agra	Uttar Pradesh	India	IND	78.00005000000004	27.19219000000004	100	
bawl	GPE	other's ears; and even then they had to bawl.	1340	Bawly, Bavlinskiy rayon, Tatarstan Republic, RUS	Locality	City					Bavlinskiy rayon	Tatarstan Republic	Russland	RUS	53.27195000000006	54.38352000000003	80	
Egypt	GPE	but the miserable deck-lantern—one glowworm in Egypt supernaturally darkened—the Agra never on an even keel	1363	Egypt	Locality	Country							Arab Republic of Egypt	EGY	29.870494860000065	26.512273493000066	100	
Agra	GPE	lantern—one glowworm in Egypt supernaturally darkened—the Agra never on an even keel, and heeling over like	1363	Agra, Uttar Pradesh, IND	Locality	City				Agra	Agra	Uttar Pradesh	India	IND	78.00005000000004	27.19219000000004	100	
Mauritius	GPE	should be about fifty miles to the southward of the Mauritius. God's will be done.”	1367	Mauritius	Locality	Country							Mauritius	MUS	57.57181746400005	-20.283556218999934	100	
Latiner	GPE	“My poor dear creature, I bain't no Latiner,” objected the patient.	1395	Latimer, MS, USA	Locality	Village				Latimer	Jackson County	Mississippi	United States	USA	-88.86556999999999	30.528790000000072	85.71	
Sampson	GPE	you are,” said Maxley, looking full at Sampson and Alfred to point the contradistinction.	1425	Sampson, MO, USA	Locality	Village				Sampson	Webster County	Missouri	United States	USA	-92.84390999999994	37.44086000000004	100	
le souris	GPE	, said confidentially, “Monsieur avait bien raison; le souris a passe: par la.”	1427	La Souris, Sarthe, Loire, FRA	Locality	City				La Souris	Sarthe	Loire	France	FRA	0.23333000000002357	48.033330000000035	100	
Merriment	GPE	—his laugh was a clean spadeful dug out of Merriment. He resumed his gravity and his theme all in	1430	Merriment, 520 Commons Dr, Saint Paul, MN, 55125, USA	POI	Specialty Store	520 Commons Dr	Commons	520	Saint Paul	Washington County	Minnesota	United States	USA	-92.95221699999996	44.93720100000007	100	
Justum	GPE	“Justum ac tenacem propositi virum,” whispered Alfred to Edward	1439	Justus, Scott Twp, PA, USA	Locality	Village				Scott Twp	Lackawanna County	Pennsylvania	United States	USA	-75.63992999999994	41.50218000000007	83.33	
propositi	GPE	“Justum ac tenacem propositi virum,” whispered Alfred to Edward.	1439	The Proposition, 162 11th Ave, New York, NY, 10011, USA	POI	Fitness Center	162 11th Ave	11th	162	New York	New York County	New York	United States	USA	-74.00701399999997	40.74844500000006	82.16	
Agra	GPE	This turned his mind sharply. Suppose the Agra had gone down, the money would be lost as	1457	Agra, Uttar Pradesh, IND	Locality	City				Agra	Agra	Uttar Pradesh	India	IND	78.00005000000004	27.19219000000004	100	
starrn	GPE	'll tell ye. It's meself looked over the starrn just now; and I seen there was no rudder	1465	Starrn, Mühldorf am Inn, Oberneukirchen, Bayern, DEU	POI	Farm				Mühldorf am Inn	Oberbayern	Bayern	Deutschland	DEU	12.497970000000066	48.16688000000005	100	
Yankee	GPE	no more than fair,” said Dodd. The Yankee inventor demanded a spare maincap, and cut away one	1472	Yankee, NM, USA	Locality	Village				Yankee	Colfax County	New Mexico	United States	USA	-104.32906999999994	36.94450000000006	100	
Mauritius	GPE	The breeze was very faint but southerly, and the Mauritius under their lee. They could make it in a	1474	Mauritius	Locality	Country							Mauritius	MUS	57.57181746400005	-20.283556218999934	100	
Agra	GPE	belonged, not to a stranger, but to the Agra herself. There was one of her waterbutts, and	1478	Agra, Uttar Pradesh, IND	Locality	City				Agra	Agra	Uttar Pradesh	India	IND	78.00005000000004	27.19219000000004	100	
waterbutts	GPE	to the Agra herself. There was one of her waterbutts, and a broken mast with some rigging: and	1478	Waterbult, Thabo Mofutsanyana District Municipality, Free State, ZAF	Locality	City				Phumelela	Thabo Mofutsanyana District Municipality	Free State	South Africa	ZAF	29.450000000000045	-27.783329999999978	82	
Agra	GPE	ashore in search of Captain Robarts, and made the Agra over to him in the friendliest way, adding warmly	1513	Agra, Uttar Pradesh, IND	Locality	City				Agra	Agra	Uttar Pradesh	India	IND	78.00005000000004	27.19219000000004	100	
the Isle of	GPE	time; and he ought to have put in to the Isle of France, which would have retarded him: his rope	1524	Isle, MN, USA	Locality	City				Isle	Mille Lacs County	Minnesota	United States	USA	-93.47078999999997	46.138010000000065	99.9	
France	GPE	he ought to have put in to the Isle of France, which would have retarded him: his rope bulwarks	1524	France	Locality	Country							France	FRA	2.5505399530000545	46.55941704400004	100	
Yankee	GPE	, one of the smartest sailors afloat, espied the Yankee makeshift from the quarter-deck of his vessel,	1527	Yankee, NM, USA	Locality	Village				Yankee	Colfax County	New Mexico	United States	USA	-104.32906999999994	36.94450000000006	100	
Salamanca	GPE	from the quarter-deck of his vessel, the Salamanca, fifty guns. In ten minutes he was under	1527	Salamanca, Castilla y León, ESP	Locality	City				Salamanca	Salamanca	Castilla y León	España	ESP	-5.663849999999968	40.964260000000024	100	
Agra	GPE	fifty guns. In ten minutes he was under the Agra's stern inspecting it; then came on board,	1527	Agra, Uttar Pradesh, IND	Locality	City				Agra	Agra	Uttar Pradesh	India	IND	78.00005000000004	27.19219000000004	100	
schoolmen	GPE	hate. And a fruitful cause is jealousy. The schoolmen, or rather certain of the schoolmen—for nothing	1539	Schkölen, Thüringen, DEU	Locality	City				Schkölen	Saale-Holzland-Kreis	Thüringen	Deutschland	DEU	11.823860000000025	51.04156000000006	77.78	
Doddites	GPE	He would get rid of all the Doddites before he sailed. He insulted Mr. Tickell, so	1541	Doddies Creek, SC, USA	POI	Stream					Pickens County	South Carolina	United States	USA	-82.53178999999994	34.92178000000007	70	
St. Helena	GPE	lucky captain, had fair weather all the way to St. Helena.	1542	St Helena	Locality	Country							Saint Helena, Ascension and Tristan da Cunha	SHN	-5.707392691999928	-15.96527132999995	100	
Agra	GPE	. She had left the Cape a week before the Agra. Captain Robarts, with his characteristic good-breeding	1543	Agra, Uttar Pradesh, IND	Locality	City				Agra	Agra	Uttar Pradesh	India	IND	78.00005000000004	27.19219000000004	100	
Agra	GPE	The Agra struck abreast her own forechains on the Salamanca's quarter	1544	Agra, Uttar Pradesh, IND	Locality	City				Agra	Agra	Uttar Pradesh	India	IND	78.00005000000004	27.19219000000004	100	
capstan	GPE	signal halyards and all; others boomed her off with capstan bars, etc., and in two minutes the	1545	Capstan, Kant Road, Fazalpur, Amroha, Jyotiba Phule Nagar, Uttar Pradesh, 244221, IND	POI	Grocery	Kant Road	Kant		Amroha	Jyotiba Phule Nagar	Uttar Pradesh	India	IND	78.46860000000004	28.91184000000004	100	
Agra	GPE	-deck. “Are you the master of the Agra?” (His quick eye had recognised her in	1545	Agra, Uttar Pradesh, IND	Locality	City				Agra	Agra	Uttar Pradesh	India	IND	78.00005000000004	27.19219000000004	100	
Agra	GPE	was soon seen working out towards him, and the Agra brought to. The pilot descended from his lugger into	1562	Agra, Uttar Pradesh, IND	Locality	City				Agra	Agra	Uttar Pradesh	India	IND	78.00005000000004	27.19219000000004	100	
Agra	GPE	customer rejoined, and soon all Billingsgate thundered on the Agra's quarter-deck. Finding, to his infinite	1567	Agra, Uttar Pradesh, IND	Locality	City				Agra	Agra	Uttar Pradesh	India	IND	78.00005000000004	27.19219000000004	100	
Agra	GPE	into his boat, then shook his fist at the Agra, and cursed her captain sky-high. “	1568	Agra, Uttar Pradesh, IND	Locality	City				Agra	Agra	Uttar Pradesh	India	IND	78.00005000000004	27.19219000000004	100	
Fiddlestick	GPE	“Isle of Fiddlestick!” was the polite reply; “Isle of	1592	Fiddlesticks, Cambridge, ON, CAN	Locality	Neighborhood				Cambridge	Waterloo Regional Municipality	Ontario	Canada	CAN	-80.28623199999998	43.39403600000003	93	
St. Katherine's	GPE	Channel, and that the land he had seen was St. Katherine's Point	1593	St Katherines, Aberdeenshire, Scotland, GBR	Locality	Village				St Katherines	Aberdeenshire	Scotland	United Kingdom	GBR	-2.3649755209999626	57.39883026400008	99.99	
Fantoccio	GPE	“What is that Fantoccio dancing at?” inquired Captain Robarts brutally.	1604	Fontocchio, Località Montecchio, 52044, Cortona, Arezzo, ITA	POI	Hotel	Località Montecchio	Montecchio		Cortona	Arezzo	Toscana	Italia	ITA	11.928780000000074	43.23553000000004	82	
Agra	GPE	But at this juncture the ex-captain of the Agra was down in the cabin with his fellow-passengers	1610	Agra, Uttar Pradesh, IND	Locality	City				Agra	Agra	Uttar Pradesh	India	IND	78.00005000000004	27.19219000000004	100	
St. Katherine's	GPE	“St. Katherine's Point lay about eight miles to windward at noon;	1611	St Katherines, Aberdeenshire, Scotland, GBR	Locality	Village				St Katherines	Aberdeenshire	Scotland	United Kingdom	GBR	-2.3649755209999626	57.39883026400008	99.99	
France	GPE	“We are nearer Yarmouth sands than France, I promise you, and nothing under our lee	1613	France	Locality	Country							France	FRA	2.5505399530000545	46.55941704400004	100	
Rotterdam	GPE	promise you, and nothing under our lee nearer than Rotterdam.”	1613	Rotterdam, NLD	Locality	City					Rotterdam	Zuid-Holland	Nederland	NLD	4.487160000000074	51.91438000000005	100	
Yankee	GPE	But now emulation was up, and neither Briton, Yankee, nor negro would give way. A line was	1637	Yankee, NM, USA	Locality	Village				Yankee	Colfax County	New Mexico	United States	USA	-104.32906999999994	36.94450000000006	100	
Agra	GPE	was veiled, and gave the poor souls on the Agra a dim peep of the frail and narrow bridge they	1650	Agra, Uttar Pradesh, IND	Locality	City				Agra	Agra	Uttar Pradesh	India	IND	78.00005000000004	27.19219000000004	100	
Agra	GPE	know, was literally strewed with things out of the Agra; masts, rigging, furniture, tea-chests	1684	Agra, Uttar Pradesh, IND	Locality	City				Agra	Agra	Uttar Pradesh	India	IND	78.00005000000004	27.19219000000004	100	
Dunkirk	GPE	water and all but insensible. The piano landed at Dunkirk three weeks later.	1697	Dunkirk, NY, USA	Locality	City				Dunkirk	Chautauqua County	New York	United States	USA	-79.33577999999994	42.48724000000004	100	
Agra	GPE	By noon the Agra's deck was thirty feet from the sand. The	1704	Agra, Uttar Pradesh, IND	Locality	City				Agra	Agra	Uttar Pradesh	India	IND	78.00005000000004	27.19219000000004	100	
Agra	GPE	“The poor Agra, ma'am! She was such a beautiful sea-	1708	Agra, Uttar Pradesh, IND	Locality	City				Agra	Agra	Uttar Pradesh	India	IND	78.00005000000004	27.19219000000004	100	
Mauritius	GPE	in the straits, and weathered a hurricane off the Mauritius; and after all for a lubber to go and	1708	Mauritius	Locality	Country							Mauritius	MUS	57.57181746400005	-20.283556218999934	100	
Paris	GPE	Colonel Kenealy went off to Paris: “I'll gain that, any way,	1712	Paris, Île-de-France, FRA	Locality	City				Paris	Paris	Île-de-France	France	FRA	2.3616573370000538	48.86369757600005	100	
Agra	GPE	and his comrade, Jacques Moinard, had heard the Agra's gun fired, and came down to batten on	1717	Agra, Uttar Pradesh, IND	Locality	City				Agra	Agra	Uttar Pradesh	India	IND	78.00005000000004	27.19219000000004	100	
Boulogne	GPE	. The only chance he saw was to get to Boulogne in time to catch the Nancy sailing packet; for	1718	Boulogne, Pas-de-Calais, Hauts-de-France, FRA	Locality	City				Boulogne	Pas-de-Calais	Hauts-de-France	France	FRA	1.6139200000000642	50.72571000000005	100	
Boulogne	GPE	packet; for it was her day. But then Boulogne was eight leagues distant, and there was no public	1718	Boulogne, Pas-de-Calais, Hauts-de-France, FRA	Locality	City				Boulogne	Pas-de-Calais	Hauts-de-France	France	FRA	1.6139200000000642	50.72571000000005	100	
Boulogne	GPE	Accordingly he started to walk on the road to Boulogne.	1730	Boulogne, Pas-de-Calais, Hauts-de-France, FRA	Locality	City				Boulogne	Pas-de-Calais	Hauts-de-France	France	FRA	1.6139200000000642	50.72571000000005	100	
Massah Black'—yah	GPE	Missy Beresford donated 'em me. Says she, 'Massah Black'—yah! yah! She always nick-nominates dis child	1735															nothing found
Massa Black	GPE	about coloured skins! I have inspectionated your conduct, Massa Black, and likewise your performances on the slack rope,	1735	Black, MO, USA	Locality	City				Black	Reynolds County	Missouri	United States	USA	-90.93339999999995	37.53246000000007	80	
Boulogne	GPE	David, then, walked towards Boulogne that afternoon a happy man. Already he tasted by	1748	Boulogne, Pas-de-Calais, Hauts-de-France, FRA	Locality	City				Boulogne	Pas-de-Calais	Hauts-de-France	France	FRA	1.6139200000000642	50.72571000000005	100	
Boulogne	GPE	The three reached Boulogne in time for the Nancy, and put Dodd on	1768	Boulogne, Pas-de-Calais, Hauts-de-France, FRA	Locality	City				Boulogne	Pas-de-Calais	Hauts-de-France	France	FRA	1.6139200000000642	50.72571000000005	100	
Paris	GPE	the pair decided to go to the Yankee Paradise—Paris.	1768	Paris, Île-de-France, FRA	Locality	City				Paris	Paris	Île-de-France	France	FRA	2.3616573370000538	48.86369757600005	100	
Barkington	GPE	And when he did wake, he was safe at Barkington.	1771	Barrington, NS, CAN	Locality	Village				Barrington	Shelburne County	Nova Scotia	Canada	CAN	-65.56156099999998	43.56263900000005	91.2	
China	GPE	was safe. When he first sewed It on in China, It seemed secure nowhere except on his own person	1774	China	Locality	Country							China	CHN	103.93002703300004	36.567348398000036	100	
Canton	GPE	CHRONOLOGY.—The Hard Cash sailed from Canton months before the boat race at Henley recorded in Chapter	1777	Canton, Guangzhou, Guangdong, CHN	Locality	City				Guangzhou	Guangzhou	Guangdong	Kina	CHN	113.25000000000011	23.116670000000056	100	
Barkington	GPE	Henley recorded in Chapter I., but it landed in Barkington a fortnight after the last home event I recorded in	1777	Barrington, NS, CAN	Locality	Village				Barrington	Shelburne County	Nova Scotia	Canada	CAN	-65.56156099999998	43.56263900000005	91.2	
Agra	GPE	rail, in hopes there would be something about the Agra; then he could call at Albion Villa. Mrs.	1779	Agra, Uttar Pradesh, IND	Locality	City				Agra	Agra	Uttar Pradesh	India	IND	78.00005000000004	27.19219000000004	100	
England	GPE	and nearer knowin the great secret than any man in England will be this year to live: and sairves the	1836	England, GBR	Locality	State or Province						England	United Kingdom	GBR	-1.4586284489999457	52.59274188900008	100	
brazened	GPE	not attack her for an involuntary fault, she now brazened it out, and said, “Men didn't	1846	Brazenet, 1710 7th St N, Clanton, AL, 35045, USA	POI	Telecom	1710 7th St N	7th	1710	Clanton	Chilton County	Alabama	United States	USA	-86.63700599999999	32.854903000000036	87.5	
Barkington	GPE	almost with emotion. “There ain't many in Barkington as ever done me a good turn, Master Alfred	1848	Barrington, NS, CAN	Locality	Village				Barrington	Shelburne County	Nova Scotia	Canada	CAN	-65.56156099999998	43.56263900000005	91.2	
Canada	GPE	concluded my last chapter, he received a letter from Canada. His wife was out with eggs; so he	1851	Canada	Locality	Country							Canada	CAN	-113.64257999999995	60.108670000000075	100	
sayed	GPE	—dis-honoured—a—bill; and sayed.'” Here she made a full stop.	1851	Sayed, El Masry Street, Warak El Arab, El Waaraq, Giza, EGY	POI	Sports Center	El Masry Street	El Masry		Warak El Arab	El Waaraq	Giza	Arab Republic of Egypt	EGY	31.189530000000047	30.09056000000004	100	
England	GPE	and aid me. Ask yourself whether any man in England needs a confidant more than I. It was bitter at	1921	England, GBR	Locality	State or Province						England	United Kingdom	GBR	-1.4586284489999457	52.59274188900008	100	
England	GPE	children? the best wife and the best mother in England. She has been a true consort to me this	1953	England, GBR	Locality	State or Province						England	United Kingdom	GBR	-1.4586284489999457	52.59274188900008	100	
Canada	GPE	that scrape, and getting him a good place in Canada, and—why, he'd have been put	1993	Canada	Locality	Country							Canada	CAN	-113.64257999999995	60.108670000000075	100	
4,000,l	GPE	Dodd; and was going to let out about the 4,000,l. when he recollected this was the banker's son	2071															nothing found
France	GPE	from Maxley he had been shipwrecked on the coast of France, and lost his chronometer and his sextant, these	2079	France	Locality	Country							France	FRA	2.5505399530000545	46.55941704400004	100	
England	GPE	young things were whirling round, the happiest pair in England.	2088	England, GBR	Locality	State or Province						England	United Kingdom	GBR	-1.4586284489999457	52.59274188900008	100	
apoplexy	GPE	“Out visiting patients when yours came. In apoplexy with a red face and stertorous breathing, put the	2131															nothing found
apoplexy	GPE	give emetic: cure with sulphate of quinine. In apoplexy with a white face, treat as for a simple	2131															nothing found
apoplexy	GPE	misgivings. Osmond reassured her. “Not bleed in apoplexy!” said he superciliously; “why, it	2132															nothing found
Hartshorn	GPE	we must make the best of what is done. Hartshorn! brandy! and caution! For those two assassins	2144	Hartshorn, MO, USA	Locality	City				Hartshorn	Texas County	Missouri	United States	USA	-91.66775999999999	37.26139000000006	100	
France	GPE	but that David had been wrecked on the coast of France, and had fallen down senseless in the street:	2145	France	Locality	Country							France	FRA	2.5505399530000545	46.55941704400004	100	
London	GPE	him Mr. Hardie was not at home; gone to London, he believed. Skinner walked away dejected. What	2239	London, Greater London, England, GBR	Locality	City				London	Greater London	England	United Kingdom	GBR	-0.12769887399997515	51.507408346000034	100	
Providence	GPE	I believe my daughter Jane is right, and that Providence really interferes sometimes in the affairs of this world.	2251	Providence, RI, USA	Locality	City				Providence	Providence County	Rhode Island	United States	USA	-71.41197999999997	41.82388000000003	100	
apoplexy	GPE	and Captain Dodd alive still. Men often recover from apoplexy, especially when they survive the first twenty-four	2280															nothing found
the United States	GPE	the posters to see when the next ship sailed for the United States. Still, he did go.	2280	The, 9000 Ming Ave, Bakersfield, CA, 93311, USA	POI	Footwear	9000 Ming Ave	Ming	9000	Bakersfield	Kern County	California	United States	USA	-119.10482399999995	35.34170400000005	100	
America	GPE	and valuables, and next day levanted with them to America, taking all the money he could scrape together in	2317	America	Locality	Country							United States	USA	-99.41461918999994	39.39870315600007	100	
London	GPE	, taking all the money he could scrape together in London, and so he passed his ruin on to others	2317	London, Greater London, England, GBR	Locality	City				London	Greater London	England	United Kingdom	GBR	-0.12769887399997515	51.507408346000034	100	
Barkington	GPE	looked back from his cart at the church spires of Barkington.	2320	Barrington, NS, CAN	Locality	Village				Barrington	Shelburne County	Nova Scotia	Canada	CAN	-65.56156099999998	43.56263900000005	91.2	
clubsmen	GPE	Friday was club day; the clubsmen met at the “Greyhound” and talked over their	2344															nothing found
Canada	GPE	hinkling: my boy Jack he wrote to me from Canada as how Hardie's was rotten out there; now	2344	Canada	Locality	Country							Canada	CAN	-113.64257999999995	60.108670000000075	100	
the United States	GPE	the latter, he was now resolved to fly to the United States with his booty, and cheat his alienated son along	2382	The, 9000 Ming Ave, Bakersfield, CA, 93311, USA	POI	Footwear	9000 Ming Ave	Ming	9000	Bakersfield	Kern County	California	United States	USA	-119.10482399999995	35.34170400000005	100	
apoplexy	GPE	Mr. Osmond replied that apoplexy was often idiopathic. Captain Dodd, as he understood	2430															nothing found
