Location	ent_type	context	p_no	LongLabel	Addr_type	Type	StAddr	StName	AddNum	City	Subregion	Region	CntryName	Country	x	y	score	error
Switzerland	GPE	whenever you marry don’t take a wife out of Switzerland; for if you begin blaspheming Helvetia, and cursing	1175	Switzerland	Locality	Country							Switzerland	CHE	8.245024096000066	46.79981744200006	100	
Hunsden	GPE	“Just let go my collar, Hunsden.”	1180	Hunden, Drage, Niedersachsen, DEU	Locality	District				Drage	Harburg	Niedersachsen	Deutschland	DEU	10.29532000000006	53.371480000000076	85.71	
faubourg	GPE	once to a small house I had taken in the faubourg nearest to that part of the city where the scene	1190	Faubourg, LA, USA	Locality	Village				Faubourg	St. Landry Parish	Louisiana	United States	USA	-92.16916999999995	30.714980000000025	100	
china	GPE	, and there were but some articles of glass, china, books, etc., to put in order	1191	China	Locality	Country							China	CHN	103.93002703300004	36.567348398000036	100	
Brussels	GPE	ticking of the clock. We were soon clear of Brussels; the fields received us, and then the lanes	1207	Brussels, BEL	Locality	City				Brussels	Brussels	Brussels	Belgium	BEL	4.406264339000074	50.89806471000003	100	
chaussées	GPE	and then the lanes, remote from carriage-resounding chaussées. Ere long we came upon a nook, so	1207	Chaussée, Deux-Sèvres, Nouvelle-Aquitaine, FRA	Locality	City				Chaussée	Deux-Sèvres	Nouvelle-Aquitaine	France	FRA	-0.2970099999999434	46.13300000000004	100	
England	GPE	what was to hinder us from going to live in England? England was still her Promised Land.	1208	England, GBR	Locality	State or Province						England	United Kingdom	GBR	-1.4586284489999457	52.59274188900008	100	
England	GPE	to hinder us from going to live in England? England was still her Promised Land.	1208	England, GBR	Locality	State or Province						England	United Kingdom	GBR	-1.4586284489999457	52.59274188900008	100	
Brussels	GPE	. Our school became one of the most popular in Brussels, and as by degrees we raised our terms and	1213	Brussels, BEL	Locality	City				Brussels	Brussels	Brussels	Belgium	BEL	4.406264339000074	50.89806471000003	100	
Belgium	GPE	at length included the children of the best families in Belgium. We had too an excellent connection in England,	1213	Belgium	Locality	Country							Belgium	BEL	4.661070427000027	50.640682937000065	100	
England	GPE	in Belgium. We had too an excellent connection in England, first opened by the unsolicited recommendation of Mr. Hunsden	1213	England, GBR	Locality	State or Province						England	United Kingdom	GBR	-1.4586284489999457	52.59274188900008	100	
shire	GPE	and soon after sent a leash of young ——shire heiresses—his cousins; as he said “to	1213	Shire, Eden, Cumbria, England, GBR	Locality	District				Eden	Cumbria	England	United Kingdom	GBR	-2.599768044999962	54.71006426900004	100	
Belgium	GPE	invest, two well-skilled counsellors, one in Belgium, one in England, viz. Vandenhuten and Hunsden	1237	Belgium	Locality	Country							Belgium	BEL	4.661070427000027	50.640682937000065	100	
England	GPE	-skilled counsellors, one in Belgium, one in England, viz. Vandenhuten and Hunsden, gave us each	1237	England, GBR	Locality	State or Province						England	United Kingdom	GBR	-1.4586284489999457	52.59274188900008	100	
Hunsden	GPE	Belgium, one in England, viz. Vandenhuten and Hunsden, gave us each a word of advice as to	1237	Hunden, Drage, Niedersachsen, DEU	Locality	District				Drage	Harburg	Niedersachsen	Deutschland	DEU	10.29532000000006	53.371480000000076	85.71	
Hunsden	GPE	how gainful; I communicated details to Messrs. Vandenhuten and Hunsden; nobody else can be interested in hearing them.	1237	Hunden, Drage, Niedersachsen, DEU	Locality	District				Drage	Harburg	Niedersachsen	Deutschland	DEU	10.29532000000006	53.371480000000076	85.71	
England	GPE	To England we now resolved to take wing; we arrived there	1239	England, GBR	Locality	State or Province						England	United Kingdom	GBR	-1.4586284489999457	52.59274188900008	100	
London	GPE	the British islands, and afterwards passed a winter in London. Then we thought it high time to fix our	1239	London, Greater London, England, GBR	Locality	City				London	Greater London	England	United Kingdom	GBR	-0.12769887399997515	51.507408346000034	100	
shire	GPE	My heart yearned towards my native county of ——shire; and it is in ——shire I now	1239	Shire, Eden, Cumbria, England, GBR	Locality	District				Eden	Cumbria	England	United Kingdom	GBR	-2.599768044999962	54.71006426900004	100	
shire	GPE	——shire; and it is in ——shire I now live; it is in the library of	1239	Shire, Eden, Cumbria, England, GBR	Locality	District				Eden	Cumbria	England	United Kingdom	GBR	-2.599768044999962	54.71006426900004	100	
shire	GPE	brings visitors with him when he comes to ——shire, and these visitors are often foreigners; sometimes he	1241	Shire, Eden, Cumbria, England, GBR	Locality	District				Eden	Cumbria	England	United Kingdom	GBR	-2.599768044999962	54.71006426900004	100	
Birmingham	GPE	English guests Hunsden invites, are all either men of Birmingham or Manchester—hard men, seemingly knit up in	1242	Birmingham, West Midlands, England, GBR	Locality	City				Birmingham	West Midlands	England	United Kingdom	GBR	-1.902935748999937	52.479298949000054	100	
Manchester	GPE	Hunsden invites, are all either men of Birmingham or Manchester—hard men, seemingly knit up in one thought	1242	Manchester, Greater Manchester, England, GBR	Locality	City				Manchester	Greater Manchester	England	United Kingdom	GBR	-2.245275941999978	53.47895622000004	100	
Russia	GPE	Continent; on their mental tablets, the names of Russia, Austria, and the Pope, are inscribed in	1242	Russia	Locality	Country							Russia	RUS	96.80537153400007	61.989526183000066	100	
Austria	GPE	on their mental tablets, the names of Russia, Austria, and the Pope, are inscribed in red ink	1242	Austria	Locality	Country							Austria	AUT	14.137076948000072	47.58581000500004	100	
Hunsden	GPE	When Hunsden is staying alone at the Wood (which seldom happens	1243	Hunden, Drage, Niedersachsen, DEU	Locality	District				Drage	Harburg	Niedersachsen	Deutschland	DEU	10.29532000000006	53.371480000000076	85.71	
Hunsden	GPE	I and Frances have dined and spent an evening with Hunsden, he often walks home with us. His wood	1245	Hunden, Drage, Niedersachsen, DEU	Locality	District				Drage	Harburg	Niedersachsen	Deutschland	DEU	10.29532000000006	53.371480000000076	85.71	
Hunsden	GPE	unclouded moon poured her light into this glade, and Hunsden held out under her beam an ivory miniature.	1247	Hunden, Drage, Niedersachsen, DEU	Locality	District				Drage	Harburg	Niedersachsen	Deutschland	DEU	10.29532000000006	53.371480000000076	85.71	
Hunsden	GPE	“Than what?” demanded Hunsden.	1257	Hunden, Drage, Niedersachsen, DEU	Locality	District				Drage	Harburg	Niedersachsen	Deutschland	DEU	10.29532000000006	53.371480000000076	85.71	
Hunsden	GPE	“Ingenious,” remarked Hunsden; “whether true or not is another question.	1261	Hunden, Drage, Niedersachsen, DEU	Locality	District				Drage	Harburg	Niedersachsen	Deutschland	DEU	10.29532000000006	53.371480000000076	85.71	
china	GPE	lawn; I see the round table, loaded with china, placed under a certain beech; Hunsden is expected	1266	China	Locality	Country							China	CHN	103.93002703300004	36.567348398000036	100	
Hunsden	GPE	loaded with china, placed under a certain beech; Hunsden is expected—nay, I hear he is come	1266	Hunden, Drage, Niedersachsen, DEU	Locality	District				Drage	Harburg	Niedersachsen	Deutschland	DEU	10.29532000000006	53.371480000000076	85.71	
Hunsden	GPE	times he should be a milksop than what he, Hunsden, calls ‘a fine lad;’ and moreover	1267	Hunden, Drage, Niedersachsen, DEU	Locality	District				Drage	Harburg	Niedersachsen	Deutschland	DEU	10.29532000000006	53.371480000000076	85.71	
Hunsden	GPE	peril, or wonder, narrated by his mother, Hunsden, or myself. But though still, he is	1269	Hunden, Drage, Niedersachsen, DEU	Locality	District				Drage	Harburg	Niedersachsen	Deutschland	DEU	10.29532000000006	53.371480000000076	85.71	
Hunsden	GPE	a dog in a rabid state. As soon as Hunsden had brought him home, and had informed me of	1270	Hunden, Drage, Niedersachsen, DEU	Locality	District				Drage	Harburg	Niedersachsen	Deutschland	DEU	10.29532000000006	53.371480000000076	85.71	
Hunsden	GPE	which emits, now and then, ominous sparks; Hunsden calls it his spirit, and says it should not	1277	Hunden, Drage, Niedersachsen, DEU	Locality	District				Drage	Harburg	Niedersachsen	Deutschland	DEU	10.29532000000006	53.371480000000076	85.71	
Hunsden	GPE	I see him now; he stands by Hunsden, who is seated on the lawn under the beech	1278	Hunden, Drage, Niedersachsen, DEU	Locality	District				Drage	Harburg	Niedersachsen	Deutschland	DEU	10.29532000000006	53.371480000000076	85.71	
Hunsden	GPE	who is seated on the lawn under the beech; Hunsden’s hand rests on the boy’s collar, and	1278	Hunden, Drage, Niedersachsen, DEU	Locality	District				Drage	Harburg	Niedersachsen	Deutschland	DEU	10.29532000000006	53.371480000000076	85.71	
Hunsden	GPE	sort of unexpressed anxiety; while her son leans on Hunsden’s knee, or rests against his shoulder, she	1278	Hunden, Drage, Niedersachsen, DEU	Locality	District				Drage	Harburg	Niedersachsen	Deutschland	DEU	10.29532000000006	53.371480000000076	85.71	
Hunsden	GPE	young from a hovering hawk; she says she wishes Hunsden had children of his own, for then he would	1278	Hunden, Drage, Niedersachsen, DEU	Locality	District				Drage	Harburg	Niedersachsen	Deutschland	DEU	10.29532000000006	53.371480000000076	85.71	
Hunsden	GPE	“Well, Hunsden? I hear you—”	1285	Hunden, Drage, Niedersachsen, DEU	Locality	District				Drage	Harburg	Niedersachsen	Deutschland	DEU	10.29532000000006	53.371480000000076	85.71	
shire	GPE	Why don’t you invite the Pelets to ——shire, Crimsworth? I should so like to see your	1286	Shire, Eden, Cumbria, England, GBR	Locality	District				Eden	Cumbria	England	United Kingdom	GBR	-2.599768044999962	54.71006426900004	100	
