Location	ent_type	context	p_no	LongLabel	Addr_type	Type	StAddr	StName	AddNum	City	Subregion	Region	CntryName	Country	x	y	score	error
Moorish	GPE	about asking busy people what seven and sixpence is in Moorish—which I don't understand. Why should I	4837	Moorish, 11 West Street, Ashburton, Newton Abbot, Devon, England, TQ13 7, GBR	POI	Bar or Pub	11 West Street	West	11	Newton Abbot	Devon	England	United Kingdom	GBR	-3.7567099999999414	50.515100000000075	100	
Town	GPE	become fixed in the east when we left Somer's Town, veered completely round, before we were a couple	4865	Town, Kasungu, Central Region, MWI	Locality	Village				Kasungu		Central Region	Malawi	MWI	33.47947000000005	-13.015099999999961	100	
Lincolnshire	GPE	Thank you—of calling here on my road from Lincolnshire, to express my regret that any cause of complaint	4873	Lincolnshire, England, GBR	Locality	Zone						England	United Kingdom	GBR	-0.27856999999994514	53.184390000000064	100	
Lincolnshire	GPE	would not have been received by my local establishment in Lincolnshire with that urbanity, that courtesy, which its members	4875	Lincolnshire, England, GBR	Locality	Zone						England	United Kingdom	GBR	-0.27856999999994514	53.184390000000064	100	
Lincolnshire	GPE	at Chesney Wold when Mr. Skimpole next came down into Lincolnshire. Mr. Skimpole professed himself much flattered and honored.	4883	Lincolnshire, England, GBR	Locality	Zone						England	United Kingdom	GBR	-0.27856999999994514	53.184390000000064	100	
Lincolnshire	GPE	me for having been shy and mute before the great Lincolnshire baronet.	4891	Lincolnshire, England, GBR	Locality	Zone						England	United Kingdom	GBR	-0.27856999999994514	53.184390000000064	100	
the Vale of Taunton	GPE	capital, and I have a father to support in the Vale of Taunton, besides striving to realise some little independence for three	4996	Vale View, Bagborough, Taunton, Somerset, England, TA4 3, GBR	StreetName		Vale View	Vale		Taunton	Somerset	England	United Kingdom	GBR	-3.1993326147262073	51.09235225457205	86.21	
London	GPE	, passing over all the sunny landscape between us and London, chilling the seed in the ground as it glided	5009	London, Greater London, England, GBR	Locality	City				London	Greater London	England	United Kingdom	GBR	-0.12769887399997515	51.507408346000034	100	
London	GPE	have left her at home. We all went to London that afternoon, and finding two places in the mail	5011	London, Greater London, England, GBR	Locality	City				London	Greater London	England	United Kingdom	GBR	-0.12769887399997515	51.507408346000034	100	
India	GPE	, about the voyage, and about the heat in India, and the serpents and the tigers; and as	5015	India	Locality	Country							India	IND	79.44332654800007	23.379379735000043	100	
Vholes	GPE	now have only one thing on my mind, and Vholes and I will work it. I shall not be	5045	Violès, Vaucluse, Provence-Alpes-Côte d'Azur, FRA	Locality	City				Violès	Vaucluse	Provence-Alpes-Côte d'Azur	France	FRA	4.952585063000072	44.16193131000006	83.33	
Vholes	GPE	who will hear of nothing but their bond now—Vholes says so. I should have a balance in my	5045	Violès, Vaucluse, Provence-Alpes-Côte d'Azur, FRA	Locality	City				Violès	Vaucluse	Provence-Alpes-Côte d'Azur	France	FRA	4.952585063000072	44.16193131000006	83.33	
London	GPE	was going to be) Richard's companion back to London, I had done no good by coming down.	5047	London, Greater London, England, GBR	Locality	City				London	Greater London	England	United Kingdom	GBR	-0.12769887399997515	51.507408346000034	100	
England	GPE	about them as if they were glad to be in England again. “Charley, Charley!” said I	5049	England, GBR	Locality	State or Province						England	United Kingdom	GBR	-1.4586284489999457	52.59274188900008	100	
England	GPE	by chance among the first to welcome him home to England. And I saw that he was very sorry for	5053	England, GBR	Locality	State or Province						England	United Kingdom	GBR	-1.4586284489999457	52.59274188900008	100	
India	GPE	his future plans, and of his probable return to India. He said that was very doubtful. He had	5065	India	Locality	Country							India	IND	79.44332654800007	23.379379735000043	100	
London	GPE	Richard proposed that we all should go to London together; but Mr. Woodcourt having to remain by his	5067	London, Greater London, England, GBR	Locality	City				London	Greater London	England	United Kingdom	GBR	-0.12769887399997515	51.507408346000034	100	
London	GPE	proceeded. “Mr. Woodcourt, you are going to London?”	5075	London, Greater London, England, GBR	Locality	City				London	Greater London	England	United Kingdom	GBR	-0.12769887399997515	51.507408346000034	100	
London	GPE	with what application, “pray let us meet in London!”	5081	London, Greater London, England, GBR	Locality	City				London	Greater London	England	United Kingdom	GBR	-0.12769887399997515	51.507408346000034	100	
Saint Albans	GPE	and-twenty mile from here, sir. At Saint Albans. You know Saint Albans, sir? I thought	5118	St Albans, Hertfordshire, England, GBR	Locality	City				St Albans	Hertfordshire	England	United Kingdom	GBR	-0.3390664859999788	51.752313608000065	100	
Saint Albans	GPE	here, sir. At Saint Albans. You know Saint Albans, sir? I thought you gave a start like	5118	St Albans, Hertfordshire, England, GBR	Locality	City				St Albans	Hertfordshire	England	United Kingdom	GBR	-0.3390664859999788	51.752313608000065	100	
astir	GPE	-Alone's is still asleep, and nothing is astir.	5120	Astir, Epimenidou, 712 02, Irakleio, GRC	POI	Rental Cars	Epimenidou	Epimenidou		Irakleio	Irakleio	Irakleio	Ellada	GRC	25.137360000000058	35.341180000000065	100	
Saint Albans	GPE	Jo!—he was along with me, sir, down at Saint Albans, ill, and a young lady Lord bless her	5134	St Albans, Hertfordshire, England, GBR	Locality	City				St Albans	Hertfordshire	England	United Kingdom	GBR	-0.3390664859999788	51.752313608000065	100	
London	GPE	let me ever see you nowheres within forty mile of London, or you'll repent it.’ So I	5170	London, Greater London, England, GBR	Locality	City				London	Greater London	England	United Kingdom	GBR	-0.12769887399997515	51.507408346000034	100	
he'd	GPE	in one of the humors he drives me into—he'd go down, sir!”	5247	Hed, Skinnskatteberg, SWE	Locality	Village				Skinnskatteberg		Västmanlands län	Sverige	SWE	15.76317000000006	59.68114000000003	99.99	
Bedlam	GPE	put too fine a point upon it, this is Bedlam, sir!” says Mr. Snagsby.	5268	Bedlam, Harrogate, North Yorkshire, England, GBR	Locality	District				Harrogate	North Yorkshire	England	United Kingdom	GBR	-1.754445933999932	54.08669644200006	100	
Lincolnshire	GPE	THE place in Lincolnshire has shut its many eyes again, and the house	5321	Lincolnshire, England, GBR	Locality	Zone						England	United Kingdom	GBR	-0.27856999999994514	53.184390000000064	100	
Lincolnshire	GPE	, and the house in town is awake. In Lincolnshire, the Dedlocks of the past doze in their picture	5321	Lincolnshire, England, GBR	Locality	Zone						England	United Kingdom	GBR	-0.27856999999994514	53.184390000000064	100	
interposes	GPE	Excuse me, my Lady,” Sir Leicester considerately interposes, “but perhaps this may be doing an injury	5383	Interpress, 11151 Law Rd, Mendocino, CA, 95460, USA	POI	Repair Services	11151 Law Rd	Law	11151	Mendocino	Mendocino County	California	United States	USA	-123.78790399999997	39.317694000000074	82	
interposes	GPE	“I beg your pardon,” interposes Mr. Rouncewell's son's father. “Sir Leicester	5384	Interpress, 11151 Law Rd, Mendocino, CA, 95460, USA	POI	Repair Services	11151 Law Rd	Law	11151	Mendocino	Mendocino County	California	United States	USA	-123.78790399999997	39.317694000000074	82	
London	GPE	, is only now rising over the great wilderness of London. The stars are shining as they shone above the	5446	London, Greater London, England, GBR	Locality	City				London	Greater London	England	United Kingdom	GBR	-0.12769887399997515	51.507408346000034	100	
London	GPE	him; but even on this stranger's wilderness of London there is some rest. Its steeples and towers,	5449	London, Greater London, England, GBR	Locality	City				London	Greater London	England	United Kingdom	GBR	-0.12769887399997515	51.507408346000034	100	
GREAT	GPE	A GREAT annual occasion has come round in the establishment of Mr.	5458	GT	Locality	Country							Guatemala	GTM	-90.36397945999994	15.697237961000042	100	
Lignum Vitæ	GPE	round in the establishment of Mr. Joseph Bagnet, otherwise Lignum Vitæ, ex-artilleryman and present bassoon-player.	5458	Lignum Vitae Bay, Saint Mary, ATG	POI	Bay						Saint Mary	Antigua and Barbuda	ATG	-61.89035999999999	17.063550000000077	82	
Woolwich	GPE	bounds of happy returns and a pudding. On young Woolwich's last birthday, Mr. Bagnet certainly did, after	5460	Woolwich, ON, CAN	Locality	City				Woolwich	Waterloo Regional Municipality	Ontario	Canada	CAN	-80.54606824999996	43.59472432000007	100	
Quebec	GPE	Quebec and Malta lay the cloth for dinner, while Woolwich	5463	Québec, QC, CAN	Locality	State or Province						Québec	Canada	CAN	-71.74874224599995	53.382603420000066	100	
Malta	GPE	Quebec and Malta lay the cloth for dinner, while Woolwich, serving	5463	Malta	Locality	Country							Malta	MLT	14.400072590000036	35.92254885600005	100	
Woolwich	GPE	Quebec and Malta lay the cloth for dinner, while Woolwich, serving, as beseems him, under his father	5463	Woolwich, ON, CAN	Locality	City				Woolwich	Waterloo Regional Municipality	Ontario	Canada	CAN	-80.54606824999996	43.59472432000007	100	
Quebec	GPE	Quebec and Malta here exclaim, with clapping of hands,	5471	Québec, QC, CAN	Locality	State or Province						Québec	Canada	CAN	-71.74874224599995	53.382603420000066	100	
Malta	GPE	Quebec and Malta here exclaim, with clapping of hands, that Bluffy	5471	Malta	Locality	Country							Malta	MLT	14.400072590000036	35.92254885600005	100	
Malta	GPE	-cloth, and winking “salt!” at Malta with her right eye, and shaking the pepper away	5472	Malta	Locality	Country							Malta	MLT	14.400072590000036	35.92254885600005	100	
Quebec	GPE	her right eye, and shaking the pepper away from Quebec with her head; “I begin to think George	5472	Québec, QC, CAN	Locality	State or Province						Québec	Canada	CAN	-71.74874224599995	53.382603420000066	100	
Woolwich	GPE	consideration, she imperils her digestion fearfully. How young Woolwich cleans the drum-sticks without being of ostrich descent	5480	Woolwich, ON, CAN	Locality	City				Woolwich	Waterloo Regional Municipality	Ontario	Canada	CAN	-80.54606824999996	43.59472432000007	100	
Quebec	GPE	At last the various cleansing processes are triumphantly completed; Quebec and Malta appear in fresh attire, smiling and dry	5481	Québec, QC, CAN	Locality	State or Province						Québec	Canada	CAN	-71.74874224599995	53.382603420000066	100	
Malta	GPE	the various cleansing processes are triumphantly completed; Quebec and Malta appear in fresh attire, smiling and dry; pipes	5481	Malta	Locality	Country							Malta	MLT	14.400072590000036	35.92254885600005	100	
Woolwich	GPE	see it done, and Mr. Bagnet looks over young Woolwich's head to see it done, with an interest	5500	Woolwich, ON, CAN	Locality	City				Woolwich	Waterloo Regional Municipality	Ontario	Canada	CAN	-80.54606824999996	43.59472432000007	100	
Woolwich	GPE	“George. Woolwich. Quebec. Malta. This is her birthday.	5510	Woolwich, ON, CAN	Locality	City				Woolwich	Waterloo Regional Municipality	Ontario	Canada	CAN	-80.54606824999996	43.59472432000007	100	
Quebec	GPE	“George. Woolwich. Quebec. Malta. This is her birthday. Take a	5510	Québec, QC, CAN	Locality	State or Province						Québec	Canada	CAN	-71.74874224599995	53.382603420000066	100	
Malta	GPE	“George. Woolwich. Quebec. Malta. This is her birthday. Take a day's	5510	Malta	Locality	Country							Malta	MLT	14.400072590000036	35.92254885600005	100	
Quebec	GPE	sat himself down next to Mr. George, and taken Quebec and Malta on his knees. “You pretty dears	5516	Québec, QC, CAN	Locality	State or Province						Québec	Canada	CAN	-71.74874224599995	53.382603420000066	100	
Malta	GPE	down next to Mr. George, and taken Quebec and Malta on his knees. “You pretty dears,”	5516	Malta	Locality	Country							Malta	MLT	14.400072590000036	35.92254885600005	100	
Malta	GPE	, my darling?” pursues Mr. Bucket, pinching Malta's cheek. “These are peaches, these are	5518	Malta	Locality	Country							Malta	MLT	14.400072590000036	35.92254885600005	100	
Quebec	GPE	my dears?” says Mr. Bucket, referring to Quebec and Malta for information on the subject of young Woolwich	5532	Québec, QC, CAN	Locality	State or Province						Québec	Canada	CAN	-71.74874224599995	53.382603420000066	100	
Malta	GPE	?” says Mr. Bucket, referring to Quebec and Malta for information on the subject of young Woolwich. “	5532	Malta	Locality	Country							Malta	MLT	14.400072590000036	35.92254885600005	100	
Woolwich	GPE	Quebec and Malta for information on the subject of young Woolwich. “And a nice brother he is—half	5532	Woolwich, ON, CAN	Locality	City				Woolwich	Waterloo Regional Municipality	Ontario	Canada	CAN	-80.54606824999996	43.59472432000007	100	
interposes	GPE	Mr. Bagnet suddenly interposes, “Plays the Fife. Beautiful.”	5537	Interpress, 11151 Law Rd, Mendocino, CA, 95460, USA	POI	Repair Services	11151 Law Rd	Law	11151	Mendocino	Mendocino County	California	United States	USA	-123.78790399999997	39.317694000000074	82	
Woolwich	GPE	acceptable to the little circle than this call upon young Woolwich, who immediately fetches his fife and performs the stirring	5539	Woolwich, ON, CAN	Locality	City				Woolwich	Waterloo Regional Municipality	Ontario	Canada	CAN	-80.54606824999996	43.59472432000007	100	
Tulkinghorn	GPE	Lincoln's Inn Fields—gentleman of the name of Tulkinghorn. He was shot last night. I want you	5558															nothing found
London	GPE	wear out a Dame Durden. We will go to London for a while, and take possession of our old	5578	London, Greater London, England, GBR	Locality	City				London	Greater London	England	United Kingdom	GBR	-0.12769887399997515	51.507408346000034	100	
London	GPE	transact in assertion of her independence, and will make London a more convenient place for all of us. So	5582	London, Greater London, England, GBR	Locality	City				London	Greater London	England	United Kingdom	GBR	-0.12769887399997515	51.507408346000034	100	
London	GPE	more convenient place for all of us. So to London we will go. That being settled, there is	5582	London, Greater London, England, GBR	Locality	City				London	Greater London	England	United Kingdom	GBR	-0.12769887399997515	51.507408346000034	100	
London	GPE	Next day we went to London. We found our old lodging vacant, and in	5596	London, Greater London, England, GBR	Locality	City				London	Greater London	England	United Kingdom	GBR	-0.12769887399997515	51.507408346000034	100	
Ada	GPE	, but it was now. I looked up at Ada, who was sitting opposite; and I saw,	5635	Ada, OK, USA	Locality	City				Ada	Pontotoc County	Oklahoma	United States	USA	-96.67865999999998	34.77506000000005	100	
London	GPE	WHEN Mr. Woodcourt arrived in London, he went, that very same day, to	5650	London, Greater London, England, GBR	Locality	City				London	Greater London	England	United Kingdom	GBR	-0.12769887399997515	51.507408346000034	100	
the Vale of	GPE	father, who is entirely dependent on me—in the Vale of Taunton; or some one. Whereas, sir,	5664	Vale, OR, USA	Locality	City				City of Vale	Malheur County	Oregon	United States	USA	-117.24174999999997	43.98395000000005	99.9	
Taunton	GPE	is entirely dependent on me—in the Vale of Taunton; or some one. Whereas, sir, my	5664	Taunton, Somerset West and Taunton, Somerset, England, GBR	Locality	City				Somerset West and Taunton	Somerset	England	United Kingdom	GBR	-3.1081894159999592	51.01340623800007	100	
Vholes	GPE	, “for I have seen nobody here yet but Vholes. Woodcourt, there is one subject I should like	5685	Violès, Vaucluse, Provence-Alpes-Côte d'Azur, FRA	Locality	City				Violès	Vaucluse	Provence-Alpes-Côte d'Azur	France	FRA	4.952585063000072	44.16193131000006	83.33	
Vholes	GPE	dejected look over the bundles of papers, “as Vholes and I are usually; but he is only an	5704	Violès, Vaucluse, Provence-Alpes-Côte d'Azur, FRA	Locality	City				Violès	Vaucluse	Provence-Alpes-Côte d'Azur	France	FRA	4.952585063000072	44.16193131000006	83.33	
Vholes	GPE	time. It's near the offices, and near Vholes.	5707	Violès, Vaucluse, Provence-Alpes-Côte d'Azur, FRA	Locality	City				Violès	Vaucluse	Provence-Alpes-Côte d'Azur	France	FRA	4.952585063000072	44.16193131000006	83.33	
St. Albans	GPE	home. The poor boy whom I had found at St. Albans had reappeared a short time before, and was lying	5737	St Albans, Hertfordshire, England, GBR	Locality	City				St Albans	Hertfordshire	England	United Kingdom	GBR	-0.3390664859999788	51.752313608000065	100	
Betweenwhiles	GPE	, as a silent recommendation to him to yield. Betweenwhiles, Mrs. Bagnet looked at me; and I understood	5823															nothing found
Woolwich	GPE	it warn't for nothing that he once spoke to my Woolwich about whitening and wrinkling mother's heads. For fifty	5846	Woolwich, ON, CAN	Locality	City				Woolwich	Waterloo Regional Municipality	Ontario	Canada	CAN	-80.54606824999996	43.59472432000007	100	
Lincolnshire	GPE	and give me the umbrella! I'm away to Lincolnshire, to bring that old lady here.”	5848	Lincolnshire, England, GBR	Locality	Zone						England	United Kingdom	GBR	-0.27856999999994514	53.184390000000064	100	
Lincolnshire	GPE	for the children. Now, I'm away into Lincolnshire after George's mother!”	5851	Lincolnshire, England, GBR	Locality	Zone						England	United Kingdom	GBR	-0.27856999999994514	53.184390000000064	100	
London	GPE	a bunch of woe. All the state coachmen in London seem plunged into mourning; and if that dead old	5861	London, Greater London, England, GBR	Locality	City				London	Greater London	England	United Kingdom	GBR	-0.12769887399997515	51.507408346000034	100	
interposes	GPE	deeming it time to dismiss the officer, here majestically interposes with the words, “Very good. Thank you	5917	Interpress, 11151 Law Rd, Mendocino, CA, 95460, USA	POI	Repair Services	11151 Law Rd	Law	11151	Mendocino	Mendocino County	California	United States	USA	-123.78790399999997	39.317694000000074	82	
Nimrod	GPE	causes. There was Krook, deceased; there was Nimrod, deceased; and there was Jo, deceased;	6048	Nimrod, MN, USA	Locality	City				Nimrod	Wadena County	Minnesota	United States	USA	-94.88008999999994	46.63987000000003	100	
Lincolnshire	GPE	wintry roads, a chaise and pair comes out of Lincolnshire, making its way towards London.	6132	Lincolnshire, England, GBR	Locality	Zone						England	United Kingdom	GBR	-0.27856999999994514	53.184390000000064	100	
London	GPE	pair comes out of Lincolnshire, making its way towards London.	6132	London, Greater London, England, GBR	Locality	City				London	Greater London	England	United Kingdom	GBR	-0.12769887399997515	51.507408346000034	100	
Woolwich	GPE	, and when he said at our house to my Woolwich, that of all the things my Woolwich could have	6135	Woolwich, ON, CAN	Locality	City				Woolwich	Waterloo Regional Municipality	Ontario	Canada	CAN	-80.54606824999996	43.59472432000007	100	
Woolwich	GPE	to my Woolwich, that of all the things my Woolwich could have to think of when he grew to be	6135	Woolwich, ON, CAN	Locality	City				Woolwich	Waterloo Regional Municipality	Ontario	Canada	CAN	-80.54606824999996	43.59472432000007	100	
Lincolnshire	GPE	century to the Dedlock family down at Chesney Wold in Lincolnshire. George has frequently told me before that he's	6139	Lincolnshire, England, GBR	Locality	Zone						England	United Kingdom	GBR	-0.27856999999994514	53.184390000000064	100	
Lincolnshire	GPE	George has frequently told me before that he's a Lincolnshire man, and I says to my old Lignum that	6139	Lincolnshire, England, GBR	Locality	Zone						England	United Kingdom	GBR	-0.27856999999994514	53.184390000000064	100	
London	GPE	vanishing and giving place to the realities of day. London reached, the travellers alight; the old housekeeper in	6145	London, Greater London, England, GBR	Locality	City				London	Greater London	England	United Kingdom	GBR	-0.12769887399997515	51.507408346000034	100	
Hong Kong	GPE	Cape of Good Hope, the Island of Ascension, Hong Kong, or any other military station.	6145	Hong Kong	Locality	Country							Hong Kong SAR	HKG	114.1193859870001	22.351958323000076	100	
china	GPE	wonderfully grave, precise, and handsome piece of old china she looks; though her heart beats fast, and	6146	China	Locality	Country							China	CHN	103.93002703300004	36.567348398000036	100	
Quebec	GPE	and take my gratitude along with you. Kisses to Quebec and Malta, love to my godson, a hearty	6186	Québec, QC, CAN	Locality	State or Province						Québec	Canada	CAN	-71.74874224599995	53.382603420000066	100	
Malta	GPE	my gratitude along with you. Kisses to Quebec and Malta, love to my godson, a hearty shake of	6186	Malta	Locality	Country							Malta	MLT	14.400072590000036	35.92254885600005	100	
hammercloths	GPE	legged coachmen in flaxen wigs, deep sunk into downy hammercloths; and up behind mount luscious Mercuries, bearing sticks	6247	Clothes Hamper, 14210 Arbor St, Omaha, NE, 68144, USA	POI	Laundry	14210 Arbor St	Arbor	14210	Omaha	Douglas County	Nebraska	United States	USA	-96.13702799999999	41.23622900000004	76.37	
London	GPE	No, she tells him; he is in London. He was taken ill in the library, this	6255	London, Greater London, England, GBR	Locality	City				London	Greater London	England	United Kingdom	GBR	-0.12769887399997515	51.507408346000034	100	
London	GPE	Right thankful she is that she happened to come to London, and is able to attend upon him.	6255	London, Greater London, England, GBR	Locality	City				London	Greater London	England	United Kingdom	GBR	-0.12769887399997515	51.507408346000034	100	
Oxford	GPE	come from there, and gives him the address near Oxford-street.	6288	Oxford, Oxfordshire, England, GBR	Locality	City				Oxford	Oxfordshire	England	United Kingdom	GBR	-1.257628795999949	51.751982637000026	100	
phaeton	GPE	me out, and we found at the door a phaeton or barouche, with a postilion and post horses.	6315	Phaéton, MTQ	Locality	City				Phaéton			Martinique	MTQ	-61.01476999999994	14.533160000000066	100	
St. Albans	GPE	After a while, I recognised the familiar way to St. Albans. At Barnet, fresh horses were ready for us	6321	St Albans, Hertfordshire, England, GBR	Locality	City				St Albans	Hertfordshire	England	United Kingdom	GBR	-0.3390664859999788	51.752313608000065	100	
Barnet	GPE	I recognised the familiar way to St. Albans. At Barnet, fresh horses were ready for us, and we	6321	Barnet, Greater London, England, GBR	Locality	City				Barnet	Greater London	England	United Kingdom	GBR	-0.1999999999999318	51.650000000000034	100	
Saint Albans	GPE	o'clock and we were yet a few miles short of Saint Albans, when he came out of one of these houses	6326	St Albans, Hertfordshire, England, GBR	Locality	City				St Albans	Hertfordshire	England	United Kingdom	GBR	-0.3390664859999788	51.752313608000065	100	
Saint Albans	GPE	We were soon in Saint Albans, and alighted a little before day, when I	6332	St Albans, Hertfordshire, England, GBR	Locality	City				St Albans	Hertfordshire	England	United Kingdom	GBR	-0.3390664859999788	51.752313608000065	100	
London	GPE	playing those games. So having warned him out of London, I made an afternoon of it to warn him	6342	London, Greater London, England, GBR	Locality	City				London	Greater London	England	United Kingdom	GBR	-0.12769887399997515	51.507408346000034	100	
London	GPE	“and trouble enough, and well enough away from London, or anywhere else. I was regularly turned on	6344	London, Greater London, England, GBR	Locality	City				London	Greater London	England	United Kingdom	GBR	-0.12769887399997515	51.507408346000034	100	
Toughey	GPE	fypunnote well bestowed if I could relieve the premises of Toughey without causing any noise or trouble. Then says he	6357	Touhey, WA, USA	Locality	Village				Touhey	Douglas County	Washington	United States	USA	-119.70965999999999	47.754530000000045	85.71	
setten	GPE	, and could she rest herself where you're a setten, for a hour or so. Yes she could	6381	Setten, Aurskog-Høland, Viken, NOR	POI	Lake					Aurskog-Høland	Viken	Norge	NOR	11.678010000000029	59.83078000000006	100	
London	GPE	it, “that her ladyship sent her up to London with some word for you, and it's possible	6404	London, Greater London, England, GBR	Locality	City				London	Greater London	England	United Kingdom	GBR	-0.12769887399997515	51.507408346000034	100	
Saint Albans	GPE	, as he had been doing frequently since we left Saint Albans—and spoke to me at the carriage side.	6408	St Albans, Hertfordshire, England, GBR	Locality	City				St Albans	Hertfordshire	England	United Kingdom	GBR	-0.3390664859999788	51.752313608000065	100	
London	GPE	Up?” said I, astonished. “To London! Are we going back?”	6430	London, Greater London, England, GBR	Locality	City				London	Greater London	England	United Kingdom	GBR	-0.12769887399997515	51.507408346000034	100	
Lincolnshire	GPE	is given out that my Lady has gone down into Lincolnshire, but is expected to return presently.	6445	Lincolnshire, England, GBR	Locality	Zone						England	United Kingdom	GBR	-0.27856999999994514	53.184390000000064	100	
Lincolnshire	GPE	busy overmuch, however, will not go down into Lincolnshire. It persists in flitting and chattering about town.	6446	Lincolnshire, England, GBR	Locality	Zone						England	United Kingdom	GBR	-0.27856999999994514	53.184390000000064	100	
Lincolnshire	GPE	in the capital, and will not go down into Lincolnshire. By half-past five, post meridian,	6448	Lincolnshire, England, GBR	Locality	Zone						England	United Kingdom	GBR	-0.27856999999994514	53.184390000000064	100	
